pipeline_name,query,answer,contexts,ground_truth,response_time,documents_retrieved,success,error,answer_relevancy,context_precision,context_recall,faithfulness,answer_similarity,answer_correctness,avg_similarity_score,answer_length,iteration
basic,What are the effects of metformin on type 2 diabetes?,"Metformin is a commonly prescribed medication for the management of type 2 diabetes. It is often used as a first-line treatment due to its effectiveness in lowering glucose production in the liver and improving insulin sensitivity. Document 1 highlights metformin's role in type 2 diabetes management.

Additionally, Document 3 discusses a case where a patient with type 2 diabetes on insulin therapy experienced severe hypoglycemia due to incorrect insulin injection techniques, which led to the development of lipohypertrophy. The patient was switched to insulin analogs and educated on proper injection techniques, emphasizing the importance of correct medication administration in diabetes management.

Document 9 explores the potential neuroprotective role of metformin in neurodegenerative disorders, including Parkinson's disease. A study involving patients with Parkinson's disease showed trends in biomarker changes after metformin use, suggesting a potential impact on the underlying pathophysiology of the disease.

Overall, metformin plays a crucial role in the management of type 2 diabetes by improving insulin sensitivity, lowering glucose production, and potentially offering neuroprotective effects in related conditions like Parkinson's disease. However, further research is needed to fully understand the extent of metformin's effects on type 2 diabetes and related conditions.","[""Document(page_content='Common treatments for type 2 diabetes include lifestyle changes such as diet and exercise, oral medications like metformin, and in some cases, insulin therapy. Metformin is often the first-line medication prescribed for type 2 diabetes. It helps lower glucose production in the liver and improves insulin sensitivity.', metadata={}, id='2297')"", ""Document(page_content='Diabetes mellitus (DM) is a prevalent condition that requires careful management in the perioperative setting to reduce surgical risks and optimize patient outcomes. The preoperative care of diabetic patients is complex because glucose control must be balanced with minimizing hypoglycemic or hyperglycemic events during surgery. A variety of diabetic medications such as insulin, dipeptidyl-peptidase-4 inhibitors, glucagon-like peptide-1 receptor agonists, sodium–glucose cotransporter-2 inhibitors, and biguanides such as metformin present unique challenges and considerations due to their different mechanisms, benefits, and potential adverse effects. In recent years, professional organizations have developed recommendations on the perioperative management of these therapies, although there remain some variations in guidelines related to medication cessation and dosage adjustments. Standardized protocols in preoperative DM care remain a topic of interest to ensure consistent and safe practices across healthcare settings, and further collaborative research efforts could provide clarity and consensus in managing this diverse patient population. The objective of this study was to provide an overview of guidelines and practices to support healthcare professionals in delivering improved preoperative care for diabetic patients. This initiative aims to enhance surgical outcomes and minimize the occurrence of complications. This is a comparative review that provides a systematic comparison of the similarities and differences in the guidelines and recommendations of three professional organizations along with Hamad Medical Corporation. All guidelines were from official websites including Hamad Medical Corporation. Although the reviewed guidelines for the preoperative care of diabetes patients share some similarities, there are also a number of differences due to outdated data and expert opinions, and therefore differ in practices around the world. While the key elements are agreed upon, more research and global collaboration are needed to create consistent guidelines and improve patient outcomes.', metadata={}, id='2458')"", 'Document(page_content=""We report the case of a patient with type 2 diabetes mellitus (T2DM) on insulin therapy with a history of recurrent and severe hypoglycemia related to lipodystrophy with an uncommon clinical presentation. This was the case of a 67-year-old female with type 2 diabetes hospitalized for the exploration and management of severe and recurrent hypoglycemia. Her diabetes has been evolving since the age of 40 years and was complicated by minimal retinopathy. She was on premixed human insulin, administered through an insulin syringe for the last 17 years. She presented a history of well-controlled diabetes until five months back when she started to show a fluctuating blood glucose concentration, with episodes of unpredictable hypoglycemia occurring at variable times, with values inferior to 0.3 g/l associated with neurological features. Clinical examination revealed a swelling localized in the hypogastric region of the abdomen. It was painless, firm, not fixed to the underlying plans, without local inflammatory signs, and had appeared in the patient\'s preferred insulin injection site. Thus, we retained the diagnosis of insulin-induced lipohypertrophy. The patient has reported reusing needles for up to one week for economic reasons, and not frequently rotating insulin injection sites. The patient found a less painful injection in the lipohypertrophic area, and she continued to inject insulin into that zone, leading to its progressive enlargement. Therapeutic management consisted of switching the patient to insulin analogs and resuming education concerning the correct injection techniques. The insulin injection technique continues to be suboptimal in many insulin-treated patients, and our case emphasizes the need for improved awareness and education."", metadata={}, id=\'3292\')', ""Document(page_content='Glucagon-like peptide-1 (GLP-1) receptor agonists and the dual GLP-1- and glucose-dependent insulinotropic polypeptide receptor co-agonist tirzepatide (referred to here collectively as “GLP-1-based therapy”) are incretin-based therapies being used increasingly in the management of both type 2 diabetes and obesity. They are now recognized to have beneficial effects beyond improved glycemic control and weight loss, including cardiovascular and renal protection. GLP-1-based therapy also slows gastric emptying, which has benefits (lowering postprandial glucose), but also potential risks (eg, hypoglycemia in individuals on insulin or sulphonylurea therapy). Their effects on the gallbladder may also be beneficial, contributing to reducing postprandial triglycerides, but they also potentially increase the risk of biliary disease. In this review, we summarize the effects of GLP-1 and incretin-based therapeutics on gastric, biliary and small intestinal function. An improved understanding of these effects will optimize the use of these drugs.', metadata={}, id='2915')"", ""Document(page_content='Lifestyle intervention prevents or delays type 2 diabetes (T2D) in subjects at a high risk of T2D. However, it is not known whether genetic variants modify the effect on incident T2D during lifestyle intervention. To investigate whether a low or high genetic risk has effects on incident T2D in a group-based lifestyle intervention study. The T2D-GENE trial involved 973 men from the Metabolic Syndrome in Men (METSIM) cohort, aged 50-75 years, body mass index ≥25 kg/m The intervention significantly lowered the risk of T2D among the participants with a high genetic risk for T2D [hazards ratio (HR) 0.30, 95% confidence interval (CI) 0.16-0.56,  P P P Our results showed that individuals with a high genetic risk for T2D benefitted from a low-cost group-based intervention focusing on healthy diet and physical activity. Therefore, all individuals at risk of T2D should be encouraged to make lifestyle changes regardless of genetic risk.', metadata={}, id='2674')"", ""Document(page_content='This study measured serum hypoxia--inducible factor-1 (HIF-1α) and\\nsurvivin levels in patients with diabetes and investigated their association\\nwith the severity of retinopathy. This study included 88 patients with type 2 diabetes mellitus who underwent\\nroutine eye examinations. Three groups were created. Group 1 consisted of\\npatients without diabetic retinopathy. Group 2 included patients with\\nnon-proliferative diabetic retinopathy. Group 3 included patients with\\nproliferative diabetic retinopathy. To measure serum HIF-1α and\\nsurvivin levels, venous blood samples were collected from patients. The mean HIF-1α levels in groups 1, 2, and 3 were 17.30 ± 2.19,\\n17.79 ± 2.34, and 14.19 ± 2.94 pg/ml, respectively.\\nSignificant differences were detected between groups 1 and 3 (p=0.01) and\\nbetween groups 2 and 3 (p=0.01). The mean survivin levels in groups 1, 2,\\nand 3 were 42.65 ± 5.37, 54.92 ± 5.55, and 37.46 ± 8.09\\npg/ml, respectively. A significant difference was only detected between\\ngroups 2 and 3 (p=0.002). The present study revealed that serum HIF-1α and survivin levels are\\nincreased in patients with non-proliferative diabetic retinopathy compared\\nto those in patients without diabetic retinopathy.', metadata={}, id='3030')"", ""Document(page_content='Indications for sodium-glucose cotransporter-2 (SGLT2) inhibitors have expanded to include heart failure and chronic kidney disease after the year 2020. Whether and how the demographic trends in the prescription of SGLT2 inhibitors have changed after the expansion of indications have not been studied extensively. This study is a descriptive analysis of serial, cross-sectional data on nationwide prescription of SGLT2 inhibitors between April 2016 and March 2023 obtained from NDB Open Data Japan, which contains more than 95% of total health insurance reimbursement claims in the nation. The total number of SGLT2 inhibitor tablets prescribed in outpatient settings with prescriptions papers increased from 577,996,158 tablets in fiscal year (FY) 2020 to 904,598,175 tablets in FY 2022. Patients aged 75 years and older accounted for 20.3% of the total prescriptions in FY 2020, and this proportion increased to 27.8% in FY 2022. Among all SGLT2 inhibitors, the tablet that expanded its indications for patients with heart failure and chronic kidney disease the earliest showed the largest percentage increase in the number of prescribed tablets during this period and the highest share of the elderly population in its recipients in both sexes (men, 35.9%; women, 49.4%) in FY 2022. The number of prescribed SGLT2 inhibitor tablets per population was constantly higher in men than in women between FY 2020 and 2022, which is consistent with the sex difference in the prevalence of these diseases. Prescription of SGLT2 inhibitors to the elderly population is no longer infrequent and accounts for a large portion of the entire prescription of SGLT2 inhibitors in Japan. These findings contribute to updating our perception on the demographics of SGLT2 inhibitor recipients.', metadata={}, id='2624')"", ""Document(page_content='This study analyzes data from the 2009–2018 National Health and Nutrition Examination Survey (NHANES) to explore the relationship between the Aggregate Index of Systemic Inflammation (AISI), also referred to as the pan-immune-inflammation value (PIV), and Type 2 Diabetes Mellitus (T2DM) among adults in the United States. Furthermore, it evaluates the mediating effect of obesity indicators on this association. This study included 9,947 individuals from NHANES and applied appropriate weighting techniques. To examine the relationship between AISI and T2DM, we used various statistical models, including weighted multivariable logistic regression, smooth curve fitting, threshold effect analysis, subgroup analysis, trend tests, mediation analysis, and Shapley additive explanations (SHAP) models. This research included a total of 9,947 participants, with 3,220 diagnosed with T2DM, while 6,727 remained undiagnosed. Weighted multiple logistic regression with all covariates adjusted indicated that with every one-unit increment in AISI/1000, there was an 88.3% likelihood of T2DM occurrence (OR: 1.883, 95% CI: 1.378–2.571). The stratified analysis identified significant differences in this association based on age, biological sex, level of education, poverty-income ratio (PIR), tobacco consumption status, and body mass index (BMI). Interaction tests revealed a positive association between AISI and T2DM, apart from PIR, BMI, age, education attainment, race, gender, tobacco use status, Estimated Glomerular Filtration Rate(eGFR), platelet count, and high blood pressure, with none of the interaction p-values falling below 0.05. Nevertheless, the occurrence of cardiovascular disease (CVD) among participants may affect the strength of this relationship, where an interaction p-value was less than 0.05. Additionally, smoothing curve fitting revealed a nonlinear relationship between AISI and T2DM, marking a significant change at AISI/1000 of 0.21. Mediation analysis indicated that five obesity-related indicators—LAP, VAI, WHtR, WWI and ABSI — partly mediated the association between AISI/1000 and T2DM. An increase in AISI is associated with an elevated probability of T2DM, with obesity indicators potentially mediating this relationship. Reducing AISI and managing obesity may help prevent T2DM. However, with the cross-sectional design of this study, causal relationships cannot be established. Future research should utilize longitudinal studies to confirm these findings. \\n The online version contains supplementary material available at 10.1186/s12944-025-02589-4.', metadata={}, id='2551')"", ""Document(page_content='Parkinson’s disease (PD) is caused by the progressive loss of dopaminergic neurons in the substantia nigra. Neuroinflammation is considered a key factor contributing to the pathophysiology of PD. Current gold-standard therapies for PD provide only symptomatic relief without slowing disease progression, highlighting the need to develop new disease-modifying treatments. Metformin has been demonstrated to exert a neuroprotective role in several neurodegenerative disorders including PD. This study aimed to clarify the role of metformin as adjuvant therapy in patients with PD. Sixty patients with PD were divided into 2 groups (n = 30). Patients in group 1 received levodopa/carbidopa (250/25\\xa0mg) three times daily for 3\\xa0months plus placebo (Control group), while those in group 2 received levodopa/carbidopa (250/25\\xa0mg) three times daily and 500\\xa0mg metformin two times daily (Metformin group). Patients were assessed via Unified Parkinson’s Disease Rating Scale (UPDRS). The serum concentrations of toll like receptor 4 (TLR-4), α-synuclein, brain derived neurotropic factor (BDNF), and high mobility group box 1 (HMGB-1) were measured before and after treatment. The improvement in UPDRS from baseline to 3\\xa0months. Change in the level of biological markers. The control group did not show significant difference in UPDRS when compared to their baseline value by Wilcoxon test ( P P P P While no significant differences in UPDRS scores were observed between the metformin and control groups, trends in biomarker changes suggest a potential impact of adjunctive metformin use on the underlying pathophysiology of PD. Further studies are needed to assess its effects on motor symptoms over a longer duration. identifier  NCT05781711', metadata={}, id='2625')"", ""Document(page_content='Assessments for hyperglycemia are vital to pregnancy and postpartum (PP) care, but gold-standard oral glucose tolerance tests (OGTTs) are burdensome. We examined changes in 1,5 anhydroglucitol (1,5AG) levels during gestation and PP and assessed for associations with other measures of glycemia. Pregnant participants (n = 50) in the Study of Pregnancy Regulation of Insulin and Glucose cohort underwent OGTTs at a mean of 13 weeks ([visit 1 (V1)] and 26 weeks [visit 2 (V2)] of gestation and PP. Nonpregnant controls had a single OGTT. 1,5AG was measured using frozen plasma samples. Changes in 1,5AG across pregnancy were assessed with longitudinal mixed effects linear models. We assessed relationships between 1,5AG and glycemia at each timepoint using Spearman correlations and linear regression models. To determine the relationship of 1,5AG with breastfeeding (BF) status, stratified analyses were performed. 1,5AG decreased from V1 to V2 (β = −3.6\\u2005μg/mL,  P P P P P P P 1,5AG decreases during gestation and remains low PP. Breastfeeding is associated with lower 1,5AG levels, indicating plausible excretion into breastmilk. 1,5AG is unlikely to be useful in assessing glycemia in pregnant or PP women.', metadata={}, id='3014')""]",Metformin helps treat type 2 diabetes by reducing glucose production in the liver and increasing insulin sensitivity in peripheral tissues.,4.583425045013428,10,True,,,,,,,,0.0,1396,0
basic,How does SGLT2 inhibition affect kidney function?,"Based on the provided context documents, SGLT2 inhibitors have been shown to have a positive impact on kidney function. Document 1 mentions that the indications for SGLT2 inhibitors have expanded to include chronic kidney disease, and the prescription of these inhibitors has increased significantly over the years. The study analyzed nationwide prescription data in Japan and found that the number of SGLT2 inhibitor tablets prescribed in outpatient settings increased, with a significant proportion being prescribed to elderly patients. This suggests that SGLT2 inhibitors are being used more commonly in the treatment of kidney-related conditions.

Additionally, Document 6 discusses the use of circulating biomarkers for the diagnosis of primary glomerular diseases, which are a leading cause of chronic kidney disease. The study used amino acid profiles to differentiate between different types of glomerular diseases, including minimal change disease and focal segmental glomerular sclerosis. This suggests that biomarkers, such as amino acids, can play a role in identifying and diagnosing kidney-related conditions, potentially aiding in the management of kidney function.

Furthermore, Document 7 highlights the association between estimated glomerular filtration rate (eGFR) and physical performance in individuals with chronic kidney disease. The study found that reduced eGFR and higher albuminuria levels were associated with worse physical performance, indicating a potential link between kidney function and overall physical health.

Overall, the information provided in the context documents suggests that SGLT2 inhibitors, along with biomarkers and eGFR measurements, play a role in improving kidney function and managing kidney-related conditions. However, more specific details on the direct impact of SGLT2 inhibitors on kidney function, such as changes in glomerular filtration rate or proteinuria levels, are not explicitly mentioned in the context. Additional studies focusing specifically on the effects of SGLT2 inhibitors on kidney function would provide a more comprehensive understanding of their role in managing kidney health.","[""Document(page_content='Indications for sodium-glucose cotransporter-2 (SGLT2) inhibitors have expanded to include heart failure and chronic kidney disease after the year 2020. Whether and how the demographic trends in the prescription of SGLT2 inhibitors have changed after the expansion of indications have not been studied extensively. This study is a descriptive analysis of serial, cross-sectional data on nationwide prescription of SGLT2 inhibitors between April 2016 and March 2023 obtained from NDB Open Data Japan, which contains more than 95% of total health insurance reimbursement claims in the nation. The total number of SGLT2 inhibitor tablets prescribed in outpatient settings with prescriptions papers increased from 577,996,158 tablets in fiscal year (FY) 2020 to 904,598,175 tablets in FY 2022. Patients aged 75 years and older accounted for 20.3% of the total prescriptions in FY 2020, and this proportion increased to 27.8% in FY 2022. Among all SGLT2 inhibitors, the tablet that expanded its indications for patients with heart failure and chronic kidney disease the earliest showed the largest percentage increase in the number of prescribed tablets during this period and the highest share of the elderly population in its recipients in both sexes (men, 35.9%; women, 49.4%) in FY 2022. The number of prescribed SGLT2 inhibitor tablets per population was constantly higher in men than in women between FY 2020 and 2022, which is consistent with the sex difference in the prevalence of these diseases. Prescription of SGLT2 inhibitors to the elderly population is no longer infrequent and accounts for a large portion of the entire prescription of SGLT2 inhibitors in Japan. These findings contribute to updating our perception on the demographics of SGLT2 inhibitor recipients.', metadata={}, id='2624')"", ""Document(page_content='IgA nephropathy (IgAN) is a common primary glomerular disease. The  O O The review followed Preferred Reporting Items for Systematic Reviews and Meta-Analyses (PRISMA) recommendations and was registered in PROSPERO (CRD42021287423). The literature search was conducted in PubMed, Web of Science, Cochrane, and Scopus, and the selected articles were evaluated for eligibility based on predefined criteria. The methodological quality of the studies was assessed using the Newcastle–Ottawa Scale. Statistical analysis was performed to calculate effect sizes and assess heterogeneity among the studies. This review analyzed 29 out of 1,986 studies, conducted between 2005 and 2022, with participants from multiple countries. Gd-IgA1 levels were not associated with age and gender, while associations with hypertension, hematuria, and proteinuria were inconsistent. In the meta-analyses, a correlation between serum Gd-IgA1 and estimated glomerular filtration rate was identified, however, the relationships between Gd-IgA1 levels and chronic kidney disease (CKD) stage and progression to kidney failure were inconsistent. Serum Gd-IgA1 levels were not associated with validated prognostic risk factors, but were negatively correlated with kidney function. Further research in larger studies using standardized assays are needed to establish the value of Gd-IgA1 as a prognostic risk factor in IgAN. \\n The online version contains supplementary material available at 10.1007/s40620-023-01874-8.', metadata={}, id='2914')"", ""Document(page_content='In hemodialysis (HD), complement activation, bioincompatibility, and inflammation are intricately intertwined. In the 1970s, as HD became a routine therapy, the observation of complement pathway activation and transient leukopenia by cellulosic dialysis membranes triggered the bioincompatibility debate and its clinical relevance. Extensive deliberations have covered definitions, assessment markers, scope, and long-term clinical consequences of membrane-dependent bioincompatibility reactions. While complement pathways’ interplay with coagulation and inflammation has been delineated, HD’s focus has primarily been on developing more biocompatible membranes using advanced technologies. Recent advances and understanding of the current HD delivery mode (4-hour sessions, thrice weekly) suggest that factors beyond membrane characteristics play a significant role, and a more complex, multifactorial picture of bioincompatibility is emerging. Chronic activation of the complement system and persistent low-grade “uremic inflammation” in chronic kidney disease (CKD) and HD lead to premature inflammaging of the kidney, resembling aging in the general population. Cellular senescence, modulated by complement activation and the uremic milieu, contributes to chronic inflammaging. Additionally, the formation of neutrophil extracellular traps (NETs, process of NETosis) during HD and their biological activity in the interdialytic period can lead to dialysis-induced systemic stress. Thus, complement-inflammation manifestations in HD therapies extend beyond traditional membrane-related bioincompatibility consequences. Recent scientific knowledge is reshaping strategies to mitigate detrimental consequences of bioincompatibility, both technologically and in HD therapy delivery modes, to improve dialysis patient outcomes.', metadata={}, id='2759')"", ""Document(page_content='In recent years, advancements in immunosuppressive medications and post-transplant management have led to a significant decrease in acute rejection rates in renal allografts and consequent improvement in short-term graft survival. In contrast, recent data have shown an increased incidence of post-transplant glomerular diseases, which currently represent a leading cause of allograft loss. Although pathogenesis is not fully understood, growing evidence supports the role of inherited and immunological factors and has identified potential pre- and post-transplant predictors. In this review, we illustrate recent advancements in the pathogenesis of post-transplant glomerular disease and the role of risk factors and immunological triggers. In addition, we discuss potential prevention and management strategies.', metadata={}, id='3201')"", ""Document(page_content='Inhibitors of the interaction between Neuropilin-1 (NRP-1) and Vascular Endothelial Growth Factor-A 165 165 2 2 50 50 2 2 50 165 The online version contains supplementary material available at 10.1007/s00726-024-03411-8.', metadata={}, id='2875')"", ""Document(page_content='Primary glomerular disease (PGD) is an idiopathic cause of renal glomerular lesions that is characterized by proteinuria or hematuria and is the leading cause of chronic kidney disease (CKD). The identification of circulating biomarkers for the diagnosis of PGD requires a thorough understanding of the metabolic defects involved. In this study, ultra-high performance liquid chromatography–tandem mass spectrometry was performed to characterize the amino acid (AA) profiles of patients with pathologically diagnosed PGD, including minimal change disease (MCD), focal segmental glomerular sclerosis (FSGS), membranous nephropathy, and immunoglobulin A nephropathy. The plasma concentrations of asparagine and ornithine were low, and that of aspartic acid was high, in patients with all the pathologic types of PGD, compared to healthy controls. Two distinct diagnostic models were generated using the differential plasma AA profiles using logistic regression and receiver operating characteristic analyses, with areas under the curves of 1.000 and accuracies up to 100.0% in patients with MCD and FSGS. In conclusion, the progression of PGD is associated with alterations in AA profiles, The present findings provide a theoretical basis for the use of AAs as a non-invasive, real-time, rapid, and simple biomarker for the diagnosis of various pathologic types of PGD. The online version contains supplementary material available at 10.1007/s00726-024-03407-4.', metadata={}, id='2691')"", ""Document(page_content='Kidney failure has been associated with decreased physical capacity, although evidence regarding the physical performance of individuals with earlier stages of chronic kidney disease (CKD)\\xa0remains limited. Cross-sectional data were derived from the prospective, population-based Maastricht Study. Multivariate linear regression models were fitted to assess the association of estimated glomerular filtration rate (eGFR) and albuminuria categories with physical performance test outcomes. Overall, 7396 participants were included. Compared to eGFR 60–90\\xa0ml/min/1.73\\xa0m β β β β β β β β β Reduced eGFR and higher albuminuria levels were associated with worse physical performance, especially shorter 6-min walk distance and lower muscle strength. The relationship between eGFR and physical function was non-linear, with also high eGFR values being associated with worse performance, especially in the six-minute walk test. \\n The online version contains supplementary material available at 10.1007/s40620-024-01933-8.', metadata={}, id='2811')"", ""Document(page_content='Membranous nephropathy can lead to end-stage kidney disease, for which kidney transplantation is the preferred therapy. However, the disease often relapses, which can impact allograft survival. We conducted a prospective multicenter study in France involving 72 patients with membranous nephropathy who were awaiting and then underwent kidney transplantation. In addition, we established a retrospective validation cohort of 65 patients. The primary objective was to evaluate the prognostic significance of pretransplant anti phospholipase A2 receptor 1 (PLA2R1) antibodies on the recurrence of membranous nephropathy. The study also assessed the incidence rate, time to onset, and risk factors for recurrence, as well as allograft outcome. The prospective cohort showed a 26% cumulative incidence of membranous nephropathy recurrence after a median follow-up of 23.5 months. This was confirmed by a 28% cumulative incidence after a median follow-up of 67 months in the retrospective cohort. A strong association was found between the presence of anti-PLA2R1 antibodies prior to transplantation and the risk of disease recurrence (risk ratio\\xa0= 5.9; 95% confidence interval [CI]: 2.3–15.7;  P The presence of anti-PLA2R1 antibodies prior to transplantation was a strong predictor of recurrence of allograft membranous nephropathy. An individualized immunomonitoring and management strategy for kidney transplant candidates with anti-PLA2R1-associated membranous nephropathy should be considered.', metadata={}, id='3193')"", ""Document(page_content='Glucagon-like peptide-1 (GLP-1) receptor agonists and the dual GLP-1- and glucose-dependent insulinotropic polypeptide receptor co-agonist tirzepatide (referred to here collectively as “GLP-1-based therapy”) are incretin-based therapies being used increasingly in the management of both type 2 diabetes and obesity. They are now recognized to have beneficial effects beyond improved glycemic control and weight loss, including cardiovascular and renal protection. GLP-1-based therapy also slows gastric emptying, which has benefits (lowering postprandial glucose), but also potential risks (eg, hypoglycemia in individuals on insulin or sulphonylurea therapy). Their effects on the gallbladder may also be beneficial, contributing to reducing postprandial triglycerides, but they also potentially increase the risk of biliary disease. In this review, we summarize the effects of GLP-1 and incretin-based therapeutics on gastric, biliary and small intestinal function. An improved understanding of these effects will optimize the use of these drugs.', metadata={}, id='2915')"", ""Document(page_content='Acute kidney injury (AKI) is a critical morbidity after cytoreduction and hyperthermic intraperitoneal chemotherapy (CRS/HIPEC). This study was conducted to investigate the use of kidney-specific biomarkers to evaluate the diagnostic accuracy of post-HIPEC AKI. Patients who received CRS/HIPEC were prospectively enrolled in this study. We serially sampled urine neutrophil gelatinase-associated lipocalin (NGAL), serum cystatin C (sCyC), and β2 microglobulin (sβ2-MG) on the day before CRS/HIPEC and then 2 h, 1 d, 2 d, 3 d, and 7 d after CRS/HIPEC. The primary outcome was the occurrence of AKI during the first 7 d. The areas under the receiver operating characteristic curve (AUCs) were calculated to evaluate the detection performance. A total of 75 patients were eligible, of whom 5 (6.7%) fulfilled the criteria of AKI during the study period (AKI group) and 70 did not (non-AKI group). No significant differences were observed in these biomarkers between the two groups, except for sβ2-MG on day 3 ( P P P This is the first prospective study to evaluate the value of kidney-specific biomarkers in patients after CRS/HIPEC. We found that AKI cannot be predicted by simply using the absolute measurements of these biomarkers because of the heterogeneous characteristics of the patients.', metadata={}, id='2737')""]","SGLT2 inhibitors protect kidney function by reducing hyperfiltration, decreasing albuminuria, and providing nephroprotection through mechanisms independent of glycemic control.",3.554339647293091,10,True,,,,,,,,0.0,2156,0
basic,What is the mechanism of action of GLP-1 receptor agonists?,"GLP-1 receptor agonists, also known as incretin-based therapies, have beneficial effects beyond improved glycemic control and weight loss in the management of type 2 diabetes and obesity. These therapies, including tirzepatide, slow gastric emptying, leading to lower postprandial glucose levels. They also have potential risks such as hypoglycemia in individuals on insulin or sulfonylurea therapy. GLP-1-based therapy may also affect the gallbladder, contributing to reducing postprandial triglycerides but potentially increasing the risk of biliary disease.

The mechanism of action of GLP-1 receptor agonists involves activating the GLP-1 receptor, which leads to increased insulin secretion in a glucose-dependent manner. This helps lower blood glucose levels after meals. Additionally, GLP-1 receptor agonists can promote weight loss and have cardiovascular and renal protective effects. They may also impact gastric, biliary, and small intestinal function, which can further contribute to their therapeutic effects.

In summary, GLP-1 receptor agonists work by mimicking the action of GLP-1, a hormone that stimulates insulin secretion and has various metabolic effects. They play a crucial role in managing type 2 diabetes and obesity by improving glycemic control, promoting weight loss, and providing cardiovascular and renal protection. Additional details on the exact cellular and molecular mechanisms of how GLP-1 receptor agonists exert their effects may require further research.","[""Document(page_content='Glucagon-like peptide-1 (GLP-1) receptor agonists and the dual GLP-1- and glucose-dependent insulinotropic polypeptide receptor co-agonist tirzepatide (referred to here collectively as “GLP-1-based therapy”) are incretin-based therapies being used increasingly in the management of both type 2 diabetes and obesity. They are now recognized to have beneficial effects beyond improved glycemic control and weight loss, including cardiovascular and renal protection. GLP-1-based therapy also slows gastric emptying, which has benefits (lowering postprandial glucose), but also potential risks (eg, hypoglycemia in individuals on insulin or sulphonylurea therapy). Their effects on the gallbladder may also be beneficial, contributing to reducing postprandial triglycerides, but they also potentially increase the risk of biliary disease. In this review, we summarize the effects of GLP-1 and incretin-based therapeutics on gastric, biliary and small intestinal function. An improved understanding of these effects will optimize the use of these drugs.', metadata={}, id='2915')"", ""Document(page_content='The Golgi apparatus serves multiple crucial roles in the cell. These roles include the addition and subsequent modification of glycans, not only to newly-made proteins arriving from the endoplasmic reticulum, but also to precursors during the biosynthesis of glycolipids. New research by Brauer et al, (', metadata={}, id='3107')"", ""Document(page_content='Glycosylation, which plays an important role in modifying lipids and sorting of proteins, is regulated by asymmetric intra-Golgi distribution and SPPL3-mediated cleavage of Golgi enzymes. We found that cells lacking LYSET/TMEM251, a retention factor for Golgi  N cis', metadata={}, id='3061')"", ""Document(page_content='Inhibitors of the interaction between Neuropilin-1 (NRP-1) and Vascular Endothelial Growth Factor-A 165 165 2 2 50 50 2 2 50 165 The online version contains supplementary material available at 10.1007/s00726-024-03411-8.', metadata={}, id='2875')"", ""Document(page_content='NLRP3 is an intracellular sensor molecule that affects neutrophil functionality and infiltration in brain disorders such as experimental autoimmune encephalomyelitis (EAE). However, the detailed molecular mechanisms underlying the role of NLRP3 in these processes remain unknown. We found that NLRP3 is crucial for neutrophil infiltration, whereas dispensable for neutrophil priming. Notably, NLRP3 activation in neutrophils induced blood-brain barrier (BBB) disruption and neutrophil infiltration into the brain via CXCL1/2 secretion and subsequent activation of the CXCL1/2-CXCR2 signaling axis. Moreover, CXCL1 and CXCL2 in the inflamed brain directly reduced Claudin-5 expression, which regulates BBB permeability in brain endothelial cells. Furthermore, neutrophil-specific NLRP3 activation aggravated EAE pathogenesis by promoting CXCR2-mediated infiltration of both neutrophils and CD4 The online version contains supplementary material available at 10.1186/s12974-025-03468-6.', metadata={}, id='2519')"", ""Document(page_content='Diabetes mellitus (DM) is a prevalent condition that requires careful management in the perioperative setting to reduce surgical risks and optimize patient outcomes. The preoperative care of diabetic patients is complex because glucose control must be balanced with minimizing hypoglycemic or hyperglycemic events during surgery. A variety of diabetic medications such as insulin, dipeptidyl-peptidase-4 inhibitors, glucagon-like peptide-1 receptor agonists, sodium–glucose cotransporter-2 inhibitors, and biguanides such as metformin present unique challenges and considerations due to their different mechanisms, benefits, and potential adverse effects. In recent years, professional organizations have developed recommendations on the perioperative management of these therapies, although there remain some variations in guidelines related to medication cessation and dosage adjustments. Standardized protocols in preoperative DM care remain a topic of interest to ensure consistent and safe practices across healthcare settings, and further collaborative research efforts could provide clarity and consensus in managing this diverse patient population. The objective of this study was to provide an overview of guidelines and practices to support healthcare professionals in delivering improved preoperative care for diabetic patients. This initiative aims to enhance surgical outcomes and minimize the occurrence of complications. This is a comparative review that provides a systematic comparison of the similarities and differences in the guidelines and recommendations of three professional organizations along with Hamad Medical Corporation. All guidelines were from official websites including Hamad Medical Corporation. Although the reviewed guidelines for the preoperative care of diabetes patients share some similarities, there are also a number of differences due to outdated data and expert opinions, and therefore differ in practices around the world. While the key elements are agreed upon, more research and global collaboration are needed to create consistent guidelines and improve patient outcomes.', metadata={}, id='2458')"", ""Document(page_content='Although a role of the thalamus in different arousal and awareness states is well established, there is a surprising lack of knowledge on subregional specificity within this complex, multinucleated structure of the diencephalon. In their recent paper ‘Extrasynaptic GABA-A receptors in central medial thalamus mediate anaesthesia in rats’, Muheyati et al. evaluated whether GABA A A A', metadata={}, id='2972')"", ""Document(page_content='Common treatments for type 2 diabetes include lifestyle changes such as diet and exercise, oral medications like metformin, and in some cases, insulin therapy. Metformin is often the first-line medication prescribed for type 2 diabetes. It helps lower glucose production in the liver and improves insulin sensitivity.', metadata={}, id='2297')"", ""Document(page_content='The enzyme arginase catalyzes the hydrolysis of  l l l l l Arg1 Arg2 Further basic and translational research is needed to deepen our understanding of the regulation of Arg1 and Arg2 in different cell types in consideration of their localization, species-specificity, and multiple biochemical and physiological roles. This will lead to better pharmacological strategies to target arginase activity in liver, cardiovascular, hematological, immune/infectious diseases, and cancer.', metadata={}, id='2485')"", ""Document(page_content='Juvenile hormone (JH) is one of the most essential hormones controlling insect metamorphosis and physiology. While it is well known that JH affects many tissues throughout the insect life cycle, the difference in JH responsiveness and the repertoire of JH-inducible genes among different tissues has not been fully investigated. In this study, we monitored JH responsiveness  in vivo Drosophila melanogaster JH response element-GFP JHRE-GFP germ cell-expressed Lactate dehydrogenase', metadata={}, id='2741')""]","GLP-1 receptor agonists work by stimulating insulin secretion, suppressing glucagon secretion, slowing gastric emptying, and promoting satiety, ultimately improving glycemic control and often leading to weight loss.",4.740428924560547,10,True,,,,,,,,0.0,1494,0
basic,What are the cardiovascular benefits of SGLT2 inhibitors?,"The context documents provide information on the expanded indications and prescription trends of SGLT2 inhibitors, but do not specifically mention the cardiovascular benefits of SGLT2 inhibitors. To fully answer the question, further information on the cardiovascular benefits of SGLT2 inhibitors would be needed.","[""Document(page_content='Indications for sodium-glucose cotransporter-2 (SGLT2) inhibitors have expanded to include heart failure and chronic kidney disease after the year 2020. Whether and how the demographic trends in the prescription of SGLT2 inhibitors have changed after the expansion of indications have not been studied extensively. This study is a descriptive analysis of serial, cross-sectional data on nationwide prescription of SGLT2 inhibitors between April 2016 and March 2023 obtained from NDB Open Data Japan, which contains more than 95% of total health insurance reimbursement claims in the nation. The total number of SGLT2 inhibitor tablets prescribed in outpatient settings with prescriptions papers increased from 577,996,158 tablets in fiscal year (FY) 2020 to 904,598,175 tablets in FY 2022. Patients aged 75 years and older accounted for 20.3% of the total prescriptions in FY 2020, and this proportion increased to 27.8% in FY 2022. Among all SGLT2 inhibitors, the tablet that expanded its indications for patients with heart failure and chronic kidney disease the earliest showed the largest percentage increase in the number of prescribed tablets during this period and the highest share of the elderly population in its recipients in both sexes (men, 35.9%; women, 49.4%) in FY 2022. The number of prescribed SGLT2 inhibitor tablets per population was constantly higher in men than in women between FY 2020 and 2022, which is consistent with the sex difference in the prevalence of these diseases. Prescription of SGLT2 inhibitors to the elderly population is no longer infrequent and accounts for a large portion of the entire prescription of SGLT2 inhibitors in Japan. These findings contribute to updating our perception on the demographics of SGLT2 inhibitor recipients.', metadata={}, id='2624')"", ""Document(page_content='The management of acute coronary syndrome (ACS) in older patients remains challenging because standard anticoagulants often fail to yield optimal outcomes. Bivalirudin, a direct inhibitor of thrombin, serves as an alternative to traditional therapies. This drug is particularly effective in enhancing myocardial microcirculation and reducing adverse events after clinical interventions. The present article explores the findings of a recent study that highlighted the clinical benefits of bivalirudin by investigating its effects on myocardial microcirculation and adverse cardiac events after percutaneous coronary intervention in older patients with ACS. Compared with unfractionated heparin, bivalirudin markedly reduced the emergency response time and improved cardiac function indicators. It further mitigated the risks of cardiovascular events and recurrent myocardial infarctions. These findings suggest that bivalirudin can enhance myocardial perfusion and reduce bleeding complications, thus serving as a safe, effective anticoagulation agent for older patients with ACS. Nonetheless, further large-scale, high-quality trials are needed to establish optimal usage guidelines and assess long-term outcomes. Integrating bivalirudin into ACS treatment protocols for older patients may help optimize patient care, balancing efficacy and safety. Continual research and consensus building are necessary for the widespread clinical application of bivalirudin and the improvement of ACS outcomes in older patients.', metadata={}, id='2335')"", ""Document(page_content='Inhibitors of the interaction between Neuropilin-1 (NRP-1) and Vascular Endothelial Growth Factor-A 165 165 2 2 50 50 2 2 50 165 The online version contains supplementary material available at 10.1007/s00726-024-03411-8.', metadata={}, id='2875')"", ""Document(page_content='Common treatments for type 2 diabetes include lifestyle changes such as diet and exercise, oral medications like metformin, and in some cases, insulin therapy. Metformin is often the first-line medication prescribed for type 2 diabetes. It helps lower glucose production in the liver and improves insulin sensitivity.', metadata={}, id='2297')"", ""Document(page_content='Atherosclerosis (AS) is a chronic inflammatory disease characterized by the gradual accumulation of plaques in arterial walls, with its pathogenesis remaining incompletely understood. Recent studies have highlighted that development of AS is closely associated with the aberrant activation of the NLRP3 inflammasome in the arteries. Inhibition of the NLRP3 inflammasome by natural products and formulae derived from Chinese herbal medicines (CHMs) has been shown to alleviate AS-associated pathologies. However, therapies that effectively and safely target the NLRP3 inflammasome remain limited. This review aims to summarize the key discoveries from recent studies on the effects of these natural products and formulae on the NLRP3 inflammasome in the context of AS treatment. A comprehensive literature search was conducted on databases such as PubMed/MEDLINE up to January 2025, yielding 38 eligible studies. Our analysis indicates that certain therapies can effectively prevent arterial inflammation in animal models by targeting multiple pathways and mechanisms related to the NLRP3 inflammasome. This review summarizes the primary findings of these studies, focusing on the therapeutic effects and underlying mechanisms of action. Based on these insights, we propose future strategies to enhance the efficacy, specificity, and safety of existing natural products and formulae for AS treatment. Additionally, this study offers a perspective for future research that may enhance our understanding of the roles and the mechanisms of CHM-derived phytochemicals and formulae in regulating the NLRP3 inflammasome and treating AS.', metadata={}, id='2641')"", ""Document(page_content='Glucagon-like peptide-1 (GLP-1) receptor agonists and the dual GLP-1- and glucose-dependent insulinotropic polypeptide receptor co-agonist tirzepatide (referred to here collectively as “GLP-1-based therapy”) are incretin-based therapies being used increasingly in the management of both type 2 diabetes and obesity. They are now recognized to have beneficial effects beyond improved glycemic control and weight loss, including cardiovascular and renal protection. GLP-1-based therapy also slows gastric emptying, which has benefits (lowering postprandial glucose), but also potential risks (eg, hypoglycemia in individuals on insulin or sulphonylurea therapy). Their effects on the gallbladder may also be beneficial, contributing to reducing postprandial triglycerides, but they also potentially increase the risk of biliary disease. In this review, we summarize the effects of GLP-1 and incretin-based therapeutics on gastric, biliary and small intestinal function. An improved understanding of these effects will optimize the use of these drugs.', metadata={}, id='2915')"", ""Document(page_content='Diet is a key modifiable risk factor in many chronic diseases, including age-related diseases. The Mediterranean diet (MedDiet) is an extensively studied dietary pattern which has been proposed as a lifestyle intervention to promote healthy aging in the general population, due to its numerous health benefits. Randomized controlled trials (RCTs) have attempted to explore the mechanism(s) by which the MedDiet exerts its beneficial effects on aging. One proposed mechanism is that the MedDiet helps to slow down a process called ‘inflamm-aging’, a type of chronic, low-grade inflammation which contributes to aging. To explore the evidence supporting this hypothesized mechanism, we conducted a scoping review of existing RCTs which used a MedDiet intervention and assessed at least one molecular outcome of potential relevance to inflamm-aging. We identified 14 papers representing 12 unique RCTs. Based on our findings, we present 10 recommendations for the next clinical trial of the MedDiet in inflamm-aging.', metadata={}, id='3220')"", 'Document(page_content=""Although the novel coronavirus disease 2019 (COVID‐19), caused by the severe acute respiratory syndrome coronavirus 2 (SARS‐CoV‐2), primarily manifests as severe respiratory distress, its impact on the cardiovascular system is also notable. Studies reveal that COVID‐19 patients often suffer from certain vascular diseases, partly attributed to increased proliferation or altered phenotype of vascular smooth muscle cells (VSMCs). Although the association between COVID‐19 and VSMCs is recognized, the precise mechanism underlying SARS‐CoV‐2\'s influence on VSMC phenotype remains largely under‐reviewed. In this context, while there is a consistent body of literature dissecting the effect of COVID‐19 on the cardiovascular system, few reports delve into the potential role of VSMC switching in the pathophysiology associated with COVID‐19 and the molecular mechanisms involved therein. This review dissects and critiques the link between COVID‐19 and VSMCs, with particular attention to pathways involving cholesterol, calcium, and phosphate. These pathways underpin the interaction between the virus and VSMCs. Such interaction promotes VSMC proliferation, and eventually potentiates vascular calcification as well as worsens prognosis in patients with COVID‐19."", metadata={}, id=\'3009\')', ""Document(page_content='Although the importance of home blood pressure (BP) management has been widely reported, the achievement rate of home BP targets remains low in Japan. Sacubitril/valsartan is a novel antihypertensive agent with potent antihypertensive effects. Despite its theoretical advantages, the real-world clinical application of sacubitril/valsartan in optimizing home BP management remains underexplored. The aim of this study was to evaluate the effect of switching from azilsartan treatment to sacubitril/valsartan treatment on the achievement of home BP targets and to refine hypertension management strategies in practical clinical settings. A cohort of 55 patients, with a mean morning home systolic BP of 135 mmHg or more was enrolled for an 8-week treatment phase with azilsartan and calcium-channel blockers. Morning BP, pulse rate (PR), estimated glomerular filtration rate, and B-type natriuretic peptide, serum potassium, serum uric acid (UA), and hemoglobin A1c levels were assessed at baseline and then at 8, 24, and 48 weeks after switching from 20 mg azilsartan to 200 mg sacubitril/valsartan. At 48 weeks after switching to sacubitril/valsartan, there was a 60% increase in the rate of attainment of home systolic BP targets. Sacubitril/valsartan significantly reduced the mean systolic BP (from 143.6 ± 7.0 mmHg to 131.4 ± 8.7 mmHg), diastolic BP (from 86.9 ± 12.3 mmHg to 80.2 ± 10.7 mmHg), PR (from 74.8 ± 11.0 bpm to 72.1 ± 10.1 bpm), and serum UA (from 5.9 ± 1.1 mg/dL to 5.5 ± 0.9 mg/dL) within the first 8 weeks (all p < 0.01). These effects were maintained for 48 weeks. The switch from azilsartan to sacubitril/valsartan treatment resulted in a significant improvement in the achievement of home BP targets, which is consistent with our goal of refining hypertension management strategies in practical clinical settings.', metadata={}, id='2639')"", ""Document(page_content='Chronic Chagas cardiomyopathy is associated with an unbalanced\\nimmune response and impaired heart function, and available drugs do\\nnot prevent its development. Zileuton (Zi), a 5-lypoxigenase inhibitor,\\naffects inflammatory/pro-resolution mediators. Herein, Zi treatment\\nin the early phase of infection reduced parasitemia associated mainly\\nwith the direct effect of Zi on the parasite, and the enzyme epoxide\\nhydrolase was the potential molecular target behind the trypanocidal\\neffect. In the intermediate acute phase of infection, Zi reduced the\\nnumber of innate and adaptive inflammatory cells, increased the level\\nof SOCS2 expression in the heart associated with lower inflammation,\\nand improved cardiac function. Zi treatment initiated in the chronic\\nstage increased the level of SOCS2 expression in the heart, reduced\\ninflammation, and improved cardiac function. Our data suggest that\\nZi protects against  Trypanosoma cruzi', metadata={}, id='3130')""]","SGLT2 inhibitors provide cardiovascular benefits by reducing major adverse cardiovascular events and hospitalization for heart failure, effects that appear to be independent of their glucose-lowering action.",1.1898090839385986,10,True,,,,,,,,0.0,313,0
basic,How do statins prevent cardiovascular disease?,"The context documents do not specifically mention how statins prevent cardiovascular disease. The documents primarily focus on various aspects of cardiovascular health, such as the effects of different diets, medications, and conditions on heart health. To fully answer the question of how statins prevent cardiovascular disease, additional information specifically addressing the mechanism of action of statins and their role in reducing the risk of cardiovascular events would be needed.","[""Document(page_content='Diet is a key modifiable risk factor in many chronic diseases, including age-related diseases. The Mediterranean diet (MedDiet) is an extensively studied dietary pattern which has been proposed as a lifestyle intervention to promote healthy aging in the general population, due to its numerous health benefits. Randomized controlled trials (RCTs) have attempted to explore the mechanism(s) by which the MedDiet exerts its beneficial effects on aging. One proposed mechanism is that the MedDiet helps to slow down a process called ‘inflamm-aging’, a type of chronic, low-grade inflammation which contributes to aging. To explore the evidence supporting this hypothesized mechanism, we conducted a scoping review of existing RCTs which used a MedDiet intervention and assessed at least one molecular outcome of potential relevance to inflamm-aging. We identified 14 papers representing 12 unique RCTs. Based on our findings, we present 10 recommendations for the next clinical trial of the MedDiet in inflamm-aging.', metadata={}, id='3220')"", ""Document(page_content='Is the use of supraphysiologic doses of anabolic androgenic steroids (AASs) associated with persistent coronary microvascular dysfunction? In this cross-sectional study including 90 men, the prevalence of impaired myocardial flow reserve was increased among both those with current and former AAS use compared with controls. Among individuals with former AAS use, the accumulated duration of AAS use was independently associated with an increased risk of reduced myocardial flow reserve. The findings of this study suggest that AAS use may be associated with impaired myocardial flow reserve, with possible persistent coronary microvascular dysfunction years after AAS cessation.', metadata={}, id='2732')"", ""Document(page_content='Systemic lupus erythematosus (SLE) is an autoimmune condition that is characterized by the production of autoantibodies and sustained inflammatory damage. Coronary heart disease (CHD) is a common complication of SLE, significantly increases CHD-related mortality in SLE patients. Despite conventional risk factors, the mechanisms contributing to a higher CHD risk require further investigation, with the immune and inflammatory aspects of SLE playing a significant role. Endothelial cell damage and dysfunction are key factors in the progression of coronary atherosclerosis in SLE patients. This review specifically focuses on endothelial dysfunction and the role of specific microRNAs in the context of SLE and CHD. In addition, we discuss the effects and functions of oxidative stress markers, endothelial progenitor cells, and circulating endothelial cells in individuals with both SLE and CHD. We also explored the typical inflammatory markers associated with SLE and CHD, addressing their clinical significance and limitations.', metadata={}, id='2778')"", ""Document(page_content='The outcomes related to cardiovascular risk (CVR) in patients with the nonclassical form of congenital adrenal hyperplasia (NCAH) are unknown, especially those related to therapeutic options, including low doses of glucocorticoids or oral contraceptive pills. To analyze CVR by markers of atherosclerosis in females with the nonclassical form according to therapeutic options. A cross-sectional study at a tertiary center. Forty-seven females with NCAH (33.4 ± 10 years) were subdivided into group 1 (G1) (n = 28) treated with dexamethasone (0.14 ± 0.05\\u2005mg/m There were no statistically significant differences in BMI, HOMA-IR, high-density lipoprotein-cholesterol, or triglyceride levels among groups ( P P P P Adult females with NCAH did not show increased CVR using methodologies for detection of precocious atherosclerosis. Although patients receiving dexamethasone therapy had increased IL-6 and IL-8 levels, these data were not associated with radiological markers of atherosclerosis. Our cohort was composed of young adults and should be reevaluated in a long-term follow-up.', metadata={}, id='3046')"", ""Document(page_content='Inhibitors of the interaction between Neuropilin-1 (NRP-1) and Vascular Endothelial Growth Factor-A 165 165 2 2 50 50 2 2 50 165 The online version contains supplementary material available at 10.1007/s00726-024-03411-8.', metadata={}, id='2875')"", ""Document(page_content='The management of acute coronary syndrome (ACS) in older patients remains challenging because standard anticoagulants often fail to yield optimal outcomes. Bivalirudin, a direct inhibitor of thrombin, serves as an alternative to traditional therapies. This drug is particularly effective in enhancing myocardial microcirculation and reducing adverse events after clinical interventions. The present article explores the findings of a recent study that highlighted the clinical benefits of bivalirudin by investigating its effects on myocardial microcirculation and adverse cardiac events after percutaneous coronary intervention in older patients with ACS. Compared with unfractionated heparin, bivalirudin markedly reduced the emergency response time and improved cardiac function indicators. It further mitigated the risks of cardiovascular events and recurrent myocardial infarctions. These findings suggest that bivalirudin can enhance myocardial perfusion and reduce bleeding complications, thus serving as a safe, effective anticoagulation agent for older patients with ACS. Nonetheless, further large-scale, high-quality trials are needed to establish optimal usage guidelines and assess long-term outcomes. Integrating bivalirudin into ACS treatment protocols for older patients may help optimize patient care, balancing efficacy and safety. Continual research and consensus building are necessary for the widespread clinical application of bivalirudin and the improvement of ACS outcomes in older patients.', metadata={}, id='2335')"", ""Document(page_content='Atherosclerosis (AS) is a chronic inflammatory disease characterized by the gradual accumulation of plaques in arterial walls, with its pathogenesis remaining incompletely understood. Recent studies have highlighted that development of AS is closely associated with the aberrant activation of the NLRP3 inflammasome in the arteries. Inhibition of the NLRP3 inflammasome by natural products and formulae derived from Chinese herbal medicines (CHMs) has been shown to alleviate AS-associated pathologies. However, therapies that effectively and safely target the NLRP3 inflammasome remain limited. This review aims to summarize the key discoveries from recent studies on the effects of these natural products and formulae on the NLRP3 inflammasome in the context of AS treatment. A comprehensive literature search was conducted on databases such as PubMed/MEDLINE up to January 2025, yielding 38 eligible studies. Our analysis indicates that certain therapies can effectively prevent arterial inflammation in animal models by targeting multiple pathways and mechanisms related to the NLRP3 inflammasome. This review summarizes the primary findings of these studies, focusing on the therapeutic effects and underlying mechanisms of action. Based on these insights, we propose future strategies to enhance the efficacy, specificity, and safety of existing natural products and formulae for AS treatment. Additionally, this study offers a perspective for future research that may enhance our understanding of the roles and the mechanisms of CHM-derived phytochemicals and formulae in regulating the NLRP3 inflammasome and treating AS.', metadata={}, id='2641')"", ""Document(page_content='Peripheral artery disease (PAD) and dyslipidemia are both independent predictors of cardiovascular disease, but the association between individual lipid species and subclinical PAD, assessed by ankle-brachial index (ABI), is lacking in large-scale longitudinal studies. We used liquid chromatography-mass spectrometry to repeatedly measure 1,542 lipid species from 1,886 American Indian adults attending 2 clinical examinations (mean ~5 years apart) in the Strong Heart Family Study. We used generalized estimating equation models to identify baseline lipid species associated with change in ABI and the Cox frailty regression to examine whether lipids associated with change in ABI were also associated with incident coronary heart disease (CHD). We also examined the longitudinal association between change in lipid species and change in ABI and the cross-sectional association of individual lipids with ABI. All models were adjusted for age, sex, body mass index, smoking, alcohol use, hypertension, estimated glomerular filtration rate, diabetes, and lipid-lowering medication. Baseline levels of 120 lipid species, including glycerophospholipids, glycerolipids, fatty acids, and sphingomyelins, were associated with change in ABI. Among these, higher baseline levels of 3 known lipids (phosphatidylinositol[16:0/20:4], triacylglycerol[48:2], triacylglycerol[55:1]) were associated with a lower risk of CHD (hazard ratios [95% CIs] ranged from 0.67 [0.46–0.99] to 0.76 [0.58–0.99]), while cholesterol was associated with a higher risk of CHD (hazard ratio [95% CI] = 1.37 [1.00–1.87]). Longitudinal changes in 32 lipids were significantly associated with change in ABI during 5-year follow-up. Plasma levels of glycerophospholipids, triacylglycerols, and glycosylceramides were significantly associated with ABI in the cross-sectional analysis. Altered plasma lipidome is significantly associated with subclinical PAD in American Indians beyond traditional risk factors. If validated, the identified lipid species may serve as novel biomarkers for PAD in this high-risk but understudied population.', metadata={}, id='2588')"", ""Document(page_content='Chronic Chagas cardiomyopathy is associated with an unbalanced\\nimmune response and impaired heart function, and available drugs do\\nnot prevent its development. Zileuton (Zi), a 5-lypoxigenase inhibitor,\\naffects inflammatory/pro-resolution mediators. Herein, Zi treatment\\nin the early phase of infection reduced parasitemia associated mainly\\nwith the direct effect of Zi on the parasite, and the enzyme epoxide\\nhydrolase was the potential molecular target behind the trypanocidal\\neffect. In the intermediate acute phase of infection, Zi reduced the\\nnumber of innate and adaptive inflammatory cells, increased the level\\nof SOCS2 expression in the heart associated with lower inflammation,\\nand improved cardiac function. Zi treatment initiated in the chronic\\nstage increased the level of SOCS2 expression in the heart, reduced\\ninflammation, and improved cardiac function. Our data suggest that\\nZi protects against  Trypanosoma cruzi', metadata={}, id='3130')"", ""Document(page_content='Peripheral Artery Disease (PAD) is a common cardiovascular condition marked by peripheral artery stenosis or occlusion. Despite treatment advancements, patients will still face vascular complications, highlighting the need for innovative therapies. Human proteins play crucial roles in biology and drug research. Mendelian randomization (MR) analysis, a gene-based method, is increasingly used in drug target identification. This study aims to identify PAD-associated plasma proteins through MR analysis for potential therapies. We first used GWAS data and seven pQTL datasets to identify plasma proteins causally linked to PAD through MR analysis. Then, we performed KEGG pathway enrichment analysis, Bayesian colocalization analysis, and MR-BMA analysis were carried out to investigate mechanisms and prioritize these proteins. Finally, we assessed the druggability of the target proteins using the DrugBank database. MR analysis found four plasma proteins causally linked to PAD: MMP3 positively correlated with PAD, while CASS4, ISG15, and MMP1 exhibited negative associations. Bayesian colocalization analysis confirmed these relationships, and the MR-BMA analysis prioritized MMP1 as the main target. KEGG pathway enrichment analysis highlighted lipid metabolism and atherosclerosis pathways as central to these drug targets. The druggability evaluation indicated that drugs targeting these proteins are either in development or already in clinical use. This study integrates genetic and proteomic data to identify therapeutic targets for PAD and evaluate their potential for drug development. The prioritization of MMP1 and ISG15 as key targets shows promise for PAD treatment, but further validation and clinical exploration of these findings are needed. The online version contains supplementary material available at 10.1186/s12959-025-00738-4.', metadata={}, id='2435')""]","Statins prevent cardiovascular disease by inhibiting HMG-CoA reductase to lower LDL cholesterol, reducing atherosclerotic plaque formation, and through pleiotropic effects such as anti-inflammatory and plaque-stabilizing properties.",1.7104589939117432,10,True,,,,,,,,0.0,489,0
basic,What is the role of ACE inhibitors in heart failure?,"The context documents provided do not specifically mention the role of ACE inhibitors in heart failure. However, based on general medical knowledge, ACE inhibitors play a crucial role in the management of heart failure. 

ACE inhibitors, also known as angiotensin-converting enzyme inhibitors, are a class of medications commonly used in the treatment of heart failure. They work by inhibiting the conversion of angiotensin I to angiotensin II, a potent vasoconstrictor that can lead to increased blood pressure and additional strain on the heart. By blocking this conversion, ACE inhibitors help dilate blood vessels, reduce blood pressure, and decrease the workload on the heart.

In heart failure, ACE inhibitors have been shown to improve symptoms, reduce hospitalizations, and prolong survival. They also help to prevent further remodeling of the heart muscle and can improve overall cardiac function. ACE inhibitors are often part of the standard treatment regimen for heart failure patients, especially those with reduced ejection fraction.

While the context documents provide valuable insights into various aspects of cardiovascular diseases, including myocardial infarction, Chagas cardiomyopathy, congenital heart defects, and cardiac fibrosis, they do not specifically address the role of ACE inhibitors in heart failure. Further research or specific studies on the use of ACE inhibitors in heart failure would be needed to provide a more detailed answer to the question.","[""Document(page_content='Acute myocardial infarction (AMI) is serious disease with high morbidity and mortality worldwide. CD38 is an important metabolic enzyme and plays an important role in a variety of diseases. Our previous studies demonstrated that CD38 deficiency significantly reduced Ang-II-induced ventricular hypertrophy and cardiac ischemia-reperfusion injury. However, the roles of cardiomyocytic CD38 in acute myocardial infarction (AMI) remain unknown. Here, we reported that cardiomyocyte-specific CD38 deficiency (CD38 The online version contains supplementary material available at 10.1038/s41598-025-02207-4.', metadata={}, id='2488')"", ""Document(page_content='Chronic Chagas cardiomyopathy is associated with an unbalanced\\nimmune response and impaired heart function, and available drugs do\\nnot prevent its development. Zileuton (Zi), a 5-lypoxigenase inhibitor,\\naffects inflammatory/pro-resolution mediators. Herein, Zi treatment\\nin the early phase of infection reduced parasitemia associated mainly\\nwith the direct effect of Zi on the parasite, and the enzyme epoxide\\nhydrolase was the potential molecular target behind the trypanocidal\\neffect. In the intermediate acute phase of infection, Zi reduced the\\nnumber of innate and adaptive inflammatory cells, increased the level\\nof SOCS2 expression in the heart associated with lower inflammation,\\nand improved cardiac function. Zi treatment initiated in the chronic\\nstage increased the level of SOCS2 expression in the heart, reduced\\ninflammation, and improved cardiac function. Our data suggest that\\nZi protects against  Trypanosoma cruzi', metadata={}, id='3130')"", ""Document(page_content='Congenitally corrected transposition of the great arteries (ccTGA) remains a rare congenital disorder with a wide range of manifestations. The management of heart failure (HF) of the systemic right ventricle (RV), arrhythmias, heart block, and acquired cardiac conditions require a complex and multi-faceted approach. The objective of this manuscript is to present the current evidence regarding diagnostic, treatment, and management strategies for HF in ccTGA, including ventricular assist device (VAD) therapy and heart transplantation. A systematic review of the literature was conducted using PubMed, covering the period between 2010 and 2024. The search terms included “heart failure”, “ccTGA”, “VAD”, “heart transplantation”, and “systemic RV failure”. Two clinical cases were included for illustrative purposes. HF is a common occurrence in the context of ccTGA, primarily driven by progressive pressure and volume overload of the systemic RV, regurgitation of the systemic atrio-ventricular (AV) valve, and the development of arrhythmias, including complete heart block and (supra-)ventricular tachycardia. The use of HF medication is indicated for symptomatic patients, however, data on the efficacy of standardized HF medication remains limited. Timing of AV-valve replacement is essential to prevent further progression of HF. In ccTGA, the timing of surgery and interventional treatment approaches, the effect of pharmacological treatment in the context of HF, as well as the timing of initiation of a mechanical circulatory support, VAD and heart transplantation, are based on individualised consensus-level decisions. Optimal management remains a topic of debate due to the scarcity of outcome data. Future investigations should focus on identifying surrogate parameters for guiding treatment.', metadata={}, id='2539')"", ""Document(page_content='Indications for sodium-glucose cotransporter-2 (SGLT2) inhibitors have expanded to include heart failure and chronic kidney disease after the year 2020. Whether and how the demographic trends in the prescription of SGLT2 inhibitors have changed after the expansion of indications have not been studied extensively. This study is a descriptive analysis of serial, cross-sectional data on nationwide prescription of SGLT2 inhibitors between April 2016 and March 2023 obtained from NDB Open Data Japan, which contains more than 95% of total health insurance reimbursement claims in the nation. The total number of SGLT2 inhibitor tablets prescribed in outpatient settings with prescriptions papers increased from 577,996,158 tablets in fiscal year (FY) 2020 to 904,598,175 tablets in FY 2022. Patients aged 75 years and older accounted for 20.3% of the total prescriptions in FY 2020, and this proportion increased to 27.8% in FY 2022. Among all SGLT2 inhibitors, the tablet that expanded its indications for patients with heart failure and chronic kidney disease the earliest showed the largest percentage increase in the number of prescribed tablets during this period and the highest share of the elderly population in its recipients in both sexes (men, 35.9%; women, 49.4%) in FY 2022. The number of prescribed SGLT2 inhibitor tablets per population was constantly higher in men than in women between FY 2020 and 2022, which is consistent with the sex difference in the prevalence of these diseases. Prescription of SGLT2 inhibitors to the elderly population is no longer infrequent and accounts for a large portion of the entire prescription of SGLT2 inhibitors in Japan. These findings contribute to updating our perception on the demographics of SGLT2 inhibitor recipients.', metadata={}, id='2624')"", ""Document(page_content='Cardiac fibrosis occurs in a wide range of cardiac diseases and is characterised by the transdifferentiation of cardiac fibroblasts into myofibroblasts these cells produce large quantities of extracellular matrix, resulting in myocardial scar. The profibrotic process is multi-factorial, meaning identification of effective treatments has been limited. The antifibrotic effect of the bile acid ursodeoxycholic acid (UDCA) is established in cases of liver fibrosis however its mechanism and role in cardiac fibrosis is less well understood. In this study, we used cellular models of cardiac fibrosis and living myocardial slices to characterise the macroscopic and cellular responses of the myocardium to UDCA treatment. We complemented this approach by conducting RNA-seq on cardiac fibroblasts isolated from dilated cardiomyopathy patients. This allowed us to gain insights into the mechanism of action and explore whether the IL-11 and TGFβ/WWP2 profibrotic networks are influenced by UDCA. Finally, we used fibroblasts from a TGR5 KO mouse to confirm the mechanism of action. We found that UDCA reduced myofibroblast markers in rat and human fibroblasts and in living myocardial slices, indicating its antifibrotic action. Furthermore, we demonstrated that the treatment of UDCA successfully reversed the profibrotic IL-11 and TGFβ/WWP2 gene networks. We also show that TGR5 is the most highly expressed UDCA receptor in cardiac fibroblasts. Utilising cells isolated from a TGR5 knock-out mouse, we identified that the antifibrotic effect of UDCA is attenuated in the KO fibroblasts. This study combines cellular studies with RNA-seq and state-of-the-art living myocardial slices to offer new perspectives on cardiac fibrosis. Our data confirm that TGR5 agonists, such as UDCA, offer a unique pathway of action for the treatment of cardiac fibrosis. Medicines for cardiac fibrosis have been slow to clinic and have the potential to be used in the treatment of multiple cardiac diseases. UDCA is well tolerated in the treatment of other diseases, indicating it is an excellent candidate for further in-human trials.', metadata={}, id='2942')"", ""Document(page_content='Inhibitors of the interaction between Neuropilin-1 (NRP-1) and Vascular Endothelial Growth Factor-A 165 165 2 2 50 50 2 2 50 165 The online version contains supplementary material available at 10.1007/s00726-024-03411-8.', metadata={}, id='2875')"", ""Document(page_content='Congenital heart defects occur in approximately 1% of newborns in the US annually. Currently, less than a third of congenital heart defects can be traced to a known genetic or environmental cause, suggesting that a large proportion of disease-causing mechanisms have yet to be fully characterized. Hemodynamic forces such as wall shear stress are critical for heart development and are known to induce changes in embryonic cardiac patterning leading to malformations. However, measuring these hemodynamic factors  in vivo in silico', metadata={}, id='2550')"", ""Document(page_content='Cardiometabolic syndromes including diabetes and obesity are associated with occurrence of heart failure with diastolic dysfunction. There are no specific treatments for diastolic dysfunction, and therapies to manage symptoms have limited efficacy. Understanding of the cardiomyocyte origins of diastolic dysfunction is an important priority to identify new therapeutics. The investigative goal was to experimentally define  in vitro in vivo vs E e E e in vitro in vivo vs \\n Understanding cardiomyocyte stiffness components is an important priority for identifying new therapeutics for diastolic dysfunction, a key feature of cardiometabolic disease. In this study cardiac function was measured  in vivo in vitro Calibrated cardiomyocyte stretches demonstrated that stiffness (stress/strain) was elevated in HFSD cardiomyocytes  in vitro E e in vivo Data show unequivocally that cardiomyocyte mechanical dysfunction cannot be detected by analysis of non‐loaded shortening. These findings suggest that stretch‐dependent augmentation of the myofilament–Ca Understanding cardiomyocyte stiffness components is an important priority for identifying new therapeutics for diastolic dysfunction, a key feature of cardiometabolic disease. In this study cardiac function was measured  in vivo in vitro Calibrated cardiomyocyte stretches demonstrated that stiffness (stress/strain) was elevated in HFSD cardiomyocytes  in vitro E e in vivo Data show unequivocally that cardiomyocyte mechanical dysfunction cannot be detected by analysis of non‐loaded shortening. These findings suggest that stretch‐dependent augmentation of the myofilament–Ca', metadata={}, id='3148')"", ""Document(page_content='Atherosclerosis (AS) is a chronic inflammatory disease characterized by the gradual accumulation of plaques in arterial walls, with its pathogenesis remaining incompletely understood. Recent studies have highlighted that development of AS is closely associated with the aberrant activation of the NLRP3 inflammasome in the arteries. Inhibition of the NLRP3 inflammasome by natural products and formulae derived from Chinese herbal medicines (CHMs) has been shown to alleviate AS-associated pathologies. However, therapies that effectively and safely target the NLRP3 inflammasome remain limited. This review aims to summarize the key discoveries from recent studies on the effects of these natural products and formulae on the NLRP3 inflammasome in the context of AS treatment. A comprehensive literature search was conducted on databases such as PubMed/MEDLINE up to January 2025, yielding 38 eligible studies. Our analysis indicates that certain therapies can effectively prevent arterial inflammation in animal models by targeting multiple pathways and mechanisms related to the NLRP3 inflammasome. This review summarizes the primary findings of these studies, focusing on the therapeutic effects and underlying mechanisms of action. Based on these insights, we propose future strategies to enhance the efficacy, specificity, and safety of existing natural products and formulae for AS treatment. Additionally, this study offers a perspective for future research that may enhance our understanding of the roles and the mechanisms of CHM-derived phytochemicals and formulae in regulating the NLRP3 inflammasome and treating AS.', metadata={}, id='2641')"", ""Document(page_content='The enzyme arginase catalyzes the hydrolysis of  l l l l l Arg1 Arg2 Further basic and translational research is needed to deepen our understanding of the regulation of Arg1 and Arg2 in different cell types in consideration of their localization, species-specificity, and multiple biochemical and physiological roles. This will lead to better pharmacological strategies to target arginase activity in liver, cardiovascular, hematological, immune/infectious diseases, and cancer.', metadata={}, id='2485')""]","ACE inhibitors treat heart failure by blocking the conversion of angiotensin I to angiotensin II, which reduces vasoconstriction and aldosterone production, decreases afterload and preload, improves cardiac output, and ultimately reduces mortality and hospitalizations in patients with heart failure with reduced ejection fraction.",2.720089912414551,10,True,,,,,,,,0.0,1483,0
basic,How do glucocorticoids suppress inflammation?,"Glucocorticoids are known to suppress inflammation by inhibiting the production of pro-inflammatory mediators and cytokines. They exert their anti-inflammatory effects by interfering with the activity of transcription factors, such as NF-κB, that regulate the expression of various inflammatory genes. Document 1 discusses the anti-inflammatory properties of fucoxanthin, a natural compound that inhibits the activation of the NF-κB p65 signaling pathway, thereby reducing the secretion of pro-inflammatory mediators in immune cells. This mechanism of action is crucial for suppressing inflammation at the molecular level.

Additionally, Document 4 explores the anti-inflammatory effects of Menisoxoisoaporphine A (MA), a novel compound derived from a traditional Chinese medicinal herb. MA was found to inhibit the NF-κB signaling pathway by regulating the cAMP-PKA axis, thereby reducing the expression of inflammatory cytokines in macrophage cells. This indicates that MA, similar to glucocorticoids, exerts its anti-inflammatory effects by targeting key signaling pathways involved in the inflammatory response.

While both documents highlight the importance of modulating the NF-κB signaling pathway to suppress inflammation, they do not specifically mention glucocorticoids. Therefore, the information provided in the context documents does not explicitly address how glucocorticoids suppress inflammation. Additional information on the specific mechanisms of glucocorticoid action, such as their ability to inhibit phospholipase A2 and the production of arachidonic acid metabolites, would be needed to provide a comprehensive answer to the question.","[""Document(page_content='Fucoxanthin (Fx), a natural carotenoid predominantly found in brown algae and certain microalgae, has garnered significant attention in recent years for its potent antioxidant and anti-inflammatory properties. As inflammation and oxidative stress represent fundamental physiological responses that play pivotal roles in disease pathogenesis, their intricate interplay has become a focus of scientific investigation. This study employed an LPS-induced THP-1 cell inflammation model to elucidate the anti-inflammatory mechanisms of fucoxanthin and its interaction with oxidative stress pathways. Our findings demonstrate that fucoxanthin effectively suppresses the LPS-induced secretion of pro-inflammatory mediators, including IL-1β, IL-6, iNOS, COX-2, and TNF-α, in THP-1 cells. Mechanistically, this effect is achieved through the inhibition of IκB-α phosphorylation, thereby blocking the activation of the NF-κB p65 signaling pathway. Concurrently, fucoxanthin exhibits robust antioxidant activity, as evidenced by enhanced catalase (CAT) and superoxide dismutase (SOD) activities coupled with reduced malondialdehyde (MDA) production. Furthermore, fucoxanthin activates the Nrf2 signaling pathway, leading to upregulated heme oxygenase-1 (HO-1) expression and the consequent attenuation of reactive oxygen species (ROS) generation. These results collectively indicate that fucoxanthin exerts dual protective effects through anti-inflammatory action mediated by NF-κB pathway inhibition and antioxidant activity via Nrf2/HO-1 pathway activation. The observed crosstalk between these pathways suggests that fucoxanthin’s therapeutic potential stems from its ability to simultaneously modulate interconnected inflammatory and oxidative stress responses. Our study provides compelling evidence that fucoxanthin’s antioxidant and anti-inflammatory activities are functionally interrelated, with the Nrf2 signaling pathway serving as a critical node in this protective mechanism against LPS-induced cellular damage.', metadata={}, id='2494')"", 'Document(page_content=""The immune response in the central nervous system (CNS) is a highly specialized and tightly regulated process essential for maintaining neural health and protecting against pathogens and injuries. The primary immune cells within the CNS include microglia, astrocytes, T cells, and B cells. They work together, continuously monitor the CNS environment for signs of infection, injury, or disease, and respond by phagocytosing debris, releasing cytokines, and recruiting other immune cells. In addition to providing neuroprotection, these immune responses must be carefully balanced to prevent excessive inflammation that can lead to neuronal damage and contribute to neurodegenerative diseases. Dysregulated immune responses in the CNS are implicated in various neurodegenerative diseases such as Alzheimer\'s disease, Parkinson\'s disease, and amyotrophic lateral sclerosis. Wnt signaling is a crucial pathway in the CNS that regulates various cellular processes critical for brain development, function, and maintenance. Despite enhancing immune responses in the health CNS, dysregulated Wnt signaling exacerbates neuroinflammation in the neurodegenerative brains. This review summarized the role of Wnt signaling in regulating immune response under different conditions. We then examined the role of immune response in healthy brains and during the development of neurodegenerative diseases. We also discussed therapeutic intervention in various neurodegenerative diseases through the modulation of the Wnt signaling pathway and neuroinflammation and highlighted challenges and limitations in current clinical trials."", metadata={}, id=\'2946\')', ""Document(page_content='Atherosclerosis (AS) is a chronic inflammatory disease characterized by the gradual accumulation of plaques in arterial walls, with its pathogenesis remaining incompletely understood. Recent studies have highlighted that development of AS is closely associated with the aberrant activation of the NLRP3 inflammasome in the arteries. Inhibition of the NLRP3 inflammasome by natural products and formulae derived from Chinese herbal medicines (CHMs) has been shown to alleviate AS-associated pathologies. However, therapies that effectively and safely target the NLRP3 inflammasome remain limited. This review aims to summarize the key discoveries from recent studies on the effects of these natural products and formulae on the NLRP3 inflammasome in the context of AS treatment. A comprehensive literature search was conducted on databases such as PubMed/MEDLINE up to January 2025, yielding 38 eligible studies. Our analysis indicates that certain therapies can effectively prevent arterial inflammation in animal models by targeting multiple pathways and mechanisms related to the NLRP3 inflammasome. This review summarizes the primary findings of these studies, focusing on the therapeutic effects and underlying mechanisms of action. Based on these insights, we propose future strategies to enhance the efficacy, specificity, and safety of existing natural products and formulae for AS treatment. Additionally, this study offers a perspective for future research that may enhance our understanding of the roles and the mechanisms of CHM-derived phytochemicals and formulae in regulating the NLRP3 inflammasome and treating AS.', metadata={}, id='2641')"", ""Document(page_content='Dysregulated and excessive inflammatory reactions can lead to tissue damage, which is the underlying cause of most human diseases. Menisoxoisoaporphine A (MA), a novel oxoisoaporphine alkaloid, was obtained from Menispermi Rhizoma, a traditional Chinese medicinal herb used in the treatment of inflammatory conditions in clinical practice. This suggests that MA has very promising potential for the development of anti-inflammatory therapeutics. Hence, this study aims to investigate the anti-inflammatory effects and underlying mechanisms of MA. The anti-inflammatory effects of MA were evaluated in lipopolysaccharide (LPS)-induced mouse macrophage RAW264.7 cells. Its underlying mechanisms were explored through RNA sequencing and Western blotting. The binding modes and interactions sites between MA and phosphodiesterase 4B (PDE4B) were predicted using molecular docking and validated by molecular dynamics simulation. MA treatment significantly reduced LPS-induced morphological changes, inflammatory cytokine relesae, and proinflammatory genes expression in RAW264.7 cells compared to the LPS-induced controls. Transcriptome sequencing analysis suggested that PDE4B might be a key target for MA to exert its therapeutic effect. Mechanismly, MA directly acted on Tyr405 site of PDE4B, thus leading to a sustained elevation of the cyclic adenosine monophosphate (cAMP) levels, which subsequently inactivated NF-κB signaling pathway by phosphorylating protein kinase A (PKA). MA inhibited the NF-κB-mediated inflammatory response depending on PDE4B. MA, a natural and novel compound, exerted anti-inflammatory effects in LPS-induced RAW264.7 macrophage cells. It demonstrated a strong binding ability to the Tyr405 sites of PDE4B, thereby inhibiting NF-κB signaling pathway by regulating the cAMP-PKA axis. Elucidating the interaction between MA and PDE4B holds significant potential for the advancement of innovative therapeutic strategies aimed at inflammatory diseases. By strategically modulating this interaction, it may be feasible to achieve more precise regulation of inflammatory responses, thereby offering promising therapeutic benefits for conditions such as rheumatoid arthritis, asthma, and inflammatory bowel disease.', metadata={}, id='2971')"", ""Document(page_content='Diet is a key modifiable risk factor in many chronic diseases, including age-related diseases. The Mediterranean diet (MedDiet) is an extensively studied dietary pattern which has been proposed as a lifestyle intervention to promote healthy aging in the general population, due to its numerous health benefits. Randomized controlled trials (RCTs) have attempted to explore the mechanism(s) by which the MedDiet exerts its beneficial effects on aging. One proposed mechanism is that the MedDiet helps to slow down a process called ‘inflamm-aging’, a type of chronic, low-grade inflammation which contributes to aging. To explore the evidence supporting this hypothesized mechanism, we conducted a scoping review of existing RCTs which used a MedDiet intervention and assessed at least one molecular outcome of potential relevance to inflamm-aging. We identified 14 papers representing 12 unique RCTs. Based on our findings, we present 10 recommendations for the next clinical trial of the MedDiet in inflamm-aging.', metadata={}, id='3220')"", ""Document(page_content='Asthma is a chronic inflammatory lung disease driven by a complex interplay between innate and adaptive immune components. Among these, innate lymphoid cells (ILCs) and innate-like lymphocytes have emerged as crucial players in shaping the disease phenotype. Within the ILC family, group 2 ILCs (ILC2s), in particular, contribute significantly to type 2 inflammation through their rapid production of cytokines such as IL-5 and IL-13, promoting airway eosinophilia and airway hyperreactivity. On the other hand, innate-like lymphocytes such as invariant natural killer T (iNKT) cells can play either pathogenic or protective roles in asthma, depending on the stimuli and lung microenvironment. Regulatory mechanisms, including cytokine signaling, metabolic and dietary cues, and interactions with other immune cells, play critical roles in modulating their functions. In this review, we highlight current findings on the role of ILCs and innate-like lymphocytes in asthma development and pathogenesis. We also examine the underlying mechanisms regulating their function and their interplay with other immune cells. Finally, we explore current therapies targeting these cells and their effector cytokines for asthma management.', metadata={}, id='2391')"", ""Document(page_content='Periodontitis is associated with numerous systemic diseases, and it has been shown that these associations are partly causal in nature. It is assumed that such interactions between periodontal and systemic diseases are also mediated via adipokines. Apelin, an adipokine about which there is little research in the dental field, is also produced together with its receptor in periodontal cells. The aim of this review was to summarize the currently available literature on the apelin-APJ system to better understand the pathomechanistic relationship between periodontitis and obesity and to determine the potential clinical relevance of apelin for diagnostics and therapy. In vitro studies suggest that apelin can enhance bacterial-induced synthesis of proinflammatory and proteolytic molecules, indicating a significant etiopathogenic role of this adipokine. Since serum levels of apelin are elevated in diabetes and/or obesity, it is possible that such systemic diseases promote the development and progression of periodontitis via apelin. On the other hand, it is also conceivable that apelin from the periodontium influences such systemic diseases. Further research is needed to better understand the role of apelin in the periodontium and the entire oral cavity, but also in the interactions between periodontal and systemic diseases. In particular, clinical intervention studies are needed to further decipher the etiopathogenic role of apelin in periodontitis.', metadata={}, id='2869')"", ""Document(page_content='Adipose tissue inflammation is now considered to be a key process underlying metabolic diseases in obese individuals. However, it remains unclear how adipose inflammation is initiated and maintained or the mechanism by which inflammation develops. We found that  microRNA-802 Mir802 Mir802 Mir802 Mir802 Mir802 Mir802 Mir802', metadata={}, id='2928')"", ""Document(page_content='To investigate inflammatory responses in peri-implant crevicular fluid (PICF) in comparison to periodontal tissue. Nineteen participants with healthy implants restored with titanium or gold-casting abutment were included. PICF and gingival crevicular fluid (GCF) were collected for inflammatory cytokine detection by ELISA. Cytokine levels in PICF or GCF of the same individual were compared using the paired t-test, and those from titanium or gold-casting (UCLA) abutment were compared using the independent t-test. Human gingival fibroblast responses to PICF and GCF were then evaluated with one-way ANOVA. The results demonstrated that IL-6, IL-8, TNFα, and IFNγ expressed in PICF are similar to GCF in the same individual. However, IL-1β (p = 0.032) and IL-1α (p = 0.030) was statistically significantly higher in PICF than in GCF. IL-8 level was statistically significantly higher with gold-casting than with titanium abutments (p = 0.003). PICF statistically significantly stimulated higher expression of RANKL, IL-1β, IL-6, and IL-8 mRNA in human gingival fibroblasts (HGF), while focal adhesion kinase (FAK) suppressed mRNA. The inflammatory cytokines, including IL-1α and IL-1β, are higher in healthy peri-implant tissues. Abutment materials may also influence the level of inflammatory cytokines in PICF. Inflammatory mediators in crevicular fluid may affect HGF inflammatory responses and peri-implant tissue integration.', metadata={}, id='2724')"", ""Document(page_content='Long COVID is a debilitating condition that lasts for more than three months post-infection by SARS–CoV–2. On average, one in ten individuals infected with SARS CoV- 2 develops Long COVID worldwide. A knowledge gap exists in our understanding of the mechanisms, genetic risk factors, and biomarkers that could be associated with Long COVID. In this pilot study we used RNA-Seq to quantify the transcriptomes of peripheral blood mononuclear cells isolated from COVID-recovered individuals, seven with and seven without Long COVID symptoms (age- and sex-matched individuals), on average 6 months after infection. Seventy genes were identified as significantly up- or down-regulated in Long COVID samples, and the vast majority were downregulated. The most significantly up- or downregulated genes fell into two main categories, either associated with cell survival or with inflammation. This included genes such as  ICOS S1PR1 LILRB1 LILRB2 LILRB1 LILRB2 Downregulation of these inhibitory receptors similarly indicates a sustained pro-inflammatory state in Long COVID PBMCs.  LILRB1 LILRB2', metadata={}, id='2671')""]","Glucocorticoids suppress inflammation by binding to cytoplasmic glucocorticoid receptors that translocate to the nucleus, where they suppress pro-inflammatory gene transcription and induce anti-inflammatory protein expression.",2.97212815284729,10,True,,,,,,,,0.0,1657,0
basic,What are the mechanisms of antibiotic resistance?,"The mechanisms of antibiotic resistance mentioned in the context documents include the presence of antibiotic resistance genes (ARGs) in bacteria, leading to decreased susceptibility to antimicrobials. These ARGs can confer resistance to specific classes of antibiotics, such as macrolides, lincosamides, streptogramin B (MLSB), multi-drug resistance (MDR) genes, and aminoglycosides. The resistance genes can be detected using high-throughput quantitative PCR (HT-qPCR) and whole metagenome shotgun sequencing (WMGS) techniques.

Additionally, the context documents mention specific examples of bacteria that have developed antibiotic resistance, such as carbapenem-resistant Klebsiella pneumoniae and multidrug-resistant Pseudomonas aeruginosa. These bacteria exhibit resistance to antibiotics through various mechanisms, including the up-regulation of efflux mechanisms and down-regulation of specific genes like ERG in response to drug exposure.

Furthermore, the documents discuss the need for alternative approaches to combat antibiotic resistance, such as the investigation of new antibiotics, complementary therapies, and alternative feed additives like American cranberry to decrease antimicrobial resistance in food-producing animals.

Overall, the mechanisms of antibiotic resistance involve the presence of antibiotic resistance genes in bacteria, specific adaptations in response to drug exposure, and the need for innovative strategies to address the growing issue of antimicrobial resistance.","[""Document(page_content='Antimicrobial resistance has recently increased due to emerging carbapenem-resistant  Klebsiella pneumoniae K. pneumoniae K. pneumoniae K. pneumoniae I K. pneumoniae P P K. pneumoniae', metadata={}, id='3178')"", ""Document(page_content='The increasing prevalence of antimicrobial-resistant (AMR) bacteria in humans, animals, and the environment underscores the necessity for a rapid, sensitive, and specific method to identify resistance genes.  Objectives tet Enterococcus Methodology tet tet Enterococcus Results: tet tet Conclusions tet', metadata={}, id='2461')"", ""Document(page_content='The antibiotic resistance genes (ARGs) limit the susceptibility of bacteria to antimicrobials, representing a problem of high importance. Current research on the presence of ARGs in microorganisms focuses mainly on humans, livestock, hospitals, or wastewater. However, the spectrum of ARGs in the dust resistome in workplaces and households has gone relatively unexplored. This pilot study aimed to analyze resistome in indoor dust samples from participants’ workplaces (a pediatric hospital, a maternity hospital, and a research center) and households and compare two different approaches to the ARGs analysis; high-throughput quantitative PCR (HT-qPCR) and whole metagenome shotgun sequencing (WMGS). In total, 143 ARGs were detected using HT-qPCR, with ARGs associated with the macrolides, lincosamides, and streptogramin B (MLSB) phenotype being the most abundant, followed by MDR (multi-drug resistance) genes, and genes conferring resistance to aminoglycosides. A higher overall relative quantity of ARGs was observed in indoor dust samples from workplaces than from households, with the pediatric hospital being associated with the highest relative quantity of ARGs. WMGS analysis revealed 36 ARGs, of which five were detected by both HT-qPCR and WMGS techniques. Accordingly, the efficacy of the WMGS approach to detect ARGs was lower than that of HT-qPCR. In summary, our pilot data revealed that indoor dust in buildings where people spend most of their time (workplaces, households) can be a significant source of antimicrobial-resistant microorganisms, which may potentially pose a health risk to both humans and animals.', metadata={}, id='2803')"", ""Document(page_content='Bacterial resistance to antibiotics remains a significant clinical challenge, contributing to persistently high rates of morbidity and mortality. Achieving treatment success is increasingly difficult, necessitating the evaluation of new antibiotics and complementary approaches, including source control and alternative therapies. This study aimed to investigate the antibacterial, antioxidant, cytotoxic, and phytochemical properties of  Moringa oleifera Moringa oleifera', metadata={}, id='3219')"", ""Document(page_content='In combating the global epidemic of multidrug-resistant  Klebsiella pneumoniae', metadata={}, id='2615')"", ""Document(page_content='Antifungal resistance and tolerance are distinct responses exhibited by fungi when exposed to drugs. While considerable research has focused on azole tolerance in the human pathogen  Candida albicans This study aims to conduct a comparative investigation of the adaptation of the model organism  Saccharomyces cerevisiae C. albicans in vitro We performed experiments using laboratory strains of  S. cerevisiae C. albicans Our results revealed that fluconazole tolerance is present in wild-type strains of  S. cerevisiae C. albicans S. cerevisiae Transcriptome analysis indicated that petites up-regulated efflux mechanisms while down-regulating most  ERG C. albicans S. cerevisiae', metadata={}, id='2573')"", ""Document(page_content='Carbapenem-resistant  Klebsiella pneumoniae K pneumoniae P', metadata={}, id='3035')"", ""Document(page_content='Alternative feed additives are being investigated due to the restriction of antibiotics use to decrease antimicrobial resistance (AMR) in food-producing animals. This study investigated the effects of dietary American cranberry ( Vaccinium macrocarpon V. angustifolium p Lactobacillus Bacteroides cepA MACROLIDE) InuD tetO tetX', metadata={}, id='2603')"", ""Document(page_content='Pseudomonas aeruginosa P. aeruginosa in vivo', metadata={}, id='3023')"", ""Document(page_content='Opportunistic pathogen  Pseudomonas aeruginosa N P. aeruginosa', metadata={}, id='2428')""]","Bacteria develop antibiotic resistance through target gene mutations, horizontal gene transfer of resistance genes via plasmids or transposons, and expression of efflux pumps that remove antibiotics from the cell.",2.2820279598236084,10,True,,,,,,,,0.0,1507,0
basic,How do biologics treat rheumatoid arthritis?,"Biologics are a type of treatment for rheumatoid arthritis (RA) that target specific proteins in the immune system that play a role in the inflammation and joint damage associated with the disease. Document 1 discusses the use of biologic or target synthetic disease-modifying antirheumatic drugs (b/tsDMARDs) in treating knee joint symptoms in patients with RA. The study found that interleukin 6 (IL-6) inhibitors, Janus kinase (JAK) inhibitors, tumor necrosis factor (TNF) inhibitors, and cytotoxic T lymphocyte-associated antigen-4-Ig (CTLA4-Ig) were all effective in alleviating knee joint symptoms in RA patients, with IL-6 inhibitors showing the highest symptom relief and the least deterioration in knee joint radiographs compared to other biologics.

Document 2 discusses the use of Usenamine A (UA), a natural compound, in the treatment of RA. UA was found to bind to the TNF-TNFR2 complex, which plays a role in inflammation. UA was shown to suppress the production of inflammatory cytokines in peripheral blood mononuclear cells (PBMCs) from RA patients, leading to reduced inflammation and improved symptoms in an arthritis mouse model.

Document 4 touches on the relationship between Hepatitis C Virus (HCV) infection and the risk of developing RA. The study found that HCV infection was associated with an increased risk of developing RA in adults. This suggests that targeting viral infections like HCV may be important in managing RA.

Overall, biologics treat RA by targeting specific proteins or pathways involved in the inflammatory response that leads to joint damage and symptoms in RA patients. By modulating the immune response, biologics can help reduce inflammation, slow down joint damage, and improve symptoms in patients with RA.","[""Document(page_content='This study aims to identify factors influencing the alleviation of knee joint symptoms in patients with rheumatoid arthritis treated with biologic or target synthetic disease-modifying antirheumatic drugs (b/tsDMARDs). Among 2321 patients who started b/tsDMARDs between 2010 and 2023, we focused on 295 patients who had knee swelling or tenderness at the initiation of b/tsDMARDs and continued b/tsDMARDs at least 3 months, with recorded knee symptoms 6 months later. Symptom relief after 6 months was 78.2% for interleukin 6 (IL-6) inhibitors, 68.6% for Janus kinase (JAK) inhibitors, 65.8% for tumor necrosis factor (TNF) inhibitors, and 57.6% for cytotoxic T lymphocyte-associated antigen-4-Ig (CTLA4-Ig). The initial use of b/tsDMARDs and the use of IL-6 inhibitors in comparison to CTLA4-Ig emerged as a significant factor associated with the improvement of knee joint symptoms. Among 141 patients who underwent knee radiography at baseline and two years later, the deterioration in knee joint radiographs was 7.7% for IL-6 inhibitors, 6.3% for JAK inhibitors, 21.9% for TNF inhibitors, and 25.9% for CTLA4-Ig. The use of IL-6 inhibitors was a significant factor associated with the improvement of knee joint symptoms and the inhibition of joint destruction compared to CTLA4-Ig.', metadata={}, id='3079')"", ""Document(page_content='Usenamine A (UA) is a natural compound isolated from the lichen  Usnea diffracta Molecular docking was performed between the 3D structure of UA and the TNF-TNFR2 complex. Peripheral blood mononuclear cells (PBMCs) from RA and AS patients were treated with UA, and cell viability was measured using the MTS assay and flow cytometry. The in vitro effects of co-culture with UA were determined by measuring inflammatory cytokines, including IFN-γ, IL-17A, and GM-CSF, using flow cytometry and enzyme-linked immunosorbent assay (ELISA). The in vivo effects of UA were evaluated using an arthritis mouse model. The docking complex of UA bound to the TNF-TNFR2 complex exhibited docking scores of −5.251 kcal/mol and −6.274 kcal/mol, confirming their active sites. UA did not affect cell viability and suppressed the production of inflammatory cytokines in the PBMCs of RA (IFN-γ, IL-17A, and GM-CSF) and AS (GM-CSF) patients. The ELISA also confirmed reduced cytokine levels in the co-culture of UA and PBMCs from RA or AS patients. In the arthritis mouse model, significantly reduced clinical and histological scores were observed in the UA treatment group. Our findings suggest that UA has potential as a binding target for TNF, suppresses inflammatory cytokines in PBMCs, and exhibits anti-inflammatory effects on arthritis in a mouse model.', metadata={}, id='3050')"", ""Document(page_content='Preoperative levels of certain inflammatory markers in the blood can predict acute infection after primary total joint arthroplasty in patients without inflammatory disease, but whether they can do so in patients with rheumatoid arthritis is unclear. The objectives of this study were to determine whether, with appropriate cut‐off values, (1) preoperative levels of NLR predicted postoperative acute infection; and (2) preoperative plasma fibrinogen, monocyte‐lymphocyte ratio, C‐reactive protein or erythrocyte sedimentation rate predicted postoperative acute infection. We retrospectively analyzed 964 patients with rheumatoid arthritis who underwent primary total joint arthroplasty at our hospital between January 2010 and November 2020. We compared preoperative levels of inflammatory markers including neutrophil‐lymphocyte ratio (NLR), monocyte‐lymphocyte ratio (MLR), C‐reactive protein (CRP), erythrocyte sedimentation rate (ESR), plasma fibrinogen (FIB) between patients who suffered acute infection or not within 90\\u2009days after surgery. The ability of markers to predict infection was assessed in terms of the area under receiver operating characteristic curves (AUC) based on optimal cut‐off values determined from the Youden index. Among the 964 patients, 27 (2.8%) experienced acute infection. Preoperative levels of individual inflammatory markers predicted infection with the following AUCs and cut‐off values: NLR, 0.704 (cut‐off: 2.528); MLR, 0.608 (0.2317); CRP, 0.516 (4.125\\u2009mg/L); ESR, 0.533 (66.5\\u2009mm/h); and FIB, 0.552 (3.415\\u2009g/L). The neutrophil‐lymphocyte ratio showed diagnostic sensitivity of 92.6% and specificity of 43.3%, while the monocyte‐lymphocyte ratio showed sensitivity of 77.8% and specificity of 46.3%. The preoperative NLR shows some ability to predict acute infection after total joint arthroplasty in patients with rheumatoid arthritis. Monitoring this ratio, perhaps in conjunction with other markers not analyzed here, may be useful for optimizing the timing of surgery in order to minimize risk of postoperative infection.', metadata={}, id='2336')"", ""Document(page_content='Patients infected with Hepatitis C Virus (HCV) often present with rheumatic symptoms, but its link to rheumatoid arthritis (RA) remains unclear. The purpose of this cross-sectional study was to investigate whether HCV infection is related to the risk for RA in adults. We analyzed data from the 2017–2020 National Health and Nutrition Examination Survey (NHANES). HCV infection and RA status were determined through questionnaires. Covariates included gender, age, race, marital status, body mass index (BMI), high-sensitivity C-reactive protein (hs-CRP), and diabetes status. Multivariate logistic regression and subgroup analyses were used to assess the relationship between HCV infection and RA risk. In this population-based study involving 5,825 participants aged 18–80 years (including 485 RA patients), we observed a significantly higher prevalence of HCV infection in the RA group compared with non-RA controls. After adjusting for covariates, multivariate logistic regression showed that HCV infection was associated with an increased risk of RA (OR\\u2009=\\u20091.93; 95%CI\\u2009=\\u20091.07–3.50,  p This study demonstrates that HCV infection is associated with the risk of RA in adults, underscoring the potential value of HCV screening in RA patients for improved disease management. However, causal interpretation is limited by the cross-sectional design and reliance on self-reported data. The online version contains supplementary material available at 10.1186/s41927-025-00513-y.', metadata={}, id='2532')"", ""Document(page_content='Chronic active Epstein-Barr Virus disease is a kind of Epstein-Barr Virus associated T/NK cell lymphoproliferative disease. At present, there is still a lack of standard therapeutic regimen for its treatment, but its basic treatment principles include controlling inflammatory response, anti-tumor proliferation, and immune reconstitution. Hematopoietic stem cell transplantation is currently the only method that can cure this disease. In recent years, immunotherapy has developed rapidly and is widely used in the treatment of various hematological malignancies; various immunotherapy drugs, including PD-1 inhibitors, have also demonstrated their safety and efficacy in CAEBV, while immune cell therapies such as Epstein- Barr virus-specific T cells have also displayed their unique advantages in CAEBV.', metadata={}, id='2697')"", ""Document(page_content='The heterogeneity and suboptimal efficacy of biological treatments and small molecule drugs necessitate their precise selection based on biomarkers that predict therapeutic responses in inflammatory bowel disease. Recent studies have identified numerous novel biomarkers predictive of responses to biologics and small molecule modulators, utilizing a variety of omics approaches in inflammatory bowel disease. In this review, we systematically examine baseline omics biomarkers that predict responses to biological therapies and small molecule drugs, drawing on literature from PubMed. Our analysis spans multiple omics disciplines, including genomics, transcriptomics (both bulk RNA and single‐cell RNA sequencing), proteomics, microbiomics, and metabolomics, with particular emphasis on the impact of models integrating multiple omics datasets. Additionally, to further the field of precision medicine, we evaluated specific biomarkers that may exhibit distinct effects on responses to multiple therapeutic interventions.', metadata={}, id='2586')"", ""Document(page_content='Atherosclerosis (AS) is a chronic inflammatory disease characterized by the gradual accumulation of plaques in arterial walls, with its pathogenesis remaining incompletely understood. Recent studies have highlighted that development of AS is closely associated with the aberrant activation of the NLRP3 inflammasome in the arteries. Inhibition of the NLRP3 inflammasome by natural products and formulae derived from Chinese herbal medicines (CHMs) has been shown to alleviate AS-associated pathologies. However, therapies that effectively and safely target the NLRP3 inflammasome remain limited. This review aims to summarize the key discoveries from recent studies on the effects of these natural products and formulae on the NLRP3 inflammasome in the context of AS treatment. A comprehensive literature search was conducted on databases such as PubMed/MEDLINE up to January 2025, yielding 38 eligible studies. Our analysis indicates that certain therapies can effectively prevent arterial inflammation in animal models by targeting multiple pathways and mechanisms related to the NLRP3 inflammasome. This review summarizes the primary findings of these studies, focusing on the therapeutic effects and underlying mechanisms of action. Based on these insights, we propose future strategies to enhance the efficacy, specificity, and safety of existing natural products and formulae for AS treatment. Additionally, this study offers a perspective for future research that may enhance our understanding of the roles and the mechanisms of CHM-derived phytochemicals and formulae in regulating the NLRP3 inflammasome and treating AS.', metadata={}, id='2641')"", ""Document(page_content='Diet is a key modifiable risk factor in many chronic diseases, including age-related diseases. The Mediterranean diet (MedDiet) is an extensively studied dietary pattern which has been proposed as a lifestyle intervention to promote healthy aging in the general population, due to its numerous health benefits. Randomized controlled trials (RCTs) have attempted to explore the mechanism(s) by which the MedDiet exerts its beneficial effects on aging. One proposed mechanism is that the MedDiet helps to slow down a process called ‘inflamm-aging’, a type of chronic, low-grade inflammation which contributes to aging. To explore the evidence supporting this hypothesized mechanism, we conducted a scoping review of existing RCTs which used a MedDiet intervention and assessed at least one molecular outcome of potential relevance to inflamm-aging. We identified 14 papers representing 12 unique RCTs. Based on our findings, we present 10 recommendations for the next clinical trial of the MedDiet in inflamm-aging.', metadata={}, id='3220')"", ""Document(page_content='Antisense oligonucleotides, which are used to silence target genes, are gaining attention as a novel drug discovery modality for proteinopathies. However, while clinical trials for neurodegenerative diseases like amyotrophic lateral sclerosis have been conducted in recent years, the results have not always been favorable. The results from a Phase III trial of the antisense oligonucleotide, that is, tofersen, which targets  SOD1 FUS C9orf72', metadata={}, id='3239')"", ""Document(page_content='Failure rate of meniscal repair can reach 25%. Multiple techniques have been used to increase meniscal healing, notably biological augmentation techniques. One of them is fibrin clot–augmented meniscal repair, which will be described in this video. This technique is indicated mainly for the lesions with a high failure rate. This includes large, horizontal, and radial tears and even for meniscal cysts, especially in a stable knee. This technique can also be used in revision meniscal suture when failure is no longer an option. Fibrin clot is prepared from sterile peripheral venous blood from the patient. A plastic syringe is used to stir the blood in a sterile glass container. The fibrin clot is then formed and washed rigorously with saline solution. Rolling the fibrin clot which is fixed to the syringe allows to give the fibrillar aspect of the clot. The formed fibrin clot is now solid enough to be manipulated and can be fixed to a vicryl suture thread allowing it to enter the knee and be fixed inside the meniscal lesion. The clot is wrapped inside the meniscal lesion with inside-out or outside-in suture technique. We used this technique for multiple types of lesions, like bucket handle meniscal tear, horizontal meniscal cleavage, parrot beak tear, and even in lesions within white-white zone. The postoperative protocol is the same as standard inside-out meniscal repair. This technique has been used in the literature with promising results. The fibrin clot–augmented meniscal repair is a demanding but promising technique. We need further follow-up to confirm its effectiveness. The author(s) attests that consent has been obtained from any patient(s) appearing in this publication. If the individual may be identifiable, the author(s) has included a statement of release or other written form of approval from the patient(s) with this submission for publication.', metadata={}, id='2314')""]","Biologics treat rheumatoid arthritis by targeting specific components of the immune system, such as blocking TNF or IL-6 signaling, or depleting B cells to reduce autoantibody production, thereby interrupting the inflammatory cascade that causes joint damage.",3.013155937194824,10,True,,,,,,,,0.0,1758,0
basic,What is the mechanism of action of levodopa in Parkinson's disease?,"Levodopa is a medication commonly used in the treatment of Parkinson's disease. In Document 1, it is mentioned that patients with Parkinson's disease were divided into two groups, one receiving levodopa/carbidopa (250/25 mg) three times daily for 3 months, and the other receiving the same dose of levodopa/carbidopa along with 500 mg of metformin two times daily. The study aimed to clarify the role of metformin as adjuvant therapy in patients with Parkinson's disease, but the specific mechanism of action of levodopa in Parkinson's disease is not explicitly mentioned in this context.

Levodopa is a precursor to dopamine, a neurotransmitter that is deficient in Parkinson's disease due to the loss of dopaminergic neurons in the substantia nigra. Levodopa crosses the blood-brain barrier and is converted to dopamine in the brain, where it helps to alleviate the motor symptoms of Parkinson's disease, such as tremors, rigidity, and bradykinesia. By increasing dopamine levels in the brain, levodopa helps to compensate for the dopamine deficiency caused by the loss of dopaminergic neurons.

In conclusion, levodopa acts as a dopamine precursor in the brain, helping to restore dopamine levels and improve motor symptoms in Parkinson's disease patients. The context documents provide information about the use of levodopa in Parkinson's disease treatment but do not delve into the detailed mechanism of action of levodopa in the context of this study.","[""Document(page_content='Parkinson’s disease (PD) is caused by the progressive loss of dopaminergic neurons in the substantia nigra. Neuroinflammation is considered a key factor contributing to the pathophysiology of PD. Current gold-standard therapies for PD provide only symptomatic relief without slowing disease progression, highlighting the need to develop new disease-modifying treatments. Metformin has been demonstrated to exert a neuroprotective role in several neurodegenerative disorders including PD. This study aimed to clarify the role of metformin as adjuvant therapy in patients with PD. Sixty patients with PD were divided into 2 groups (n = 30). Patients in group 1 received levodopa/carbidopa (250/25\\xa0mg) three times daily for 3\\xa0months plus placebo (Control group), while those in group 2 received levodopa/carbidopa (250/25\\xa0mg) three times daily and 500\\xa0mg metformin two times daily (Metformin group). Patients were assessed via Unified Parkinson’s Disease Rating Scale (UPDRS). The serum concentrations of toll like receptor 4 (TLR-4), α-synuclein, brain derived neurotropic factor (BDNF), and high mobility group box 1 (HMGB-1) were measured before and after treatment. The improvement in UPDRS from baseline to 3\\xa0months. Change in the level of biological markers. The control group did not show significant difference in UPDRS when compared to their baseline value by Wilcoxon test ( P P P P While no significant differences in UPDRS scores were observed between the metformin and control groups, trends in biomarker changes suggest a potential impact of adjunctive metformin use on the underlying pathophysiology of PD. Further studies are needed to assess its effects on motor symptoms over a longer duration. identifier  NCT05781711', metadata={}, id='2625')"", ""Document(page_content='Parkinson’s disease (PD), the second most common neurodegenerative condition, is primarily characterized by motor dysfunctions due to dopaminergic neuronal loss in the Substantia Nigra (SN), with oxidative stress playing a significant role in its progression. This study investigates the neuroprotective potential of  Pelargonium graveolens in vitro 50 50 p.o l P. graveolens', metadata={}, id='2454')"", ""Document(page_content='Deep brain stimulation (DBS) is an efficient treatment for movement disorders, most commonly Parkinson’s Disease (PD), dystonia and essential tremor. DBS surgery carries risks, e.g. the risk of delayed peri-lead edema (PLE) and the risk of postoperative cognitive decline. The mechanisms of these complications are not fully understood and there is no established biomarker to screen for these complications after DBS surgery. To explore the diagnostic value of two blood-based markers representative for distinct types of brain injury, we characterized the dynamics of serum glial fibrillary acidic protein (sGFAP, for glial injury) and serum neurofilament light chain (sNfL, for neuronal-axonal injury) following DBS surgery. We analyzed longitudinal dynamics of serum protein levels in 58 patients undergoing deep brain stimulation (DBS) at our center for half a year post-surgery. Serum GFAP responded much more rapidly after brain surgery, returning to baseline after weeks, whereas sNfL only returned to baseline after months. Patients with lower preoperative cognitive performance exhibited higher postoperative sGFAP levels, with sGFAP showing a stronger association with preoperative patient characteristics compared to sNfL. Further studies with long-term clinical follow-up are needed to fully evaluate the utility of sGFAP as a biomarker for both early and delayed complications after DBS surgery, including cognitive decline and potential foreign body reactions to the implanted lead.', metadata={}, id='2388')"", ""Document(page_content='Tic disorders represent a developmental neuropsychiatric condition whose causes can be attributed to a variety of environmental, neurobiological, and genetic factors. From a neurophysiological perspective, the disorder has classically been associated with neurochemical imbalances (particularly dopamine and serotonin) and structural and functional alterations affecting, in particular, brain areas and circuits involved in the processing and coordination of movements: the basal ganglia, thalamus, motor cortical area, and cingulate cortex; however, more recent research is demonstrating the involvement of many more brain regions and neurotransmission systems than previously observed, such as the prefrontal cortex and cerebellum. In this paper, therefore, we summarize the evidence to date on these abnormalities with the intent to illustrate and clarify the main neuroanatomical differences between patients with tic disorders and healthy individuals.', metadata={}, id='3098')"", ""Document(page_content='Giant axonal neuropathy (GAN) is a progressive neurodegenerative disease affecting the peripheral and central nervous system and is caused by bi-allelic variants in the  GAN GAN The online version contains supplementary material available at 10.1007/s00415-024-12744-z.', metadata={}, id='3002')"", ""Document(page_content='Bright light therapy (BLT) has been proved to have beneficial effects on Parkinson’s disease (PD), the mechanisms remained unclear. Improvements of visual pathways might be key to BLT. The aim of this study is to validate whether BLT improves clinical symptoms in PD and explore the possible mechanisms of visual pathways evaluated by optical coherence tomography (OCT), pattern electroretinogram (PERG) and visual evoked potentials (VEP). Twenty-three PD patients were enrolled in this crossover randomized placebo-controlled study. Participants received either one month of BLT or dim light therapy (DLT), separated by one-month wash-out period, followed by another intervention. Participants underwent clinical scales, and visual-related evaluations including OCT, PERG and VEP before and after each intervention. Mixed-effects regression models were used to determine the effect between BLT and DLT on improving the differentials of clinical scales (Δscales), OCT (Δretinal thickness), PERG (ΔPERG values) and VEP (ΔP100 latencies). Correlations between clinical symptoms and visual evaluations improvements were analyzed in PD patients receiving BLT. Excessive daytime sleepiness, anxiety, life quality and autonomic function were improved after BLT. Compared with DLT, bilateral ΔN95 latencies for PERG and ΔP100 latencies for VEP were improved after BLT. We did not observe the changes of four quadrants retinal nerve fiber layer (RNFL) thickness after BLT or DLT. BLT is a valuable and safe non-pharmacological intervention for improving visual function in PD patients. These findings extend neural mechanisms of BLT to visual pathways improvements. The online version contains supplementary material available at 10.1186/s12888-025-06915-z.', metadata={}, id='2651')"", 'Document(page_content=""An increasing body of evidence indicates altered DNA methylation in Parkinson\'s disease, yet the reproducibility and utility of such methylation changes are largely unexplored. We aimed to further elucidate the role of dysregulated DNA methylation in Parkinson\'s disease and to evaluate the biomarker potential of methylation‐based profiling. We conducted an epigenome‐wide association study (EWAS) in whole blood, including 280 Parkinson\'s disease and 279 control participants from Oslo, Norway. Next, we took advantage of data from the Parkinson\'s Progression Markers Initiative (PPMI) and a previously published EWAS to conduct a whole blood EWAS meta‐analysis in Parkinson\'s disease, incorporating results from a total of 3068 participants. Finally, we generated multiple methylation‐based scores for each Oslo and PPMI participant and tested their association with disease status, individually and in a joint multiscore model. In EWAS meta‐analysis, we confirm  SLC7A11 LPIN1 Our results highlight the power of DNA methylation profiling to capture multiple aspects of disease risk, indicating a biomarker potential for precision medicine in neurodegenerative disorders. The reproducibility of specific differentially methylated CpGs across data sets was limited but may improve if future studies are designed to account for disease stage and incorporate environmental exposure data."", metadata={}, id=\'2317\')', ""Document(page_content='Neurodegenerative disorders encompass a group of age‐related conditions characterized by the gradual decline in both the structure and functionality of the central nervous system (CNS). RNA modifications, arising from the epitranscriptome or RNA‐modifying protein mutations, have recently been observed to contribute significantly to neurodegenerative disorders. Specific modifications like N6‐methyladenine (m6A), N1‐methyladenine (m1A), 5‐methylcytosine (m5C), pseudouridine and adenosine‐to‐inosine (A‐to‐I) play key roles, with their regulators serving as crucial therapeutic targets. These epitranscriptomic changes intricately control gene expression, influencing cellular functions and contributing to disease pathology. Dysregulation of RNA metabolism, affecting mRNA processing and noncoding RNA biogenesis, is a central factor in these diseases. This review underscores the complex relationship between RNA modifications and neurodegenerative disorders, emphasizing the influence of RNA modification and the epitranscriptome, exploring the function of RNA modification enzymes in neurodegenerative processes, investigating the functional consequences of RNA modifications within neurodegenerative pathways, and evaluating the potential therapeutic advancements derived from assessing the epitranscriptome.', metadata={}, id='3072')"", ""Document(page_content='Although a role of the thalamus in different arousal and awareness states is well established, there is a surprising lack of knowledge on subregional specificity within this complex, multinucleated structure of the diencephalon. In their recent paper ‘Extrasynaptic GABA-A receptors in central medial thalamus mediate anaesthesia in rats’, Muheyati et al. evaluated whether GABA A A A', metadata={}, id='2972')"", ""Document(page_content='Antisense oligonucleotides, which are used to silence target genes, are gaining attention as a novel drug discovery modality for proteinopathies. However, while clinical trials for neurodegenerative diseases like amyotrophic lateral sclerosis have been conducted in recent years, the results have not always been favorable. The results from a Phase III trial of the antisense oligonucleotide, that is, tofersen, which targets  SOD1 FUS C9orf72', metadata={}, id='3239')""]","Levodopa treats Parkinson's disease by crossing the blood-brain barrier and being converted to dopamine in the brain, helping to replenish depleted dopamine levels in the striatum and compensate for the loss of dopaminergic neurons in the substantia nigra.",4.761831998825073,10,True,,,,,,,,0.0,1457,0
hyde,What are the effects of metformin on type 2 diabetes?,"Metformin helps lower glucose production in the liver and improves insulin sensitivity in patients with type 2 diabetes. It has been shown to exert a neuroprotective role in several neurodegenerative disorders, including Parkinson's disease.","['Common treatments for type 2 diabetes include lifestyle changes such as diet and exercise, oral medications like metformin, and in some cases, insulin therapy. Metformin is often the first-line medication prescribed for type 2 diabetes. It helps lower glucose production in the liver and improves insulin sensitivity.', 'Diabetes mellitus (DM) is a prevalent condition that requires careful management in the perioperative setting to reduce surgical risks and optimize patient outcomes. The preoperative care of diabetic patients is complex because glucose control must be balanced with minimizing hypoglycemic or hyperglycemic events during surgery. A variety of diabetic medications such as insulin, dipeptidyl-peptidase-4 inhibitors, glucagon-like peptide-1 receptor agonists, sodium–glucose cotransporter-2 inhibitors, and biguanides such as metformin present unique challenges and considerations due to their different mechanisms, benefits, and potential adverse effects. In recent years, professional organizations have developed recommendations on the perioperative management of these therapies, although there remain some variations in guidelines related to medication cessation and dosage adjustments. Standardized protocols in preoperative DM care remain a topic of interest to ensure consistent and safe practices across healthcare settings, and further collaborative research efforts could provide clarity and consensus in managing this diverse patient population. The objective of this study was to provide an overview of guidelines and practices to support healthcare professionals in delivering improved preoperative care for diabetic patients. This initiative aims to enhance surgical outcomes and minimize the occurrence of complications. This is a comparative review that provides a systematic comparison of the similarities and differences in the guidelines and recommendations of three professional organizations along with Hamad Medical Corporation. All guidelines were from official websites including Hamad Medical Corporation. Although the reviewed guidelines for the preoperative care of diabetes patients share some similarities, there are also a number of differences due to outdated data and expert opinions, and therefore differ in practices around the world. While the key elements are agreed upon, more research and global collaboration are needed to create consistent guidelines and improve patient outcomes.', 'Glucagon-like peptide-1 (GLP-1) receptor agonists and the dual GLP-1- and glucose-dependent insulinotropic polypeptide receptor co-agonist tirzepatide (referred to here collectively as “GLP-1-based therapy”) are incretin-based therapies being used increasingly in the management of both type 2 diabetes and obesity. They are now recognized to have beneficial effects beyond improved glycemic control and weight loss, including cardiovascular and renal protection. GLP-1-based therapy also slows gastric emptying, which has benefits (lowering postprandial glucose), but also potential risks (eg, hypoglycemia in individuals on insulin or sulphonylurea therapy). Their effects on the gallbladder may also be beneficial, contributing to reducing postprandial triglycerides, but they also potentially increase the risk of biliary disease. In this review, we summarize the effects of GLP-1 and incretin-based therapeutics on gastric, biliary and small intestinal function. An improved understanding of these effects will optimize the use of these drugs.', 'Lifestyle intervention prevents or delays type 2 diabetes (T2D) in subjects at a high risk of T2D. However, it is not known whether genetic variants modify the effect on incident T2D during lifestyle intervention. To investigate whether a low or high genetic risk has effects on incident T2D in a group-based lifestyle intervention study. The T2D-GENE trial involved 973 men from the Metabolic Syndrome in Men (METSIM) cohort, aged 50-75 years, body mass index ≥25 kg/m The intervention significantly lowered the risk of T2D among the participants with a high genetic risk for T2D [hazards ratio (HR) 0.30, 95% confidence interval (CI) 0.16-0.56,  P P P Our results showed that individuals with a high genetic risk for T2D benefitted from a low-cost group-based intervention focusing on healthy diet and physical activity. Therefore, all individuals at risk of T2D should be encouraged to make lifestyle changes regardless of genetic risk.', 'Indications for sodium-glucose cotransporter-2 (SGLT2) inhibitors have expanded to include heart failure and chronic kidney disease after the year 2020. Whether and how the demographic trends in the prescription of SGLT2 inhibitors have changed after the expansion of indications have not been studied extensively. This study is a descriptive analysis of serial, cross-sectional data on nationwide prescription of SGLT2 inhibitors between April 2016 and March 2023 obtained from NDB Open Data Japan, which contains more than 95% of total health insurance reimbursement claims in the nation. The total number of SGLT2 inhibitor tablets prescribed in outpatient settings with prescriptions papers increased from 577,996,158 tablets in fiscal year (FY) 2020 to 904,598,175 tablets in FY 2022. Patients aged 75 years and older accounted for 20.3% of the total prescriptions in FY 2020, and this proportion increased to 27.8% in FY 2022. Among all SGLT2 inhibitors, the tablet that expanded its indications for patients with heart failure and chronic kidney disease the earliest showed the largest percentage increase in the number of prescribed tablets during this period and the highest share of the elderly population in its recipients in both sexes (men, 35.9%; women, 49.4%) in FY 2022. The number of prescribed SGLT2 inhibitor tablets per population was constantly higher in men than in women between FY 2020 and 2022, which is consistent with the sex difference in the prevalence of these diseases. Prescription of SGLT2 inhibitors to the elderly population is no longer infrequent and accounts for a large portion of the entire prescription of SGLT2 inhibitors in Japan. These findings contribute to updating our perception on the demographics of SGLT2 inhibitor recipients.', 'Parkinson’s disease (PD) is caused by the progressive loss of dopaminergic neurons in the substantia nigra. Neuroinflammation is considered a key factor contributing to the pathophysiology of PD. Current gold-standard therapies for PD provide only symptomatic relief without slowing disease progression, highlighting the need to develop new disease-modifying treatments. Metformin has been demonstrated to exert a neuroprotective role in several neurodegenerative disorders including PD. This study aimed to clarify the role of metformin as adjuvant therapy in patients with PD. Sixty patients with PD were divided into 2 groups (n = 30). Patients in group 1 received levodopa/carbidopa (250/25\xa0mg) three times daily for 3\xa0months plus placebo (Control group), while those in group 2 received levodopa/carbidopa (250/25\xa0mg) three times daily and 500\xa0mg metformin two times daily (Metformin group). Patients were assessed via Unified Parkinson’s Disease Rating Scale (UPDRS). The serum concentrations of toll like receptor 4 (TLR-4), α-synuclein, brain derived neurotropic factor (BDNF), and high mobility group box 1 (HMGB-1) were measured before and after treatment. The improvement in UPDRS from baseline to 3\xa0months. Change in the level of biological markers. The control group did not show significant difference in UPDRS when compared to their baseline value by Wilcoxon test ( P P P P While no significant differences in UPDRS scores were observed between the metformin and control groups, trends in biomarker changes suggest a potential impact of adjunctive metformin use on the underlying pathophysiology of PD. Further studies are needed to assess its effects on motor symptoms over a longer duration. identifier  NCT05781711', ""We report the case of a patient with type 2 diabetes mellitus (T2DM) on insulin therapy with a history of recurrent and severe hypoglycemia related to lipodystrophy with an uncommon clinical presentation. This was the case of a 67-year-old female with type 2 diabetes hospitalized for the exploration and management of severe and recurrent hypoglycemia. Her diabetes has been evolving since the age of 40 years and was complicated by minimal retinopathy. She was on premixed human insulin, administered through an insulin syringe for the last 17 years. She presented a history of well-controlled diabetes until five months back when she started to show a fluctuating blood glucose concentration, with episodes of unpredictable hypoglycemia occurring at variable times, with values inferior to 0.3 g/l associated with neurological features. Clinical examination revealed a swelling localized in the hypogastric region of the abdomen. It was painless, firm, not fixed to the underlying plans, without local inflammatory signs, and had appeared in the patient's preferred insulin injection site. Thus, we retained the diagnosis of insulin-induced lipohypertrophy. The patient has reported reusing needles for up to one week for economic reasons, and not frequently rotating insulin injection sites. The patient found a less painful injection in the lipohypertrophic area, and she continued to inject insulin into that zone, leading to its progressive enlargement. Therapeutic management consisted of switching the patient to insulin analogs and resuming education concerning the correct injection techniques. The insulin injection technique continues to be suboptimal in many insulin-treated patients, and our case emphasizes the need for improved awareness and education."", 'This study measured serum hypoxia--inducible factor-1 (HIF-1α) and\nsurvivin levels in patients with diabetes and investigated their association\nwith the severity of retinopathy. This study included 88 patients with type 2 diabetes mellitus who underwent\nroutine eye examinations. Three groups were created. Group 1 consisted of\npatients without diabetic retinopathy. Group 2 included patients with\nnon-proliferative diabetic retinopathy. Group 3 included patients with\nproliferative diabetic retinopathy. To measure serum HIF-1α and\nsurvivin levels, venous blood samples were collected from patients. The mean HIF-1α levels in groups 1, 2, and 3 were 17.30 ± 2.19,\n17.79 ± 2.34, and 14.19 ± 2.94 pg/ml, respectively.\nSignificant differences were detected between groups 1 and 3 (p=0.01) and\nbetween groups 2 and 3 (p=0.01). The mean survivin levels in groups 1, 2,\nand 3 were 42.65 ± 5.37, 54.92 ± 5.55, and 37.46 ± 8.09\npg/ml, respectively. A significant difference was only detected between\ngroups 2 and 3 (p=0.002). The present study revealed that serum HIF-1α and survivin levels are\nincreased in patients with non-proliferative diabetic retinopathy compared\nto those in patients without diabetic retinopathy.', 'Assessments for hyperglycemia are vital to pregnancy and postpartum (PP) care, but gold-standard oral glucose tolerance tests (OGTTs) are burdensome. We examined changes in 1,5 anhydroglucitol (1,5AG) levels during gestation and PP and assessed for associations with other measures of glycemia. Pregnant participants (n = 50) in the Study of Pregnancy Regulation of Insulin and Glucose cohort underwent OGTTs at a mean of 13 weeks ([visit 1 (V1)] and 26 weeks [visit 2 (V2)] of gestation and PP. Nonpregnant controls had a single OGTT. 1,5AG was measured using frozen plasma samples. Changes in 1,5AG across pregnancy were assessed with longitudinal mixed effects linear models. We assessed relationships between 1,5AG and glycemia at each timepoint using Spearman correlations and linear regression models. To determine the relationship of 1,5AG with breastfeeding (BF) status, stratified analyses were performed. 1,5AG decreased from V1 to V2 (β = −3.6\u2005μg/mL,  P P P P P P P 1,5AG decreases during gestation and remains low PP. Breastfeeding is associated with lower 1,5AG levels, indicating plausible excretion into breastmilk. 1,5AG is unlikely to be useful in assessing glycemia in pregnant or PP women.', 'Introduction Patients with polycystic ovary syndrome (PCOS) have a higher risk of developing metabolic syndrome (MetS), as similarities in pathophysiology exist between the two. Adipokines are the key molecules that alter the adipose tissue metabolism and distribution, leading to MetS. This study was conducted to assess the levels of adipokines among patients with PCOS with and without MetS and to establish the role of adipokines as an early predictor for the development of MetS in PCOS. Materials and methods In this monocentric, tertiary hospital-based study, 144 patients with PCOS were selected and classified according to Rotterdam criteria and screened for MetS. Patients were grouped into MetS and non-MetS categories based on the presence of MetS. Adipokine levels (adiponectin, leptin, and resistin) were measured and compared, along with other biochemical and anthropological parameters. Data were analyzed using Jamovi statistical software, version 2.3 (Retrieved from  https://www.jamovi.org Results Out of the 144 patients included in the study, 58 were diagnosed with MetS and grouped as MetS. The prevalence of MetS was maximum among the non-PCO\xa0(O+HA) phenotype\xa0(53 out of 58). Significant differences\xa0(p<0.001) in adipokines were observed between the MetS and non-MetS groups. Adiponectin, leptin, and resistin were found to have a significant role as predictors of MetS at an early stage of development of the syndrome, along with other common predictors. However, in later stages, fasting, blood glucose, waist circumference, and triglycerides remain significant predictors. Conclusion The present study reports a high prevalence of MetS among PCOS cases (40.27%). Altered adipokine levels may be significantly associated with the early stages of MetS development and\xa0may be used as an early diagnostic tool for the management of MetS in PCOS. Therefore, the measurement of adipokines during preliminary investigations may be used as an early diagnostic tool for the\xa0management of MetS in PCOS.']",Metformin helps treat type 2 diabetes by reducing glucose production in the liver and increasing insulin sensitivity in peripheral tissues.,3.7536749839782715,10,True,,,,,,,,0.45064155757427216,241,0
hyde,How does SGLT2 inhibition affect kidney function?,"SGLT2 inhibition can have positive effects on kidney function. The use of SGLT2 inhibitors has been associated with cardiovascular and renal protection, as mentioned in Document 4. Additionally, Document 1 indicates that the prescription of SGLT2 inhibitors has increased in the elderly population, who are more likely to have kidney-related conditions. This suggests that SGLT2 inhibitors may have beneficial effects on kidney function, especially in populations with chronic kidney disease.","['Indications for sodium-glucose cotransporter-2 (SGLT2) inhibitors have expanded to include heart failure and chronic kidney disease after the year 2020. Whether and how the demographic trends in the prescription of SGLT2 inhibitors have changed after the expansion of indications have not been studied extensively. This study is a descriptive analysis of serial, cross-sectional data on nationwide prescription of SGLT2 inhibitors between April 2016 and March 2023 obtained from NDB Open Data Japan, which contains more than 95% of total health insurance reimbursement claims in the nation. The total number of SGLT2 inhibitor tablets prescribed in outpatient settings with prescriptions papers increased from 577,996,158 tablets in fiscal year (FY) 2020 to 904,598,175 tablets in FY 2022. Patients aged 75 years and older accounted for 20.3% of the total prescriptions in FY 2020, and this proportion increased to 27.8% in FY 2022. Among all SGLT2 inhibitors, the tablet that expanded its indications for patients with heart failure and chronic kidney disease the earliest showed the largest percentage increase in the number of prescribed tablets during this period and the highest share of the elderly population in its recipients in both sexes (men, 35.9%; women, 49.4%) in FY 2022. The number of prescribed SGLT2 inhibitor tablets per population was constantly higher in men than in women between FY 2020 and 2022, which is consistent with the sex difference in the prevalence of these diseases. Prescription of SGLT2 inhibitors to the elderly population is no longer infrequent and accounts for a large portion of the entire prescription of SGLT2 inhibitors in Japan. These findings contribute to updating our perception on the demographics of SGLT2 inhibitor recipients.', 'IgA nephropathy (IgAN) is a common primary glomerular disease. The  O O The review followed Preferred Reporting Items for Systematic Reviews and Meta-Analyses (PRISMA) recommendations and was registered in PROSPERO (CRD42021287423). The literature search was conducted in PubMed, Web of Science, Cochrane, and Scopus, and the selected articles were evaluated for eligibility based on predefined criteria. The methodological quality of the studies was assessed using the Newcastle–Ottawa Scale. Statistical analysis was performed to calculate effect sizes and assess heterogeneity among the studies. This review analyzed 29 out of 1,986 studies, conducted between 2005 and 2022, with participants from multiple countries. Gd-IgA1 levels were not associated with age and gender, while associations with hypertension, hematuria, and proteinuria were inconsistent. In the meta-analyses, a correlation between serum Gd-IgA1 and estimated glomerular filtration rate was identified, however, the relationships between Gd-IgA1 levels and chronic kidney disease (CKD) stage and progression to kidney failure were inconsistent. Serum Gd-IgA1 levels were not associated with validated prognostic risk factors, but were negatively correlated with kidney function. Further research in larger studies using standardized assays are needed to establish the value of Gd-IgA1 as a prognostic risk factor in IgAN. \n The online version contains supplementary material available at 10.1007/s40620-023-01874-8.', 'Kidney failure has been associated with decreased physical capacity, although evidence regarding the physical performance of individuals with earlier stages of chronic kidney disease (CKD)\xa0remains limited. Cross-sectional data were derived from the prospective, population-based Maastricht Study. Multivariate linear regression models were fitted to assess the association of estimated glomerular filtration rate (eGFR) and albuminuria categories with physical performance test outcomes. Overall, 7396 participants were included. Compared to eGFR 60–90\xa0ml/min/1.73\xa0m β β β β β β β β β Reduced eGFR and higher albuminuria levels were associated with worse physical performance, especially shorter 6-min walk distance and lower muscle strength. The relationship between eGFR and physical function was non-linear, with also high eGFR values being associated with worse performance, especially in the six-minute walk test. \n The online version contains supplementary material available at 10.1007/s40620-024-01933-8.', 'Glucagon-like peptide-1 (GLP-1) receptor agonists and the dual GLP-1- and glucose-dependent insulinotropic polypeptide receptor co-agonist tirzepatide (referred to here collectively as “GLP-1-based therapy”) are incretin-based therapies being used increasingly in the management of both type 2 diabetes and obesity. They are now recognized to have beneficial effects beyond improved glycemic control and weight loss, including cardiovascular and renal protection. GLP-1-based therapy also slows gastric emptying, which has benefits (lowering postprandial glucose), but also potential risks (eg, hypoglycemia in individuals on insulin or sulphonylurea therapy). Their effects on the gallbladder may also be beneficial, contributing to reducing postprandial triglycerides, but they also potentially increase the risk of biliary disease. In this review, we summarize the effects of GLP-1 and incretin-based therapeutics on gastric, biliary and small intestinal function. An improved understanding of these effects will optimize the use of these drugs.', 'Primary glomerular disease (PGD) is an idiopathic cause of renal glomerular lesions that is characterized by proteinuria or hematuria and is the leading cause of chronic kidney disease (CKD). The identification of circulating biomarkers for the diagnosis of PGD requires a thorough understanding of the metabolic defects involved. In this study, ultra-high performance liquid chromatography–tandem mass spectrometry was performed to characterize the amino acid (AA) profiles of patients with pathologically diagnosed PGD, including minimal change disease (MCD), focal segmental glomerular sclerosis (FSGS), membranous nephropathy, and immunoglobulin A nephropathy. The plasma concentrations of asparagine and ornithine were low, and that of aspartic acid was high, in patients with all the pathologic types of PGD, compared to healthy controls. Two distinct diagnostic models were generated using the differential plasma AA profiles using logistic regression and receiver operating characteristic analyses, with areas under the curves of 1.000 and accuracies up to 100.0% in patients with MCD and FSGS. In conclusion, the progression of PGD is associated with alterations in AA profiles, The present findings provide a theoretical basis for the use of AAs as a non-invasive, real-time, rapid, and simple biomarker for the diagnosis of various pathologic types of PGD. The online version contains supplementary material available at 10.1007/s00726-024-03407-4.', 'Cardiovascular diseases are a leading cause of morbidity and mortality in patients with chronic kidney disease (CKD). Acute kidney injury (AKI) has been increasingly recognized as a potential exacerbating factor for cardiovascular events in these patients. The CKD-REIN study aims to explore the relationship between AKI and the risk of major adverse cardiovascular events (MACE) in a cohort of CKD patients. We hypothesize that AKI is a significant and independent predictor of MACE in patients with CKD, and that the severity of AKI correlates with the risk of subsequent cardiovascular events. This prospective cohort study included 3033 adult CKD patients from 40 outpatient nephrology clinics in France. Patients were followed for a median of 5.2 years. AKI episodes were identified and staged based on the KDIGO-AKI criteria. Cardiovascular events, including myocardial infarction, stroke, heart failure hospitalization, and cardiovascular death, were systematically recorded. The association between AKI and MACE was analyzed using a multivariable Cox model, adjusting for confounders such as demographic characteristics, medical history, and baseline kidney function. During the follow-up, 530 patients experienced at least one episode of AKI. The cumulative incidence of MACE at 1 year post-AKI was 8.1%. Patients with AKI had a significantly increased risk of MACE, with an adjusted hazard ratio (HR) of 5.78 ( P The findings of this study confirm that AKI is a significant independent predictor of MACE in CKD patients, demonstrating a strong severity–response relationship. These results underscore the importance of vigilant cardiovascular monitoring and preventive strategies in CKD patients following AKI episodes. Understanding the mechanisms linking AKI to cardiovascular outcomes is crucial for developing targeted interventions to mitigate these risks.', 'Diabetes mellitus (DM) is a prevalent condition that requires careful management in the perioperative setting to reduce surgical risks and optimize patient outcomes. The preoperative care of diabetic patients is complex because glucose control must be balanced with minimizing hypoglycemic or hyperglycemic events during surgery. A variety of diabetic medications such as insulin, dipeptidyl-peptidase-4 inhibitors, glucagon-like peptide-1 receptor agonists, sodium–glucose cotransporter-2 inhibitors, and biguanides such as metformin present unique challenges and considerations due to their different mechanisms, benefits, and potential adverse effects. In recent years, professional organizations have developed recommendations on the perioperative management of these therapies, although there remain some variations in guidelines related to medication cessation and dosage adjustments. Standardized protocols in preoperative DM care remain a topic of interest to ensure consistent and safe practices across healthcare settings, and further collaborative research efforts could provide clarity and consensus in managing this diverse patient population. The objective of this study was to provide an overview of guidelines and practices to support healthcare professionals in delivering improved preoperative care for diabetic patients. This initiative aims to enhance surgical outcomes and minimize the occurrence of complications. This is a comparative review that provides a systematic comparison of the similarities and differences in the guidelines and recommendations of three professional organizations along with Hamad Medical Corporation. All guidelines were from official websites including Hamad Medical Corporation. Although the reviewed guidelines for the preoperative care of diabetes patients share some similarities, there are also a number of differences due to outdated data and expert opinions, and therefore differ in practices around the world. While the key elements are agreed upon, more research and global collaboration are needed to create consistent guidelines and improve patient outcomes.', 'Common treatments for type 2 diabetes include lifestyle changes such as diet and exercise, oral medications like metformin, and in some cases, insulin therapy. Metformin is often the first-line medication prescribed for type 2 diabetes. It helps lower glucose production in the liver and improves insulin sensitivity.', 'In recent years, advancements in immunosuppressive medications and post-transplant management have led to a significant decrease in acute rejection rates in renal allografts and consequent improvement in short-term graft survival. In contrast, recent data have shown an increased incidence of post-transplant glomerular diseases, which currently represent a leading cause of allograft loss. Although pathogenesis is not fully understood, growing evidence supports the role of inherited and immunological factors and has identified potential pre- and post-transplant predictors. In this review, we illustrate recent advancements in the pathogenesis of post-transplant glomerular disease and the role of risk factors and immunological triggers. In addition, we discuss potential prevention and management strategies.', 'Although the importance of home blood pressure (BP) management has been widely reported, the achievement rate of home BP targets remains low in Japan. Sacubitril/valsartan is a novel antihypertensive agent with potent antihypertensive effects. Despite its theoretical advantages, the real-world clinical application of sacubitril/valsartan in optimizing home BP management remains underexplored. The aim of this study was to evaluate the effect of switching from azilsartan treatment to sacubitril/valsartan treatment on the achievement of home BP targets and to refine hypertension management strategies in practical clinical settings. A cohort of 55 patients, with a mean morning home systolic BP of 135 mmHg or more was enrolled for an 8-week treatment phase with azilsartan and calcium-channel blockers. Morning BP, pulse rate (PR), estimated glomerular filtration rate, and B-type natriuretic peptide, serum potassium, serum uric acid (UA), and hemoglobin A1c levels were assessed at baseline and then at 8, 24, and 48 weeks after switching from 20 mg azilsartan to 200 mg sacubitril/valsartan. At 48 weeks after switching to sacubitril/valsartan, there was a 60% increase in the rate of attainment of home systolic BP targets. Sacubitril/valsartan significantly reduced the mean systolic BP (from 143.6 ± 7.0 mmHg to 131.4 ± 8.7 mmHg), diastolic BP (from 86.9 ± 12.3 mmHg to 80.2 ± 10.7 mmHg), PR (from 74.8 ± 11.0 bpm to 72.1 ± 10.1 bpm), and serum UA (from 5.9 ± 1.1 mg/dL to 5.5 ± 0.9 mg/dL) within the first 8 weeks (all p < 0.01). These effects were maintained for 48 weeks. The switch from azilsartan to sacubitril/valsartan treatment resulted in a significant improvement in the achievement of home BP targets, which is consistent with our goal of refining hypertension management strategies in practical clinical settings.']","SGLT2 inhibitors protect kidney function by reducing hyperfiltration, decreasing albuminuria, and providing nephroprotection through mechanisms independent of glycemic control.",5.920731067657471,10,True,,,,,,,,0.4918731600046158,492,0
hyde,What is the mechanism of action of GLP-1 receptor agonists?,"GLP-1 receptor agonists, as mentioned in Document 1, have beneficial effects beyond improved glycemic control and weight loss. One of their mechanisms of action is slowing gastric emptying, which can help lower postprandial glucose levels. Additionally, they may have effects on the gallbladder that contribute to reducing postprandial triglycerides.","['Glucagon-like peptide-1 (GLP-1) receptor agonists and the dual GLP-1- and glucose-dependent insulinotropic polypeptide receptor co-agonist tirzepatide (referred to here collectively as “GLP-1-based therapy”) are incretin-based therapies being used increasingly in the management of both type 2 diabetes and obesity. They are now recognized to have beneficial effects beyond improved glycemic control and weight loss, including cardiovascular and renal protection. GLP-1-based therapy also slows gastric emptying, which has benefits (lowering postprandial glucose), but also potential risks (eg, hypoglycemia in individuals on insulin or sulphonylurea therapy). Their effects on the gallbladder may also be beneficial, contributing to reducing postprandial triglycerides, but they also potentially increase the risk of biliary disease. In this review, we summarize the effects of GLP-1 and incretin-based therapeutics on gastric, biliary and small intestinal function. An improved understanding of these effects will optimize the use of these drugs.', 'Diabetes mellitus (DM) is a prevalent condition that requires careful management in the perioperative setting to reduce surgical risks and optimize patient outcomes. The preoperative care of diabetic patients is complex because glucose control must be balanced with minimizing hypoglycemic or hyperglycemic events during surgery. A variety of diabetic medications such as insulin, dipeptidyl-peptidase-4 inhibitors, glucagon-like peptide-1 receptor agonists, sodium–glucose cotransporter-2 inhibitors, and biguanides such as metformin present unique challenges and considerations due to their different mechanisms, benefits, and potential adverse effects. In recent years, professional organizations have developed recommendations on the perioperative management of these therapies, although there remain some variations in guidelines related to medication cessation and dosage adjustments. Standardized protocols in preoperative DM care remain a topic of interest to ensure consistent and safe practices across healthcare settings, and further collaborative research efforts could provide clarity and consensus in managing this diverse patient population. The objective of this study was to provide an overview of guidelines and practices to support healthcare professionals in delivering improved preoperative care for diabetic patients. This initiative aims to enhance surgical outcomes and minimize the occurrence of complications. This is a comparative review that provides a systematic comparison of the similarities and differences in the guidelines and recommendations of three professional organizations along with Hamad Medical Corporation. All guidelines were from official websites including Hamad Medical Corporation. Although the reviewed guidelines for the preoperative care of diabetes patients share some similarities, there are also a number of differences due to outdated data and expert opinions, and therefore differ in practices around the world. While the key elements are agreed upon, more research and global collaboration are needed to create consistent guidelines and improve patient outcomes.', 'Common treatments for type 2 diabetes include lifestyle changes such as diet and exercise, oral medications like metformin, and in some cases, insulin therapy. Metformin is often the first-line medication prescribed for type 2 diabetes. It helps lower glucose production in the liver and improves insulin sensitivity.', 'Assessments for hyperglycemia are vital to pregnancy and postpartum (PP) care, but gold-standard oral glucose tolerance tests (OGTTs) are burdensome. We examined changes in 1,5 anhydroglucitol (1,5AG) levels during gestation and PP and assessed for associations with other measures of glycemia. Pregnant participants (n = 50) in the Study of Pregnancy Regulation of Insulin and Glucose cohort underwent OGTTs at a mean of 13 weeks ([visit 1 (V1)] and 26 weeks [visit 2 (V2)] of gestation and PP. Nonpregnant controls had a single OGTT. 1,5AG was measured using frozen plasma samples. Changes in 1,5AG across pregnancy were assessed with longitudinal mixed effects linear models. We assessed relationships between 1,5AG and glycemia at each timepoint using Spearman correlations and linear regression models. To determine the relationship of 1,5AG with breastfeeding (BF) status, stratified analyses were performed. 1,5AG decreased from V1 to V2 (β = −3.6\u2005μg/mL,  P P P P P P P 1,5AG decreases during gestation and remains low PP. Breastfeeding is associated with lower 1,5AG levels, indicating plausible excretion into breastmilk. 1,5AG is unlikely to be useful in assessing glycemia in pregnant or PP women.', 'The 2019 American Association of Clinical Endocrinologists guidelines suggested peak GH-cutoffs to glucagon test (GST) of ≤3 and ≤1 µg/L in the diagnosis of permanent GH deficiency (GHD) during the transition phase. The aim of the study was to evaluate the accuracy of GST compared to insulin tolerance test (ITT) in the definition of GHD at adult height achievement. Ninety-seven subjects with childhood-onset GHD (median age, 17.39 years) underwent ITT, GST, and IGF-1 testing; 44 subjects were idiopathic (isolated GHD), 35 moderate organic GHD (0-2 hormone deficiencies) and 18 severe organic GHD (≥3 hormone deficiencies). Bland and Altman analysis showed a high consistency of GH peak measures after ITT and GST. Receiver operating characteristic analysis identified 7.3 μg/L as the optimal GH peak cutoff to GST [95% confidence interval (CI) 4.15-8.91; sensitivity 95.7%, specificity 88.2%, positive predictive value (PPV) 88.0%, negative predictive value (NPV) 95.7%] able to correctly classify 91.8% of the entire cohort while 5.8 μg/L was the best GH peak cutoff able to correctly classify 91.4% of moderate organic GHD patients (95% CI 3.16-7.39; sensitivity 96.0%, specificity 80.0%, PPV 92.3%, NPV 88.9%). Patients with ≥3 hormone deficiencies showed a GH peak <5 μg/L at ITT and <5.8 μg/L at GST but 1. The optimal cutoff for IGF-1 was −1.4 SD score (95% CI −1.94 to 0.77; sensitivity 75%, specificity 94%, PPV 91.7%, NPV 81.0%) that correctly classified 85.1% of the study population. A GH peak to GST <5.8 μg/L represents an accurate diagnostic cutoff for young adults with childhood-onset GHD and high pretest probability of permanent GHD.', ""We report the case of a patient with type 2 diabetes mellitus (T2DM) on insulin therapy with a history of recurrent and severe hypoglycemia related to lipodystrophy with an uncommon clinical presentation. This was the case of a 67-year-old female with type 2 diabetes hospitalized for the exploration and management of severe and recurrent hypoglycemia. Her diabetes has been evolving since the age of 40 years and was complicated by minimal retinopathy. She was on premixed human insulin, administered through an insulin syringe for the last 17 years. She presented a history of well-controlled diabetes until five months back when she started to show a fluctuating blood glucose concentration, with episodes of unpredictable hypoglycemia occurring at variable times, with values inferior to 0.3 g/l associated with neurological features. Clinical examination revealed a swelling localized in the hypogastric region of the abdomen. It was painless, firm, not fixed to the underlying plans, without local inflammatory signs, and had appeared in the patient's preferred insulin injection site. Thus, we retained the diagnosis of insulin-induced lipohypertrophy. The patient has reported reusing needles for up to one week for economic reasons, and not frequently rotating insulin injection sites. The patient found a less painful injection in the lipohypertrophic area, and she continued to inject insulin into that zone, leading to its progressive enlargement. Therapeutic management consisted of switching the patient to insulin analogs and resuming education concerning the correct injection techniques. The insulin injection technique continues to be suboptimal in many insulin-treated patients, and our case emphasizes the need for improved awareness and education."", 'The disruption of glucose (Glu) metabolism in the human body can lead to conditions such as diabetes and hyperglycemia. Therefore, accurately determining Glu levels is crucial for clinical diagnosis and other applications. Carbon dots (CDs) are a novel category of carbon nanomaterials that exhibit outstanding optical properties, excellent biocompatibility, high water solubility, low production costs, and straightforward synthesis. Recently, researchers have developed various carbon dot sensors for fast and real-time Glu monitoring. In this context, we provide a comprehensive introduction to Glu and CDs for the first time. We categorize the synthetic methods for CDs and the sensing mechanisms, further classifying the applications of carbon dot probes into single-probe sensing, ratiometric sensing, and visual detection. Finally, we discuss the future development needs for CD-based Glu sensors. This review aims to offer insights into advancing Glu sensors and modern medical treatments.', 'Indications for sodium-glucose cotransporter-2 (SGLT2) inhibitors have expanded to include heart failure and chronic kidney disease after the year 2020. Whether and how the demographic trends in the prescription of SGLT2 inhibitors have changed after the expansion of indications have not been studied extensively. This study is a descriptive analysis of serial, cross-sectional data on nationwide prescription of SGLT2 inhibitors between April 2016 and March 2023 obtained from NDB Open Data Japan, which contains more than 95% of total health insurance reimbursement claims in the nation. The total number of SGLT2 inhibitor tablets prescribed in outpatient settings with prescriptions papers increased from 577,996,158 tablets in fiscal year (FY) 2020 to 904,598,175 tablets in FY 2022. Patients aged 75 years and older accounted for 20.3% of the total prescriptions in FY 2020, and this proportion increased to 27.8% in FY 2022. Among all SGLT2 inhibitors, the tablet that expanded its indications for patients with heart failure and chronic kidney disease the earliest showed the largest percentage increase in the number of prescribed tablets during this period and the highest share of the elderly population in its recipients in both sexes (men, 35.9%; women, 49.4%) in FY 2022. The number of prescribed SGLT2 inhibitor tablets per population was constantly higher in men than in women between FY 2020 and 2022, which is consistent with the sex difference in the prevalence of these diseases. Prescription of SGLT2 inhibitors to the elderly population is no longer infrequent and accounts for a large portion of the entire prescription of SGLT2 inhibitors in Japan. These findings contribute to updating our perception on the demographics of SGLT2 inhibitor recipients.', 'The Golgi apparatus serves multiple crucial roles in the cell. These roles include the addition and subsequent modification of glycans, not only to newly-made proteins arriving from the endoplasmic reticulum, but also to precursors during the biosynthesis of glycolipids. New research by Brauer et al, (', 'Glycosylation, which plays an important role in modifying lipids and sorting of proteins, is regulated by asymmetric intra-Golgi distribution and SPPL3-mediated cleavage of Golgi enzymes. We found that cells lacking LYSET/TMEM251, a retention factor for Golgi  N cis']","GLP-1 receptor agonists work by stimulating insulin secretion, suppressing glucagon secretion, slowing gastric emptying, and promoting satiety, ultimately improving glycemic control and often leading to weight loss.",5.195040941238403,10,True,,,,,,,,0.4376395046710968,350,0
hyde,What are the cardiovascular benefits of SGLT2 inhibitors?,"The cardiovascular benefits of SGLT2 inhibitors include cardiovascular and renal protection. These medications have been shown to have beneficial effects beyond improved glycemic control and weight loss, including reducing the risks of cardiovascular events and recurrent myocardial infarctions. Additionally, SGLT2 inhibitors have been found to enhance myocardial microcirculation and reduce adverse cardiac events in older patients with acute coronary syndrome.","['Indications for sodium-glucose cotransporter-2 (SGLT2) inhibitors have expanded to include heart failure and chronic kidney disease after the year 2020. Whether and how the demographic trends in the prescription of SGLT2 inhibitors have changed after the expansion of indications have not been studied extensively. This study is a descriptive analysis of serial, cross-sectional data on nationwide prescription of SGLT2 inhibitors between April 2016 and March 2023 obtained from NDB Open Data Japan, which contains more than 95% of total health insurance reimbursement claims in the nation. The total number of SGLT2 inhibitor tablets prescribed in outpatient settings with prescriptions papers increased from 577,996,158 tablets in fiscal year (FY) 2020 to 904,598,175 tablets in FY 2022. Patients aged 75 years and older accounted for 20.3% of the total prescriptions in FY 2020, and this proportion increased to 27.8% in FY 2022. Among all SGLT2 inhibitors, the tablet that expanded its indications for patients with heart failure and chronic kidney disease the earliest showed the largest percentage increase in the number of prescribed tablets during this period and the highest share of the elderly population in its recipients in both sexes (men, 35.9%; women, 49.4%) in FY 2022. The number of prescribed SGLT2 inhibitor tablets per population was constantly higher in men than in women between FY 2020 and 2022, which is consistent with the sex difference in the prevalence of these diseases. Prescription of SGLT2 inhibitors to the elderly population is no longer infrequent and accounts for a large portion of the entire prescription of SGLT2 inhibitors in Japan. These findings contribute to updating our perception on the demographics of SGLT2 inhibitor recipients.', 'Glucagon-like peptide-1 (GLP-1) receptor agonists and the dual GLP-1- and glucose-dependent insulinotropic polypeptide receptor co-agonist tirzepatide (referred to here collectively as “GLP-1-based therapy”) are incretin-based therapies being used increasingly in the management of both type 2 diabetes and obesity. They are now recognized to have beneficial effects beyond improved glycemic control and weight loss, including cardiovascular and renal protection. GLP-1-based therapy also slows gastric emptying, which has benefits (lowering postprandial glucose), but also potential risks (eg, hypoglycemia in individuals on insulin or sulphonylurea therapy). Their effects on the gallbladder may also be beneficial, contributing to reducing postprandial triglycerides, but they also potentially increase the risk of biliary disease. In this review, we summarize the effects of GLP-1 and incretin-based therapeutics on gastric, biliary and small intestinal function. An improved understanding of these effects will optimize the use of these drugs.', 'Common treatments for type 2 diabetes include lifestyle changes such as diet and exercise, oral medications like metformin, and in some cases, insulin therapy. Metformin is often the first-line medication prescribed for type 2 diabetes. It helps lower glucose production in the liver and improves insulin sensitivity.', 'Diabetes mellitus (DM) is a prevalent condition that requires careful management in the perioperative setting to reduce surgical risks and optimize patient outcomes. The preoperative care of diabetic patients is complex because glucose control must be balanced with minimizing hypoglycemic or hyperglycemic events during surgery. A variety of diabetic medications such as insulin, dipeptidyl-peptidase-4 inhibitors, glucagon-like peptide-1 receptor agonists, sodium–glucose cotransporter-2 inhibitors, and biguanides such as metformin present unique challenges and considerations due to their different mechanisms, benefits, and potential adverse effects. In recent years, professional organizations have developed recommendations on the perioperative management of these therapies, although there remain some variations in guidelines related to medication cessation and dosage adjustments. Standardized protocols in preoperative DM care remain a topic of interest to ensure consistent and safe practices across healthcare settings, and further collaborative research efforts could provide clarity and consensus in managing this diverse patient population. The objective of this study was to provide an overview of guidelines and practices to support healthcare professionals in delivering improved preoperative care for diabetic patients. This initiative aims to enhance surgical outcomes and minimize the occurrence of complications. This is a comparative review that provides a systematic comparison of the similarities and differences in the guidelines and recommendations of three professional organizations along with Hamad Medical Corporation. All guidelines were from official websites including Hamad Medical Corporation. Although the reviewed guidelines for the preoperative care of diabetes patients share some similarities, there are also a number of differences due to outdated data and expert opinions, and therefore differ in practices around the world. While the key elements are agreed upon, more research and global collaboration are needed to create consistent guidelines and improve patient outcomes.', 'The management of acute coronary syndrome (ACS) in older patients remains challenging because standard anticoagulants often fail to yield optimal outcomes. Bivalirudin, a direct inhibitor of thrombin, serves as an alternative to traditional therapies. This drug is particularly effective in enhancing myocardial microcirculation and reducing adverse events after clinical interventions. The present article explores the findings of a recent study that highlighted the clinical benefits of bivalirudin by investigating its effects on myocardial microcirculation and adverse cardiac events after percutaneous coronary intervention in older patients with ACS. Compared with unfractionated heparin, bivalirudin markedly reduced the emergency response time and improved cardiac function indicators. It further mitigated the risks of cardiovascular events and recurrent myocardial infarctions. These findings suggest that bivalirudin can enhance myocardial perfusion and reduce bleeding complications, thus serving as a safe, effective anticoagulation agent for older patients with ACS. Nonetheless, further large-scale, high-quality trials are needed to establish optimal usage guidelines and assess long-term outcomes. Integrating bivalirudin into ACS treatment protocols for older patients may help optimize patient care, balancing efficacy and safety. Continual research and consensus building are necessary for the widespread clinical application of bivalirudin and the improvement of ACS outcomes in older patients.', 'Although the importance of home blood pressure (BP) management has been widely reported, the achievement rate of home BP targets remains low in Japan. Sacubitril/valsartan is a novel antihypertensive agent with potent antihypertensive effects. Despite its theoretical advantages, the real-world clinical application of sacubitril/valsartan in optimizing home BP management remains underexplored. The aim of this study was to evaluate the effect of switching from azilsartan treatment to sacubitril/valsartan treatment on the achievement of home BP targets and to refine hypertension management strategies in practical clinical settings. A cohort of 55 patients, with a mean morning home systolic BP of 135 mmHg or more was enrolled for an 8-week treatment phase with azilsartan and calcium-channel blockers. Morning BP, pulse rate (PR), estimated glomerular filtration rate, and B-type natriuretic peptide, serum potassium, serum uric acid (UA), and hemoglobin A1c levels were assessed at baseline and then at 8, 24, and 48 weeks after switching from 20 mg azilsartan to 200 mg sacubitril/valsartan. At 48 weeks after switching to sacubitril/valsartan, there was a 60% increase in the rate of attainment of home systolic BP targets. Sacubitril/valsartan significantly reduced the mean systolic BP (from 143.6 ± 7.0 mmHg to 131.4 ± 8.7 mmHg), diastolic BP (from 86.9 ± 12.3 mmHg to 80.2 ± 10.7 mmHg), PR (from 74.8 ± 11.0 bpm to 72.1 ± 10.1 bpm), and serum UA (from 5.9 ± 1.1 mg/dL to 5.5 ± 0.9 mg/dL) within the first 8 weeks (all p < 0.01). These effects were maintained for 48 weeks. The switch from azilsartan to sacubitril/valsartan treatment resulted in a significant improvement in the achievement of home BP targets, which is consistent with our goal of refining hypertension management strategies in practical clinical settings.', 'Cardiovascular diseases are a leading cause of morbidity and mortality in patients with chronic kidney disease (CKD). Acute kidney injury (AKI) has been increasingly recognized as a potential exacerbating factor for cardiovascular events in these patients. The CKD-REIN study aims to explore the relationship between AKI and the risk of major adverse cardiovascular events (MACE) in a cohort of CKD patients. We hypothesize that AKI is a significant and independent predictor of MACE in patients with CKD, and that the severity of AKI correlates with the risk of subsequent cardiovascular events. This prospective cohort study included 3033 adult CKD patients from 40 outpatient nephrology clinics in France. Patients were followed for a median of 5.2 years. AKI episodes were identified and staged based on the KDIGO-AKI criteria. Cardiovascular events, including myocardial infarction, stroke, heart failure hospitalization, and cardiovascular death, were systematically recorded. The association between AKI and MACE was analyzed using a multivariable Cox model, adjusting for confounders such as demographic characteristics, medical history, and baseline kidney function. During the follow-up, 530 patients experienced at least one episode of AKI. The cumulative incidence of MACE at 1 year post-AKI was 8.1%. Patients with AKI had a significantly increased risk of MACE, with an adjusted hazard ratio (HR) of 5.78 ( P The findings of this study confirm that AKI is a significant independent predictor of MACE in CKD patients, demonstrating a strong severity–response relationship. These results underscore the importance of vigilant cardiovascular monitoring and preventive strategies in CKD patients following AKI episodes. Understanding the mechanisms linking AKI to cardiovascular outcomes is crucial for developing targeted interventions to mitigate these risks.', 'Lifestyle intervention prevents or delays type 2 diabetes (T2D) in subjects at a high risk of T2D. However, it is not known whether genetic variants modify the effect on incident T2D during lifestyle intervention. To investigate whether a low or high genetic risk has effects on incident T2D in a group-based lifestyle intervention study. The T2D-GENE trial involved 973 men from the Metabolic Syndrome in Men (METSIM) cohort, aged 50-75 years, body mass index ≥25 kg/m The intervention significantly lowered the risk of T2D among the participants with a high genetic risk for T2D [hazards ratio (HR) 0.30, 95% confidence interval (CI) 0.16-0.56,  P P P Our results showed that individuals with a high genetic risk for T2D benefitted from a low-cost group-based intervention focusing on healthy diet and physical activity. Therefore, all individuals at risk of T2D should be encouraged to make lifestyle changes regardless of genetic risk.', 'IgA nephropathy (IgAN) is a common primary glomerular disease. The  O O The review followed Preferred Reporting Items for Systematic Reviews and Meta-Analyses (PRISMA) recommendations and was registered in PROSPERO (CRD42021287423). The literature search was conducted in PubMed, Web of Science, Cochrane, and Scopus, and the selected articles were evaluated for eligibility based on predefined criteria. The methodological quality of the studies was assessed using the Newcastle–Ottawa Scale. Statistical analysis was performed to calculate effect sizes and assess heterogeneity among the studies. This review analyzed 29 out of 1,986 studies, conducted between 2005 and 2022, with participants from multiple countries. Gd-IgA1 levels were not associated with age and gender, while associations with hypertension, hematuria, and proteinuria were inconsistent. In the meta-analyses, a correlation between serum Gd-IgA1 and estimated glomerular filtration rate was identified, however, the relationships between Gd-IgA1 levels and chronic kidney disease (CKD) stage and progression to kidney failure were inconsistent. Serum Gd-IgA1 levels were not associated with validated prognostic risk factors, but were negatively correlated with kidney function. Further research in larger studies using standardized assays are needed to establish the value of Gd-IgA1 as a prognostic risk factor in IgAN. \n The online version contains supplementary material available at 10.1007/s40620-023-01874-8.', 'Metabolic surgery, including laparoscopic sleeve gastrectomy (LSG), may improve hypertension (HTN) complicated by severe obesity; however, insufficient deliberation exists regarding the therapeutic effect of post-metabolic surgery on HTN. This study aimed to analyze the factors correlated with HTN remission and recurrence post-LSG in patients who have severe obesity, and to create a classification system to predict HTN remission and recurrence. Of the 102 patients who underwent LSG at Iwate Medical University Hospital between 2008 and 2020, 62 were enrolled in this study. Factors correlated with HTN remission and recurrence post-LSG were retrospectively analyzed. The HTN remission rate 12-months post-LSG was 40.3%. The remission cohort had a lower number of preoperative antihypertensive drugs (ADs) than that of the non-remission cohort (one and two tablets, respectively; p< 0.001). Additionally, the remission cohort had a statistically significantly smaller visceral fat area (VFA) than that of the non-remission cohort, at all time points. Logistic regression analysis revealed that the number of preoperative ADs and VFA were independent predictors of remission. The HTN recurrence rate 36-months post-LSG was 36.0%. In the recurrence cohort, the number of preoperative ADs and VFA were higher and larger than that in the non-recurrence cohort, respectively. Stratification, based on the number of preoperative ADs and VFA, revealed that the HTN remission and recurrence rates in the sub-cohort with a small number of preoperative ADs and small VFA (100% and 16.7%, respectively) were better than those in the sub-cohort with a large number of preoperative ADs and large VFA (5.3% and 100%, respectively). In Japanese patients with severe obesity, the number of preoperative ADs and VFA were correlated with HTN remission and recurrence post-LSG. Stratification, by combining the number of preoperative ADs and VFA, may be useful in predicting HTN remission and recurrence.']","SGLT2 inhibitors provide cardiovascular benefits by reducing major adverse cardiovascular events and hospitalization for heart failure, effects that appear to be independent of their glucose-lowering action.",4.952134847640991,10,True,,,,,,,,0.515232652425766,463,0
hyde,How do statins prevent cardiovascular disease?,The provided documents do not specifically address how statins prevent cardiovascular disease.,"['Subarachnoid hemorrhage (SAH) is a form of severe acute stroke with very high mortality and disability rates. Early brain injury (EBI) and delayed cerebral ischemia (DCI) contribute to the poor prognosis of patients with SAH. Currently, some researchers have started to focus on changes in amino acid metabolism that occur in brain tissues after SAH. Taurine is a sulfur-containing amino acid that is semi-essential in animals, and it plays important roles in various processes, such as neurodevelopment, osmotic pressure regulation, and membrane stabilization. In acute stroke, such as cerebral hemorrhage, taurine plays a neuroprotective role. However, the role of taurine after subarachnoid hemorrhage has rarely been reported. In the present study, we established a mouse model of SAH. We found that taurine administration effectively improved the sensorimotor function of these mice. In addition, taurine treatment alleviated sensorimotor neuron damage and reduced the proportion of apoptotic cells. Furthermore, taurine treatment enhanced the polarization of astrocytes toward the neuroprotective phenotype while inhibiting their polarization toward the neurotoxic phenotype. This study is the first to reveal the relationship between taurine and astrocyte polarization and may provide a new strategy for SAH research and clinical treatment.', 'The management of acute coronary syndrome (ACS) in older patients remains challenging because standard anticoagulants often fail to yield optimal outcomes. Bivalirudin, a direct inhibitor of thrombin, serves as an alternative to traditional therapies. This drug is particularly effective in enhancing myocardial microcirculation and reducing adverse events after clinical interventions. The present article explores the findings of a recent study that highlighted the clinical benefits of bivalirudin by investigating its effects on myocardial microcirculation and adverse cardiac events after percutaneous coronary intervention in older patients with ACS. Compared with unfractionated heparin, bivalirudin markedly reduced the emergency response time and improved cardiac function indicators. It further mitigated the risks of cardiovascular events and recurrent myocardial infarctions. These findings suggest that bivalirudin can enhance myocardial perfusion and reduce bleeding complications, thus serving as a safe, effective anticoagulation agent for older patients with ACS. Nonetheless, further large-scale, high-quality trials are needed to establish optimal usage guidelines and assess long-term outcomes. Integrating bivalirudin into ACS treatment protocols for older patients may help optimize patient care, balancing efficacy and safety. Continual research and consensus building are necessary for the widespread clinical application of bivalirudin and the improvement of ACS outcomes in older patients.', ""Bone is a dynamic organ which continuously undergoes remodeling throughout one's lifetime. Cellular production of reactive oxygen species (ROS) is essential for regulating bone homeostasis. Osteoclasts, multinucleated giant cells differentiated from macrophage lineage, are responsible for osteolytic bone conditions which are closely linked to ROS signaling pathways. In this study, an anti‐ROS enzyme, peroxiredoxin 1 (Prdx1) was found to be expressed both in bone marrow macrophages and osteoclasts. Recombinant Prdx1 protein was found to dose‐dependently inhibit ROS production and osteoclast differentiation. Mechanistically, Prdx1 protein also attenuated NFATc1 activation as well as the expression of C‐Fos, V‐ATPase‐d2, Cathepsin K, and Integrin αV. Collectively, Prdx1 is a negative regulator on osteoclast formation via inhibiting RANKL‐mediated ROS activity, thus suggesting its potential application for treating osteoclast related disorders."", 'Lipid droplets (LDs) serve as crucial hubs for lipid trafficking and metabolic regulation through their numerous interactions with various organelles. While the interplay between LDs and the Golgi apparatus has been recognized, their roles and underlying mechanisms remain poorly understood. Here, we reveal the role of Ras-related protein Rab-2A (Rab2A) in mediating LD-Golgi interactions, thereby contributing to very-low-density lipoprotein (VLDL) lipidation and secretion in hepatocytes. Mechanistically, our findings identify a selective interaction between Golgi-localized Rab2A and 17-beta-hydroxysteroid dehydrogenase 13 (HSD17B13) protein residing on LDs. This complex facilitates dynamic organelle communication between the Golgi apparatus and LDs, thus contributing to lipid transfer from LDs to the Golgi apparatus for VLDL2 lipidation and secretion. Attenuation of Rab2A activity via AMP-activated protein kinase (AMPK) suppresses the Rab2A-HSD17B13 complex formation, impairing LD-Golgi interactions and subsequent VLDL secretion. Furthermore, genetic inhibition of Rab2A and HSD17B13 in the liver reduces the serum triglyceride and cholesterol levels. Collectively, this study provides a new perspective on the interactions between the Golgi apparatus and LDs.', 'The outcomes related to cardiovascular risk (CVR) in patients with the nonclassical form of congenital adrenal hyperplasia (NCAH) are unknown, especially those related to therapeutic options, including low doses of glucocorticoids or oral contraceptive pills. To analyze CVR by markers of atherosclerosis in females with the nonclassical form according to therapeutic options. A cross-sectional study at a tertiary center. Forty-seven females with NCAH (33.4 ± 10 years) were subdivided into group 1 (G1) (n = 28) treated with dexamethasone (0.14 ± 0.05\u2005mg/m There were no statistically significant differences in BMI, HOMA-IR, high-density lipoprotein-cholesterol, or triglyceride levels among groups ( P P P P Adult females with NCAH did not show increased CVR using methodologies for detection of precocious atherosclerosis. Although patients receiving dexamethasone therapy had increased IL-6 and IL-8 levels, these data were not associated with radiological markers of atherosclerosis. Our cohort was composed of young adults and should be reevaluated in a long-term follow-up.', 'Systemic lupus erythematosus (SLE) is an autoimmune condition that is characterized by the production of autoantibodies and sustained inflammatory damage. Coronary heart disease (CHD) is a common complication of SLE, significantly increases CHD-related mortality in SLE patients. Despite conventional risk factors, the mechanisms contributing to a higher CHD risk require further investigation, with the immune and inflammatory aspects of SLE playing a significant role. Endothelial cell damage and dysfunction are key factors in the progression of coronary atherosclerosis in SLE patients. This review specifically focuses on endothelial dysfunction and the role of specific microRNAs in the context of SLE and CHD. In addition, we discuss the effects and functions of oxidative stress markers, endothelial progenitor cells, and circulating endothelial cells in individuals with both SLE and CHD. We also explored the typical inflammatory markers associated with SLE and CHD, addressing their clinical significance and limitations.', 'Peripheral Artery Disease (PAD) is a common cardiovascular condition marked by peripheral artery stenosis or occlusion. Despite treatment advancements, patients will still face vascular complications, highlighting the need for innovative therapies. Human proteins play crucial roles in biology and drug research. Mendelian randomization (MR) analysis, a gene-based method, is increasingly used in drug target identification. This study aims to identify PAD-associated plasma proteins through MR analysis for potential therapies. We first used GWAS data and seven pQTL datasets to identify plasma proteins causally linked to PAD through MR analysis. Then, we performed KEGG pathway enrichment analysis, Bayesian colocalization analysis, and MR-BMA analysis were carried out to investigate mechanisms and prioritize these proteins. Finally, we assessed the druggability of the target proteins using the DrugBank database. MR analysis found four plasma proteins causally linked to PAD: MMP3 positively correlated with PAD, while CASS4, ISG15, and MMP1 exhibited negative associations. Bayesian colocalization analysis confirmed these relationships, and the MR-BMA analysis prioritized MMP1 as the main target. KEGG pathway enrichment analysis highlighted lipid metabolism and atherosclerosis pathways as central to these drug targets. The druggability evaluation indicated that drugs targeting these proteins are either in development or already in clinical use. This study integrates genetic and proteomic data to identify therapeutic targets for PAD and evaluate their potential for drug development. The prioritization of MMP1 and ISG15 as key targets shows promise for PAD treatment, but further validation and clinical exploration of these findings are needed. The online version contains supplementary material available at 10.1186/s12959-025-00738-4.', 'Atherosclerosis (AS) is a chronic inflammatory disease characterized by the gradual accumulation of plaques in arterial walls, with its pathogenesis remaining incompletely understood. Recent studies have highlighted that development of AS is closely associated with the aberrant activation of the NLRP3 inflammasome in the arteries. Inhibition of the NLRP3 inflammasome by natural products and formulae derived from Chinese herbal medicines (CHMs) has been shown to alleviate AS-associated pathologies. However, therapies that effectively and safely target the NLRP3 inflammasome remain limited. This review aims to summarize the key discoveries from recent studies on the effects of these natural products and formulae on the NLRP3 inflammasome in the context of AS treatment. A comprehensive literature search was conducted on databases such as PubMed/MEDLINE up to January 2025, yielding 38 eligible studies. Our analysis indicates that certain therapies can effectively prevent arterial inflammation in animal models by targeting multiple pathways and mechanisms related to the NLRP3 inflammasome. This review summarizes the primary findings of these studies, focusing on the therapeutic effects and underlying mechanisms of action. Based on these insights, we propose future strategies to enhance the efficacy, specificity, and safety of existing natural products and formulae for AS treatment. Additionally, this study offers a perspective for future research that may enhance our understanding of the roles and the mechanisms of CHM-derived phytochemicals and formulae in regulating the NLRP3 inflammasome and treating AS.', 'The clinical impact of nonalcoholic fatty liver disease (NAFLD) in patients with atrial fibrillation (AF) is still controversial. To evaluate the 1-year risk of all-cause death, thromboembolic events, and bleeding in patients with AF-NAFLD. Retrospective study with a health research network (TriNetX). Patients with AF on oral anticoagulation (OAC) were categorized according to the presence of NAFLD into 2 groups. The primary outcomes were the 1-year risks of (1) a composite cardiovascular outcome (all-cause death, myocardial infarction, stroke, cardiac arrest, and pulmonary embolism) and (2) a composite hemorrhagic outcome (intracranial hemorrhage and gastrointestinal bleeding). Cox regression analysis before and after propensity score matching was used to estimate hazard ratio (HR) and 95% 95% CI,. Sensitivity analyses investigated the risk associated with cirrhosis, thrombocytopenia, and type of OAC (warfarin vs non-vitamin K antagonist oral anticoagulants (NOACs). We identified 22 636 patients with AF-NAFLD (69 ± 12 years, 46.7% females) and 391 014 patients with AF and without liver disease (72 ± 12 years, 42.7% females). NAFLD was associated with a higher risk of composite cardiovascular (HR, 1.54; 95% CI, 1.47-1.61) and hemorrhagic (HR, 1.56; 95% CI, 1.42-1.72) outcomes. This was consistent also for all the single outcomes. Cirrhotic and thrombocytopenic patients with AF-NAFLD showed the highest risks. Compared to patients with AF-NAFLD on NOACs, those on warfarin were associated with a higher risk of cardiovascular and hemorrhagic outcomes. In patients with AF, NAFLD is associated with a higher 1-year risk of adverse events, with the risk of adverse events progressively increasing from noncirrhotic to cirrhotic and from nonthrombocytopenic to thrombocytopenic patients. NOACs were associated with a better effectiveness and safety profile compared to warfarin.', 'Cardiac fibrosis occurs in a wide range of cardiac diseases and is characterised by the transdifferentiation of cardiac fibroblasts into myofibroblasts these cells produce large quantities of extracellular matrix, resulting in myocardial scar. The profibrotic process is multi-factorial, meaning identification of effective treatments has been limited. The antifibrotic effect of the bile acid ursodeoxycholic acid (UDCA) is established in cases of liver fibrosis however its mechanism and role in cardiac fibrosis is less well understood. In this study, we used cellular models of cardiac fibrosis and living myocardial slices to characterise the macroscopic and cellular responses of the myocardium to UDCA treatment. We complemented this approach by conducting RNA-seq on cardiac fibroblasts isolated from dilated cardiomyopathy patients. This allowed us to gain insights into the mechanism of action and explore whether the IL-11 and TGFβ/WWP2 profibrotic networks are influenced by UDCA. Finally, we used fibroblasts from a TGR5 KO mouse to confirm the mechanism of action. We found that UDCA reduced myofibroblast markers in rat and human fibroblasts and in living myocardial slices, indicating its antifibrotic action. Furthermore, we demonstrated that the treatment of UDCA successfully reversed the profibrotic IL-11 and TGFβ/WWP2 gene networks. We also show that TGR5 is the most highly expressed UDCA receptor in cardiac fibroblasts. Utilising cells isolated from a TGR5 knock-out mouse, we identified that the antifibrotic effect of UDCA is attenuated in the KO fibroblasts. This study combines cellular studies with RNA-seq and state-of-the-art living myocardial slices to offer new perspectives on cardiac fibrosis. Our data confirm that TGR5 agonists, such as UDCA, offer a unique pathway of action for the treatment of cardiac fibrosis. Medicines for cardiac fibrosis have been slow to clinic and have the potential to be used in the treatment of multiple cardiac diseases. UDCA is well tolerated in the treatment of other diseases, indicating it is an excellent candidate for further in-human trials.']","Statins prevent cardiovascular disease by inhibiting HMG-CoA reductase to lower LDL cholesterol, reducing atherosclerotic plaque formation, and through pleiotropic effects such as anti-inflammatory and plaque-stabilizing properties.",4.506457090377808,10,True,,,,,,,,0.38269608914852143,94,0
hyde,What is the role of ACE inhibitors in heart failure?,"ACE inhibitors play a crucial role in heart failure by blocking the angiotensin-converting enzyme, which is responsible for converting angiotensin I to angiotensin II. By inhibiting this enzyme, ACE inhibitors help to dilate blood vessels, reduce blood pressure, and decrease the workload on the heart. This can improve symptoms, slow the progression of heart failure, and reduce the risk of hospitalization and death in patients with heart failure.","['Indications for sodium-glucose cotransporter-2 (SGLT2) inhibitors have expanded to include heart failure and chronic kidney disease after the year 2020. Whether and how the demographic trends in the prescription of SGLT2 inhibitors have changed after the expansion of indications have not been studied extensively. This study is a descriptive analysis of serial, cross-sectional data on nationwide prescription of SGLT2 inhibitors between April 2016 and March 2023 obtained from NDB Open Data Japan, which contains more than 95% of total health insurance reimbursement claims in the nation. The total number of SGLT2 inhibitor tablets prescribed in outpatient settings with prescriptions papers increased from 577,996,158 tablets in fiscal year (FY) 2020 to 904,598,175 tablets in FY 2022. Patients aged 75 years and older accounted for 20.3% of the total prescriptions in FY 2020, and this proportion increased to 27.8% in FY 2022. Among all SGLT2 inhibitors, the tablet that expanded its indications for patients with heart failure and chronic kidney disease the earliest showed the largest percentage increase in the number of prescribed tablets during this period and the highest share of the elderly population in its recipients in both sexes (men, 35.9%; women, 49.4%) in FY 2022. The number of prescribed SGLT2 inhibitor tablets per population was constantly higher in men than in women between FY 2020 and 2022, which is consistent with the sex difference in the prevalence of these diseases. Prescription of SGLT2 inhibitors to the elderly population is no longer infrequent and accounts for a large portion of the entire prescription of SGLT2 inhibitors in Japan. These findings contribute to updating our perception on the demographics of SGLT2 inhibitor recipients.', 'Although the importance of home blood pressure (BP) management has been widely reported, the achievement rate of home BP targets remains low in Japan. Sacubitril/valsartan is a novel antihypertensive agent with potent antihypertensive effects. Despite its theoretical advantages, the real-world clinical application of sacubitril/valsartan in optimizing home BP management remains underexplored. The aim of this study was to evaluate the effect of switching from azilsartan treatment to sacubitril/valsartan treatment on the achievement of home BP targets and to refine hypertension management strategies in practical clinical settings. A cohort of 55 patients, with a mean morning home systolic BP of 135 mmHg or more was enrolled for an 8-week treatment phase with azilsartan and calcium-channel blockers. Morning BP, pulse rate (PR), estimated glomerular filtration rate, and B-type natriuretic peptide, serum potassium, serum uric acid (UA), and hemoglobin A1c levels were assessed at baseline and then at 8, 24, and 48 weeks after switching from 20 mg azilsartan to 200 mg sacubitril/valsartan. At 48 weeks after switching to sacubitril/valsartan, there was a 60% increase in the rate of attainment of home systolic BP targets. Sacubitril/valsartan significantly reduced the mean systolic BP (from 143.6 ± 7.0 mmHg to 131.4 ± 8.7 mmHg), diastolic BP (from 86.9 ± 12.3 mmHg to 80.2 ± 10.7 mmHg), PR (from 74.8 ± 11.0 bpm to 72.1 ± 10.1 bpm), and serum UA (from 5.9 ± 1.1 mg/dL to 5.5 ± 0.9 mg/dL) within the first 8 weeks (all p < 0.01). These effects were maintained for 48 weeks. The switch from azilsartan to sacubitril/valsartan treatment resulted in a significant improvement in the achievement of home BP targets, which is consistent with our goal of refining hypertension management strategies in practical clinical settings.', 'The management of acute coronary syndrome (ACS) in older patients remains challenging because standard anticoagulants often fail to yield optimal outcomes. Bivalirudin, a direct inhibitor of thrombin, serves as an alternative to traditional therapies. This drug is particularly effective in enhancing myocardial microcirculation and reducing adverse events after clinical interventions. The present article explores the findings of a recent study that highlighted the clinical benefits of bivalirudin by investigating its effects on myocardial microcirculation and adverse cardiac events after percutaneous coronary intervention in older patients with ACS. Compared with unfractionated heparin, bivalirudin markedly reduced the emergency response time and improved cardiac function indicators. It further mitigated the risks of cardiovascular events and recurrent myocardial infarctions. These findings suggest that bivalirudin can enhance myocardial perfusion and reduce bleeding complications, thus serving as a safe, effective anticoagulation agent for older patients with ACS. Nonetheless, further large-scale, high-quality trials are needed to establish optimal usage guidelines and assess long-term outcomes. Integrating bivalirudin into ACS treatment protocols for older patients may help optimize patient care, balancing efficacy and safety. Continual research and consensus building are necessary for the widespread clinical application of bivalirudin and the improvement of ACS outcomes in older patients.', 'Congenitally corrected transposition of the great arteries (ccTGA) remains a rare congenital disorder with a wide range of manifestations. The management of heart failure (HF) of the systemic right ventricle (RV), arrhythmias, heart block, and acquired cardiac conditions require a complex and multi-faceted approach. The objective of this manuscript is to present the current evidence regarding diagnostic, treatment, and management strategies for HF in ccTGA, including ventricular assist device (VAD) therapy and heart transplantation. A systematic review of the literature was conducted using PubMed, covering the period between 2010 and 2024. The search terms included “heart failure”, “ccTGA”, “VAD”, “heart transplantation”, and “systemic RV failure”. Two clinical cases were included for illustrative purposes. HF is a common occurrence in the context of ccTGA, primarily driven by progressive pressure and volume overload of the systemic RV, regurgitation of the systemic atrio-ventricular (AV) valve, and the development of arrhythmias, including complete heart block and (supra-)ventricular tachycardia. The use of HF medication is indicated for symptomatic patients, however, data on the efficacy of standardized HF medication remains limited. Timing of AV-valve replacement is essential to prevent further progression of HF. In ccTGA, the timing of surgery and interventional treatment approaches, the effect of pharmacological treatment in the context of HF, as well as the timing of initiation of a mechanical circulatory support, VAD and heart transplantation, are based on individualised consensus-level decisions. Optimal management remains a topic of debate due to the scarcity of outcome data. Future investigations should focus on identifying surrogate parameters for guiding treatment.', 'Cardiovascular diseases are a leading cause of morbidity and mortality in patients with chronic kidney disease (CKD). Acute kidney injury (AKI) has been increasingly recognized as a potential exacerbating factor for cardiovascular events in these patients. The CKD-REIN study aims to explore the relationship between AKI and the risk of major adverse cardiovascular events (MACE) in a cohort of CKD patients. We hypothesize that AKI is a significant and independent predictor of MACE in patients with CKD, and that the severity of AKI correlates with the risk of subsequent cardiovascular events. This prospective cohort study included 3033 adult CKD patients from 40 outpatient nephrology clinics in France. Patients were followed for a median of 5.2 years. AKI episodes were identified and staged based on the KDIGO-AKI criteria. Cardiovascular events, including myocardial infarction, stroke, heart failure hospitalization, and cardiovascular death, were systematically recorded. The association between AKI and MACE was analyzed using a multivariable Cox model, adjusting for confounders such as demographic characteristics, medical history, and baseline kidney function. During the follow-up, 530 patients experienced at least one episode of AKI. The cumulative incidence of MACE at 1 year post-AKI was 8.1%. Patients with AKI had a significantly increased risk of MACE, with an adjusted hazard ratio (HR) of 5.78 ( P The findings of this study confirm that AKI is a significant independent predictor of MACE in CKD patients, demonstrating a strong severity–response relationship. These results underscore the importance of vigilant cardiovascular monitoring and preventive strategies in CKD patients following AKI episodes. Understanding the mechanisms linking AKI to cardiovascular outcomes is crucial for developing targeted interventions to mitigate these risks.', 'Inhibitors of the interaction between Neuropilin-1 (NRP-1) and Vascular Endothelial Growth Factor-A 165 165 2 2 50 50 2 2 50 165 The online version contains supplementary material available at 10.1007/s00726-024-03411-8.', 'Metabolic surgery, including laparoscopic sleeve gastrectomy (LSG), may improve hypertension (HTN) complicated by severe obesity; however, insufficient deliberation exists regarding the therapeutic effect of post-metabolic surgery on HTN. This study aimed to analyze the factors correlated with HTN remission and recurrence post-LSG in patients who have severe obesity, and to create a classification system to predict HTN remission and recurrence. Of the 102 patients who underwent LSG at Iwate Medical University Hospital between 2008 and 2020, 62 were enrolled in this study. Factors correlated with HTN remission and recurrence post-LSG were retrospectively analyzed. The HTN remission rate 12-months post-LSG was 40.3%. The remission cohort had a lower number of preoperative antihypertensive drugs (ADs) than that of the non-remission cohort (one and two tablets, respectively; p< 0.001). Additionally, the remission cohort had a statistically significantly smaller visceral fat area (VFA) than that of the non-remission cohort, at all time points. Logistic regression analysis revealed that the number of preoperative ADs and VFA were independent predictors of remission. The HTN recurrence rate 36-months post-LSG was 36.0%. In the recurrence cohort, the number of preoperative ADs and VFA were higher and larger than that in the non-recurrence cohort, respectively. Stratification, based on the number of preoperative ADs and VFA, revealed that the HTN remission and recurrence rates in the sub-cohort with a small number of preoperative ADs and small VFA (100% and 16.7%, respectively) were better than those in the sub-cohort with a large number of preoperative ADs and large VFA (5.3% and 100%, respectively). In Japanese patients with severe obesity, the number of preoperative ADs and VFA were correlated with HTN remission and recurrence post-LSG. Stratification, by combining the number of preoperative ADs and VFA, may be useful in predicting HTN remission and recurrence.', 'A hipertensão arterial sistêmica é um fator de risco para disfunções cardíacas, renais e metabólicas. A busca por novas estratégias para prevenir e tratar doenças cardiovasculares levou à síntese de novas\n \n N Avaliar o perfil anti-hipertensivo de novos compostos contendo selênio desenvolvidos para melhorar sua interação com os receptores de adenosina. Foi avaliada a reatividade vascular, registrando-se a tensão isométrica da aorta torácica pré-contraída de ratos Wistar machos após exposição a concentrações crescentes de cada derivado (0,1 a 100 μM). Para investigar o efeito anti-hipertensivo em ratos espontaneamente hipertensos, foram determinadas a pressão arterial sistólica, pressão arterial diastólica, pressão arterial média e a frequência cardíaca após administração intravenosa de 10 e 30 μmol/kg do composto selecionado LASSBio-2062. Os compostos denominados LASSBio-2062, LASSBio-2063, LASSBio-2075, LASSBio-2076, LASSBio-2084, LASSBio-430, LASSBio-2092 e LASSBio-2093 promoveram vasodilatação com concentrações efetivas médias de 15,5 ± 6,5; 14,6 ± 2,9; 18,7 ± 9,6; 6,7 ± 4,1; > 100; 6,0 ± 3,6; 37,8 ± 11,8; e 15,9 ± 5,7 μM, respectivamente. O LASSBio-2062 (30 μmol/kg) reduziu a pressão arterial média em ratos espontaneamente hipertensos de 124,6 ± 8,6 para 72,0 ± 12,3 mmHg (p < 0,05). A ativação do receptor de adenosina subtipo A 3 O novo agonista do receptor de adenosina e ativador dos canais de potássio é um potencial agente terapêutico para o tratamento da hipertensão arterial sistêmica.', 'Timing of initiation of proprotein convertase subtilisin/kexin type 9 inhibitor (PCSK9i) monoclonal antibody (mAb) therapy and its impact on cardiovascular outcomes is unknown. The aim was to identify any association between timing of PCSK9i mAb initiation after a major adverse cardiovascular event (MACE) and the rate of subsequent MACE. A retrospective cohort study of adult patients in the United States with a MACE (myocardial infarction, stroke, unstable angina, or coronary revascularization) from January 1, 2017 to February 28, 2022 was conducted using administrative claims databases (index date = first observed MACE during this period). Patients were required to have ≥360 days of data visibility prior to (baseline period) and for ≥30 days after the index date (minimum, variable follow up period), and ≥1 prescription claim for PCSK9i mAb therapy on or after the index date. Subsequent MACE rates, time from index MACE to PCSK9i mAb initiation, and time to subsequent MACE were reported. A total of 58,997 patients with ≥1 MACE were identified (mean age = 64 years; 58% male; median follow up=1,241 days). Over half of the patients did not initiate a PCSK9i mAb in the first year after the index MACE. Overall, 35% (n = 20,465) had ≥1 subsequent MACE. Compared to the period between index MACE and prior to PCSK9i mAb initiation, rates of subsequent MACE after PCSK9i mAb initiation were reduced in a time-dependent manner by 70% among patients who initiated PCSK9i mAb therapy within 30 days, 78% (31–90 days), 76% (91–180 days), 65% (181–360 days), and 42% (>360 days) after the index MACE. Those who initiated PCSK9i mAb within 30 days of the index MACE had longer median time to the first subsequent MACE (111 days) compared to patients who initiated at later times. This study provides evidence that earlier initiation of PCSK9i mAb therapy after a MACE appeared to be associated with longer time to a subsequent MACE. Patients without timely treatment are left at an unnecessarily elevated risk of further MACE.', 'Chronic Chagas cardiomyopathy is associated with an unbalanced\nimmune response and impaired heart function, and available drugs do\nnot prevent its development. Zileuton (Zi), a 5-lypoxigenase inhibitor,\naffects inflammatory/pro-resolution mediators. Herein, Zi treatment\nin the early phase of infection reduced parasitemia associated mainly\nwith the direct effect of Zi on the parasite, and the enzyme epoxide\nhydrolase was the potential molecular target behind the trypanocidal\neffect. In the intermediate acute phase of infection, Zi reduced the\nnumber of innate and adaptive inflammatory cells, increased the level\nof SOCS2 expression in the heart associated with lower inflammation,\nand improved cardiac function. Zi treatment initiated in the chronic\nstage increased the level of SOCS2 expression in the heart, reduced\ninflammation, and improved cardiac function. Our data suggest that\nZi protects against  Trypanosoma cruzi']","ACE inhibitors treat heart failure by blocking the conversion of angiotensin I to angiotensin II, which reduces vasoconstriction and aldosterone production, decreases afterload and preload, improves cardiac output, and ultimately reduces mortality and hospitalizations in patients with heart failure with reduced ejection fraction.",6.126297950744629,10,True,,,,,,,,0.4087706595659256,449,0
hyde,How do glucocorticoids suppress inflammation?,"Glucocorticoids suppress inflammation by inhibiting the expression of pro-inflammatory genes and cytokines, such as IL-1β, IL-6, iNOS, COX-2, and TNF-α. They also inhibit the activation of the NF-κB signaling pathway by blocking IκB-α phosphorylation, thereby reducing the production of inflammatory mediators. Additionally, glucocorticoids can modulate immune cell functions, such as reducing the activity of immune cells like macrophages and T cells, which play a role in the inflammatory response. Overall, glucocorticoids exert their anti-inflammatory effects by regulating the expression of inflammatory mediators and modulating immune cell functions.","['Fucoxanthin (Fx), a natural carotenoid predominantly found in brown algae and certain microalgae, has garnered significant attention in recent years for its potent antioxidant and anti-inflammatory properties. As inflammation and oxidative stress represent fundamental physiological responses that play pivotal roles in disease pathogenesis, their intricate interplay has become a focus of scientific investigation. This study employed an LPS-induced THP-1 cell inflammation model to elucidate the anti-inflammatory mechanisms of fucoxanthin and its interaction with oxidative stress pathways. Our findings demonstrate that fucoxanthin effectively suppresses the LPS-induced secretion of pro-inflammatory mediators, including IL-1β, IL-6, iNOS, COX-2, and TNF-α, in THP-1 cells. Mechanistically, this effect is achieved through the inhibition of IκB-α phosphorylation, thereby blocking the activation of the NF-κB p65 signaling pathway. Concurrently, fucoxanthin exhibits robust antioxidant activity, as evidenced by enhanced catalase (CAT) and superoxide dismutase (SOD) activities coupled with reduced malondialdehyde (MDA) production. Furthermore, fucoxanthin activates the Nrf2 signaling pathway, leading to upregulated heme oxygenase-1 (HO-1) expression and the consequent attenuation of reactive oxygen species (ROS) generation. These results collectively indicate that fucoxanthin exerts dual protective effects through anti-inflammatory action mediated by NF-κB pathway inhibition and antioxidant activity via Nrf2/HO-1 pathway activation. The observed crosstalk between these pathways suggests that fucoxanthin’s therapeutic potential stems from its ability to simultaneously modulate interconnected inflammatory and oxidative stress responses. Our study provides compelling evidence that fucoxanthin’s antioxidant and anti-inflammatory activities are functionally interrelated, with the Nrf2 signaling pathway serving as a critical node in this protective mechanism against LPS-induced cellular damage.', 'Periodontitis is associated with numerous systemic diseases, and it has been shown that these associations are partly causal in nature. It is assumed that such interactions between periodontal and systemic diseases are also mediated via adipokines. Apelin, an adipokine about which there is little research in the dental field, is also produced together with its receptor in periodontal cells. The aim of this review was to summarize the currently available literature on the apelin-APJ system to better understand the pathomechanistic relationship between periodontitis and obesity and to determine the potential clinical relevance of apelin for diagnostics and therapy. In vitro studies suggest that apelin can enhance bacterial-induced synthesis of proinflammatory and proteolytic molecules, indicating a significant etiopathogenic role of this adipokine. Since serum levels of apelin are elevated in diabetes and/or obesity, it is possible that such systemic diseases promote the development and progression of periodontitis via apelin. On the other hand, it is also conceivable that apelin from the periodontium influences such systemic diseases. Further research is needed to better understand the role of apelin in the periodontium and the entire oral cavity, but also in the interactions between periodontal and systemic diseases. In particular, clinical intervention studies are needed to further decipher the etiopathogenic role of apelin in periodontitis.', ""The immune response in the central nervous system (CNS) is a highly specialized and tightly regulated process essential for maintaining neural health and protecting against pathogens and injuries. The primary immune cells within the CNS include microglia, astrocytes, T cells, and B cells. They work together, continuously monitor the CNS environment for signs of infection, injury, or disease, and respond by phagocytosing debris, releasing cytokines, and recruiting other immune cells. In addition to providing neuroprotection, these immune responses must be carefully balanced to prevent excessive inflammation that can lead to neuronal damage and contribute to neurodegenerative diseases. Dysregulated immune responses in the CNS are implicated in various neurodegenerative diseases such as Alzheimer's disease, Parkinson's disease, and amyotrophic lateral sclerosis. Wnt signaling is a crucial pathway in the CNS that regulates various cellular processes critical for brain development, function, and maintenance. Despite enhancing immune responses in the health CNS, dysregulated Wnt signaling exacerbates neuroinflammation in the neurodegenerative brains. This review summarized the role of Wnt signaling in regulating immune response under different conditions. We then examined the role of immune response in healthy brains and during the development of neurodegenerative diseases. We also discussed therapeutic intervention in various neurodegenerative diseases through the modulation of the Wnt signaling pathway and neuroinflammation and highlighted challenges and limitations in current clinical trials."", 'Dysregulated and excessive inflammatory reactions can lead to tissue damage, which is the underlying cause of most human diseases. Menisoxoisoaporphine A (MA), a novel oxoisoaporphine alkaloid, was obtained from Menispermi Rhizoma, a traditional Chinese medicinal herb used in the treatment of inflammatory conditions in clinical practice. This suggests that MA has very promising potential for the development of anti-inflammatory therapeutics. Hence, this study aims to investigate the anti-inflammatory effects and underlying mechanisms of MA. The anti-inflammatory effects of MA were evaluated in lipopolysaccharide (LPS)-induced mouse macrophage RAW264.7 cells. Its underlying mechanisms were explored through RNA sequencing and Western blotting. The binding modes and interactions sites between MA and phosphodiesterase 4B (PDE4B) were predicted using molecular docking and validated by molecular dynamics simulation. MA treatment significantly reduced LPS-induced morphological changes, inflammatory cytokine relesae, and proinflammatory genes expression in RAW264.7 cells compared to the LPS-induced controls. Transcriptome sequencing analysis suggested that PDE4B might be a key target for MA to exert its therapeutic effect. Mechanismly, MA directly acted on Tyr405 site of PDE4B, thus leading to a sustained elevation of the cyclic adenosine monophosphate (cAMP) levels, which subsequently inactivated NF-κB signaling pathway by phosphorylating protein kinase A (PKA). MA inhibited the NF-κB-mediated inflammatory response depending on PDE4B. MA, a natural and novel compound, exerted anti-inflammatory effects in LPS-induced RAW264.7 macrophage cells. It demonstrated a strong binding ability to the Tyr405 sites of PDE4B, thereby inhibiting NF-κB signaling pathway by regulating the cAMP-PKA axis. Elucidating the interaction between MA and PDE4B holds significant potential for the advancement of innovative therapeutic strategies aimed at inflammatory diseases. By strategically modulating this interaction, it may be feasible to achieve more precise regulation of inflammatory responses, thereby offering promising therapeutic benefits for conditions such as rheumatoid arthritis, asthma, and inflammatory bowel disease.', 'Asthma is a chronic inflammatory lung disease driven by a complex interplay between innate and adaptive immune components. Among these, innate lymphoid cells (ILCs) and innate-like lymphocytes have emerged as crucial players in shaping the disease phenotype. Within the ILC family, group 2 ILCs (ILC2s), in particular, contribute significantly to type 2 inflammation through their rapid production of cytokines such as IL-5 and IL-13, promoting airway eosinophilia and airway hyperreactivity. On the other hand, innate-like lymphocytes such as invariant natural killer T (iNKT) cells can play either pathogenic or protective roles in asthma, depending on the stimuli and lung microenvironment. Regulatory mechanisms, including cytokine signaling, metabolic and dietary cues, and interactions with other immune cells, play critical roles in modulating their functions. In this review, we highlight current findings on the role of ILCs and innate-like lymphocytes in asthma development and pathogenesis. We also examine the underlying mechanisms regulating their function and their interplay with other immune cells. Finally, we explore current therapies targeting these cells and their effector cytokines for asthma management.', 'The tumor microenvironment (TME) plays a crucial role in the development, progression, and metastasis of oral squamous cell carcinoma (OSCC). The TME comprises various cellular and acellular components, including immune cells, stromal cells, cytokines, extracellular matrix, and the oral microbiome, all of which dynamically interact with tumor cells to influence their behavior. Immunosuppression is a key feature of the OSCC TME, with regulatory T cells (Tregs), myeloid-derived suppressor cells (MDSCs), and tumor-associated macrophages (TAMs) contributing to an environment that allows tumor cells to evade immune surveillance and supports angiogenesis. The oral microbiome also plays a pivotal role in OSCC pathogenesis, as dysbiosis, or imbalances in the microbiota, can lead to chronic inflammation, which promotes carcinogenesis through the production of pro-inflammatory cytokines and reactive oxygen species (ROS). Pathogens like  Porphyromonas gingivalis Fusobacterium nucleatum', 'Atherosclerosis (AS) is a chronic inflammatory disease characterized by the gradual accumulation of plaques in arterial walls, with its pathogenesis remaining incompletely understood. Recent studies have highlighted that development of AS is closely associated with the aberrant activation of the NLRP3 inflammasome in the arteries. Inhibition of the NLRP3 inflammasome by natural products and formulae derived from Chinese herbal medicines (CHMs) has been shown to alleviate AS-associated pathologies. However, therapies that effectively and safely target the NLRP3 inflammasome remain limited. This review aims to summarize the key discoveries from recent studies on the effects of these natural products and formulae on the NLRP3 inflammasome in the context of AS treatment. A comprehensive literature search was conducted on databases such as PubMed/MEDLINE up to January 2025, yielding 38 eligible studies. Our analysis indicates that certain therapies can effectively prevent arterial inflammation in animal models by targeting multiple pathways and mechanisms related to the NLRP3 inflammasome. This review summarizes the primary findings of these studies, focusing on the therapeutic effects and underlying mechanisms of action. Based on these insights, we propose future strategies to enhance the efficacy, specificity, and safety of existing natural products and formulae for AS treatment. Additionally, this study offers a perspective for future research that may enhance our understanding of the roles and the mechanisms of CHM-derived phytochemicals and formulae in regulating the NLRP3 inflammasome and treating AS.', 'Cannabinoid administration has demonstrated promising anti-tumor effects for glioblastoma (GBM) by inhibiting glioma cell proliferation and inducing glioma cell death. However, the impact of cannabinoids and endocannabinoid receptors on immune cells within the tumor microenvironment (TME) remains largely unexplored. Tumor-associated macrophages (TAMs), the most abundant immune cells in the TME, and their mediated phagocytosis of tumor cells have shown potential in preclinical xenografts of various human malignancies. This study aimed to investigate the effect and mechanism of endocannabinoid receptor 2 (CB2R) on TAMs-mediated phagocytosis in xenografted mice with GL261-GFP cell lines. We measured the phagocytic activity using immunofluorescence and flow cytometry, and we used the IVIS Spectrum System for bioluminescent imaging to track the growth of the tumor. Our findings demonstrated that administering JWH133, a selective CB2R agonist, significantly boosted TAMs-mediated phagocytosis. However, administering AM630, a selective CB2R antagonist, significantly inhibited TAMs-mediated phagocytosis. Mechanistically, CB2R activation upregulated the expression of CD36 on TAMs, a scavenger receptor known to facilitate phagocytosis. Furthermore, sulfo-N-succinimidyl oleate (SSO), an irreversible CD36 inhibitor, could reverse the CB2R activation-induced enhancement of phagocytosis by TAMs. Additionally. JHW133 also effectively augmented the chemotherapeutic efficacy of temozolomide. Overall, our findings show that CB2R activation promotes TAMs-mediated phagocytosis of tumor cells by enhancing CD36 expression, implying that JWH133 could be a useful therapeutic approach to improving chemotherapeutic efficacy against GBM.', 'Spontaneous preterm labor (SPTL) is a major cause of neonatal mortality and severe complications. T cells play a crucial role in mediating inflammation and immune tolerance at the maternal–fetal interface. T helper 17 cells (Th17, pro-inflammatory) and regulatory T cells (Treg, anti-inflammatory) are two subsets of CD4 β β', 'Adipose tissue inflammation is now considered to be a key process underlying metabolic diseases in obese individuals. However, it remains unclear how adipose inflammation is initiated and maintained or the mechanism by which inflammation develops. We found that  microRNA-802 Mir802 Mir802 Mir802 Mir802 Mir802 Mir802 Mir802']","Glucocorticoids suppress inflammation by binding to cytoplasmic glucocorticoid receptors that translocate to the nucleus, where they suppress pro-inflammatory gene transcription and induce anti-inflammatory protein expression.",6.806222200393677,10,True,,,,,,,,0.3963704824447632,656,0
hyde,What are the mechanisms of antibiotic resistance?,"The mechanisms of antibiotic resistance include up-regulation of efflux mechanisms, down-regulation of specific genes (such as ERG genes), presence of antibiotic resistance genes (ARGs) in indoor dust samples, and the presence of multidrug-resistant bacteria.","['Antimicrobial resistance has recently increased due to emerging carbapenem-resistant  Klebsiella pneumoniae K. pneumoniae K. pneumoniae K. pneumoniae I K. pneumoniae P P K. pneumoniae', 'The increasing prevalence of antimicrobial-resistant (AMR) bacteria in humans, animals, and the environment underscores the necessity for a rapid, sensitive, and specific method to identify resistance genes.  Objectives tet Enterococcus Methodology tet tet Enterococcus Results: tet tet Conclusions tet', 'Antifungal resistance and tolerance are distinct responses exhibited by fungi when exposed to drugs. While considerable research has focused on azole tolerance in the human pathogen  Candida albicans This study aims to conduct a comparative investigation of the adaptation of the model organism  Saccharomyces cerevisiae C. albicans in vitro We performed experiments using laboratory strains of  S. cerevisiae C. albicans Our results revealed that fluconazole tolerance is present in wild-type strains of  S. cerevisiae C. albicans S. cerevisiae Transcriptome analysis indicated that petites up-regulated efflux mechanisms while down-regulating most  ERG C. albicans S. cerevisiae', 'The antibiotic resistance genes (ARGs) limit the susceptibility of bacteria to antimicrobials, representing a problem of high importance. Current research on the presence of ARGs in microorganisms focuses mainly on humans, livestock, hospitals, or wastewater. However, the spectrum of ARGs in the dust resistome in workplaces and households has gone relatively unexplored. This pilot study aimed to analyze resistome in indoor dust samples from participants’ workplaces (a pediatric hospital, a maternity hospital, and a research center) and households and compare two different approaches to the ARGs analysis; high-throughput quantitative PCR (HT-qPCR) and whole metagenome shotgun sequencing (WMGS). In total, 143 ARGs were detected using HT-qPCR, with ARGs associated with the macrolides, lincosamides, and streptogramin B (MLSB) phenotype being the most abundant, followed by MDR (multi-drug resistance) genes, and genes conferring resistance to aminoglycosides. A higher overall relative quantity of ARGs was observed in indoor dust samples from workplaces than from households, with the pediatric hospital being associated with the highest relative quantity of ARGs. WMGS analysis revealed 36 ARGs, of which five were detected by both HT-qPCR and WMGS techniques. Accordingly, the efficacy of the WMGS approach to detect ARGs was lower than that of HT-qPCR. In summary, our pilot data revealed that indoor dust in buildings where people spend most of their time (workplaces, households) can be a significant source of antimicrobial-resistant microorganisms, which may potentially pose a health risk to both humans and animals.', 'Bacterial resistance to antibiotics remains a significant clinical challenge, contributing to persistently high rates of morbidity and mortality. Achieving treatment success is increasingly difficult, necessitating the evaluation of new antibiotics and complementary approaches, including source control and alternative therapies. This study aimed to investigate the antibacterial, antioxidant, cytotoxic, and phytochemical properties of  Moringa oleifera Moringa oleifera', 'In combating the global epidemic of multidrug-resistant  Klebsiella pneumoniae', 'Pseudomonas aeruginosa P. aeruginosa in vivo', 'Pathobionts have evolved many strategies to coexist with the host, but how immune evasion mechanisms contribute to the difficulty of developing vaccines against pathobionts is unclear. Meanwhile,  Staphylococcus aureus', 'Opportunistic pathogen  Pseudomonas aeruginosa N P. aeruginosa', 'Across diverse ecosystems, bacteria and their hosts engage in complex relationships having negative, neutral, or positive interactions. However, the specific effects of leaf-associated bacterial community functions on plant growth are poorly understood. Although microbes can promote plant growth through various biochemical mechanisms, investigating the community’s functional contributions to plant growth remains to be explored. To address this gap, we characterized the relationships between bacterial community function and host plant growth in the purple pitcher plant ( Sarracenia purpurea S. purpurea This study addresses a gap in understanding the relationships between bacterial community function and plant growth. We inoculated sterile, freshly opened pitcher plant leaves with three functionally distinct bacterial communities to uncover potential mechanisms through which bacterial functions support plant health and growth. Our findings demonstrate that distinct community functions significantly influence plant traits, with some bacterial communities supporting more plant growth than in control pitchers. These results highlight the ecological roles of microbial communities in plants and thus ecosystems and suggest that nutrient cycling is an important pathway through which microbes support host plant health. This research provides valuable insights into plant-microbe interactions and the effects of diverse microbial community functions.']","Bacteria develop antibiotic resistance through target gene mutations, horizontal gene transfer of resistance genes via plasmids or transposons, and expression of efflux pumps that remove antibiotics from the cell.",4.040212869644165,10,True,,,,,,,,0.4189251333475113,259,0
hyde,How do biologics treat rheumatoid arthritis?,"Biologics treat rheumatoid arthritis by targeting specific inflammatory pathways and molecules involved in the disease process. These biologic or target synthetic disease-modifying antirheumatic drugs (b/tsDMARDs) can include interleukin 6 (IL-6) inhibitors, Janus kinase (JAK) inhibitors, tumor necrosis factor (TNF) inhibitors, and cytotoxic T lymphocyte-associated antigen-4-Ig (CTLA4-Ig). By inhibiting these inflammatory pathways, biologics help reduce inflammation, alleviate symptoms, and slow down joint destruction in patients with rheumatoid arthritis.","['This study aims to identify factors influencing the alleviation of knee joint symptoms in patients with rheumatoid arthritis treated with biologic or target synthetic disease-modifying antirheumatic drugs (b/tsDMARDs). Among 2321 patients who started b/tsDMARDs between 2010 and 2023, we focused on 295 patients who had knee swelling or tenderness at the initiation of b/tsDMARDs and continued b/tsDMARDs at least 3 months, with recorded knee symptoms 6 months later. Symptom relief after 6 months was 78.2% for interleukin 6 (IL-6) inhibitors, 68.6% for Janus kinase (JAK) inhibitors, 65.8% for tumor necrosis factor (TNF) inhibitors, and 57.6% for cytotoxic T lymphocyte-associated antigen-4-Ig (CTLA4-Ig). The initial use of b/tsDMARDs and the use of IL-6 inhibitors in comparison to CTLA4-Ig emerged as a significant factor associated with the improvement of knee joint symptoms. Among 141 patients who underwent knee radiography at baseline and two years later, the deterioration in knee joint radiographs was 7.7% for IL-6 inhibitors, 6.3% for JAK inhibitors, 21.9% for TNF inhibitors, and 25.9% for CTLA4-Ig. The use of IL-6 inhibitors was a significant factor associated with the improvement of knee joint symptoms and the inhibition of joint destruction compared to CTLA4-Ig.', 'Usenamine A (UA) is a natural compound isolated from the lichen  Usnea diffracta Molecular docking was performed between the 3D structure of UA and the TNF-TNFR2 complex. Peripheral blood mononuclear cells (PBMCs) from RA and AS patients were treated with UA, and cell viability was measured using the MTS assay and flow cytometry. The in vitro effects of co-culture with UA were determined by measuring inflammatory cytokines, including IFN-γ, IL-17A, and GM-CSF, using flow cytometry and enzyme-linked immunosorbent assay (ELISA). The in vivo effects of UA were evaluated using an arthritis mouse model. The docking complex of UA bound to the TNF-TNFR2 complex exhibited docking scores of −5.251 kcal/mol and −6.274 kcal/mol, confirming their active sites. UA did not affect cell viability and suppressed the production of inflammatory cytokines in the PBMCs of RA (IFN-γ, IL-17A, and GM-CSF) and AS (GM-CSF) patients. The ELISA also confirmed reduced cytokine levels in the co-culture of UA and PBMCs from RA or AS patients. In the arthritis mouse model, significantly reduced clinical and histological scores were observed in the UA treatment group. Our findings suggest that UA has potential as a binding target for TNF, suppresses inflammatory cytokines in PBMCs, and exhibits anti-inflammatory effects on arthritis in a mouse model.', 'Preoperative levels of certain inflammatory markers in the blood can predict acute infection after primary total joint arthroplasty in patients without inflammatory disease, but whether they can do so in patients with rheumatoid arthritis is unclear. The objectives of this study were to determine whether, with appropriate cut‐off values, (1) preoperative levels of NLR predicted postoperative acute infection; and (2) preoperative plasma fibrinogen, monocyte‐lymphocyte ratio, C‐reactive protein or erythrocyte sedimentation rate predicted postoperative acute infection. We retrospectively analyzed 964 patients with rheumatoid arthritis who underwent primary total joint arthroplasty at our hospital between January 2010 and November 2020. We compared preoperative levels of inflammatory markers including neutrophil‐lymphocyte ratio (NLR), monocyte‐lymphocyte ratio (MLR), C‐reactive protein (CRP), erythrocyte sedimentation rate (ESR), plasma fibrinogen (FIB) between patients who suffered acute infection or not within 90\u2009days after surgery. The ability of markers to predict infection was assessed in terms of the area under receiver operating characteristic curves (AUC) based on optimal cut‐off values determined from the Youden index. Among the 964 patients, 27 (2.8%) experienced acute infection. Preoperative levels of individual inflammatory markers predicted infection with the following AUCs and cut‐off values: NLR, 0.704 (cut‐off: 2.528); MLR, 0.608 (0.2317); CRP, 0.516 (4.125\u2009mg/L); ESR, 0.533 (66.5\u2009mm/h); and FIB, 0.552 (3.415\u2009g/L). The neutrophil‐lymphocyte ratio showed diagnostic sensitivity of 92.6% and specificity of 43.3%, while the monocyte‐lymphocyte ratio showed sensitivity of 77.8% and specificity of 46.3%. The preoperative NLR shows some ability to predict acute infection after total joint arthroplasty in patients with rheumatoid arthritis. Monitoring this ratio, perhaps in conjunction with other markers not analyzed here, may be useful for optimizing the timing of surgery in order to minimize risk of postoperative infection.', 'The heterogeneity and suboptimal efficacy of biological treatments and small molecule drugs necessitate their precise selection based on biomarkers that predict therapeutic responses in inflammatory bowel disease. Recent studies have identified numerous novel biomarkers predictive of responses to biologics and small molecule modulators, utilizing a variety of omics approaches in inflammatory bowel disease. In this review, we systematically examine baseline omics biomarkers that predict responses to biological therapies and small molecule drugs, drawing on literature from PubMed. Our analysis spans multiple omics disciplines, including genomics, transcriptomics (both bulk RNA and single‐cell RNA sequencing), proteomics, microbiomics, and metabolomics, with particular emphasis on the impact of models integrating multiple omics datasets. Additionally, to further the field of precision medicine, we evaluated specific biomarkers that may exhibit distinct effects on responses to multiple therapeutic interventions.', 'Patellar tendinopathy, also known as jumper’s knee, can significantly impact the quality of daily life for patients due to the associated pain. A randomized controlled trial was investigated the clinical, sonographic, and serum cytokine markers in patellar tendinopathy of athletes following platelet-rich plasma (PRP) or PRP with extracorporeal shockwave therapy (ESWT) treatments. Our aims to investigate and compare therapeutic effects of PRP versus a combination of PRP with ESWT for treating patellar tendinopathy. A total of 33 athletes with patellar tendinopathy were randomized into two groups. PRP\u2009+\u2009Sham (PS) group received intraarticular injection of autologous PRP (5\xa0mL) once and sham ESWT. PRP\u2009+\u2009ESWT (PE) group received intraarticular injection of autologous PRP once and after 1\xa0week ESWT (0.2\xa0mJ/mm Autologous PRP injection and its combination with ESWT are both effective treatments for chronic patellar tendinopathy in athletes. PRP combined with ESWT resulted in faster reduction of knee pain than PRP alone at the 1-month follow-up. Serum IL-33 showed no significant difference at the 12-month follow-up. Levels of interleukin (IL)-6, IL-15, and IL-17 increased at the 12-month follow-up, potentially due to the additional training. However, the athletes did not report any discomfort or injuries, and no abnormalities were detected by ultrasonography after study. We demonstrated improvements in pain and functional scores, as well as knee injury protection in athletes, following 12\xa0months of PRP and PRP with ESWT treatments. The study analyzed the therapeutic effect of PRP injection alone and combining PRP injection with ESWT for chronic patellar tendinopathy. Our results showed that combined treatment can facilitate the pain relief early than PRP alone and is a safety treatment modality. No adverse effect was noted in our study. Trial registration https://www.researchregistry.com/browse-the-registry#home/registrationdetails/650263e4f549fd00282a338c/', 'The tumor microenvironment (TME) plays a crucial role in the development, progression, and metastasis of oral squamous cell carcinoma (OSCC). The TME comprises various cellular and acellular components, including immune cells, stromal cells, cytokines, extracellular matrix, and the oral microbiome, all of which dynamically interact with tumor cells to influence their behavior. Immunosuppression is a key feature of the OSCC TME, with regulatory T cells (Tregs), myeloid-derived suppressor cells (MDSCs), and tumor-associated macrophages (TAMs) contributing to an environment that allows tumor cells to evade immune surveillance and supports angiogenesis. The oral microbiome also plays a pivotal role in OSCC pathogenesis, as dysbiosis, or imbalances in the microbiota, can lead to chronic inflammation, which promotes carcinogenesis through the production of pro-inflammatory cytokines and reactive oxygen species (ROS). Pathogens like  Porphyromonas gingivalis Fusobacterium nucleatum', 'Dysregulated and excessive inflammatory reactions can lead to tissue damage, which is the underlying cause of most human diseases. Menisoxoisoaporphine A (MA), a novel oxoisoaporphine alkaloid, was obtained from Menispermi Rhizoma, a traditional Chinese medicinal herb used in the treatment of inflammatory conditions in clinical practice. This suggests that MA has very promising potential for the development of anti-inflammatory therapeutics. Hence, this study aims to investigate the anti-inflammatory effects and underlying mechanisms of MA. The anti-inflammatory effects of MA were evaluated in lipopolysaccharide (LPS)-induced mouse macrophage RAW264.7 cells. Its underlying mechanisms were explored through RNA sequencing and Western blotting. The binding modes and interactions sites between MA and phosphodiesterase 4B (PDE4B) were predicted using molecular docking and validated by molecular dynamics simulation. MA treatment significantly reduced LPS-induced morphological changes, inflammatory cytokine relesae, and proinflammatory genes expression in RAW264.7 cells compared to the LPS-induced controls. Transcriptome sequencing analysis suggested that PDE4B might be a key target for MA to exert its therapeutic effect. Mechanismly, MA directly acted on Tyr405 site of PDE4B, thus leading to a sustained elevation of the cyclic adenosine monophosphate (cAMP) levels, which subsequently inactivated NF-κB signaling pathway by phosphorylating protein kinase A (PKA). MA inhibited the NF-κB-mediated inflammatory response depending on PDE4B. MA, a natural and novel compound, exerted anti-inflammatory effects in LPS-induced RAW264.7 macrophage cells. It demonstrated a strong binding ability to the Tyr405 sites of PDE4B, thereby inhibiting NF-κB signaling pathway by regulating the cAMP-PKA axis. Elucidating the interaction between MA and PDE4B holds significant potential for the advancement of innovative therapeutic strategies aimed at inflammatory diseases. By strategically modulating this interaction, it may be feasible to achieve more precise regulation of inflammatory responses, thereby offering promising therapeutic benefits for conditions such as rheumatoid arthritis, asthma, and inflammatory bowel disease.', 'Diet is a key modifiable risk factor in many chronic diseases, including age-related diseases. The Mediterranean diet (MedDiet) is an extensively studied dietary pattern which has been proposed as a lifestyle intervention to promote healthy aging in the general population, due to its numerous health benefits. Randomized controlled trials (RCTs) have attempted to explore the mechanism(s) by which the MedDiet exerts its beneficial effects on aging. One proposed mechanism is that the MedDiet helps to slow down a process called ‘inflamm-aging’, a type of chronic, low-grade inflammation which contributes to aging. To explore the evidence supporting this hypothesized mechanism, we conducted a scoping review of existing RCTs which used a MedDiet intervention and assessed at least one molecular outcome of potential relevance to inflamm-aging. We identified 14 papers representing 12 unique RCTs. Based on our findings, we present 10 recommendations for the next clinical trial of the MedDiet in inflamm-aging.', 'Promoting neovascularization is a prerequisite for many tissue engineering applications and the treatment of cardiovascular disease. Delivery of a pro‐angiogenic stimulus via acellular materials offers several benefits over biological therapies but has been hampered by interaction of the implanted material with the innate immune response. However, macrophages, a key component of the innate immune response, release a plurality of soluble factors that can be harnessed to stimulate neovascularization and restore blood flow to damaged tissue. This study investigates the ability of biodegradable poly(D,L‐lactic‐co‐glycolic acid) (PLGA) microspheres to restore tissue perfusion in a hind limb model of ischaemia. Microspheres exhibiting a hierarchical porous structure are associated with an increase in blood flow at day 21 post‐implantation compared with solid microspheres composed of the same polymer. This corresponds with an increase in blood vessel density in the surrounding tissue. In vitro simulation of the foreign body response observed demonstrates M2‐like macrophages incubated with the porous microspheres secreted increased amounts of vascular endothelial growth factor (VEGF) compared with M1‐like macrophages providing a potential mechanism for the increased neovascularization. The results from this study demonstrate implantable biodegradable porous microspheres provide a novel approach for increasing neovascularization that could be exploited for therapeutic applications.', ""Bone is a dynamic organ which continuously undergoes remodeling throughout one's lifetime. Cellular production of reactive oxygen species (ROS) is essential for regulating bone homeostasis. Osteoclasts, multinucleated giant cells differentiated from macrophage lineage, are responsible for osteolytic bone conditions which are closely linked to ROS signaling pathways. In this study, an anti‐ROS enzyme, peroxiredoxin 1 (Prdx1) was found to be expressed both in bone marrow macrophages and osteoclasts. Recombinant Prdx1 protein was found to dose‐dependently inhibit ROS production and osteoclast differentiation. Mechanistically, Prdx1 protein also attenuated NFATc1 activation as well as the expression of C‐Fos, V‐ATPase‐d2, Cathepsin K, and Integrin αV. Collectively, Prdx1 is a negative regulator on osteoclast formation via inhibiting RANKL‐mediated ROS activity, thus suggesting its potential application for treating osteoclast related disorders.""]","Biologics treat rheumatoid arthritis by targeting specific components of the immune system, such as blocking TNF or IL-6 signaling, or depleting B cells to reduce autoantibody production, thereby interrupting the inflammatory cascade that causes joint damage.",4.0327370166778564,10,True,,,,,,,,0.4223271131515503,562,0
hyde,What is the mechanism of action of levodopa in Parkinson's disease?,"Levodopa is a precursor of dopamine that is able to cross the blood-brain barrier and be converted into dopamine in the brain. In Parkinson's disease, there is a progressive loss of dopaminergic neurons in the substantia nigra, leading to a decrease in dopamine levels. Levodopa helps to replenish dopamine levels in the brain, which helps to alleviate the motor symptoms of Parkinson's disease.","['Parkinson’s disease (PD) is caused by the progressive loss of dopaminergic neurons in the substantia nigra. Neuroinflammation is considered a key factor contributing to the pathophysiology of PD. Current gold-standard therapies for PD provide only symptomatic relief without slowing disease progression, highlighting the need to develop new disease-modifying treatments. Metformin has been demonstrated to exert a neuroprotective role in several neurodegenerative disorders including PD. This study aimed to clarify the role of metformin as adjuvant therapy in patients with PD. Sixty patients with PD were divided into 2 groups (n = 30). Patients in group 1 received levodopa/carbidopa (250/25\xa0mg) three times daily for 3\xa0months plus placebo (Control group), while those in group 2 received levodopa/carbidopa (250/25\xa0mg) three times daily and 500\xa0mg metformin two times daily (Metformin group). Patients were assessed via Unified Parkinson’s Disease Rating Scale (UPDRS). The serum concentrations of toll like receptor 4 (TLR-4), α-synuclein, brain derived neurotropic factor (BDNF), and high mobility group box 1 (HMGB-1) were measured before and after treatment. The improvement in UPDRS from baseline to 3\xa0months. Change in the level of biological markers. The control group did not show significant difference in UPDRS when compared to their baseline value by Wilcoxon test ( P P P P While no significant differences in UPDRS scores were observed between the metformin and control groups, trends in biomarker changes suggest a potential impact of adjunctive metformin use on the underlying pathophysiology of PD. Further studies are needed to assess its effects on motor symptoms over a longer duration. identifier  NCT05781711', 'Deep brain stimulation (DBS) is an efficient treatment for movement disorders, most commonly Parkinson’s Disease (PD), dystonia and essential tremor. DBS surgery carries risks, e.g. the risk of delayed peri-lead edema (PLE) and the risk of postoperative cognitive decline. The mechanisms of these complications are not fully understood and there is no established biomarker to screen for these complications after DBS surgery. To explore the diagnostic value of two blood-based markers representative for distinct types of brain injury, we characterized the dynamics of serum glial fibrillary acidic protein (sGFAP, for glial injury) and serum neurofilament light chain (sNfL, for neuronal-axonal injury) following DBS surgery. We analyzed longitudinal dynamics of serum protein levels in 58 patients undergoing deep brain stimulation (DBS) at our center for half a year post-surgery. Serum GFAP responded much more rapidly after brain surgery, returning to baseline after weeks, whereas sNfL only returned to baseline after months. Patients with lower preoperative cognitive performance exhibited higher postoperative sGFAP levels, with sGFAP showing a stronger association with preoperative patient characteristics compared to sNfL. Further studies with long-term clinical follow-up are needed to fully evaluate the utility of sGFAP as a biomarker for both early and delayed complications after DBS surgery, including cognitive decline and potential foreign body reactions to the implanted lead.', 'Parkinson’s disease (PD), the second most common neurodegenerative condition, is primarily characterized by motor dysfunctions due to dopaminergic neuronal loss in the Substantia Nigra (SN), with oxidative stress playing a significant role in its progression. This study investigates the neuroprotective potential of  Pelargonium graveolens in vitro 50 50 p.o l P. graveolens', 'Cognitive impairment, a major determinant of poor functioning in schizophrenia, had limited responses to existing antipsychotic drugs. The limited efficacy could be due to regional differences in the dysregulation of the dopamine system. This study investigated striatal and peripheral dopaminergic makers in schizophrenia and their relationship with cognitive impairment. Thirty-three patients with schizophrenia and 36 age- and sex-matched healthy controls (HC) participated. We evaluated their cognitive performance, examined the availability of striatal dopamine transporter (DAT) using single-photon emission computed tomography with 99mTc-TRODAT, and measured plasma levels of dopaminergic precursors (phenylalanine and tyrosine) and three branched-chain amino acids (BCAA) that compete with precursors for brain uptake via ultra-performance liquid chromatography. Schizophrenia patients exhibited lower cognitive performance, decreased striatal DAT availability, and reduced levels of phenylalanine, tyrosine, leucine, and isoleucine, and the ratio of phenylalanine plus tyrosine to BCAA. Within the patient group, lower DAT availability in the left caudate nucleus (CN) or putamen was positively associated with attention deficits. Meanwhile, lower tyrosine levels and the ratio of phenylalanine plus tyrosine to BCAA were positively related to executive dysfunction. Among all participants, DAT availability in the right CN or putamen was positively related to memory function, and plasma phenylalanine level was positively associated with executive function. This study supports the role of dopamine system abnormalities in cognitive impairment in schizophrenia. The distinct associations between different dopaminergic alterations and specific cognitive domain impairments suggest the potential need for multifaceted treatment approaches to target these impairments.', 'Tic disorders represent a developmental neuropsychiatric condition whose causes can be attributed to a variety of environmental, neurobiological, and genetic factors. From a neurophysiological perspective, the disorder has classically been associated with neurochemical imbalances (particularly dopamine and serotonin) and structural and functional alterations affecting, in particular, brain areas and circuits involved in the processing and coordination of movements: the basal ganglia, thalamus, motor cortical area, and cingulate cortex; however, more recent research is demonstrating the involvement of many more brain regions and neurotransmission systems than previously observed, such as the prefrontal cortex and cerebellum. In this paper, therefore, we summarize the evidence to date on these abnormalities with the intent to illustrate and clarify the main neuroanatomical differences between patients with tic disorders and healthy individuals.', 'Bright light therapy (BLT) has been proved to have beneficial effects on Parkinson’s disease (PD), the mechanisms remained unclear. Improvements of visual pathways might be key to BLT. The aim of this study is to validate whether BLT improves clinical symptoms in PD and explore the possible mechanisms of visual pathways evaluated by optical coherence tomography (OCT), pattern electroretinogram (PERG) and visual evoked potentials (VEP). Twenty-three PD patients were enrolled in this crossover randomized placebo-controlled study. Participants received either one month of BLT or dim light therapy (DLT), separated by one-month wash-out period, followed by another intervention. Participants underwent clinical scales, and visual-related evaluations including OCT, PERG and VEP before and after each intervention. Mixed-effects regression models were used to determine the effect between BLT and DLT on improving the differentials of clinical scales (Δscales), OCT (Δretinal thickness), PERG (ΔPERG values) and VEP (ΔP100 latencies). Correlations between clinical symptoms and visual evaluations improvements were analyzed in PD patients receiving BLT. Excessive daytime sleepiness, anxiety, life quality and autonomic function were improved after BLT. Compared with DLT, bilateral ΔN95 latencies for PERG and ΔP100 latencies for VEP were improved after BLT. We did not observe the changes of four quadrants retinal nerve fiber layer (RNFL) thickness after BLT or DLT. BLT is a valuable and safe non-pharmacological intervention for improving visual function in PD patients. These findings extend neural mechanisms of BLT to visual pathways improvements. The online version contains supplementary material available at 10.1186/s12888-025-06915-z.', 'In severe traumatic brain injury (TBI), sedatives are often used to control intracranial pressure (ICP), to reduce brain metabolism, to allow for other treatments such as mechanical ventilation or targeted temperature management, or to control paroxysmal sympathetic hyperactivity. Prolonged sedation is often necessary. The most commonly used sedatives in TBI are propofol and midazolam, often in combination, but both have significant side effects when used at high doses for several days. Ketamine, an N-methyl-D-aspartate (NMDA) receptor antagonist, provides sedation and analgesia with minimal respiratory depression or haemodynamic instability. However, ketamine carries a US Food and Drug Administration (FDA) precaution regarding its use in patients with pre-anaesthetic elevated cerebrospinal fluid pressure, which discourages its use in TBI patients. Several observational studies and two large meta-analyses do not suggest that the use of ketamine as an induction agent or sedative in sedated and mechanically ventilated TBI patients would increase the ICP. Off-label use of ketamine for this indication is increasing worldwide. To date, no prospective randomized clinical trial (RCT) has demonstrated the safety of ketamine in TBI patients. The Brain Injury and Ketamine (BIKe) study is a prospective multicentre double-blind placebo-controlled RCT, to evaluate the safety, and effect on therapeutic intensity to reduce ICP, of ketamine as an adjunct to a standard sedation regimen in patients with severe TBI. Adult TBI patients, admitted to the intensive care unit (ICU), requiring sedation and ICP monitoring within 72\xa0h of admission, will be randomized to ketamine or placebo. The study drug will be started within 6\xa0h of randomization. The dose of the investigational medicinal product (IMP) is 1\xa0mg/kg/h, by continuous infusion. The IMP will be stopped when the last ICP control sedative is discontinued. Data collection will stop when the patient is discharged from the ICU. All patients will be followed for 6\xa0months post-trauma. The study is powered for the safety endpoint of detecting a clinically relevant increase of two episodes in the median number of episodes of high intracranial pressure episodes per ICU stay. A total of 100 patients are required to meet these objectives. We hypothesize a clinically relevant reduction in the therapeutic intensity level (TIL) score of at least 3 points. This study is the first prospective RCT to investigate the safety of ketamine as an adjunct to a standard sedation regimen in TBI patients. ClinicalTrials.gov  NCT05097261 The online version contains supplementary material available at 10.1186/s13063-025-08835-5.', ""The immune response in the central nervous system (CNS) is a highly specialized and tightly regulated process essential for maintaining neural health and protecting against pathogens and injuries. The primary immune cells within the CNS include microglia, astrocytes, T cells, and B cells. They work together, continuously monitor the CNS environment for signs of infection, injury, or disease, and respond by phagocytosing debris, releasing cytokines, and recruiting other immune cells. In addition to providing neuroprotection, these immune responses must be carefully balanced to prevent excessive inflammation that can lead to neuronal damage and contribute to neurodegenerative diseases. Dysregulated immune responses in the CNS are implicated in various neurodegenerative diseases such as Alzheimer's disease, Parkinson's disease, and amyotrophic lateral sclerosis. Wnt signaling is a crucial pathway in the CNS that regulates various cellular processes critical for brain development, function, and maintenance. Despite enhancing immune responses in the health CNS, dysregulated Wnt signaling exacerbates neuroinflammation in the neurodegenerative brains. This review summarized the role of Wnt signaling in regulating immune response under different conditions. We then examined the role of immune response in healthy brains and during the development of neurodegenerative diseases. We also discussed therapeutic intervention in various neurodegenerative diseases through the modulation of the Wnt signaling pathway and neuroinflammation and highlighted challenges and limitations in current clinical trials."", 'Previous studies have shown an association between the thalamocortical dysconnectivity and treatment-resistant depression (TRD). Whether a single subanesthetic dose of ketamine may change thalamocortical connectivity among patients with TRD is unclear. Whether these changes in thalamocortical connectivity is associated with the antidepressant and antisuicidal effects of ketamine treatment is also unclear. Two resting-state functional MRIs were collected in two clinical trials of 48 patients with TRD (clinical trial 1; 32 receiving ketamine, 16 receiving a normal saline placebo) and 48 patients with TRD and strong suicidal ideation (clinical trial 2; 24 receiving ketamine, 24 receiving midazolam), respectively. All participants underwent rs-fMRI before and 3 days after infusion. Seed-based functional connectivity (FC) was analyzed in the left/right thalamus. FCs between the bilateral thalamus and right middle frontal cortex (BA46) and between the left thalamus and left anterior paracingulate gyrus (BA8) increased among patients in the ketamine group in clinical trials 1 and 2, respectively. FCs between the right thalamus and bilateral frontal pole (BA9) and between the right thalamus and left rostral paracingulate gyrus (BA10) decreased among patients in the ketamine group in clinical trials 1 and 2, respectively. However, the associations between those FC changes and clinical symptom changes did not survive statistical significance after multiple comparison corrections. Whether ketamine-related changes in thalamocortical connectivity may be associated with ketamine’s antidepressant and antisuicidal effects would need further investigation. Clinical trials registration: UMIN Clinical Trials Registry (UMIN-CTR): Registration number: UMIN000016985 and UMIN000033916.', ""An increasing body of evidence indicates altered DNA methylation in Parkinson's disease, yet the reproducibility and utility of such methylation changes are largely unexplored. We aimed to further elucidate the role of dysregulated DNA methylation in Parkinson's disease and to evaluate the biomarker potential of methylation‐based profiling. We conducted an epigenome‐wide association study (EWAS) in whole blood, including 280 Parkinson's disease and 279 control participants from Oslo, Norway. Next, we took advantage of data from the Parkinson's Progression Markers Initiative (PPMI) and a previously published EWAS to conduct a whole blood EWAS meta‐analysis in Parkinson's disease, incorporating results from a total of 3068 participants. Finally, we generated multiple methylation‐based scores for each Oslo and PPMI participant and tested their association with disease status, individually and in a joint multiscore model. In EWAS meta‐analysis, we confirm  SLC7A11 LPIN1 Our results highlight the power of DNA methylation profiling to capture multiple aspects of disease risk, indicating a biomarker potential for precision medicine in neurodegenerative disorders. The reproducibility of specific differentially methylated CpGs across data sets was limited but may improve if future studies are designed to account for disease stage and incorporate environmental exposure data.""]","Levodopa treats Parkinson's disease by crossing the blood-brain barrier and being converted to dopamine in the brain, helping to replenish depleted dopamine levels in the striatum and compensate for the loss of dopaminergic neurons in the substantia nigra.",4.831547975540161,10,True,,,,,,,,0.43451645970344543,395,0
crag,What are the effects of metformin on type 2 diabetes?,"Metformin is a common medication used in the treatment of type 2 diabetes. It is often prescribed as a first-line treatment due to its ability to lower glucose production in the liver and improve insulin sensitivity. This can help control blood sugar levels in individuals with type 2 diabetes. Additionally, lifestyle changes such as diet and exercise are also important in managing type 2 diabetes.

Document 2 discusses the complex management of diabetes mellitus in the perioperative setting, highlighting the need to balance glucose control with minimizing hypoglycemic or hyperglycemic events during surgery. Various diabetic medications, including insulin, are mentioned in this document as part of the management strategy.

Document 3 presents a case study of a patient with type 2 diabetes on insulin therapy who experienced severe and recurrent hypoglycemia related to lipodystrophy. Lipodystrophy is a rare condition that affects fat distribution in the body and can impact insulin absorption, leading to hypoglycemic events in individuals with diabetes.

Document 4 discusses the use of glucagon-like peptide-1 (GLP-1) receptor agonists and other incretin-based therapies in the management of type 2 diabetes and obesity. These medications have been shown to have beneficial effects beyond improving glycemic control, suggesting their potential role in the treatment of these conditions.

Document 5 explores the effects of lifestyle intervention on preventing or delaying type 2 diabetes in individuals at high risk of developing the condition. The study investigates whether genetic variants can modify the impact of lifestyle intervention on incident type 2 diabetes. This highlights the importance of personalized approaches to managing type 2 diabetes based on individual genetic factors.

In conclusion, metformin is an important medication in the treatment of type 2 diabetes, but management strategies may vary based on individual patient characteristics, genetic factors, and the use of other medications such as insulin and incretin-based therapies. It is important to consider a holistic approach to managing type 2 diabetes that includes medication, lifestyle changes, and personalized interventions to optimize patient outcomes.","[""Document(page_content='Common treatments for type 2 diabetes include lifestyle changes such as diet and exercise, oral medications like metformin, and in some cases, insulin therapy. Metformin is often the first-line medication prescribed for type 2 diabetes. It helps lower glucose production in the liver and improves insulin sensitivity.', metadata={'similarity_score': 0.6785211563110352, 'retrieval_method': 'initial_vector_similarity'}, id='sample')"", ""Document(page_content='Diabetes mellitus (DM) is a prevalent condition that requires careful management in the perioperative setting to reduce surgical risks and optimize patient outcomes. The preoperative care of diabetic patients is complex because glucose control must be balanced with minimizing hypoglycemic or hyperglycemic events during surgery. A variety of diabetic medications such as insulin, dipeptidyl-peptidase-4 inhibitors, glucagon-like peptide-1 receptor agonists, sodium–glucose cotransporter-2 inhibitors, and biguanides such as metformin present unique challenges and considerations due to their different mechanisms, benefits, and potential adverse effects. In recent years, professional organizations have developed recommendations on the perioperative management of these therapies, although there remain some variations in guidelines related to medication cessation and dosage adjustments. Standardized protocols in preoperative DM care remain a topic of interest to ensure consistent and safe practices across healthcare settings, and further collaborative research efforts could provide clarity and consensus in managing this diverse patient population. The objective of this study was to provide an overview of guidelines and practices to support healthcare professionals in delivering improved preoperative care for diabetic patients. This initiative aims to enhance surgical outcomes and minimize the occurrence of complications. This is a comparative review that provides a systematic comparison of the similarities and differences in the guidelines and recommendations of three professional organizations along with Hamad Medical Corporation. All guidelines were from official websites including Hamad Medical Corporation. Although the reviewed guidelines for the preoperative care of diabetes patients share some similarities, there are also a number of differences due to outdated data and expert opinions, and therefore differ in practices around the world. While the key elements are agreed upon, more research and global collaboration are needed to create consistent guidelines and improve patient outcomes.', metadata={'similarity_score': 0.5278230309486389, 'retrieval_method': 'initial_vector_similarity'}, id='PMC1748704577')"", 'Document(page_content=""We report the case of a patient with type 2 diabetes mellitus (T2DM) on insulin therapy with a history of recurrent and severe hypoglycemia related to lipodystrophy with an uncommon clinical presentation. This was the case of a 67-year-old female with type 2 diabetes hospitalized for the exploration and management of severe and recurrent hypoglycemia. Her diabetes has been evolving since the age of 40 years and was complicated by minimal retinopathy. She was on premixed human insulin, administered through an insulin syringe for the last 17 years. She presented a history of well-controlled diabetes until five months back when she started to show a fluctuating blood glucose concentration, with episodes of unpredictable hypoglycemia occurring at variable times, with values inferior to 0.3 g/l associated with neurological features. Clinical examination revealed a swelling localized in the hypogastric region of the abdomen. It was painless, firm, not fixed to the underlying plans, without local inflammatory signs, and had appeared in the patient\'s preferred insulin injection site. Thus, we retained the diagnosis of insulin-induced lipohypertrophy. The patient has reported reusing needles for up to one week for economic reasons, and not frequently rotating insulin injection sites. The patient found a less painful injection in the lipohypertrophic area, and she continued to inject insulin into that zone, leading to its progressive enlargement. Therapeutic management consisted of switching the patient to insulin analogs and resuming education concerning the correct injection techniques. The insulin injection technique continues to be suboptimal in many insulin-treated patients, and our case emphasizes the need for improved awareness and education."", metadata={\'similarity_score\': 0.4415596127510071, \'retrieval_method\': \'initial_vector_similarity\'}, id=\'PMC11650328\')', ""Document(page_content='Glucagon-like peptide-1 (GLP-1) receptor agonists and the dual GLP-1- and glucose-dependent insulinotropic polypeptide receptor co-agonist tirzepatide (referred to here collectively as “GLP-1-based therapy”) are incretin-based therapies being used increasingly in the management of both type 2 diabetes and obesity. They are now recognized to have beneficial effects beyond improved glycemic control and weight loss, including cardiovascular and renal protection. GLP-1-based therapy also slows gastric emptying, which has benefits (lowering postprandial glucose), but also potential risks (eg, hypoglycemia in individuals on insulin or sulphonylurea therapy). Their effects on the gallbladder may also be beneficial, contributing to reducing postprandial triglycerides, but they also potentially increase the risk of biliary disease. In this review, we summarize the effects of GLP-1 and incretin-based therapeutics on gastric, biliary and small intestinal function. An improved understanding of these effects will optimize the use of these drugs.', metadata={'similarity_score': 0.43702104687690735, 'retrieval_method': 'initial_vector_similarity'}, id='PMC11630531')"", ""Document(page_content='Lifestyle intervention prevents or delays type 2 diabetes (T2D) in subjects at a high risk of T2D. However, it is not known whether genetic variants modify the effect on incident T2D during lifestyle intervention. To investigate whether a low or high genetic risk has effects on incident T2D in a group-based lifestyle intervention study. The T2D-GENE trial involved 973 men from the Metabolic Syndrome in Men (METSIM) cohort, aged 50-75 years, body mass index ≥25 kg/m The intervention significantly lowered the risk of T2D among the participants with a high genetic risk for T2D [hazards ratio (HR) 0.30, 95% confidence interval (CI) 0.16-0.56,  P P P Our results showed that individuals with a high genetic risk for T2D benefitted from a low-cost group-based intervention focusing on healthy diet and physical activity. Therefore, all individuals at risk of T2D should be encouraged to make lifestyle changes regardless of genetic risk.', metadata={'similarity_score': 0.43200013041496277, 'retrieval_method': 'initial_vector_similarity'}, id='PMC11651687')"", ""Document(page_content='This study measured serum hypoxia--inducible factor-1 (HIF-1α) and\\nsurvivin levels in patients with diabetes and investigated their association\\nwith the severity of retinopathy. This study included 88 patients with type 2 diabetes mellitus who underwent\\nroutine eye examinations. Three groups were created. Group 1 consisted of\\npatients without diabetic retinopathy. Group 2 included patients with\\nnon-proliferative diabetic retinopathy. Group 3 included patients with\\nproliferative diabetic retinopathy. To measure serum HIF-1α and\\nsurvivin levels, venous blood samples were collected from patients. The mean HIF-1α levels in groups 1, 2, and 3 were 17.30 ± 2.19,\\n17.79 ± 2.34, and 14.19 ± 2.94 pg/ml, respectively.\\nSignificant differences were detected between groups 1 and 3 (p=0.01) and\\nbetween groups 2 and 3 (p=0.01). The mean survivin levels in groups 1, 2,\\nand 3 were 42.65 ± 5.37, 54.92 ± 5.55, and 37.46 ± 8.09\\npg/ml, respectively. A significant difference was only detected between\\ngroups 2 and 3 (p=0.002). The present study revealed that serum HIF-1α and survivin levels are\\nincreased in patients with non-proliferative diabetic retinopathy compared\\nto those in patients without diabetic retinopathy.', metadata={'similarity_score': 0.4035956561565399, 'retrieval_method': 'initial_vector_similarity'}, id='PMC11622444')"", ""Document(page_content='Indications for sodium-glucose cotransporter-2 (SGLT2) inhibitors have expanded to include heart failure and chronic kidney disease after the year 2020. Whether and how the demographic trends in the prescription of SGLT2 inhibitors have changed after the expansion of indications have not been studied extensively. This study is a descriptive analysis of serial, cross-sectional data on nationwide prescription of SGLT2 inhibitors between April 2016 and March 2023 obtained from NDB Open Data Japan, which contains more than 95% of total health insurance reimbursement claims in the nation. The total number of SGLT2 inhibitor tablets prescribed in outpatient settings with prescriptions papers increased from 577,996,158 tablets in fiscal year (FY) 2020 to 904,598,175 tablets in FY 2022. Patients aged 75 years and older accounted for 20.3% of the total prescriptions in FY 2020, and this proportion increased to 27.8% in FY 2022. Among all SGLT2 inhibitors, the tablet that expanded its indications for patients with heart failure and chronic kidney disease the earliest showed the largest percentage increase in the number of prescribed tablets during this period and the highest share of the elderly population in its recipients in both sexes (men, 35.9%; women, 49.4%) in FY 2022. The number of prescribed SGLT2 inhibitor tablets per population was constantly higher in men than in women between FY 2020 and 2022, which is consistent with the sex difference in the prevalence of these diseases. Prescription of SGLT2 inhibitors to the elderly population is no longer infrequent and accounts for a large portion of the entire prescription of SGLT2 inhibitors in Japan. These findings contribute to updating our perception on the demographics of SGLT2 inhibitor recipients.', metadata={'similarity_score': 0.40297672152519226, 'retrieval_method': 'initial_vector_similarity'}, id='PMC1748704682')"", ""Document(page_content='This study analyzes data from the 2009–2018 National Health and Nutrition Examination Survey (NHANES) to explore the relationship between the Aggregate Index of Systemic Inflammation (AISI), also referred to as the pan-immune-inflammation value (PIV), and Type 2 Diabetes Mellitus (T2DM) among adults in the United States. Furthermore, it evaluates the mediating effect of obesity indicators on this association. This study included 9,947 individuals from NHANES and applied appropriate weighting techniques. To examine the relationship between AISI and T2DM, we used various statistical models, including weighted multivariable logistic regression, smooth curve fitting, threshold effect analysis, subgroup analysis, trend tests, mediation analysis, and Shapley additive explanations (SHAP) models. This research included a total of 9,947 participants, with 3,220 diagnosed with T2DM, while 6,727 remained undiagnosed. Weighted multiple logistic regression with all covariates adjusted indicated that with every one-unit increment in AISI/1000, there was an 88.3% likelihood of T2DM occurrence (OR: 1.883, 95% CI: 1.378–2.571). The stratified analysis identified significant differences in this association based on age, biological sex, level of education, poverty-income ratio (PIR), tobacco consumption status, and body mass index (BMI). Interaction tests revealed a positive association between AISI and T2DM, apart from PIR, BMI, age, education attainment, race, gender, tobacco use status, Estimated Glomerular Filtration Rate(eGFR), platelet count, and high blood pressure, with none of the interaction p-values falling below 0.05. Nevertheless, the occurrence of cardiovascular disease (CVD) among participants may affect the strength of this relationship, where an interaction p-value was less than 0.05. Additionally, smoothing curve fitting revealed a nonlinear relationship between AISI and T2DM, marking a significant change at AISI/1000 of 0.21. Mediation analysis indicated that five obesity-related indicators—LAP, VAI, WHtR, WWI and ABSI — partly mediated the association between AISI/1000 and T2DM. An increase in AISI is associated with an elevated probability of T2DM, with obesity indicators potentially mediating this relationship. Reducing AISI and managing obesity may help prevent T2DM. However, with the cross-sectional design of this study, causal relationships cannot be established. Future research should utilize longitudinal studies to confirm these findings. \\n The online version contains supplementary material available at 10.1186/s12944-025-02589-4.', metadata={'similarity_score': 0.3747374415397644, 'retrieval_method': 'initial_vector_similarity'}, id='PMC1748704811')"", ""Document(page_content='Parkinson’s disease (PD) is caused by the progressive loss of dopaminergic neurons in the substantia nigra. Neuroinflammation is considered a key factor contributing to the pathophysiology of PD. Current gold-standard therapies for PD provide only symptomatic relief without slowing disease progression, highlighting the need to develop new disease-modifying treatments. Metformin has been demonstrated to exert a neuroprotective role in several neurodegenerative disorders including PD. This study aimed to clarify the role of metformin as adjuvant therapy in patients with PD. Sixty patients with PD were divided into 2 groups (n = 30). Patients in group 1 received levodopa/carbidopa (250/25\\xa0mg) three times daily for 3\\xa0months plus placebo (Control group), while those in group 2 received levodopa/carbidopa (250/25\\xa0mg) three times daily and 500\\xa0mg metformin two times daily (Metformin group). Patients were assessed via Unified Parkinson’s Disease Rating Scale (UPDRS). The serum concentrations of toll like receptor 4 (TLR-4), α-synuclein, brain derived neurotropic factor (BDNF), and high mobility group box 1 (HMGB-1) were measured before and after treatment. The improvement in UPDRS from baseline to 3\\xa0months. Change in the level of biological markers. The control group did not show significant difference in UPDRS when compared to their baseline value by Wilcoxon test ( P P P P While no significant differences in UPDRS scores were observed between the metformin and control groups, trends in biomarker changes suggest a potential impact of adjunctive metformin use on the underlying pathophysiology of PD. Further studies are needed to assess its effects on motor symptoms over a longer duration. identifier  NCT05781711', metadata={'similarity_score': 0.3742445111274719, 'retrieval_method': 'initial_vector_similarity'}, id='PMC1748215544')"", ""Document(page_content='Assessments for hyperglycemia are vital to pregnancy and postpartum (PP) care, but gold-standard oral glucose tolerance tests (OGTTs) are burdensome. We examined changes in 1,5 anhydroglucitol (1,5AG) levels during gestation and PP and assessed for associations with other measures of glycemia. Pregnant participants (n = 50) in the Study of Pregnancy Regulation of Insulin and Glucose cohort underwent OGTTs at a mean of 13 weeks ([visit 1 (V1)] and 26 weeks [visit 2 (V2)] of gestation and PP. Nonpregnant controls had a single OGTT. 1,5AG was measured using frozen plasma samples. Changes in 1,5AG across pregnancy were assessed with longitudinal mixed effects linear models. We assessed relationships between 1,5AG and glycemia at each timepoint using Spearman correlations and linear regression models. To determine the relationship of 1,5AG with breastfeeding (BF) status, stratified analyses were performed. 1,5AG decreased from V1 to V2 (β = −3.6\\u2005μg/mL,  P P P P P P P 1,5AG decreases during gestation and remains low PP. Breastfeeding is associated with lower 1,5AG levels, indicating plausible excretion into breastmilk. 1,5AG is unlikely to be useful in assessing glycemia in pregnant or PP women.', metadata={'similarity_score': 0.3416031002998352, 'retrieval_method': 'initial_vector_similarity'}, id='PMC11635448')""]",Metformin helps treat type 2 diabetes by reducing glucose production in the liver and increasing insulin sensitivity in peripheral tissues.,3.1116511821746826,10,True,,,,,,,,0.0,2253,0
crag,How does SGLT2 inhibition affect kidney function?,"Based on the provided documents, there is limited direct information on how SGLT2 inhibition affects kidney function. Document 1 mentions the expanded indications for SGLT2 inhibitors to include chronic kidney disease, but it does not delve into the specific effects on kidney function. Document 2 discusses IgA nephropathy, a primary glomerular disease, but does not directly address SGLT2 inhibitors. Document 3 focuses on complement activation, bioincompatibility, and inflammation in hemodialysis, which are not directly related to SGLT2 inhibitors. 

Therefore, based on the available information, it is unclear how SGLT2 inhibition specifically affects kidney function. Further research or additional documents focusing on the effects of SGLT2 inhibitors on kidney function would be needed to provide a comprehensive answer.","[""Document(page_content='Indications for sodium-glucose cotransporter-2 (SGLT2) inhibitors have expanded to include heart failure and chronic kidney disease after the year 2020. Whether and how the demographic trends in the prescription of SGLT2 inhibitors have changed after the expansion of indications have not been studied extensively. This study is a descriptive analysis of serial, cross-sectional data on nationwide prescription of SGLT2 inhibitors between April 2016 and March 2023 obtained from NDB Open Data Japan, which contains more than 95% of total health insurance reimbursement claims in the nation. The total number of SGLT2 inhibitor tablets prescribed in outpatient settings with prescriptions papers increased from 577,996,158 tablets in fiscal year (FY) 2020 to 904,598,175 tablets in FY 2022. Patients aged 75 years and older accounted for 20.3% of the total prescriptions in FY 2020, and this proportion increased to 27.8% in FY 2022. Among all SGLT2 inhibitors, the tablet that expanded its indications for patients with heart failure and chronic kidney disease the earliest showed the largest percentage increase in the number of prescribed tablets during this period and the highest share of the elderly population in its recipients in both sexes (men, 35.9%; women, 49.4%) in FY 2022. The number of prescribed SGLT2 inhibitor tablets per population was constantly higher in men than in women between FY 2020 and 2022, which is consistent with the sex difference in the prevalence of these diseases. Prescription of SGLT2 inhibitors to the elderly population is no longer infrequent and accounts for a large portion of the entire prescription of SGLT2 inhibitors in Japan. These findings contribute to updating our perception on the demographics of SGLT2 inhibitor recipients.', metadata={'similarity_score': 0.537039041519165, 'retrieval_method': 'initial_vector_similarity'}, id='PMC1748704682')"", ""Document(page_content='IgA nephropathy (IgAN) is a common primary glomerular disease. The  O O The review followed Preferred Reporting Items for Systematic Reviews and Meta-Analyses (PRISMA) recommendations and was registered in PROSPERO (CRD42021287423). The literature search was conducted in PubMed, Web of Science, Cochrane, and Scopus, and the selected articles were evaluated for eligibility based on predefined criteria. The methodological quality of the studies was assessed using the Newcastle–Ottawa Scale. Statistical analysis was performed to calculate effect sizes and assess heterogeneity among the studies. This review analyzed 29 out of 1,986 studies, conducted between 2005 and 2022, with participants from multiple countries. Gd-IgA1 levels were not associated with age and gender, while associations with hypertension, hematuria, and proteinuria were inconsistent. In the meta-analyses, a correlation between serum Gd-IgA1 and estimated glomerular filtration rate was identified, however, the relationships between Gd-IgA1 levels and chronic kidney disease (CKD) stage and progression to kidney failure were inconsistent. Serum Gd-IgA1 levels were not associated with validated prognostic risk factors, but were negatively correlated with kidney function. Further research in larger studies using standardized assays are needed to establish the value of Gd-IgA1 as a prognostic risk factor in IgAN. \\n The online version contains supplementary material available at 10.1007/s40620-023-01874-8.', metadata={'similarity_score': 0.4322875440120697, 'retrieval_method': 'initial_vector_similarity'}, id='PMC11649794')"", ""Document(page_content='In hemodialysis (HD), complement activation, bioincompatibility, and inflammation are intricately intertwined. In the 1970s, as HD became a routine therapy, the observation of complement pathway activation and transient leukopenia by cellulosic dialysis membranes triggered the bioincompatibility debate and its clinical relevance. Extensive deliberations have covered definitions, assessment markers, scope, and long-term clinical consequences of membrane-dependent bioincompatibility reactions. While complement pathways’ interplay with coagulation and inflammation has been delineated, HD’s focus has primarily been on developing more biocompatible membranes using advanced technologies. Recent advances and understanding of the current HD delivery mode (4-hour sessions, thrice weekly) suggest that factors beyond membrane characteristics play a significant role, and a more complex, multifactorial picture of bioincompatibility is emerging. Chronic activation of the complement system and persistent low-grade “uremic inflammation” in chronic kidney disease (CKD) and HD lead to premature inflammaging of the kidney, resembling aging in the general population. Cellular senescence, modulated by complement activation and the uremic milieu, contributes to chronic inflammaging. Additionally, the formation of neutrophil extracellular traps (NETs, process of NETosis) during HD and their biological activity in the interdialytic period can lead to dialysis-induced systemic stress. Thus, complement-inflammation manifestations in HD therapies extend beyond traditional membrane-related bioincompatibility consequences. Recent scientific knowledge is reshaping strategies to mitigate detrimental consequences of bioincompatibility, both technologically and in HD therapy delivery modes, to improve dialysis patient outcomes.', metadata={'similarity_score': 0.4236581027507782, 'retrieval_method': 'initial_vector_similarity'}, id='PMC11649546')"", ""Document(page_content='In recent years, advancements in immunosuppressive medications and post-transplant management have led to a significant decrease in acute rejection rates in renal allografts and consequent improvement in short-term graft survival. In contrast, recent data have shown an increased incidence of post-transplant glomerular diseases, which currently represent a leading cause of allograft loss. Although pathogenesis is not fully understood, growing evidence supports the role of inherited and immunological factors and has identified potential pre- and post-transplant predictors. In this review, we illustrate recent advancements in the pathogenesis of post-transplant glomerular disease and the role of risk factors and immunological triggers. In addition, we discuss potential prevention and management strategies.', metadata={'similarity_score': 0.3968540132045746, 'retrieval_method': 'initial_vector_similarity'}, id='PMC11630810')"", ""Document(page_content='Inhibitors of the interaction between Neuropilin-1 (NRP-1) and Vascular Endothelial Growth Factor-A 165 165 2 2 50 50 2 2 50 165 The online version contains supplementary material available at 10.1007/s00726-024-03411-8.', metadata={'similarity_score': 0.39665278792381287, 'retrieval_method': 'initial_vector_similarity'}, id='PMC11344719')"", ""Document(page_content='Primary glomerular disease (PGD) is an idiopathic cause of renal glomerular lesions that is characterized by proteinuria or hematuria and is the leading cause of chronic kidney disease (CKD). The identification of circulating biomarkers for the diagnosis of PGD requires a thorough understanding of the metabolic defects involved. In this study, ultra-high performance liquid chromatography–tandem mass spectrometry was performed to characterize the amino acid (AA) profiles of patients with pathologically diagnosed PGD, including minimal change disease (MCD), focal segmental glomerular sclerosis (FSGS), membranous nephropathy, and immunoglobulin A nephropathy. The plasma concentrations of asparagine and ornithine were low, and that of aspartic acid was high, in patients with all the pathologic types of PGD, compared to healthy controls. Two distinct diagnostic models were generated using the differential plasma AA profiles using logistic regression and receiver operating characteristic analyses, with areas under the curves of 1.000 and accuracies up to 100.0% in patients with MCD and FSGS. In conclusion, the progression of PGD is associated with alterations in AA profiles, The present findings provide a theoretical basis for the use of AAs as a non-invasive, real-time, rapid, and simple biomarker for the diagnosis of various pathologic types of PGD. The online version contains supplementary material available at 10.1007/s00726-024-03407-4.', metadata={'similarity_score': 0.3896699845790863, 'retrieval_method': 'initial_vector_similarity'}, id='PMC11255010')"", ""Document(page_content='Kidney failure has been associated with decreased physical capacity, although evidence regarding the physical performance of individuals with earlier stages of chronic kidney disease (CKD)\\xa0remains limited. Cross-sectional data were derived from the prospective, population-based Maastricht Study. Multivariate linear regression models were fitted to assess the association of estimated glomerular filtration rate (eGFR) and albuminuria categories with physical performance test outcomes. Overall, 7396 participants were included. Compared to eGFR 60–90\\xa0ml/min/1.73\\xa0m β β β β β β β β β Reduced eGFR and higher albuminuria levels were associated with worse physical performance, especially shorter 6-min walk distance and lower muscle strength. The relationship between eGFR and physical function was non-linear, with also high eGFR values being associated with worse performance, especially in the six-minute walk test. \\n The online version contains supplementary material available at 10.1007/s40620-024-01933-8.', metadata={'similarity_score': 0.38796907663345337, 'retrieval_method': 'initial_vector_similarity'}, id='PMC11649829')"", ""Document(page_content='Membranous nephropathy can lead to end-stage kidney disease, for which kidney transplantation is the preferred therapy. However, the disease often relapses, which can impact allograft survival. We conducted a prospective multicenter study in France involving 72 patients with membranous nephropathy who were awaiting and then underwent kidney transplantation. In addition, we established a retrospective validation cohort of 65 patients. The primary objective was to evaluate the prognostic significance of pretransplant anti phospholipase A2 receptor 1 (PLA2R1) antibodies on the recurrence of membranous nephropathy. The study also assessed the incidence rate, time to onset, and risk factors for recurrence, as well as allograft outcome. The prospective cohort showed a 26% cumulative incidence of membranous nephropathy recurrence after a median follow-up of 23.5 months. This was confirmed by a 28% cumulative incidence after a median follow-up of 67 months in the retrospective cohort. A strong association was found between the presence of anti-PLA2R1 antibodies prior to transplantation and the risk of disease recurrence (risk ratio\\xa0= 5.9; 95% confidence interval [CI]: 2.3–15.7;  P The presence of anti-PLA2R1 antibodies prior to transplantation was a strong predictor of recurrence of allograft membranous nephropathy. An individualized immunomonitoring and management strategy for kidney transplant candidates with anti-PLA2R1-associated membranous nephropathy should be considered.', metadata={'similarity_score': 0.3707736134529114, 'retrieval_method': 'initial_vector_similarity'}, id='PMC11652070')"", ""Document(page_content='Glucagon-like peptide-1 (GLP-1) receptor agonists and the dual GLP-1- and glucose-dependent insulinotropic polypeptide receptor co-agonist tirzepatide (referred to here collectively as “GLP-1-based therapy”) are incretin-based therapies being used increasingly in the management of both type 2 diabetes and obesity. They are now recognized to have beneficial effects beyond improved glycemic control and weight loss, including cardiovascular and renal protection. GLP-1-based therapy also slows gastric emptying, which has benefits (lowering postprandial glucose), but also potential risks (eg, hypoglycemia in individuals on insulin or sulphonylurea therapy). Their effects on the gallbladder may also be beneficial, contributing to reducing postprandial triglycerides, but they also potentially increase the risk of biliary disease. In this review, we summarize the effects of GLP-1 and incretin-based therapeutics on gastric, biliary and small intestinal function. An improved understanding of these effects will optimize the use of these drugs.', metadata={'similarity_score': 0.36344456672668457, 'retrieval_method': 'initial_vector_similarity'}, id='PMC11630531')"", ""Document(page_content='Acute kidney injury (AKI) is a critical morbidity after cytoreduction and hyperthermic intraperitoneal chemotherapy (CRS/HIPEC). This study was conducted to investigate the use of kidney-specific biomarkers to evaluate the diagnostic accuracy of post-HIPEC AKI. Patients who received CRS/HIPEC were prospectively enrolled in this study. We serially sampled urine neutrophil gelatinase-associated lipocalin (NGAL), serum cystatin C (sCyC), and β2 microglobulin (sβ2-MG) on the day before CRS/HIPEC and then 2 h, 1 d, 2 d, 3 d, and 7 d after CRS/HIPEC. The primary outcome was the occurrence of AKI during the first 7 d. The areas under the receiver operating characteristic curve (AUCs) were calculated to evaluate the detection performance. A total of 75 patients were eligible, of whom 5 (6.7%) fulfilled the criteria of AKI during the study period (AKI group) and 70 did not (non-AKI group). No significant differences were observed in these biomarkers between the two groups, except for sβ2-MG on day 3 ( P P P This is the first prospective study to evaluate the value of kidney-specific biomarkers in patients after CRS/HIPEC. We found that AKI cannot be predicted by simply using the absolute measurements of these biomarkers because of the heterogeneous characteristics of the patients.', metadata={'similarity_score': 0.3459194302558899, 'retrieval_method': 'initial_vector_similarity'}, id='PMC11650413')""]","SGLT2 inhibitors protect kidney function by reducing hyperfiltration, decreasing albuminuria, and providing nephroprotection through mechanisms independent of glycemic control.",1.744570016860962,10,True,,,,,,,,0.0,830,0
crag,What is the mechanism of action of GLP-1 receptor agonists?,"GLP-1 receptor agonists work by activating the glucagon-like peptide-1 receptor, which is involved in regulating glucose homeostasis. When GLP-1 binds to its receptor, it stimulates the release of insulin from pancreatic beta cells, which helps to lower blood sugar levels. Additionally, GLP-1 receptor activation inhibits the release of glucagon from pancreatic alpha cells, which further helps to reduce blood glucose levels. 

From the provided documents, there is no specific information regarding the exact mechanism of action of GLP-1 receptor agonists. However, based on general knowledge and the information provided, it can be inferred that the main mechanism of action of GLP-1 receptor agonists is through the activation of the GLP-1 receptor to regulate glucose metabolism.","[""Document(page_content='Glucagon-like peptide-1 (GLP-1) receptor agonists and the dual GLP-1- and glucose-dependent insulinotropic polypeptide receptor co-agonist tirzepatide (referred to here collectively as “GLP-1-based therapy”) are incretin-based therapies being used increasingly in the management of both type 2 diabetes and obesity. They are now recognized to have beneficial effects beyond improved glycemic control and weight loss, including cardiovascular and renal protection. GLP-1-based therapy also slows gastric emptying, which has benefits (lowering postprandial glucose), but also potential risks (eg, hypoglycemia in individuals on insulin or sulphonylurea therapy). Their effects on the gallbladder may also be beneficial, contributing to reducing postprandial triglycerides, but they also potentially increase the risk of biliary disease. In this review, we summarize the effects of GLP-1 and incretin-based therapeutics on gastric, biliary and small intestinal function. An improved understanding of these effects will optimize the use of these drugs.', metadata={'similarity_score': 0.5381851196289062, 'retrieval_method': 'knowledge_base_expansion'}, id='PMC11630531')"", ""Document(page_content='The Golgi apparatus serves multiple crucial roles in the cell. These roles include the addition and subsequent modification of glycans, not only to newly-made proteins arriving from the endoplasmic reticulum, but also to precursors during the biosynthesis of glycolipids. New research by Brauer et al, (', metadata={'similarity_score': 0.36178669333457947, 'retrieval_method': 'knowledge_base_expansion'}, id='PMC11649812')"", ""Document(page_content='Glycosylation, which plays an important role in modifying lipids and sorting of proteins, is regulated by asymmetric intra-Golgi distribution and SPPL3-mediated cleavage of Golgi enzymes. We found that cells lacking LYSET/TMEM251, a retention factor for Golgi  N cis', metadata={'similarity_score': 0.32712316513061523, 'retrieval_method': 'knowledge_base_expansion'}, id='PMC11649813')"", ""Document(page_content='Inhibitors of the interaction between Neuropilin-1 (NRP-1) and Vascular Endothelial Growth Factor-A 165 165 2 2 50 50 2 2 50 165 The online version contains supplementary material available at 10.1007/s00726-024-03411-8.', metadata={'similarity_score': 0.3120233118534088, 'retrieval_method': 'knowledge_base_expansion'}, id='PMC11344719')"", ""Document(page_content='NLRP3 is an intracellular sensor molecule that affects neutrophil functionality and infiltration in brain disorders such as experimental autoimmune encephalomyelitis (EAE). However, the detailed molecular mechanisms underlying the role of NLRP3 in these processes remain unknown. We found that NLRP3 is crucial for neutrophil infiltration, whereas dispensable for neutrophil priming. Notably, NLRP3 activation in neutrophils induced blood-brain barrier (BBB) disruption and neutrophil infiltration into the brain via CXCL1/2 secretion and subsequent activation of the CXCL1/2-CXCR2 signaling axis. Moreover, CXCL1 and CXCL2 in the inflamed brain directly reduced Claudin-5 expression, which regulates BBB permeability in brain endothelial cells. Furthermore, neutrophil-specific NLRP3 activation aggravated EAE pathogenesis by promoting CXCR2-mediated infiltration of both neutrophils and CD4 The online version contains supplementary material available at 10.1186/s12974-025-03468-6.', metadata={'similarity_score': 0.2971397936344147, 'retrieval_method': 'knowledge_base_expansion'}, id='PMC1748704639')"", ""Document(page_content='Diabetes mellitus (DM) is a prevalent condition that requires careful management in the perioperative setting to reduce surgical risks and optimize patient outcomes. The preoperative care of diabetic patients is complex because glucose control must be balanced with minimizing hypoglycemic or hyperglycemic events during surgery. A variety of diabetic medications such as insulin, dipeptidyl-peptidase-4 inhibitors, glucagon-like peptide-1 receptor agonists, sodium–glucose cotransporter-2 inhibitors, and biguanides such as metformin present unique challenges and considerations due to their different mechanisms, benefits, and potential adverse effects. In recent years, professional organizations have developed recommendations on the perioperative management of these therapies, although there remain some variations in guidelines related to medication cessation and dosage adjustments. Standardized protocols in preoperative DM care remain a topic of interest to ensure consistent and safe practices across healthcare settings, and further collaborative research efforts could provide clarity and consensus in managing this diverse patient population. The objective of this study was to provide an overview of guidelines and practices to support healthcare professionals in delivering improved preoperative care for diabetic patients. This initiative aims to enhance surgical outcomes and minimize the occurrence of complications. This is a comparative review that provides a systematic comparison of the similarities and differences in the guidelines and recommendations of three professional organizations along with Hamad Medical Corporation. All guidelines were from official websites including Hamad Medical Corporation. Although the reviewed guidelines for the preoperative care of diabetes patients share some similarities, there are also a number of differences due to outdated data and expert opinions, and therefore differ in practices around the world. While the key elements are agreed upon, more research and global collaboration are needed to create consistent guidelines and improve patient outcomes.', metadata={'similarity_score': 0.2890487015247345, 'retrieval_method': 'knowledge_base_expansion'}, id='PMC1748704577')"", ""Document(page_content='Although a role of the thalamus in different arousal and awareness states is well established, there is a surprising lack of knowledge on subregional specificity within this complex, multinucleated structure of the diencephalon. In their recent paper ‘Extrasynaptic GABA-A receptors in central medial thalamus mediate anaesthesia in rats’, Muheyati et al. evaluated whether GABA A A A', metadata={'similarity_score': 0.2882241904735565, 'retrieval_method': 'knowledge_base_expansion'}, id='PMC11650603')"", ""Document(page_content='Common treatments for type 2 diabetes include lifestyle changes such as diet and exercise, oral medications like metformin, and in some cases, insulin therapy. Metformin is often the first-line medication prescribed for type 2 diabetes. It helps lower glucose production in the liver and improves insulin sensitivity.', metadata={'similarity_score': 0.27862343192100525, 'retrieval_method': 'knowledge_base_expansion'}, id='sample')"", ""Document(page_content='The enzyme arginase catalyzes the hydrolysis of  l l l l l Arg1 Arg2 Further basic and translational research is needed to deepen our understanding of the regulation of Arg1 and Arg2 in different cell types in consideration of their localization, species-specificity, and multiple biochemical and physiological roles. This will lead to better pharmacological strategies to target arginase activity in liver, cardiovascular, hematological, immune/infectious diseases, and cancer.', metadata={'similarity_score': 0.27655747532844543, 'retrieval_method': 'knowledge_base_expansion'}, id='PMC1748704617')"", ""Document(page_content='Juvenile hormone (JH) is one of the most essential hormones controlling insect metamorphosis and physiology. While it is well known that JH affects many tissues throughout the insect life cycle, the difference in JH responsiveness and the repertoire of JH-inducible genes among different tissues has not been fully investigated. In this study, we monitored JH responsiveness  in vivo Drosophila melanogaster JH response element-GFP JHRE-GFP germ cell-expressed Lactate dehydrogenase', metadata={'similarity_score': 0.2763129472732544, 'retrieval_method': 'knowledge_base_expansion'}, id='PMC11651902')""]","GLP-1 receptor agonists work by stimulating insulin secretion, suppressing glucagon secretion, slowing gastric emptying, and promoting satiety, ultimately improving glycemic control and often leading to weight loss.",2.3544719219207764,10,True,,,,,,,,0.0,785,0
crag,What are the cardiovascular benefits of SGLT2 inhibitors?,"Based on the provided documents, there is limited direct information on the cardiovascular benefits of SGLT2 inhibitors. Document 1 mentions that the indications for SGLT2 inhibitors have expanded to include heart failure and chronic kidney disease after 2020, indicating a potential benefit for cardiovascular health. However, the specific cardiovascular benefits of SGLT2 inhibitors are not explicitly discussed in this document.

Document 4 briefly mentions that common treatments for type 2 diabetes, which often coexists with cardiovascular risk factors, include medications like metformin. Metformin helps improve insulin sensitivity and lower glucose production in the liver, which can indirectly benefit cardiovascular health by helping to manage blood sugar levels.

While Document 2 discusses the use of bivalirudin in the management of acute coronary syndrome (ACS) to improve myocardial microcirculation and reduce adverse events, this is not directly related to SGLT2 inhibitors.

Overall, based on the available information, it is uncertain if there are specific cardiovascular benefits of SGLT2 inhibitors discussed in the provided documents. Further research and literature review specific to the cardiovascular effects of SGLT2 inhibitors would be needed to provide a comprehensive answer on this topic.","[""Document(page_content='Indications for sodium-glucose cotransporter-2 (SGLT2) inhibitors have expanded to include heart failure and chronic kidney disease after the year 2020. Whether and how the demographic trends in the prescription of SGLT2 inhibitors have changed after the expansion of indications have not been studied extensively. This study is a descriptive analysis of serial, cross-sectional data on nationwide prescription of SGLT2 inhibitors between April 2016 and March 2023 obtained from NDB Open Data Japan, which contains more than 95% of total health insurance reimbursement claims in the nation. The total number of SGLT2 inhibitor tablets prescribed in outpatient settings with prescriptions papers increased from 577,996,158 tablets in fiscal year (FY) 2020 to 904,598,175 tablets in FY 2022. Patients aged 75 years and older accounted for 20.3% of the total prescriptions in FY 2020, and this proportion increased to 27.8% in FY 2022. Among all SGLT2 inhibitors, the tablet that expanded its indications for patients with heart failure and chronic kidney disease the earliest showed the largest percentage increase in the number of prescribed tablets during this period and the highest share of the elderly population in its recipients in both sexes (men, 35.9%; women, 49.4%) in FY 2022. The number of prescribed SGLT2 inhibitor tablets per population was constantly higher in men than in women between FY 2020 and 2022, which is consistent with the sex difference in the prevalence of these diseases. Prescription of SGLT2 inhibitors to the elderly population is no longer infrequent and accounts for a large portion of the entire prescription of SGLT2 inhibitors in Japan. These findings contribute to updating our perception on the demographics of SGLT2 inhibitor recipients.', metadata={'similarity_score': 0.5698674917221069, 'retrieval_method': 'initial_vector_similarity'}, id='PMC1748704682')"", ""Document(page_content='The management of acute coronary syndrome (ACS) in older patients remains challenging because standard anticoagulants often fail to yield optimal outcomes. Bivalirudin, a direct inhibitor of thrombin, serves as an alternative to traditional therapies. This drug is particularly effective in enhancing myocardial microcirculation and reducing adverse events after clinical interventions. The present article explores the findings of a recent study that highlighted the clinical benefits of bivalirudin by investigating its effects on myocardial microcirculation and adverse cardiac events after percutaneous coronary intervention in older patients with ACS. Compared with unfractionated heparin, bivalirudin markedly reduced the emergency response time and improved cardiac function indicators. It further mitigated the risks of cardiovascular events and recurrent myocardial infarctions. These findings suggest that bivalirudin can enhance myocardial perfusion and reduce bleeding complications, thus serving as a safe, effective anticoagulation agent for older patients with ACS. Nonetheless, further large-scale, high-quality trials are needed to establish optimal usage guidelines and assess long-term outcomes. Integrating bivalirudin into ACS treatment protocols for older patients may help optimize patient care, balancing efficacy and safety. Continual research and consensus building are necessary for the widespread clinical application of bivalirudin and the improvement of ACS outcomes in older patients.', metadata={'similarity_score': 0.4164641797542572, 'retrieval_method': 'initial_vector_similarity'}, id='PMC11736530_gen_142')"", ""Document(page_content='Inhibitors of the interaction between Neuropilin-1 (NRP-1) and Vascular Endothelial Growth Factor-A 165 165 2 2 50 50 2 2 50 165 The online version contains supplementary material available at 10.1007/s00726-024-03411-8.', metadata={'similarity_score': 0.41489577293395996, 'retrieval_method': 'initial_vector_similarity'}, id='PMC11344719')"", ""Document(page_content='Common treatments for type 2 diabetes include lifestyle changes such as diet and exercise, oral medications like metformin, and in some cases, insulin therapy. Metformin is often the first-line medication prescribed for type 2 diabetes. It helps lower glucose production in the liver and improves insulin sensitivity.', metadata={'similarity_score': 0.4129023253917694, 'retrieval_method': 'initial_vector_similarity'}, id='sample')"", ""Document(page_content='Atherosclerosis (AS) is a chronic inflammatory disease characterized by the gradual accumulation of plaques in arterial walls, with its pathogenesis remaining incompletely understood. Recent studies have highlighted that development of AS is closely associated with the aberrant activation of the NLRP3 inflammasome in the arteries. Inhibition of the NLRP3 inflammasome by natural products and formulae derived from Chinese herbal medicines (CHMs) has been shown to alleviate AS-associated pathologies. However, therapies that effectively and safely target the NLRP3 inflammasome remain limited. This review aims to summarize the key discoveries from recent studies on the effects of these natural products and formulae on the NLRP3 inflammasome in the context of AS treatment. A comprehensive literature search was conducted on databases such as PubMed/MEDLINE up to January 2025, yielding 38 eligible studies. Our analysis indicates that certain therapies can effectively prevent arterial inflammation in animal models by targeting multiple pathways and mechanisms related to the NLRP3 inflammasome. This review summarizes the primary findings of these studies, focusing on the therapeutic effects and underlying mechanisms of action. Based on these insights, we propose future strategies to enhance the efficacy, specificity, and safety of existing natural products and formulae for AS treatment. Additionally, this study offers a perspective for future research that may enhance our understanding of the roles and the mechanisms of CHM-derived phytochemicals and formulae in regulating the NLRP3 inflammasome and treating AS.', metadata={'similarity_score': 0.39650627970695496, 'retrieval_method': 'initial_vector_similarity'}, id='PMC1748704493')"", ""Document(page_content='Glucagon-like peptide-1 (GLP-1) receptor agonists and the dual GLP-1- and glucose-dependent insulinotropic polypeptide receptor co-agonist tirzepatide (referred to here collectively as “GLP-1-based therapy”) are incretin-based therapies being used increasingly in the management of both type 2 diabetes and obesity. They are now recognized to have beneficial effects beyond improved glycemic control and weight loss, including cardiovascular and renal protection. GLP-1-based therapy also slows gastric emptying, which has benefits (lowering postprandial glucose), but also potential risks (eg, hypoglycemia in individuals on insulin or sulphonylurea therapy). Their effects on the gallbladder may also be beneficial, contributing to reducing postprandial triglycerides, but they also potentially increase the risk of biliary disease. In this review, we summarize the effects of GLP-1 and incretin-based therapeutics on gastric, biliary and small intestinal function. An improved understanding of these effects will optimize the use of these drugs.', metadata={'similarity_score': 0.39217236638069153, 'retrieval_method': 'initial_vector_similarity'}, id='PMC11630531')"", ""Document(page_content='Diet is a key modifiable risk factor in many chronic diseases, including age-related diseases. The Mediterranean diet (MedDiet) is an extensively studied dietary pattern which has been proposed as a lifestyle intervention to promote healthy aging in the general population, due to its numerous health benefits. Randomized controlled trials (RCTs) have attempted to explore the mechanism(s) by which the MedDiet exerts its beneficial effects on aging. One proposed mechanism is that the MedDiet helps to slow down a process called ‘inflamm-aging’, a type of chronic, low-grade inflammation which contributes to aging. To explore the evidence supporting this hypothesized mechanism, we conducted a scoping review of existing RCTs which used a MedDiet intervention and assessed at least one molecular outcome of potential relevance to inflamm-aging. We identified 14 papers representing 12 unique RCTs. Based on our findings, we present 10 recommendations for the next clinical trial of the MedDiet in inflamm-aging.', metadata={'similarity_score': 0.38000455498695374, 'retrieval_method': 'initial_vector_similarity'}, id='PMC11649874')"", 'Document(page_content=""Although the novel coronavirus disease 2019 (COVID‐19), caused by the severe acute respiratory syndrome coronavirus 2 (SARS‐CoV‐2), primarily manifests as severe respiratory distress, its impact on the cardiovascular system is also notable. Studies reveal that COVID‐19 patients often suffer from certain vascular diseases, partly attributed to increased proliferation or altered phenotype of vascular smooth muscle cells (VSMCs). Although the association between COVID‐19 and VSMCs is recognized, the precise mechanism underlying SARS‐CoV‐2\'s influence on VSMC phenotype remains largely under‐reviewed. In this context, while there is a consistent body of literature dissecting the effect of COVID‐19 on the cardiovascular system, few reports delve into the potential role of VSMC switching in the pathophysiology associated with COVID‐19 and the molecular mechanisms involved therein. This review dissects and critiques the link between COVID‐19 and VSMCs, with particular attention to pathways involving cholesterol, calcium, and phosphate. These pathways underpin the interaction between the virus and VSMCs. Such interaction promotes VSMC proliferation, and eventually potentiates vascular calcification as well as worsens prognosis in patients with COVID‐19."", metadata={\'similarity_score\': 0.3790280520915985, \'retrieval_method\': \'initial_vector_similarity\'}, id=\'PMC11649971\')', ""Document(page_content='Although the importance of home blood pressure (BP) management has been widely reported, the achievement rate of home BP targets remains low in Japan. Sacubitril/valsartan is a novel antihypertensive agent with potent antihypertensive effects. Despite its theoretical advantages, the real-world clinical application of sacubitril/valsartan in optimizing home BP management remains underexplored. The aim of this study was to evaluate the effect of switching from azilsartan treatment to sacubitril/valsartan treatment on the achievement of home BP targets and to refine hypertension management strategies in practical clinical settings. A cohort of 55 patients, with a mean morning home systolic BP of 135 mmHg or more was enrolled for an 8-week treatment phase with azilsartan and calcium-channel blockers. Morning BP, pulse rate (PR), estimated glomerular filtration rate, and B-type natriuretic peptide, serum potassium, serum uric acid (UA), and hemoglobin A1c levels were assessed at baseline and then at 8, 24, and 48 weeks after switching from 20 mg azilsartan to 200 mg sacubitril/valsartan. At 48 weeks after switching to sacubitril/valsartan, there was a 60% increase in the rate of attainment of home systolic BP targets. Sacubitril/valsartan significantly reduced the mean systolic BP (from 143.6 ± 7.0 mmHg to 131.4 ± 8.7 mmHg), diastolic BP (from 86.9 ± 12.3 mmHg to 80.2 ± 10.7 mmHg), PR (from 74.8 ± 11.0 bpm to 72.1 ± 10.1 bpm), and serum UA (from 5.9 ± 1.1 mg/dL to 5.5 ± 0.9 mg/dL) within the first 8 weeks (all p < 0.01). These effects were maintained for 48 weeks. The switch from azilsartan to sacubitril/valsartan treatment resulted in a significant improvement in the achievement of home BP targets, which is consistent with our goal of refining hypertension management strategies in practical clinical settings.', metadata={'similarity_score': 0.37268009781837463, 'retrieval_method': 'initial_vector_similarity'}, id='PMC1748704693')"", ""Document(page_content='Chronic Chagas cardiomyopathy is associated with an unbalanced\\nimmune response and impaired heart function, and available drugs do\\nnot prevent its development. Zileuton (Zi), a 5-lypoxigenase inhibitor,\\naffects inflammatory/pro-resolution mediators. Herein, Zi treatment\\nin the early phase of infection reduced parasitemia associated mainly\\nwith the direct effect of Zi on the parasite, and the enzyme epoxide\\nhydrolase was the potential molecular target behind the trypanocidal\\neffect. In the intermediate acute phase of infection, Zi reduced the\\nnumber of innate and adaptive inflammatory cells, increased the level\\nof SOCS2 expression in the heart associated with lower inflammation,\\nand improved cardiac function. Zi treatment initiated in the chronic\\nstage increased the level of SOCS2 expression in the heart, reduced\\ninflammation, and improved cardiac function. Our data suggest that\\nZi protects against  Trypanosoma cruzi', metadata={'similarity_score': 0.3649723529815674, 'retrieval_method': 'initial_vector_similarity'}, id='PMC11650774')""]","SGLT2 inhibitors provide cardiovascular benefits by reducing major adverse cardiovascular events and hospitalization for heart failure, effects that appear to be independent of their glucose-lowering action.",2.0326898097991943,10,True,,,,,,,,0.0,1320,0
crag,How do statins prevent cardiovascular disease?,"Statins prevent cardiovascular disease by lowering cholesterol levels in the blood. They work by inhibiting an enzyme in the liver that is responsible for producing cholesterol. By reducing cholesterol levels, statins can help prevent the buildup of plaque in the arteries, which can lead to atherosclerosis and ultimately cardiovascular disease. Additionally, statins have anti-inflammatory and antioxidant properties that can help protect the blood vessels and reduce the risk of cardiovascular events.

However, the provided documents do not directly address how statins prevent cardiovascular disease. Document 1 discusses the benefits of the Mediterranean diet in promoting healthy aging, while Document 2 explores the association between anabolic androgenic steroid use and coronary microvascular dysfunction. Document 3 focuses on the increased risk of coronary heart disease in patients with systemic lupus erythematosus, and Document 4 discusses cardiovascular risk in patients with nonclassical congenital adrenal hyperplasia. Document 5 appears to be a scientific article on inhibitors of the interaction between Neuropilin-1 and Vascular Endothelial Growth Factor-A, which is not directly related to the question.

Therefore, based on the broader search results and general knowledge, it can be concluded that statins prevent cardiovascular disease by lowering cholesterol levels, reducing inflammation, and protecting blood vessels, ultimately reducing the risk of atherosclerosis and cardiovascular events.","[""Document(page_content='Diet is a key modifiable risk factor in many chronic diseases, including age-related diseases. The Mediterranean diet (MedDiet) is an extensively studied dietary pattern which has been proposed as a lifestyle intervention to promote healthy aging in the general population, due to its numerous health benefits. Randomized controlled trials (RCTs) have attempted to explore the mechanism(s) by which the MedDiet exerts its beneficial effects on aging. One proposed mechanism is that the MedDiet helps to slow down a process called ‘inflamm-aging’, a type of chronic, low-grade inflammation which contributes to aging. To explore the evidence supporting this hypothesized mechanism, we conducted a scoping review of existing RCTs which used a MedDiet intervention and assessed at least one molecular outcome of potential relevance to inflamm-aging. We identified 14 papers representing 12 unique RCTs. Based on our findings, we present 10 recommendations for the next clinical trial of the MedDiet in inflamm-aging.', metadata={'similarity_score': 0.3990134298801422, 'retrieval_method': 'knowledge_base_expansion'}, id='PMC11649874')"", ""Document(page_content='Is the use of supraphysiologic doses of anabolic androgenic steroids (AASs) associated with persistent coronary microvascular dysfunction? In this cross-sectional study including 90 men, the prevalence of impaired myocardial flow reserve was increased among both those with current and former AAS use compared with controls. Among individuals with former AAS use, the accumulated duration of AAS use was independently associated with an increased risk of reduced myocardial flow reserve. The findings of this study suggest that AAS use may be associated with impaired myocardial flow reserve, with possible persistent coronary microvascular dysfunction years after AAS cessation.', metadata={'similarity_score': 0.38858360052108765, 'retrieval_method': 'knowledge_base_expansion'}, id='PMC11650407')"", ""Document(page_content='Systemic lupus erythematosus (SLE) is an autoimmune condition that is characterized by the production of autoantibodies and sustained inflammatory damage. Coronary heart disease (CHD) is a common complication of SLE, significantly increases CHD-related mortality in SLE patients. Despite conventional risk factors, the mechanisms contributing to a higher CHD risk require further investigation, with the immune and inflammatory aspects of SLE playing a significant role. Endothelial cell damage and dysfunction are key factors in the progression of coronary atherosclerosis in SLE patients. This review specifically focuses on endothelial dysfunction and the role of specific microRNAs in the context of SLE and CHD. In addition, we discuss the effects and functions of oxidative stress markers, endothelial progenitor cells, and circulating endothelial cells in individuals with both SLE and CHD. We also explored the typical inflammatory markers associated with SLE and CHD, addressing their clinical significance and limitations.', metadata={'similarity_score': 0.3867160677909851, 'retrieval_method': 'knowledge_base_expansion'}, id='PMC11651451')"", ""Document(page_content='The outcomes related to cardiovascular risk (CVR) in patients with the nonclassical form of congenital adrenal hyperplasia (NCAH) are unknown, especially those related to therapeutic options, including low doses of glucocorticoids or oral contraceptive pills. To analyze CVR by markers of atherosclerosis in females with the nonclassical form according to therapeutic options. A cross-sectional study at a tertiary center. Forty-seven females with NCAH (33.4 ± 10 years) were subdivided into group 1 (G1) (n = 28) treated with dexamethasone (0.14 ± 0.05\\u2005mg/m There were no statistically significant differences in BMI, HOMA-IR, high-density lipoprotein-cholesterol, or triglyceride levels among groups ( P P P P Adult females with NCAH did not show increased CVR using methodologies for detection of precocious atherosclerosis. Although patients receiving dexamethasone therapy had increased IL-6 and IL-8 levels, these data were not associated with radiological markers of atherosclerosis. Our cohort was composed of young adults and should be reevaluated in a long-term follow-up.', metadata={'similarity_score': 0.3862256407737732, 'retrieval_method': 'knowledge_base_expansion'}, id='PMC11651682')"", ""Document(page_content='Inhibitors of the interaction between Neuropilin-1 (NRP-1) and Vascular Endothelial Growth Factor-A 165 165 2 2 50 50 2 2 50 165 The online version contains supplementary material available at 10.1007/s00726-024-03411-8.', metadata={'similarity_score': 0.37462911009788513, 'retrieval_method': 'knowledge_base_expansion'}, id='PMC11344719')"", ""Document(page_content='The management of acute coronary syndrome (ACS) in older patients remains challenging because standard anticoagulants often fail to yield optimal outcomes. Bivalirudin, a direct inhibitor of thrombin, serves as an alternative to traditional therapies. This drug is particularly effective in enhancing myocardial microcirculation and reducing adverse events after clinical interventions. The present article explores the findings of a recent study that highlighted the clinical benefits of bivalirudin by investigating its effects on myocardial microcirculation and adverse cardiac events after percutaneous coronary intervention in older patients with ACS. Compared with unfractionated heparin, bivalirudin markedly reduced the emergency response time and improved cardiac function indicators. It further mitigated the risks of cardiovascular events and recurrent myocardial infarctions. These findings suggest that bivalirudin can enhance myocardial perfusion and reduce bleeding complications, thus serving as a safe, effective anticoagulation agent for older patients with ACS. Nonetheless, further large-scale, high-quality trials are needed to establish optimal usage guidelines and assess long-term outcomes. Integrating bivalirudin into ACS treatment protocols for older patients may help optimize patient care, balancing efficacy and safety. Continual research and consensus building are necessary for the widespread clinical application of bivalirudin and the improvement of ACS outcomes in older patients.', metadata={'similarity_score': 0.36537206172943115, 'retrieval_method': 'knowledge_base_expansion'}, id='PMC11736530_gen_142')"", ""Document(page_content='Atherosclerosis (AS) is a chronic inflammatory disease characterized by the gradual accumulation of plaques in arterial walls, with its pathogenesis remaining incompletely understood. Recent studies have highlighted that development of AS is closely associated with the aberrant activation of the NLRP3 inflammasome in the arteries. Inhibition of the NLRP3 inflammasome by natural products and formulae derived from Chinese herbal medicines (CHMs) has been shown to alleviate AS-associated pathologies. However, therapies that effectively and safely target the NLRP3 inflammasome remain limited. This review aims to summarize the key discoveries from recent studies on the effects of these natural products and formulae on the NLRP3 inflammasome in the context of AS treatment. A comprehensive literature search was conducted on databases such as PubMed/MEDLINE up to January 2025, yielding 38 eligible studies. Our analysis indicates that certain therapies can effectively prevent arterial inflammation in animal models by targeting multiple pathways and mechanisms related to the NLRP3 inflammasome. This review summarizes the primary findings of these studies, focusing on the therapeutic effects and underlying mechanisms of action. Based on these insights, we propose future strategies to enhance the efficacy, specificity, and safety of existing natural products and formulae for AS treatment. Additionally, this study offers a perspective for future research that may enhance our understanding of the roles and the mechanisms of CHM-derived phytochemicals and formulae in regulating the NLRP3 inflammasome and treating AS.', metadata={'similarity_score': 0.3631735146045685, 'retrieval_method': 'knowledge_base_expansion'}, id='PMC1748704493')"", ""Document(page_content='Peripheral artery disease (PAD) and dyslipidemia are both independent predictors of cardiovascular disease, but the association between individual lipid species and subclinical PAD, assessed by ankle-brachial index (ABI), is lacking in large-scale longitudinal studies. We used liquid chromatography-mass spectrometry to repeatedly measure 1,542 lipid species from 1,886 American Indian adults attending 2 clinical examinations (mean ~5 years apart) in the Strong Heart Family Study. We used generalized estimating equation models to identify baseline lipid species associated with change in ABI and the Cox frailty regression to examine whether lipids associated with change in ABI were also associated with incident coronary heart disease (CHD). We also examined the longitudinal association between change in lipid species and change in ABI and the cross-sectional association of individual lipids with ABI. All models were adjusted for age, sex, body mass index, smoking, alcohol use, hypertension, estimated glomerular filtration rate, diabetes, and lipid-lowering medication. Baseline levels of 120 lipid species, including glycerophospholipids, glycerolipids, fatty acids, and sphingomyelins, were associated with change in ABI. Among these, higher baseline levels of 3 known lipids (phosphatidylinositol[16:0/20:4], triacylglycerol[48:2], triacylglycerol[55:1]) were associated with a lower risk of CHD (hazard ratios [95% CIs] ranged from 0.67 [0.46–0.99] to 0.76 [0.58–0.99]), while cholesterol was associated with a higher risk of CHD (hazard ratio [95% CI] = 1.37 [1.00–1.87]). Longitudinal changes in 32 lipids were significantly associated with change in ABI during 5-year follow-up. Plasma levels of glycerophospholipids, triacylglycerols, and glycosylceramides were significantly associated with ABI in the cross-sectional analysis. Altered plasma lipidome is significantly associated with subclinical PAD in American Indians beyond traditional risk factors. If validated, the identified lipid species may serve as novel biomarkers for PAD in this high-risk but understudied population.', metadata={'similarity_score': 0.3622146546840668, 'retrieval_method': 'knowledge_base_expansion'}, id='PMC1748215496')"", ""Document(page_content='Chronic Chagas cardiomyopathy is associated with an unbalanced\\nimmune response and impaired heart function, and available drugs do\\nnot prevent its development. Zileuton (Zi), a 5-lypoxigenase inhibitor,\\naffects inflammatory/pro-resolution mediators. Herein, Zi treatment\\nin the early phase of infection reduced parasitemia associated mainly\\nwith the direct effect of Zi on the parasite, and the enzyme epoxide\\nhydrolase was the potential molecular target behind the trypanocidal\\neffect. In the intermediate acute phase of infection, Zi reduced the\\nnumber of innate and adaptive inflammatory cells, increased the level\\nof SOCS2 expression in the heart associated with lower inflammation,\\nand improved cardiac function. Zi treatment initiated in the chronic\\nstage increased the level of SOCS2 expression in the heart, reduced\\ninflammation, and improved cardiac function. Our data suggest that\\nZi protects against  Trypanosoma cruzi', metadata={'similarity_score': 0.36158761382102966, 'retrieval_method': 'knowledge_base_expansion'}, id='PMC11650774')"", ""Document(page_content='Peripheral Artery Disease (PAD) is a common cardiovascular condition marked by peripheral artery stenosis or occlusion. Despite treatment advancements, patients will still face vascular complications, highlighting the need for innovative therapies. Human proteins play crucial roles in biology and drug research. Mendelian randomization (MR) analysis, a gene-based method, is increasingly used in drug target identification. This study aims to identify PAD-associated plasma proteins through MR analysis for potential therapies. We first used GWAS data and seven pQTL datasets to identify plasma proteins causally linked to PAD through MR analysis. Then, we performed KEGG pathway enrichment analysis, Bayesian colocalization analysis, and MR-BMA analysis were carried out to investigate mechanisms and prioritize these proteins. Finally, we assessed the druggability of the target proteins using the DrugBank database. MR analysis found four plasma proteins causally linked to PAD: MMP3 positively correlated with PAD, while CASS4, ISG15, and MMP1 exhibited negative associations. Bayesian colocalization analysis confirmed these relationships, and the MR-BMA analysis prioritized MMP1 as the main target. KEGG pathway enrichment analysis highlighted lipid metabolism and atherosclerosis pathways as central to these drug targets. The druggability evaluation indicated that drugs targeting these proteins are either in development or already in clinical use. This study integrates genetic and proteomic data to identify therapeutic targets for PAD and evaluate their potential for drug development. The prioritization of MMP1 and ISG15 as key targets shows promise for PAD treatment, but further validation and clinical exploration of these findings are needed. The online version contains supplementary material available at 10.1186/s12959-025-00738-4.', metadata={'similarity_score': 0.3570508360862732, 'retrieval_method': 'knowledge_base_expansion'}, id='PMC1748704713')""]","Statins prevent cardiovascular disease by inhibiting HMG-CoA reductase to lower LDL cholesterol, reducing atherosclerotic plaque formation, and through pleiotropic effects such as anti-inflammatory and plaque-stabilizing properties.",2.9295151233673096,10,True,,,,,,,,0.0,1520,0
crag,What is the role of ACE inhibitors in heart failure?,"Based on the provided documents, the role of ACE inhibitors in heart failure is not directly addressed. Document 5 discusses cardiac fibrosis and the limited identification of effective treatments for this condition, but ACE inhibitors are not specifically mentioned. Document 4 mentions the expanded indications for SGLT2 inhibitors to include heart failure, but does not mention ACE inhibitors.

Given the lack of specific information in the provided documents, it is uncertain whether ACE inhibitors are directly discussed in relation to heart failure. However, based on broader search results and medical knowledge, ACE inhibitors are commonly used in the management of heart failure. ACE inhibitors work by blocking the angiotensin-converting enzyme, which helps to relax blood vessels and lower blood pressure, reducing the workload on the heart. Additionally, ACE inhibitors can help improve symptoms, decrease hospitalizations, and improve survival in patients with heart failure.

In conclusion, while the role of ACE inhibitors in heart failure is not directly addressed in the provided documents, they are commonly used in the management of heart failure based on broader medical knowledge and research.","[""Document(page_content='Acute myocardial infarction (AMI) is serious disease with high morbidity and mortality worldwide. CD38 is an important metabolic enzyme and plays an important role in a variety of diseases. Our previous studies demonstrated that CD38 deficiency significantly reduced Ang-II-induced ventricular hypertrophy and cardiac ischemia-reperfusion injury. However, the roles of cardiomyocytic CD38 in acute myocardial infarction (AMI) remain unknown. Here, we reported that cardiomyocyte-specific CD38 deficiency (CD38 The online version contains supplementary material available at 10.1038/s41598-025-02207-4.', metadata={'similarity_score': 0.4452318251132965, 'retrieval_method': 'knowledge_base_expansion'}, id='PMC1748215516')"", ""Document(page_content='Chronic Chagas cardiomyopathy is associated with an unbalanced\\nimmune response and impaired heart function, and available drugs do\\nnot prevent its development. Zileuton (Zi), a 5-lypoxigenase inhibitor,\\naffects inflammatory/pro-resolution mediators. Herein, Zi treatment\\nin the early phase of infection reduced parasitemia associated mainly\\nwith the direct effect of Zi on the parasite, and the enzyme epoxide\\nhydrolase was the potential molecular target behind the trypanocidal\\neffect. In the intermediate acute phase of infection, Zi reduced the\\nnumber of innate and adaptive inflammatory cells, increased the level\\nof SOCS2 expression in the heart associated with lower inflammation,\\nand improved cardiac function. Zi treatment initiated in the chronic\\nstage increased the level of SOCS2 expression in the heart, reduced\\ninflammation, and improved cardiac function. Our data suggest that\\nZi protects against  Trypanosoma cruzi', metadata={'similarity_score': 0.4290677607059479, 'retrieval_method': 'knowledge_base_expansion'}, id='PMC11650774')"", ""Document(page_content='Congenitally corrected transposition of the great arteries (ccTGA) remains a rare congenital disorder with a wide range of manifestations. The management of heart failure (HF) of the systemic right ventricle (RV), arrhythmias, heart block, and acquired cardiac conditions require a complex and multi-faceted approach. The objective of this manuscript is to present the current evidence regarding diagnostic, treatment, and management strategies for HF in ccTGA, including ventricular assist device (VAD) therapy and heart transplantation. A systematic review of the literature was conducted using PubMed, covering the period between 2010 and 2024. The search terms included “heart failure”, “ccTGA”, “VAD”, “heart transplantation”, and “systemic RV failure”. Two clinical cases were included for illustrative purposes. HF is a common occurrence in the context of ccTGA, primarily driven by progressive pressure and volume overload of the systemic RV, regurgitation of the systemic atrio-ventricular (AV) valve, and the development of arrhythmias, including complete heart block and (supra-)ventricular tachycardia. The use of HF medication is indicated for symptomatic patients, however, data on the efficacy of standardized HF medication remains limited. Timing of AV-valve replacement is essential to prevent further progression of HF. In ccTGA, the timing of surgery and interventional treatment approaches, the effect of pharmacological treatment in the context of HF, as well as the timing of initiation of a mechanical circulatory support, VAD and heart transplantation, are based on individualised consensus-level decisions. Optimal management remains a topic of debate due to the scarcity of outcome data. Future investigations should focus on identifying surrogate parameters for guiding treatment.', metadata={'similarity_score': 0.42047226428985596, 'retrieval_method': 'knowledge_base_expansion'}, id='PMC1748704794')"", ""Document(page_content='Indications for sodium-glucose cotransporter-2 (SGLT2) inhibitors have expanded to include heart failure and chronic kidney disease after the year 2020. Whether and how the demographic trends in the prescription of SGLT2 inhibitors have changed after the expansion of indications have not been studied extensively. This study is a descriptive analysis of serial, cross-sectional data on nationwide prescription of SGLT2 inhibitors between April 2016 and March 2023 obtained from NDB Open Data Japan, which contains more than 95% of total health insurance reimbursement claims in the nation. The total number of SGLT2 inhibitor tablets prescribed in outpatient settings with prescriptions papers increased from 577,996,158 tablets in fiscal year (FY) 2020 to 904,598,175 tablets in FY 2022. Patients aged 75 years and older accounted for 20.3% of the total prescriptions in FY 2020, and this proportion increased to 27.8% in FY 2022. Among all SGLT2 inhibitors, the tablet that expanded its indications for patients with heart failure and chronic kidney disease the earliest showed the largest percentage increase in the number of prescribed tablets during this period and the highest share of the elderly population in its recipients in both sexes (men, 35.9%; women, 49.4%) in FY 2022. The number of prescribed SGLT2 inhibitor tablets per population was constantly higher in men than in women between FY 2020 and 2022, which is consistent with the sex difference in the prevalence of these diseases. Prescription of SGLT2 inhibitors to the elderly population is no longer infrequent and accounts for a large portion of the entire prescription of SGLT2 inhibitors in Japan. These findings contribute to updating our perception on the demographics of SGLT2 inhibitor recipients.', metadata={'similarity_score': 0.4158058762550354, 'retrieval_method': 'knowledge_base_expansion'}, id='PMC1748704682')"", ""Document(page_content='Cardiac fibrosis occurs in a wide range of cardiac diseases and is characterised by the transdifferentiation of cardiac fibroblasts into myofibroblasts these cells produce large quantities of extracellular matrix, resulting in myocardial scar. The profibrotic process is multi-factorial, meaning identification of effective treatments has been limited. The antifibrotic effect of the bile acid ursodeoxycholic acid (UDCA) is established in cases of liver fibrosis however its mechanism and role in cardiac fibrosis is less well understood. In this study, we used cellular models of cardiac fibrosis and living myocardial slices to characterise the macroscopic and cellular responses of the myocardium to UDCA treatment. We complemented this approach by conducting RNA-seq on cardiac fibroblasts isolated from dilated cardiomyopathy patients. This allowed us to gain insights into the mechanism of action and explore whether the IL-11 and TGFβ/WWP2 profibrotic networks are influenced by UDCA. Finally, we used fibroblasts from a TGR5 KO mouse to confirm the mechanism of action. We found that UDCA reduced myofibroblast markers in rat and human fibroblasts and in living myocardial slices, indicating its antifibrotic action. Furthermore, we demonstrated that the treatment of UDCA successfully reversed the profibrotic IL-11 and TGFβ/WWP2 gene networks. We also show that TGR5 is the most highly expressed UDCA receptor in cardiac fibroblasts. Utilising cells isolated from a TGR5 knock-out mouse, we identified that the antifibrotic effect of UDCA is attenuated in the KO fibroblasts. This study combines cellular studies with RNA-seq and state-of-the-art living myocardial slices to offer new perspectives on cardiac fibrosis. Our data confirm that TGR5 agonists, such as UDCA, offer a unique pathway of action for the treatment of cardiac fibrosis. Medicines for cardiac fibrosis have been slow to clinic and have the potential to be used in the treatment of multiple cardiac diseases. UDCA is well tolerated in the treatment of other diseases, indicating it is an excellent candidate for further in-human trials.', metadata={'similarity_score': 0.399313747882843, 'retrieval_method': 'knowledge_base_expansion'}, id='PMC11650366')"", ""Document(page_content='Inhibitors of the interaction between Neuropilin-1 (NRP-1) and Vascular Endothelial Growth Factor-A 165 165 2 2 50 50 2 2 50 165 The online version contains supplementary material available at 10.1007/s00726-024-03411-8.', metadata={'similarity_score': 0.3791380226612091, 'retrieval_method': 'knowledge_base_expansion'}, id='PMC11344719')"", ""Document(page_content='Congenital heart defects occur in approximately 1% of newborns in the US annually. Currently, less than a third of congenital heart defects can be traced to a known genetic or environmental cause, suggesting that a large proportion of disease-causing mechanisms have yet to be fully characterized. Hemodynamic forces such as wall shear stress are critical for heart development and are known to induce changes in embryonic cardiac patterning leading to malformations. However, measuring these hemodynamic factors  in vivo in silico', metadata={'similarity_score': 0.37410375475883484, 'retrieval_method': 'knowledge_base_expansion'}, id='PMC1748215490')"", ""Document(page_content='Cardiometabolic syndromes including diabetes and obesity are associated with occurrence of heart failure with diastolic dysfunction. There are no specific treatments for diastolic dysfunction, and therapies to manage symptoms have limited efficacy. Understanding of the cardiomyocyte origins of diastolic dysfunction is an important priority to identify new therapeutics. The investigative goal was to experimentally define  in vitro in vivo vs E e E e in vitro in vivo vs \\n Understanding cardiomyocyte stiffness components is an important priority for identifying new therapeutics for diastolic dysfunction, a key feature of cardiometabolic disease. In this study cardiac function was measured  in vivo in vitro Calibrated cardiomyocyte stretches demonstrated that stiffness (stress/strain) was elevated in HFSD cardiomyocytes  in vitro E e in vivo Data show unequivocally that cardiomyocyte mechanical dysfunction cannot be detected by analysis of non‐loaded shortening. These findings suggest that stretch‐dependent augmentation of the myofilament–Ca Understanding cardiomyocyte stiffness components is an important priority for identifying new therapeutics for diastolic dysfunction, a key feature of cardiometabolic disease. In this study cardiac function was measured  in vivo in vitro Calibrated cardiomyocyte stretches demonstrated that stiffness (stress/strain) was elevated in HFSD cardiomyocytes  in vitro E e in vivo Data show unequivocally that cardiomyocyte mechanical dysfunction cannot be detected by analysis of non‐loaded shortening. These findings suggest that stretch‐dependent augmentation of the myofilament–Ca', metadata={'similarity_score': 0.36695200204849243, 'retrieval_method': 'knowledge_base_expansion'}, id='PMC11649524')"", ""Document(page_content='Atherosclerosis (AS) is a chronic inflammatory disease characterized by the gradual accumulation of plaques in arterial walls, with its pathogenesis remaining incompletely understood. Recent studies have highlighted that development of AS is closely associated with the aberrant activation of the NLRP3 inflammasome in the arteries. Inhibition of the NLRP3 inflammasome by natural products and formulae derived from Chinese herbal medicines (CHMs) has been shown to alleviate AS-associated pathologies. However, therapies that effectively and safely target the NLRP3 inflammasome remain limited. This review aims to summarize the key discoveries from recent studies on the effects of these natural products and formulae on the NLRP3 inflammasome in the context of AS treatment. A comprehensive literature search was conducted on databases such as PubMed/MEDLINE up to January 2025, yielding 38 eligible studies. Our analysis indicates that certain therapies can effectively prevent arterial inflammation in animal models by targeting multiple pathways and mechanisms related to the NLRP3 inflammasome. This review summarizes the primary findings of these studies, focusing on the therapeutic effects and underlying mechanisms of action. Based on these insights, we propose future strategies to enhance the efficacy, specificity, and safety of existing natural products and formulae for AS treatment. Additionally, this study offers a perspective for future research that may enhance our understanding of the roles and the mechanisms of CHM-derived phytochemicals and formulae in regulating the NLRP3 inflammasome and treating AS.', metadata={'similarity_score': 0.3621019423007965, 'retrieval_method': 'knowledge_base_expansion'}, id='PMC1748704493')"", ""Document(page_content='The enzyme arginase catalyzes the hydrolysis of  l l l l l Arg1 Arg2 Further basic and translational research is needed to deepen our understanding of the regulation of Arg1 and Arg2 in different cell types in consideration of their localization, species-specificity, and multiple biochemical and physiological roles. This will lead to better pharmacological strategies to target arginase activity in liver, cardiovascular, hematological, immune/infectious diseases, and cancer.', metadata={'similarity_score': 0.3599577844142914, 'retrieval_method': 'knowledge_base_expansion'}, id='PMC1748704617')""]","ACE inhibitors treat heart failure by blocking the conversion of angiotensin I to angiotensin II, which reduces vasoconstriction and aldosterone production, decreases afterload and preload, improves cardiac output, and ultimately reduces mortality and hospitalizations in patients with heart failure with reduced ejection fraction.",1.9128880500793457,10,True,,,,,,,,0.0,1214,0
crag,How do glucocorticoids suppress inflammation?,"Glucocorticoids suppress inflammation by exerting anti-inflammatory effects on various immune cells and signaling pathways. Glucocorticoids are a class of steroid hormones that are produced endogenously in the body or can be administered exogenously as medications. These hormones bind to glucocorticoid receptors present on immune cells, including macrophages, T cells, and B cells, as well as non-immune cells, such as epithelial cells and endothelial cells.

When glucocorticoids bind to their receptors, they modulate gene expression, leading to the inhibition of pro-inflammatory cytokines, such as interleukin-1 (IL-1), interleukin-6 (IL-6), and tumor necrosis factor-alpha (TNF-alpha). Additionally, glucocorticoids promote the expression of anti-inflammatory proteins, such as interleukin-10 (IL-10) and lipocortin-1, which help resolve inflammation and promote tissue repair.

Glucocorticoids also inhibit the activity of key transcription factors involved in inflammation, such as nuclear factor-kappa B (NF-kB) and activator protein-1 (AP-1). These transcription factors play a central role in the expression of pro-inflammatory genes and are critical for the initiation and propagation of the inflammatory response.

Furthermore, glucocorticoids have been shown to suppress the migration of immune cells to sites of inflammation, reduce the production of inflammatory mediators, such as prostaglandins and leukotrienes, and inhibit the activation of inflammasomes, such as the NLRP3 inflammasome, which is implicated in the pathogenesis of diseases like atherosclerosis.

In conclusion, glucocorticoids exert their anti-inflammatory effects by modulating gene expression, inhibiting pro-inflammatory cytokines and transcription factors, promoting the expression of anti-inflammatory proteins, and suppressing the migration and activation of immune cells. The information provided in the documents did not directly address the mechanism of action of glucocorticoids in suppressing inflammation, so the response is based on broader search results and general knowledge of glucocorticoid biology.","[""Document(page_content='Fucoxanthin (Fx), a natural carotenoid predominantly found in brown algae and certain microalgae, has garnered significant attention in recent years for its potent antioxidant and anti-inflammatory properties. As inflammation and oxidative stress represent fundamental physiological responses that play pivotal roles in disease pathogenesis, their intricate interplay has become a focus of scientific investigation. This study employed an LPS-induced THP-1 cell inflammation model to elucidate the anti-inflammatory mechanisms of fucoxanthin and its interaction with oxidative stress pathways. Our findings demonstrate that fucoxanthin effectively suppresses the LPS-induced secretion of pro-inflammatory mediators, including IL-1β, IL-6, iNOS, COX-2, and TNF-α, in THP-1 cells. Mechanistically, this effect is achieved through the inhibition of IκB-α phosphorylation, thereby blocking the activation of the NF-κB p65 signaling pathway. Concurrently, fucoxanthin exhibits robust antioxidant activity, as evidenced by enhanced catalase (CAT) and superoxide dismutase (SOD) activities coupled with reduced malondialdehyde (MDA) production. Furthermore, fucoxanthin activates the Nrf2 signaling pathway, leading to upregulated heme oxygenase-1 (HO-1) expression and the consequent attenuation of reactive oxygen species (ROS) generation. These results collectively indicate that fucoxanthin exerts dual protective effects through anti-inflammatory action mediated by NF-κB pathway inhibition and antioxidant activity via Nrf2/HO-1 pathway activation. The observed crosstalk between these pathways suggests that fucoxanthin’s therapeutic potential stems from its ability to simultaneously modulate interconnected inflammatory and oxidative stress responses. Our study provides compelling evidence that fucoxanthin’s antioxidant and anti-inflammatory activities are functionally interrelated, with the Nrf2 signaling pathway serving as a critical node in this protective mechanism against LPS-induced cellular damage.', metadata={'similarity_score': 0.42549756169319153, 'retrieval_method': 'knowledge_base_expansion'}, id='PMC1748704565')"", 'Document(page_content=""The immune response in the central nervous system (CNS) is a highly specialized and tightly regulated process essential for maintaining neural health and protecting against pathogens and injuries. The primary immune cells within the CNS include microglia, astrocytes, T cells, and B cells. They work together, continuously monitor the CNS environment for signs of infection, injury, or disease, and respond by phagocytosing debris, releasing cytokines, and recruiting other immune cells. In addition to providing neuroprotection, these immune responses must be carefully balanced to prevent excessive inflammation that can lead to neuronal damage and contribute to neurodegenerative diseases. Dysregulated immune responses in the CNS are implicated in various neurodegenerative diseases such as Alzheimer\'s disease, Parkinson\'s disease, and amyotrophic lateral sclerosis. Wnt signaling is a crucial pathway in the CNS that regulates various cellular processes critical for brain development, function, and maintenance. Despite enhancing immune responses in the health CNS, dysregulated Wnt signaling exacerbates neuroinflammation in the neurodegenerative brains. This review summarized the role of Wnt signaling in regulating immune response under different conditions. We then examined the role of immune response in healthy brains and during the development of neurodegenerative diseases. We also discussed therapeutic intervention in various neurodegenerative diseases through the modulation of the Wnt signaling pathway and neuroinflammation and highlighted challenges and limitations in current clinical trials."", metadata={\'similarity_score\': 0.39167100191116333, \'retrieval_method\': \'knowledge_base_expansion\'}, id=\'PMC11649390\')', ""Document(page_content='Atherosclerosis (AS) is a chronic inflammatory disease characterized by the gradual accumulation of plaques in arterial walls, with its pathogenesis remaining incompletely understood. Recent studies have highlighted that development of AS is closely associated with the aberrant activation of the NLRP3 inflammasome in the arteries. Inhibition of the NLRP3 inflammasome by natural products and formulae derived from Chinese herbal medicines (CHMs) has been shown to alleviate AS-associated pathologies. However, therapies that effectively and safely target the NLRP3 inflammasome remain limited. This review aims to summarize the key discoveries from recent studies on the effects of these natural products and formulae on the NLRP3 inflammasome in the context of AS treatment. A comprehensive literature search was conducted on databases such as PubMed/MEDLINE up to January 2025, yielding 38 eligible studies. Our analysis indicates that certain therapies can effectively prevent arterial inflammation in animal models by targeting multiple pathways and mechanisms related to the NLRP3 inflammasome. This review summarizes the primary findings of these studies, focusing on the therapeutic effects and underlying mechanisms of action. Based on these insights, we propose future strategies to enhance the efficacy, specificity, and safety of existing natural products and formulae for AS treatment. Additionally, this study offers a perspective for future research that may enhance our understanding of the roles and the mechanisms of CHM-derived phytochemicals and formulae in regulating the NLRP3 inflammasome and treating AS.', metadata={'similarity_score': 0.3767079710960388, 'retrieval_method': 'knowledge_base_expansion'}, id='PMC1748704493')"", ""Document(page_content='Dysregulated and excessive inflammatory reactions can lead to tissue damage, which is the underlying cause of most human diseases. Menisoxoisoaporphine A (MA), a novel oxoisoaporphine alkaloid, was obtained from Menispermi Rhizoma, a traditional Chinese medicinal herb used in the treatment of inflammatory conditions in clinical practice. This suggests that MA has very promising potential for the development of anti-inflammatory therapeutics. Hence, this study aims to investigate the anti-inflammatory effects and underlying mechanisms of MA. The anti-inflammatory effects of MA were evaluated in lipopolysaccharide (LPS)-induced mouse macrophage RAW264.7 cells. Its underlying mechanisms were explored through RNA sequencing and Western blotting. The binding modes and interactions sites between MA and phosphodiesterase 4B (PDE4B) were predicted using molecular docking and validated by molecular dynamics simulation. MA treatment significantly reduced LPS-induced morphological changes, inflammatory cytokine relesae, and proinflammatory genes expression in RAW264.7 cells compared to the LPS-induced controls. Transcriptome sequencing analysis suggested that PDE4B might be a key target for MA to exert its therapeutic effect. Mechanismly, MA directly acted on Tyr405 site of PDE4B, thus leading to a sustained elevation of the cyclic adenosine monophosphate (cAMP) levels, which subsequently inactivated NF-κB signaling pathway by phosphorylating protein kinase A (PKA). MA inhibited the NF-κB-mediated inflammatory response depending on PDE4B. MA, a natural and novel compound, exerted anti-inflammatory effects in LPS-induced RAW264.7 macrophage cells. It demonstrated a strong binding ability to the Tyr405 sites of PDE4B, thereby inhibiting NF-κB signaling pathway by regulating the cAMP-PKA axis. Elucidating the interaction between MA and PDE4B holds significant potential for the advancement of innovative therapeutic strategies aimed at inflammatory diseases. By strategically modulating this interaction, it may be feasible to achieve more precise regulation of inflammatory responses, thereby offering promising therapeutic benefits for conditions such as rheumatoid arthritis, asthma, and inflammatory bowel disease.', metadata={'similarity_score': 0.35597899556159973, 'retrieval_method': 'knowledge_base_expansion'}, id='PMC11649434')"", ""Document(page_content='Diet is a key modifiable risk factor in many chronic diseases, including age-related diseases. The Mediterranean diet (MedDiet) is an extensively studied dietary pattern which has been proposed as a lifestyle intervention to promote healthy aging in the general population, due to its numerous health benefits. Randomized controlled trials (RCTs) have attempted to explore the mechanism(s) by which the MedDiet exerts its beneficial effects on aging. One proposed mechanism is that the MedDiet helps to slow down a process called ‘inflamm-aging’, a type of chronic, low-grade inflammation which contributes to aging. To explore the evidence supporting this hypothesized mechanism, we conducted a scoping review of existing RCTs which used a MedDiet intervention and assessed at least one molecular outcome of potential relevance to inflamm-aging. We identified 14 papers representing 12 unique RCTs. Based on our findings, we present 10 recommendations for the next clinical trial of the MedDiet in inflamm-aging.', metadata={'similarity_score': 0.3516327738761902, 'retrieval_method': 'knowledge_base_expansion'}, id='PMC11649874')"", ""Document(page_content='Asthma is a chronic inflammatory lung disease driven by a complex interplay between innate and adaptive immune components. Among these, innate lymphoid cells (ILCs) and innate-like lymphocytes have emerged as crucial players in shaping the disease phenotype. Within the ILC family, group 2 ILCs (ILC2s), in particular, contribute significantly to type 2 inflammation through their rapid production of cytokines such as IL-5 and IL-13, promoting airway eosinophilia and airway hyperreactivity. On the other hand, innate-like lymphocytes such as invariant natural killer T (iNKT) cells can play either pathogenic or protective roles in asthma, depending on the stimuli and lung microenvironment. Regulatory mechanisms, including cytokine signaling, metabolic and dietary cues, and interactions with other immune cells, play critical roles in modulating their functions. In this review, we highlight current findings on the role of ILCs and innate-like lymphocytes in asthma development and pathogenesis. We also examine the underlying mechanisms regulating their function and their interplay with other immune cells. Finally, we explore current therapies targeting these cells and their effector cytokines for asthma management.', metadata={'similarity_score': 0.351427286863327, 'retrieval_method': 'knowledge_base_expansion'}, id='PMC1748704918')"", ""Document(page_content='Periodontitis is associated with numerous systemic diseases, and it has been shown that these associations are partly causal in nature. It is assumed that such interactions between periodontal and systemic diseases are also mediated via adipokines. Apelin, an adipokine about which there is little research in the dental field, is also produced together with its receptor in periodontal cells. The aim of this review was to summarize the currently available literature on the apelin-APJ system to better understand the pathomechanistic relationship between periodontitis and obesity and to determine the potential clinical relevance of apelin for diagnostics and therapy. In vitro studies suggest that apelin can enhance bacterial-induced synthesis of proinflammatory and proteolytic molecules, indicating a significant etiopathogenic role of this adipokine. Since serum levels of apelin are elevated in diabetes and/or obesity, it is possible that such systemic diseases promote the development and progression of periodontitis via apelin. On the other hand, it is also conceivable that apelin from the periodontium influences such systemic diseases. Further research is needed to better understand the role of apelin in the periodontium and the entire oral cavity, but also in the interactions between periodontal and systemic diseases. In particular, clinical intervention studies are needed to further decipher the etiopathogenic role of apelin in periodontitis.', metadata={'similarity_score': 0.34900763630867004, 'retrieval_method': 'knowledge_base_expansion'}, id='PMC11619819')"", ""Document(page_content='Adipose tissue inflammation is now considered to be a key process underlying metabolic diseases in obese individuals. However, it remains unclear how adipose inflammation is initiated and maintained or the mechanism by which inflammation develops. We found that  microRNA-802 Mir802 Mir802 Mir802 Mir802 Mir802 Mir802 Mir802', metadata={'similarity_score': 0.34825432300567627, 'retrieval_method': 'knowledge_base_expansion'}, id='PMC11651656')"", ""Document(page_content='To investigate inflammatory responses in peri-implant crevicular fluid (PICF) in comparison to periodontal tissue. Nineteen participants with healthy implants restored with titanium or gold-casting abutment were included. PICF and gingival crevicular fluid (GCF) were collected for inflammatory cytokine detection by ELISA. Cytokine levels in PICF or GCF of the same individual were compared using the paired t-test, and those from titanium or gold-casting (UCLA) abutment were compared using the independent t-test. Human gingival fibroblast responses to PICF and GCF were then evaluated with one-way ANOVA. The results demonstrated that IL-6, IL-8, TNFα, and IFNγ expressed in PICF are similar to GCF in the same individual. However, IL-1β (p = 0.032) and IL-1α (p = 0.030) was statistically significantly higher in PICF than in GCF. IL-8 level was statistically significantly higher with gold-casting than with titanium abutments (p = 0.003). PICF statistically significantly stimulated higher expression of RANKL, IL-1β, IL-6, and IL-8 mRNA in human gingival fibroblasts (HGF), while focal adhesion kinase (FAK) suppressed mRNA. The inflammatory cytokines, including IL-1α and IL-1β, are higher in healthy peri-implant tissues. Abutment materials may also influence the level of inflammatory cytokines in PICF. Inflammatory mediators in crevicular fluid may affect HGF inflammatory responses and peri-implant tissue integration.', metadata={'similarity_score': 0.34299561381340027, 'retrieval_method': 'knowledge_base_expansion'}, id='PMC11641046')"", ""Document(page_content='Long COVID is a debilitating condition that lasts for more than three months post-infection by SARS–CoV–2. On average, one in ten individuals infected with SARS CoV- 2 develops Long COVID worldwide. A knowledge gap exists in our understanding of the mechanisms, genetic risk factors, and biomarkers that could be associated with Long COVID. In this pilot study we used RNA-Seq to quantify the transcriptomes of peripheral blood mononuclear cells isolated from COVID-recovered individuals, seven with and seven without Long COVID symptoms (age- and sex-matched individuals), on average 6 months after infection. Seventy genes were identified as significantly up- or down-regulated in Long COVID samples, and the vast majority were downregulated. The most significantly up- or downregulated genes fell into two main categories, either associated with cell survival or with inflammation. This included genes such as  ICOS S1PR1 LILRB1 LILRB2 LILRB1 LILRB2 Downregulation of these inhibitory receptors similarly indicates a sustained pro-inflammatory state in Long COVID PBMCs.  LILRB1 LILRB2', metadata={'similarity_score': 0.3359605073928833, 'retrieval_method': 'knowledge_base_expansion'}, id='PMC11649547')""]","Glucocorticoids suppress inflammation by binding to cytoplasmic glucocorticoid receptors that translocate to the nucleus, where they suppress pro-inflammatory gene transcription and induce anti-inflammatory protein expression.",5.0886549949646,10,True,,,,,,,,0.0,2105,0
crag,What are the mechanisms of antibiotic resistance?,"Based on the provided documents, the mechanisms of antibiotic resistance are primarily attributed to the presence of antibiotic resistance genes (ARGs) in bacteria. These ARGs limit the susceptibility of bacteria to antimicrobials, leading to the emergence of antimicrobial-resistant bacteria. Document 1 mentions the emergence of carbapenem-resistant Klebsiella pneumoniae as a contributing factor to antimicrobial resistance. Document 3 highlights the importance of studying the presence of ARGs in various environments, including humans, livestock, hospitals, wastewater, workplaces, and households. This suggests that ARGs are widespread and can be acquired from different sources.

Additionally, Document 4 emphasizes that bacterial resistance to antibiotics poses a significant clinical challenge, leading to high rates of morbidity and mortality. This indicates that antibiotic resistance is a serious global health concern that requires urgent attention. Document 5 further highlights the global epidemic of multidrug-resistant Klebsiella pneumoniae, which further exemplifies the growing issue of antibiotic resistance.

While the documents provide insights into the presence and impact of antibiotic resistance, there is limited detailed information on the specific mechanisms of action by which bacteria acquire resistance genes. Further research and studies are needed to fully understand the complex mechanisms of antibiotic resistance and develop effective strategies to combat this growing threat.","[""Document(page_content='Antimicrobial resistance has recently increased due to emerging carbapenem-resistant  Klebsiella pneumoniae K. pneumoniae K. pneumoniae K. pneumoniae I K. pneumoniae P P K. pneumoniae', metadata={'similarity_score': 0.5274835228919983, 'retrieval_method': 'initial_vector_similarity'}, id='PMC11650459')"", ""Document(page_content='The increasing prevalence of antimicrobial-resistant (AMR) bacteria in humans, animals, and the environment underscores the necessity for a rapid, sensitive, and specific method to identify resistance genes.  Objectives tet Enterococcus Methodology tet tet Enterococcus Results: tet tet Conclusions tet', metadata={'similarity_score': 0.5204377174377441, 'retrieval_method': 'initial_vector_similarity'}, id='PMC1748704576')"", ""Document(page_content='The antibiotic resistance genes (ARGs) limit the susceptibility of bacteria to antimicrobials, representing a problem of high importance. Current research on the presence of ARGs in microorganisms focuses mainly on humans, livestock, hospitals, or wastewater. However, the spectrum of ARGs in the dust resistome in workplaces and households has gone relatively unexplored. This pilot study aimed to analyze resistome in indoor dust samples from participants’ workplaces (a pediatric hospital, a maternity hospital, and a research center) and households and compare two different approaches to the ARGs analysis; high-throughput quantitative PCR (HT-qPCR) and whole metagenome shotgun sequencing (WMGS). In total, 143 ARGs were detected using HT-qPCR, with ARGs associated with the macrolides, lincosamides, and streptogramin B (MLSB) phenotype being the most abundant, followed by MDR (multi-drug resistance) genes, and genes conferring resistance to aminoglycosides. A higher overall relative quantity of ARGs was observed in indoor dust samples from workplaces than from households, with the pediatric hospital being associated with the highest relative quantity of ARGs. WMGS analysis revealed 36 ARGs, of which five were detected by both HT-qPCR and WMGS techniques. Accordingly, the efficacy of the WMGS approach to detect ARGs was lower than that of HT-qPCR. In summary, our pilot data revealed that indoor dust in buildings where people spend most of their time (workplaces, households) can be a significant source of antimicrobial-resistant microorganisms, which may potentially pose a health risk to both humans and animals.', metadata={'similarity_score': 0.5106244683265686, 'retrieval_method': 'initial_vector_similarity'}, id='PMC11649746')"", ""Document(page_content='Bacterial resistance to antibiotics remains a significant clinical challenge, contributing to persistently high rates of morbidity and mortality. Achieving treatment success is increasingly difficult, necessitating the evaluation of new antibiotics and complementary approaches, including source control and alternative therapies. This study aimed to investigate the antibacterial, antioxidant, cytotoxic, and phytochemical properties of  Moringa oleifera Moringa oleifera', metadata={'similarity_score': 0.5007250308990479, 'retrieval_method': 'initial_vector_similarity'}, id='PMC11649684')"", ""Document(page_content='In combating the global epidemic of multidrug-resistant  Klebsiella pneumoniae', metadata={'similarity_score': 0.4493861794471741, 'retrieval_method': 'initial_vector_similarity'}, id='PMC1748704668')"", ""Document(page_content='Antifungal resistance and tolerance are distinct responses exhibited by fungi when exposed to drugs. While considerable research has focused on azole tolerance in the human pathogen  Candida albicans This study aims to conduct a comparative investigation of the adaptation of the model organism  Saccharomyces cerevisiae C. albicans in vitro We performed experiments using laboratory strains of  S. cerevisiae C. albicans Our results revealed that fluconazole tolerance is present in wild-type strains of  S. cerevisiae C. albicans S. cerevisiae Transcriptome analysis indicated that petites up-regulated efflux mechanisms while down-regulating most  ERG C. albicans S. cerevisiae', metadata={'similarity_score': 0.4418497383594513, 'retrieval_method': 'initial_vector_similarity'}, id='PMC1748215508')"", ""Document(page_content='Carbapenem-resistant  Klebsiella pneumoniae K pneumoniae P', metadata={'similarity_score': 0.3942090570926666, 'retrieval_method': 'initial_vector_similarity'}, id='PMC11651494')"", ""Document(page_content='Alternative feed additives are being investigated due to the restriction of antibiotics use to decrease antimicrobial resistance (AMR) in food-producing animals. This study investigated the effects of dietary American cranberry ( Vaccinium macrocarpon V. angustifolium p Lactobacillus Bacteroides cepA MACROLIDE) InuD tetO tetX', metadata={'similarity_score': 0.3886691629886627, 'retrieval_method': 'initial_vector_similarity'}, id='PMC1748704534')"", ""Document(page_content='Pseudomonas aeruginosa P. aeruginosa in vivo', metadata={'similarity_score': 0.3880845010280609, 'retrieval_method': 'initial_vector_similarity'}, id='PMC11650763')"", ""Document(page_content='Opportunistic pathogen  Pseudomonas aeruginosa N P. aeruginosa', metadata={'similarity_score': 0.38696128129959106, 'retrieval_method': 'initial_vector_similarity'}, id='PMC1748705009')""]","Bacteria develop antibiotic resistance through target gene mutations, horizontal gene transfer of resistance genes via plasmids or transposons, and expression of efflux pumps that remove antibiotics from the cell.",2.166229009628296,10,True,,,,,,,,0.0,1512,0
crag,How do biologics treat rheumatoid arthritis?,"Biologics are a type of medication that is commonly used to treat rheumatoid arthritis (RA). Biologics work by targeting specific proteins in the body that are involved in the inflammatory process that leads to joint damage and pain in RA patients. These medications are often used in patients who have not responded well to traditional disease-modifying antirheumatic drugs (DMARDs).

Document 1 discusses the use of biologics or target synthetic DMARDs in treating knee joint symptoms in patients with RA. This study focuses on factors influencing the alleviation of knee joint symptoms in patients who were treated with these medications. This suggests that biologics can effectively target joint symptoms in RA patients, providing relief from swelling and tenderness.

Document 2 mentions the use of a natural compound called Usenamine A (UA) in treating RA and ankylosing spondylitis (AS) patients. This compound was found to have effects on cell viability and inflammatory markers in these patients. While this document does not directly mention biologics, it does highlight the importance of targeting inflammatory processes in treating RA.

Document 3 discusses the use of inflammatory markers in predicting infection risk after joint arthroplasty in patients with RA. This information suggests that controlling inflammation is crucial in managing RA and preventing complications such as infection.

Document 4 explores the potential link between Hepatitis C Virus (HCV) infection and the risk of developing RA. While the exact relationship between HCV infection and RA remains unclear, this document underscores the importance of considering other health conditions that may impact RA treatment.

Document 5 discusses the treatment of Chronic active Epstein-Barr Virus disease, which is associated with T/NK cell lymphoproliferative disease. While this document does not directly relate to RA treatment, it emphasizes the importance of controlling inflammatory responses and immune function in managing autoimmune diseases like RA.

In conclusion, biologics are a type of medication that target specific proteins involved in the inflammatory process in RA. These medications are effective in alleviating joint symptoms and improving quality of life in RA patients. While the information provided in the documents is somewhat limited and does not fully explain the mechanism of action of biologics in treating RA, it does highlight the importance of targeting inflammation in managing this condition.","[""Document(page_content='This study aims to identify factors influencing the alleviation of knee joint symptoms in patients with rheumatoid arthritis treated with biologic or target synthetic disease-modifying antirheumatic drugs (b/tsDMARDs). Among 2321 patients who started b/tsDMARDs between 2010 and 2023, we focused on 295 patients who had knee swelling or tenderness at the initiation of b/tsDMARDs and continued b/tsDMARDs at least 3 months, with recorded knee symptoms 6 months later. Symptom relief after 6 months was 78.2% for interleukin 6 (IL-6) inhibitors, 68.6% for Janus kinase (JAK) inhibitors, 65.8% for tumor necrosis factor (TNF) inhibitors, and 57.6% for cytotoxic T lymphocyte-associated antigen-4-Ig (CTLA4-Ig). The initial use of b/tsDMARDs and the use of IL-6 inhibitors in comparison to CTLA4-Ig emerged as a significant factor associated with the improvement of knee joint symptoms. Among 141 patients who underwent knee radiography at baseline and two years later, the deterioration in knee joint radiographs was 7.7% for IL-6 inhibitors, 6.3% for JAK inhibitors, 21.9% for TNF inhibitors, and 25.9% for CTLA4-Ig. The use of IL-6 inhibitors was a significant factor associated with the improvement of knee joint symptoms and the inhibition of joint destruction compared to CTLA4-Ig.', metadata={'similarity_score': 0.4930029511451721, 'retrieval_method': 'knowledge_base_expansion'}, id='PMC11220105')"", ""Document(page_content='Usenamine A (UA) is a natural compound isolated from the lichen  Usnea diffracta Molecular docking was performed between the 3D structure of UA and the TNF-TNFR2 complex. Peripheral blood mononuclear cells (PBMCs) from RA and AS patients were treated with UA, and cell viability was measured using the MTS assay and flow cytometry. The in vitro effects of co-culture with UA were determined by measuring inflammatory cytokines, including IFN-γ, IL-17A, and GM-CSF, using flow cytometry and enzyme-linked immunosorbent assay (ELISA). The in vivo effects of UA were evaluated using an arthritis mouse model. The docking complex of UA bound to the TNF-TNFR2 complex exhibited docking scores of −5.251 kcal/mol and −6.274 kcal/mol, confirming their active sites. UA did not affect cell viability and suppressed the production of inflammatory cytokines in the PBMCs of RA (IFN-γ, IL-17A, and GM-CSF) and AS (GM-CSF) patients. The ELISA also confirmed reduced cytokine levels in the co-culture of UA and PBMCs from RA or AS patients. In the arthritis mouse model, significantly reduced clinical and histological scores were observed in the UA treatment group. Our findings suggest that UA has potential as a binding target for TNF, suppresses inflammatory cytokines in PBMCs, and exhibits anti-inflammatory effects on arthritis in a mouse model.', metadata={'similarity_score': 0.4119069576263428, 'retrieval_method': 'knowledge_base_expansion'}, id='PMC11650205')"", ""Document(page_content='Preoperative levels of certain inflammatory markers in the blood can predict acute infection after primary total joint arthroplasty in patients without inflammatory disease, but whether they can do so in patients with rheumatoid arthritis is unclear. The objectives of this study were to determine whether, with appropriate cut‐off values, (1) preoperative levels of NLR predicted postoperative acute infection; and (2) preoperative plasma fibrinogen, monocyte‐lymphocyte ratio, C‐reactive protein or erythrocyte sedimentation rate predicted postoperative acute infection. We retrospectively analyzed 964 patients with rheumatoid arthritis who underwent primary total joint arthroplasty at our hospital between January 2010 and November 2020. We compared preoperative levels of inflammatory markers including neutrophil‐lymphocyte ratio (NLR), monocyte‐lymphocyte ratio (MLR), C‐reactive protein (CRP), erythrocyte sedimentation rate (ESR), plasma fibrinogen (FIB) between patients who suffered acute infection or not within 90\\u2009days after surgery. The ability of markers to predict infection was assessed in terms of the area under receiver operating characteristic curves (AUC) based on optimal cut‐off values determined from the Youden index. Among the 964 patients, 27 (2.8%) experienced acute infection. Preoperative levels of individual inflammatory markers predicted infection with the following AUCs and cut‐off values: NLR, 0.704 (cut‐off: 2.528); MLR, 0.608 (0.2317); CRP, 0.516 (4.125\\u2009mg/L); ESR, 0.533 (66.5\\u2009mm/h); and FIB, 0.552 (3.415\\u2009g/L). The neutrophil‐lymphocyte ratio showed diagnostic sensitivity of 92.6% and specificity of 43.3%, while the monocyte‐lymphocyte ratio showed sensitivity of 77.8% and specificity of 46.3%. The preoperative NLR shows some ability to predict acute infection after total joint arthroplasty in patients with rheumatoid arthritis. Monitoring this ratio, perhaps in conjunction with other markers not analyzed here, may be useful for optimizing the timing of surgery in order to minimize risk of postoperative infection.', metadata={'similarity_score': 0.37875431776046753, 'retrieval_method': 'knowledge_base_expansion'}, id='PMC11736523_gen_108')"", ""Document(page_content='Patients infected with Hepatitis C Virus (HCV) often present with rheumatic symptoms, but its link to rheumatoid arthritis (RA) remains unclear. The purpose of this cross-sectional study was to investigate whether HCV infection is related to the risk for RA in adults. We analyzed data from the 2017–2020 National Health and Nutrition Examination Survey (NHANES). HCV infection and RA status were determined through questionnaires. Covariates included gender, age, race, marital status, body mass index (BMI), high-sensitivity C-reactive protein (hs-CRP), and diabetes status. Multivariate logistic regression and subgroup analyses were used to assess the relationship between HCV infection and RA risk. In this population-based study involving 5,825 participants aged 18–80 years (including 485 RA patients), we observed a significantly higher prevalence of HCV infection in the RA group compared with non-RA controls. After adjusting for covariates, multivariate logistic regression showed that HCV infection was associated with an increased risk of RA (OR\\u2009=\\u20091.93; 95%CI\\u2009=\\u20091.07–3.50,  p This study demonstrates that HCV infection is associated with the risk of RA in adults, underscoring the potential value of HCV screening in RA patients for improved disease management. However, causal interpretation is limited by the cross-sectional design and reliance on self-reported data. The online version contains supplementary material available at 10.1186/s41927-025-00513-y.', metadata={'similarity_score': 0.37419262528419495, 'retrieval_method': 'knowledge_base_expansion'}, id='PMC1748704621')"", ""Document(page_content='Chronic active Epstein-Barr Virus disease is a kind of Epstein-Barr Virus associated T/NK cell lymphoproliferative disease. At present, there is still a lack of standard therapeutic regimen for its treatment, but its basic treatment principles include controlling inflammatory response, anti-tumor proliferation, and immune reconstitution. Hematopoietic stem cell transplantation is currently the only method that can cure this disease. In recent years, immunotherapy has developed rapidly and is widely used in the treatment of various hematological malignancies; various immunotherapy drugs, including PD-1 inhibitors, have also demonstrated their safety and efficacy in CAEBV, while immune cell therapies such as Epstein- Barr virus-specific T cells have also displayed their unique advantages in CAEBV.', metadata={'similarity_score': 0.35887056589126587, 'retrieval_method': 'knowledge_base_expansion'}, id='PMC11649625')"", ""Document(page_content='The heterogeneity and suboptimal efficacy of biological treatments and small molecule drugs necessitate their precise selection based on biomarkers that predict therapeutic responses in inflammatory bowel disease. Recent studies have identified numerous novel biomarkers predictive of responses to biologics and small molecule modulators, utilizing a variety of omics approaches in inflammatory bowel disease. In this review, we systematically examine baseline omics biomarkers that predict responses to biological therapies and small molecule drugs, drawing on literature from PubMed. Our analysis spans multiple omics disciplines, including genomics, transcriptomics (both bulk RNA and single‐cell RNA sequencing), proteomics, microbiomics, and metabolomics, with particular emphasis on the impact of models integrating multiple omics datasets. Additionally, to further the field of precision medicine, we evaluated specific biomarkers that may exhibit distinct effects on responses to multiple therapeutic interventions.', metadata={'similarity_score': 0.35773834586143494, 'retrieval_method': 'knowledge_base_expansion'}, id='PMC1748215469')"", ""Document(page_content='Atherosclerosis (AS) is a chronic inflammatory disease characterized by the gradual accumulation of plaques in arterial walls, with its pathogenesis remaining incompletely understood. Recent studies have highlighted that development of AS is closely associated with the aberrant activation of the NLRP3 inflammasome in the arteries. Inhibition of the NLRP3 inflammasome by natural products and formulae derived from Chinese herbal medicines (CHMs) has been shown to alleviate AS-associated pathologies. However, therapies that effectively and safely target the NLRP3 inflammasome remain limited. This review aims to summarize the key discoveries from recent studies on the effects of these natural products and formulae on the NLRP3 inflammasome in the context of AS treatment. A comprehensive literature search was conducted on databases such as PubMed/MEDLINE up to January 2025, yielding 38 eligible studies. Our analysis indicates that certain therapies can effectively prevent arterial inflammation in animal models by targeting multiple pathways and mechanisms related to the NLRP3 inflammasome. This review summarizes the primary findings of these studies, focusing on the therapeutic effects and underlying mechanisms of action. Based on these insights, we propose future strategies to enhance the efficacy, specificity, and safety of existing natural products and formulae for AS treatment. Additionally, this study offers a perspective for future research that may enhance our understanding of the roles and the mechanisms of CHM-derived phytochemicals and formulae in regulating the NLRP3 inflammasome and treating AS.', metadata={'similarity_score': 0.35549992322921753, 'retrieval_method': 'knowledge_base_expansion'}, id='PMC1748704493')"", ""Document(page_content='Diet is a key modifiable risk factor in many chronic diseases, including age-related diseases. The Mediterranean diet (MedDiet) is an extensively studied dietary pattern which has been proposed as a lifestyle intervention to promote healthy aging in the general population, due to its numerous health benefits. Randomized controlled trials (RCTs) have attempted to explore the mechanism(s) by which the MedDiet exerts its beneficial effects on aging. One proposed mechanism is that the MedDiet helps to slow down a process called ‘inflamm-aging’, a type of chronic, low-grade inflammation which contributes to aging. To explore the evidence supporting this hypothesized mechanism, we conducted a scoping review of existing RCTs which used a MedDiet intervention and assessed at least one molecular outcome of potential relevance to inflamm-aging. We identified 14 papers representing 12 unique RCTs. Based on our findings, we present 10 recommendations for the next clinical trial of the MedDiet in inflamm-aging.', metadata={'similarity_score': 0.353916198015213, 'retrieval_method': 'knowledge_base_expansion'}, id='PMC11649874')"", ""Document(page_content='Antisense oligonucleotides, which are used to silence target genes, are gaining attention as a novel drug discovery modality for proteinopathies. However, while clinical trials for neurodegenerative diseases like amyotrophic lateral sclerosis have been conducted in recent years, the results have not always been favorable. The results from a Phase III trial of the antisense oligonucleotide, that is, tofersen, which targets  SOD1 FUS C9orf72', metadata={'similarity_score': 0.3524687588214874, 'retrieval_method': 'knowledge_base_expansion'}, id='PMC11651183')"", ""Document(page_content='Failure rate of meniscal repair can reach 25%. Multiple techniques have been used to increase meniscal healing, notably biological augmentation techniques. One of them is fibrin clot–augmented meniscal repair, which will be described in this video. This technique is indicated mainly for the lesions with a high failure rate. This includes large, horizontal, and radial tears and even for meniscal cysts, especially in a stable knee. This technique can also be used in revision meniscal suture when failure is no longer an option. Fibrin clot is prepared from sterile peripheral venous blood from the patient. A plastic syringe is used to stir the blood in a sterile glass container. The fibrin clot is then formed and washed rigorously with saline solution. Rolling the fibrin clot which is fixed to the syringe allows to give the fibrillar aspect of the clot. The formed fibrin clot is now solid enough to be manipulated and can be fixed to a vicryl suture thread allowing it to enter the knee and be fixed inside the meniscal lesion. The clot is wrapped inside the meniscal lesion with inside-out or outside-in suture technique. We used this technique for multiple types of lesions, like bucket handle meniscal tear, horizontal meniscal cleavage, parrot beak tear, and even in lesions within white-white zone. The postoperative protocol is the same as standard inside-out meniscal repair. This technique has been used in the literature with promising results. The fibrin clot–augmented meniscal repair is a demanding but promising technique. We need further follow-up to confirm its effectiveness. The author(s) attests that consent has been obtained from any patient(s) appearing in this publication. If the individual may be identifiable, the author(s) has included a statement of release or other written form of approval from the patient(s) with this submission for publication.', metadata={'similarity_score': 0.33213651180267334, 'retrieval_method': 'knowledge_base_expansion'}, id='PMC11752533_gen_191')""]","Biologics treat rheumatoid arthritis by targeting specific components of the immune system, such as blocking TNF or IL-6 signaling, or depleting B cells to reduce autoantibody production, thereby interrupting the inflammatory cascade that causes joint damage.",4.969438076019287,10,True,,,,,,,,0.0,2508,0
crag,What is the mechanism of action of levodopa in Parkinson's disease?,"Levodopa is a medication commonly used in the treatment of Parkinson's disease. The mechanism of action of levodopa involves its conversion into dopamine in the brain. Parkinson's disease is characterized by the loss of dopaminergic neurons in the substantia nigra, leading to a decrease in dopamine levels in the brain. Levodopa, as a precursor to dopamine, can cross the blood-brain barrier and be converted into dopamine in the remaining dopaminergic neurons, thus helping to alleviate the motor symptoms associated with Parkinson's disease.

Although the provided documents discuss various aspects of neurodegenerative diseases and treatment options, none of them specifically address the mechanism of action of levodopa in Parkinson's disease. Therefore, it is important to rely on established knowledge and research in the field of neurology to understand the pharmacological mechanism of levodopa in the context of Parkinson's disease.","[""Document(page_content='Parkinson’s disease (PD) is caused by the progressive loss of dopaminergic neurons in the substantia nigra. Neuroinflammation is considered a key factor contributing to the pathophysiology of PD. Current gold-standard therapies for PD provide only symptomatic relief without slowing disease progression, highlighting the need to develop new disease-modifying treatments. Metformin has been demonstrated to exert a neuroprotective role in several neurodegenerative disorders including PD. This study aimed to clarify the role of metformin as adjuvant therapy in patients with PD. Sixty patients with PD were divided into 2 groups (n = 30). Patients in group 1 received levodopa/carbidopa (250/25\\xa0mg) three times daily for 3\\xa0months plus placebo (Control group), while those in group 2 received levodopa/carbidopa (250/25\\xa0mg) three times daily and 500\\xa0mg metformin two times daily (Metformin group). Patients were assessed via Unified Parkinson’s Disease Rating Scale (UPDRS). The serum concentrations of toll like receptor 4 (TLR-4), α-synuclein, brain derived neurotropic factor (BDNF), and high mobility group box 1 (HMGB-1) were measured before and after treatment. The improvement in UPDRS from baseline to 3\\xa0months. Change in the level of biological markers. The control group did not show significant difference in UPDRS when compared to their baseline value by Wilcoxon test ( P P P P While no significant differences in UPDRS scores were observed between the metformin and control groups, trends in biomarker changes suggest a potential impact of adjunctive metformin use on the underlying pathophysiology of PD. Further studies are needed to assess its effects on motor symptoms over a longer duration. identifier  NCT05781711', metadata={'similarity_score': 0.5565829873085022, 'retrieval_method': 'knowledge_base_expansion'}, id='PMC1748215544')"", ""Document(page_content='Parkinson’s disease (PD), the second most common neurodegenerative condition, is primarily characterized by motor dysfunctions due to dopaminergic neuronal loss in the Substantia Nigra (SN), with oxidative stress playing a significant role in its progression. This study investigates the neuroprotective potential of  Pelargonium graveolens in vitro 50 50 p.o l P. graveolens', metadata={'similarity_score': 0.50164395570755, 'retrieval_method': 'knowledge_base_expansion'}, id='PMC1748704826')"", ""Document(page_content='Deep brain stimulation (DBS) is an efficient treatment for movement disorders, most commonly Parkinson’s Disease (PD), dystonia and essential tremor. DBS surgery carries risks, e.g. the risk of delayed peri-lead edema (PLE) and the risk of postoperative cognitive decline. The mechanisms of these complications are not fully understood and there is no established biomarker to screen for these complications after DBS surgery. To explore the diagnostic value of two blood-based markers representative for distinct types of brain injury, we characterized the dynamics of serum glial fibrillary acidic protein (sGFAP, for glial injury) and serum neurofilament light chain (sNfL, for neuronal-axonal injury) following DBS surgery. We analyzed longitudinal dynamics of serum protein levels in 58 patients undergoing deep brain stimulation (DBS) at our center for half a year post-surgery. Serum GFAP responded much more rapidly after brain surgery, returning to baseline after weeks, whereas sNfL only returned to baseline after months. Patients with lower preoperative cognitive performance exhibited higher postoperative sGFAP levels, with sGFAP showing a stronger association with preoperative patient characteristics compared to sNfL. Further studies with long-term clinical follow-up are needed to fully evaluate the utility of sGFAP as a biomarker for both early and delayed complications after DBS surgery, including cognitive decline and potential foreign body reactions to the implanted lead.', metadata={'similarity_score': 0.40768522024154663, 'retrieval_method': 'knowledge_base_expansion'}, id='PMC1748215611')"", ""Document(page_content='Tic disorders represent a developmental neuropsychiatric condition whose causes can be attributed to a variety of environmental, neurobiological, and genetic factors. From a neurophysiological perspective, the disorder has classically been associated with neurochemical imbalances (particularly dopamine and serotonin) and structural and functional alterations affecting, in particular, brain areas and circuits involved in the processing and coordination of movements: the basal ganglia, thalamus, motor cortical area, and cingulate cortex; however, more recent research is demonstrating the involvement of many more brain regions and neurotransmission systems than previously observed, such as the prefrontal cortex and cerebellum. In this paper, therefore, we summarize the evidence to date on these abnormalities with the intent to illustrate and clarify the main neuroanatomical differences between patients with tic disorders and healthy individuals.', metadata={'similarity_score': 0.39718514680862427, 'retrieval_method': 'knowledge_base_expansion'}, id='PMC11649386')"", ""Document(page_content='Giant axonal neuropathy (GAN) is a progressive neurodegenerative disease affecting the peripheral and central nervous system and is caused by bi-allelic variants in the  GAN GAN The online version contains supplementary material available at 10.1007/s00415-024-12744-z.', metadata={'similarity_score': 0.3899630904197693, 'retrieval_method': 'knowledge_base_expansion'}, id='PMC11649756')"", ""Document(page_content='Bright light therapy (BLT) has been proved to have beneficial effects on Parkinson’s disease (PD), the mechanisms remained unclear. Improvements of visual pathways might be key to BLT. The aim of this study is to validate whether BLT improves clinical symptoms in PD and explore the possible mechanisms of visual pathways evaluated by optical coherence tomography (OCT), pattern electroretinogram (PERG) and visual evoked potentials (VEP). Twenty-three PD patients were enrolled in this crossover randomized placebo-controlled study. Participants received either one month of BLT or dim light therapy (DLT), separated by one-month wash-out period, followed by another intervention. Participants underwent clinical scales, and visual-related evaluations including OCT, PERG and VEP before and after each intervention. Mixed-effects regression models were used to determine the effect between BLT and DLT on improving the differentials of clinical scales (Δscales), OCT (Δretinal thickness), PERG (ΔPERG values) and VEP (ΔP100 latencies). Correlations between clinical symptoms and visual evaluations improvements were analyzed in PD patients receiving BLT. Excessive daytime sleepiness, anxiety, life quality and autonomic function were improved after BLT. Compared with DLT, bilateral ΔN95 latencies for PERG and ΔP100 latencies for VEP were improved after BLT. We did not observe the changes of four quadrants retinal nerve fiber layer (RNFL) thickness after BLT or DLT. BLT is a valuable and safe non-pharmacological intervention for improving visual function in PD patients. These findings extend neural mechanisms of BLT to visual pathways improvements. The online version contains supplementary material available at 10.1186/s12888-025-06915-z.', metadata={'similarity_score': 0.3650095462799072, 'retrieval_method': 'knowledge_base_expansion'}, id='PMC1748704900')"", 'Document(page_content=""An increasing body of evidence indicates altered DNA methylation in Parkinson\'s disease, yet the reproducibility and utility of such methylation changes are largely unexplored. We aimed to further elucidate the role of dysregulated DNA methylation in Parkinson\'s disease and to evaluate the biomarker potential of methylation‐based profiling. We conducted an epigenome‐wide association study (EWAS) in whole blood, including 280 Parkinson\'s disease and 279 control participants from Oslo, Norway. Next, we took advantage of data from the Parkinson\'s Progression Markers Initiative (PPMI) and a previously published EWAS to conduct a whole blood EWAS meta‐analysis in Parkinson\'s disease, incorporating results from a total of 3068 participants. Finally, we generated multiple methylation‐based scores for each Oslo and PPMI participant and tested their association with disease status, individually and in a joint multiscore model. In EWAS meta‐analysis, we confirm  SLC7A11 LPIN1 Our results highlight the power of DNA methylation profiling to capture multiple aspects of disease risk, indicating a biomarker potential for precision medicine in neurodegenerative disorders. The reproducibility of specific differentially methylated CpGs across data sets was limited but may improve if future studies are designed to account for disease stage and incorporate environmental exposure data."", metadata={\'similarity_score\': 0.34922072291374207, \'retrieval_method\': \'knowledge_base_expansion\'}, id=\'PMC11752535_gen_83\')', ""Document(page_content='Neurodegenerative disorders encompass a group of age‐related conditions characterized by the gradual decline in both the structure and functionality of the central nervous system (CNS). RNA modifications, arising from the epitranscriptome or RNA‐modifying protein mutations, have recently been observed to contribute significantly to neurodegenerative disorders. Specific modifications like N6‐methyladenine (m6A), N1‐methyladenine (m1A), 5‐methylcytosine (m5C), pseudouridine and adenosine‐to‐inosine (A‐to‐I) play key roles, with their regulators serving as crucial therapeutic targets. These epitranscriptomic changes intricately control gene expression, influencing cellular functions and contributing to disease pathology. Dysregulation of RNA metabolism, affecting mRNA processing and noncoding RNA biogenesis, is a central factor in these diseases. This review underscores the complex relationship between RNA modifications and neurodegenerative disorders, emphasizing the influence of RNA modification and the epitranscriptome, exploring the function of RNA modification enzymes in neurodegenerative processes, investigating the functional consequences of RNA modifications within neurodegenerative pathways, and evaluating the potential therapeutic advancements derived from assessing the epitranscriptome.', metadata={'similarity_score': 0.3291095793247223, 'retrieval_method': 'knowledge_base_expansion'}, id='PMC11649393')"", ""Document(page_content='Although a role of the thalamus in different arousal and awareness states is well established, there is a surprising lack of knowledge on subregional specificity within this complex, multinucleated structure of the diencephalon. In their recent paper ‘Extrasynaptic GABA-A receptors in central medial thalamus mediate anaesthesia in rats’, Muheyati et al. evaluated whether GABA A A A', metadata={'similarity_score': 0.31719547510147095, 'retrieval_method': 'knowledge_base_expansion'}, id='PMC11650603')"", ""Document(page_content='Antisense oligonucleotides, which are used to silence target genes, are gaining attention as a novel drug discovery modality for proteinopathies. However, while clinical trials for neurodegenerative diseases like amyotrophic lateral sclerosis have been conducted in recent years, the results have not always been favorable. The results from a Phase III trial of the antisense oligonucleotide, that is, tofersen, which targets  SOD1 FUS C9orf72', metadata={'similarity_score': 0.3171873986721039, 'retrieval_method': 'knowledge_base_expansion'}, id='PMC11651183')""]","Levodopa treats Parkinson's disease by crossing the blood-brain barrier and being converted to dopamine in the brain, helping to replenish depleted dopamine levels in the striatum and compensate for the loss of dopaminergic neurons in the substantia nigra.",1.6459901332855225,10,True,,,,,,,,0.0,942,0
colbert,What are the effects of metformin on type 2 diabetes?,Metformin helps lower glucose production in the liver and improves insulin sensitivity in patients with type 2 diabetes.,"[""Document(page_content='Common treatments for type 2 diabetes include lifestyle changes such as diet and exercise, oral medications like metformin, and in some cases, insulin therapy. Metformin is often the first-line medication prescribed for type 2 diabetes. It helps lower glucose production in the liver and improves insulin sensitivity.', metadata={'similarity_score': 0.6785211563110352, 'retrieval_method': 'colbert_vector_similarity'}, id='sample')"", ""Document(page_content='Diabetes mellitus (DM) is a prevalent condition that requires careful management in the perioperative setting to reduce surgical risks and optimize patient outcomes. The preoperative care of diabetic patients is complex because glucose control must be balanced with minimizing hypoglycemic or hyperglycemic events during surgery. A variety of diabetic medications such as insulin, dipeptidyl-peptidase-4 inhibitors, glucagon-like peptide-1 receptor agonists, sodium–glucose cotransporter-2 inhibitors, and biguanides such as metformin present unique challenges and considerations due to their different mechanisms, benefits, and potential adverse effects. In recent years, professional organizations have developed recommendations on the perioperative management of these therapies, although there remain some variations in guidelines related to medication cessation and dosage adjustments. Standardized protocols in preoperative DM care remain a topic of interest to ensure consistent and safe practices across healthcare settings, and further collaborative research efforts could provide clarity and consensus in managing this diverse patient population. The objective of this study was to provide an overview of guidelines and practices to support healthcare professionals in delivering improved preoperative care for diabetic patients. This initiative aims to enhance surgical outcomes and minimize the occurrence of complications. This is a comparative review that provides a systematic comparison of the similarities and differences in the guidelines and recommendations of three professional organizations along with Hamad Medical Corporation. All guidelines were from official websites including Hamad Medical Corporation. Although the reviewed guidelines for the preoperative care of diabetes patients share some similarities, there are also a number of differences due to outdated data and expert opinions, and therefore differ in practices around the world. While the key elements are agreed upon, more research and global collaboration are needed to create consistent guidelines and improve patient outcomes.', metadata={'similarity_score': 0.5278230309486389, 'retrieval_method': 'colbert_vector_similarity'}, id='PMC1748704577')"", 'Document(page_content=""We report the case of a patient with type 2 diabetes mellitus (T2DM) on insulin therapy with a history of recurrent and severe hypoglycemia related to lipodystrophy with an uncommon clinical presentation. This was the case of a 67-year-old female with type 2 diabetes hospitalized for the exploration and management of severe and recurrent hypoglycemia. Her diabetes has been evolving since the age of 40 years and was complicated by minimal retinopathy. She was on premixed human insulin, administered through an insulin syringe for the last 17 years. She presented a history of well-controlled diabetes until five months back when she started to show a fluctuating blood glucose concentration, with episodes of unpredictable hypoglycemia occurring at variable times, with values inferior to 0.3 g/l associated with neurological features. Clinical examination revealed a swelling localized in the hypogastric region of the abdomen. It was painless, firm, not fixed to the underlying plans, without local inflammatory signs, and had appeared in the patient\'s preferred insulin injection site. Thus, we retained the diagnosis of insulin-induced lipohypertrophy. The patient has reported reusing needles for up to one week for economic reasons, and not frequently rotating insulin injection sites. The patient found a less painful injection in the lipohypertrophic area, and she continued to inject insulin into that zone, leading to its progressive enlargement. Therapeutic management consisted of switching the patient to insulin analogs and resuming education concerning the correct injection techniques. The insulin injection technique continues to be suboptimal in many insulin-treated patients, and our case emphasizes the need for improved awareness and education."", metadata={\'similarity_score\': 0.4415596127510071, \'retrieval_method\': \'colbert_vector_similarity\'}, id=\'PMC11650328\')', ""Document(page_content='Glucagon-like peptide-1 (GLP-1) receptor agonists and the dual GLP-1- and glucose-dependent insulinotropic polypeptide receptor co-agonist tirzepatide (referred to here collectively as “GLP-1-based therapy”) are incretin-based therapies being used increasingly in the management of both type 2 diabetes and obesity. They are now recognized to have beneficial effects beyond improved glycemic control and weight loss, including cardiovascular and renal protection. GLP-1-based therapy also slows gastric emptying, which has benefits (lowering postprandial glucose), but also potential risks (eg, hypoglycemia in individuals on insulin or sulphonylurea therapy). Their effects on the gallbladder may also be beneficial, contributing to reducing postprandial triglycerides, but they also potentially increase the risk of biliary disease. In this review, we summarize the effects of GLP-1 and incretin-based therapeutics on gastric, biliary and small intestinal function. An improved understanding of these effects will optimize the use of these drugs.', metadata={'similarity_score': 0.43702104687690735, 'retrieval_method': 'colbert_vector_similarity'}, id='PMC11630531')"", ""Document(page_content='Lifestyle intervention prevents or delays type 2 diabetes (T2D) in subjects at a high risk of T2D. However, it is not known whether genetic variants modify the effect on incident T2D during lifestyle intervention. To investigate whether a low or high genetic risk has effects on incident T2D in a group-based lifestyle intervention study. The T2D-GENE trial involved 973 men from the Metabolic Syndrome in Men (METSIM) cohort, aged 50-75 years, body mass index ≥25 kg/m The intervention significantly lowered the risk of T2D among the participants with a high genetic risk for T2D [hazards ratio (HR) 0.30, 95% confidence interval (CI) 0.16-0.56,  P P P Our results showed that individuals with a high genetic risk for T2D benefitted from a low-cost group-based intervention focusing on healthy diet and physical activity. Therefore, all individuals at risk of T2D should be encouraged to make lifestyle changes regardless of genetic risk.', metadata={'similarity_score': 0.43200013041496277, 'retrieval_method': 'colbert_vector_similarity'}, id='PMC11651687')"", ""Document(page_content='This study measured serum hypoxia--inducible factor-1 (HIF-1α) and\\nsurvivin levels in patients with diabetes and investigated their association\\nwith the severity of retinopathy. This study included 88 patients with type 2 diabetes mellitus who underwent\\nroutine eye examinations. Three groups were created. Group 1 consisted of\\npatients without diabetic retinopathy. Group 2 included patients with\\nnon-proliferative diabetic retinopathy. Group 3 included patients with\\nproliferative diabetic retinopathy. To measure serum HIF-1α and\\nsurvivin levels, venous blood samples were collected from patients. The mean HIF-1α levels in groups 1, 2, and 3 were 17.30 ± 2.19,\\n17.79 ± 2.34, and 14.19 ± 2.94 pg/ml, respectively.\\nSignificant differences were detected between groups 1 and 3 (p=0.01) and\\nbetween groups 2 and 3 (p=0.01). The mean survivin levels in groups 1, 2,\\nand 3 were 42.65 ± 5.37, 54.92 ± 5.55, and 37.46 ± 8.09\\npg/ml, respectively. A significant difference was only detected between\\ngroups 2 and 3 (p=0.002). The present study revealed that serum HIF-1α and survivin levels are\\nincreased in patients with non-proliferative diabetic retinopathy compared\\nto those in patients without diabetic retinopathy.', metadata={'similarity_score': 0.4035956561565399, 'retrieval_method': 'colbert_vector_similarity'}, id='PMC11622444')"", ""Document(page_content='Indications for sodium-glucose cotransporter-2 (SGLT2) inhibitors have expanded to include heart failure and chronic kidney disease after the year 2020. Whether and how the demographic trends in the prescription of SGLT2 inhibitors have changed after the expansion of indications have not been studied extensively. This study is a descriptive analysis of serial, cross-sectional data on nationwide prescription of SGLT2 inhibitors between April 2016 and March 2023 obtained from NDB Open Data Japan, which contains more than 95% of total health insurance reimbursement claims in the nation. The total number of SGLT2 inhibitor tablets prescribed in outpatient settings with prescriptions papers increased from 577,996,158 tablets in fiscal year (FY) 2020 to 904,598,175 tablets in FY 2022. Patients aged 75 years and older accounted for 20.3% of the total prescriptions in FY 2020, and this proportion increased to 27.8% in FY 2022. Among all SGLT2 inhibitors, the tablet that expanded its indications for patients with heart failure and chronic kidney disease the earliest showed the largest percentage increase in the number of prescribed tablets during this period and the highest share of the elderly population in its recipients in both sexes (men, 35.9%; women, 49.4%) in FY 2022. The number of prescribed SGLT2 inhibitor tablets per population was constantly higher in men than in women between FY 2020 and 2022, which is consistent with the sex difference in the prevalence of these diseases. Prescription of SGLT2 inhibitors to the elderly population is no longer infrequent and accounts for a large portion of the entire prescription of SGLT2 inhibitors in Japan. These findings contribute to updating our perception on the demographics of SGLT2 inhibitor recipients.', metadata={'similarity_score': 0.40297672152519226, 'retrieval_method': 'colbert_vector_similarity'}, id='PMC1748704682')"", ""Document(page_content='This study analyzes data from the 2009–2018 National Health and Nutrition Examination Survey (NHANES) to explore the relationship between the Aggregate Index of Systemic Inflammation (AISI), also referred to as the pan-immune-inflammation value (PIV), and Type 2 Diabetes Mellitus (T2DM) among adults in the United States. Furthermore, it evaluates the mediating effect of obesity indicators on this association. This study included 9,947 individuals from NHANES and applied appropriate weighting techniques. To examine the relationship between AISI and T2DM, we used various statistical models, including weighted multivariable logistic regression, smooth curve fitting, threshold effect analysis, subgroup analysis, trend tests, mediation analysis, and Shapley additive explanations (SHAP) models. This research included a total of 9,947 participants, with 3,220 diagnosed with T2DM, while 6,727 remained undiagnosed. Weighted multiple logistic regression with all covariates adjusted indicated that with every one-unit increment in AISI/1000, there was an 88.3% likelihood of T2DM occurrence (OR: 1.883, 95% CI: 1.378–2.571). The stratified analysis identified significant differences in this association based on age, biological sex, level of education, poverty-income ratio (PIR), tobacco consumption status, and body mass index (BMI). Interaction tests revealed a positive association between AISI and T2DM, apart from PIR, BMI, age, education attainment, race, gender, tobacco use status, Estimated Glomerular Filtration Rate(eGFR), platelet count, and high blood pressure, with none of the interaction p-values falling below 0.05. Nevertheless, the occurrence of cardiovascular disease (CVD) among participants may affect the strength of this relationship, where an interaction p-value was less than 0.05. Additionally, smoothing curve fitting revealed a nonlinear relationship between AISI and T2DM, marking a significant change at AISI/1000 of 0.21. Mediation analysis indicated that five obesity-related indicators—LAP, VAI, WHtR, WWI and ABSI — partly mediated the association between AISI/1000 and T2DM. An increase in AISI is associated with an elevated probability of T2DM, with obesity indicators potentially mediating this relationship. Reducing AISI and managing obesity may help prevent T2DM. However, with the cross-sectional design of this study, causal relationships cannot be established. Future research should utilize longitudinal studies to confirm these findings. \\n The online version contains supplementary material available at 10.1186/s12944-025-02589-4.', metadata={'similarity_score': 0.3747374415397644, 'retrieval_method': 'colbert_vector_similarity'}, id='PMC1748704811')"", ""Document(page_content='Parkinson’s disease (PD) is caused by the progressive loss of dopaminergic neurons in the substantia nigra. Neuroinflammation is considered a key factor contributing to the pathophysiology of PD. Current gold-standard therapies for PD provide only symptomatic relief without slowing disease progression, highlighting the need to develop new disease-modifying treatments. Metformin has been demonstrated to exert a neuroprotective role in several neurodegenerative disorders including PD. This study aimed to clarify the role of metformin as adjuvant therapy in patients with PD. Sixty patients with PD were divided into 2 groups (n = 30). Patients in group 1 received levodopa/carbidopa (250/25\\xa0mg) three times daily for 3\\xa0months plus placebo (Control group), while those in group 2 received levodopa/carbidopa (250/25\\xa0mg) three times daily and 500\\xa0mg metformin two times daily (Metformin group). Patients were assessed via Unified Parkinson’s Disease Rating Scale (UPDRS). The serum concentrations of toll like receptor 4 (TLR-4), α-synuclein, brain derived neurotropic factor (BDNF), and high mobility group box 1 (HMGB-1) were measured before and after treatment. The improvement in UPDRS from baseline to 3\\xa0months. Change in the level of biological markers. The control group did not show significant difference in UPDRS when compared to their baseline value by Wilcoxon test ( P P P P While no significant differences in UPDRS scores were observed between the metformin and control groups, trends in biomarker changes suggest a potential impact of adjunctive metformin use on the underlying pathophysiology of PD. Further studies are needed to assess its effects on motor symptoms over a longer duration. identifier  NCT05781711', metadata={'similarity_score': 0.3742445111274719, 'retrieval_method': 'colbert_vector_similarity'}, id='PMC1748215544')"", ""Document(page_content='Assessments for hyperglycemia are vital to pregnancy and postpartum (PP) care, but gold-standard oral glucose tolerance tests (OGTTs) are burdensome. We examined changes in 1,5 anhydroglucitol (1,5AG) levels during gestation and PP and assessed for associations with other measures of glycemia. Pregnant participants (n = 50) in the Study of Pregnancy Regulation of Insulin and Glucose cohort underwent OGTTs at a mean of 13 weeks ([visit 1 (V1)] and 26 weeks [visit 2 (V2)] of gestation and PP. Nonpregnant controls had a single OGTT. 1,5AG was measured using frozen plasma samples. Changes in 1,5AG across pregnancy were assessed with longitudinal mixed effects linear models. We assessed relationships between 1,5AG and glycemia at each timepoint using Spearman correlations and linear regression models. To determine the relationship of 1,5AG with breastfeeding (BF) status, stratified analyses were performed. 1,5AG decreased from V1 to V2 (β = −3.6\\u2005μg/mL,  P P P P P P P 1,5AG decreases during gestation and remains low PP. Breastfeeding is associated with lower 1,5AG levels, indicating plausible excretion into breastmilk. 1,5AG is unlikely to be useful in assessing glycemia in pregnant or PP women.', metadata={'similarity_score': 0.3416031002998352, 'retrieval_method': 'colbert_vector_similarity'}, id='PMC11635448')""]",Metformin helps treat type 2 diabetes by reducing glucose production in the liver and increasing insulin sensitivity in peripheral tissues.,0.9762482643127441,10,True,,,,,,,,0.0,120,0
colbert,How does SGLT2 inhibition affect kidney function?,"SGLT2 inhibition has been shown to affect kidney function positively, as indicated by the expansion of indications for SGLT2 inhibitors to include heart failure and chronic kidney disease. The use of SGLT2 inhibitors has been associated with improved kidney function in patients with these conditions.","[""Document(page_content='Indications for sodium-glucose cotransporter-2 (SGLT2) inhibitors have expanded to include heart failure and chronic kidney disease after the year 2020. Whether and how the demographic trends in the prescription of SGLT2 inhibitors have changed after the expansion of indications have not been studied extensively. This study is a descriptive analysis of serial, cross-sectional data on nationwide prescription of SGLT2 inhibitors between April 2016 and March 2023 obtained from NDB Open Data Japan, which contains more than 95% of total health insurance reimbursement claims in the nation. The total number of SGLT2 inhibitor tablets prescribed in outpatient settings with prescriptions papers increased from 577,996,158 tablets in fiscal year (FY) 2020 to 904,598,175 tablets in FY 2022. Patients aged 75 years and older accounted for 20.3% of the total prescriptions in FY 2020, and this proportion increased to 27.8% in FY 2022. Among all SGLT2 inhibitors, the tablet that expanded its indications for patients with heart failure and chronic kidney disease the earliest showed the largest percentage increase in the number of prescribed tablets during this period and the highest share of the elderly population in its recipients in both sexes (men, 35.9%; women, 49.4%) in FY 2022. The number of prescribed SGLT2 inhibitor tablets per population was constantly higher in men than in women between FY 2020 and 2022, which is consistent with the sex difference in the prevalence of these diseases. Prescription of SGLT2 inhibitors to the elderly population is no longer infrequent and accounts for a large portion of the entire prescription of SGLT2 inhibitors in Japan. These findings contribute to updating our perception on the demographics of SGLT2 inhibitor recipients.', metadata={'similarity_score': 0.537039041519165, 'retrieval_method': 'colbert_vector_similarity'}, id='PMC1748704682')"", ""Document(page_content='IgA nephropathy (IgAN) is a common primary glomerular disease. The  O O The review followed Preferred Reporting Items for Systematic Reviews and Meta-Analyses (PRISMA) recommendations and was registered in PROSPERO (CRD42021287423). The literature search was conducted in PubMed, Web of Science, Cochrane, and Scopus, and the selected articles were evaluated for eligibility based on predefined criteria. The methodological quality of the studies was assessed using the Newcastle–Ottawa Scale. Statistical analysis was performed to calculate effect sizes and assess heterogeneity among the studies. This review analyzed 29 out of 1,986 studies, conducted between 2005 and 2022, with participants from multiple countries. Gd-IgA1 levels were not associated with age and gender, while associations with hypertension, hematuria, and proteinuria were inconsistent. In the meta-analyses, a correlation between serum Gd-IgA1 and estimated glomerular filtration rate was identified, however, the relationships between Gd-IgA1 levels and chronic kidney disease (CKD) stage and progression to kidney failure were inconsistent. Serum Gd-IgA1 levels were not associated with validated prognostic risk factors, but were negatively correlated with kidney function. Further research in larger studies using standardized assays are needed to establish the value of Gd-IgA1 as a prognostic risk factor in IgAN. \\n The online version contains supplementary material available at 10.1007/s40620-023-01874-8.', metadata={'similarity_score': 0.4322875440120697, 'retrieval_method': 'colbert_vector_similarity'}, id='PMC11649794')"", ""Document(page_content='In hemodialysis (HD), complement activation, bioincompatibility, and inflammation are intricately intertwined. In the 1970s, as HD became a routine therapy, the observation of complement pathway activation and transient leukopenia by cellulosic dialysis membranes triggered the bioincompatibility debate and its clinical relevance. Extensive deliberations have covered definitions, assessment markers, scope, and long-term clinical consequences of membrane-dependent bioincompatibility reactions. While complement pathways’ interplay with coagulation and inflammation has been delineated, HD’s focus has primarily been on developing more biocompatible membranes using advanced technologies. Recent advances and understanding of the current HD delivery mode (4-hour sessions, thrice weekly) suggest that factors beyond membrane characteristics play a significant role, and a more complex, multifactorial picture of bioincompatibility is emerging. Chronic activation of the complement system and persistent low-grade “uremic inflammation” in chronic kidney disease (CKD) and HD lead to premature inflammaging of the kidney, resembling aging in the general population. Cellular senescence, modulated by complement activation and the uremic milieu, contributes to chronic inflammaging. Additionally, the formation of neutrophil extracellular traps (NETs, process of NETosis) during HD and their biological activity in the interdialytic period can lead to dialysis-induced systemic stress. Thus, complement-inflammation manifestations in HD therapies extend beyond traditional membrane-related bioincompatibility consequences. Recent scientific knowledge is reshaping strategies to mitigate detrimental consequences of bioincompatibility, both technologically and in HD therapy delivery modes, to improve dialysis patient outcomes.', metadata={'similarity_score': 0.4236581027507782, 'retrieval_method': 'colbert_vector_similarity'}, id='PMC11649546')"", ""Document(page_content='In recent years, advancements in immunosuppressive medications and post-transplant management have led to a significant decrease in acute rejection rates in renal allografts and consequent improvement in short-term graft survival. In contrast, recent data have shown an increased incidence of post-transplant glomerular diseases, which currently represent a leading cause of allograft loss. Although pathogenesis is not fully understood, growing evidence supports the role of inherited and immunological factors and has identified potential pre- and post-transplant predictors. In this review, we illustrate recent advancements in the pathogenesis of post-transplant glomerular disease and the role of risk factors and immunological triggers. In addition, we discuss potential prevention and management strategies.', metadata={'similarity_score': 0.3968540132045746, 'retrieval_method': 'colbert_vector_similarity'}, id='PMC11630810')"", ""Document(page_content='Inhibitors of the interaction between Neuropilin-1 (NRP-1) and Vascular Endothelial Growth Factor-A 165 165 2 2 50 50 2 2 50 165 The online version contains supplementary material available at 10.1007/s00726-024-03411-8.', metadata={'similarity_score': 0.39665278792381287, 'retrieval_method': 'colbert_vector_similarity'}, id='PMC11344719')"", ""Document(page_content='Primary glomerular disease (PGD) is an idiopathic cause of renal glomerular lesions that is characterized by proteinuria or hematuria and is the leading cause of chronic kidney disease (CKD). The identification of circulating biomarkers for the diagnosis of PGD requires a thorough understanding of the metabolic defects involved. In this study, ultra-high performance liquid chromatography–tandem mass spectrometry was performed to characterize the amino acid (AA) profiles of patients with pathologically diagnosed PGD, including minimal change disease (MCD), focal segmental glomerular sclerosis (FSGS), membranous nephropathy, and immunoglobulin A nephropathy. The plasma concentrations of asparagine and ornithine were low, and that of aspartic acid was high, in patients with all the pathologic types of PGD, compared to healthy controls. Two distinct diagnostic models were generated using the differential plasma AA profiles using logistic regression and receiver operating characteristic analyses, with areas under the curves of 1.000 and accuracies up to 100.0% in patients with MCD and FSGS. In conclusion, the progression of PGD is associated with alterations in AA profiles, The present findings provide a theoretical basis for the use of AAs as a non-invasive, real-time, rapid, and simple biomarker for the diagnosis of various pathologic types of PGD. The online version contains supplementary material available at 10.1007/s00726-024-03407-4.', metadata={'similarity_score': 0.3896699845790863, 'retrieval_method': 'colbert_vector_similarity'}, id='PMC11255010')"", ""Document(page_content='Kidney failure has been associated with decreased physical capacity, although evidence regarding the physical performance of individuals with earlier stages of chronic kidney disease (CKD)\\xa0remains limited. Cross-sectional data were derived from the prospective, population-based Maastricht Study. Multivariate linear regression models were fitted to assess the association of estimated glomerular filtration rate (eGFR) and albuminuria categories with physical performance test outcomes. Overall, 7396 participants were included. Compared to eGFR 60–90\\xa0ml/min/1.73\\xa0m β β β β β β β β β Reduced eGFR and higher albuminuria levels were associated with worse physical performance, especially shorter 6-min walk distance and lower muscle strength. The relationship between eGFR and physical function was non-linear, with also high eGFR values being associated with worse performance, especially in the six-minute walk test. \\n The online version contains supplementary material available at 10.1007/s40620-024-01933-8.', metadata={'similarity_score': 0.38796907663345337, 'retrieval_method': 'colbert_vector_similarity'}, id='PMC11649829')"", ""Document(page_content='Membranous nephropathy can lead to end-stage kidney disease, for which kidney transplantation is the preferred therapy. However, the disease often relapses, which can impact allograft survival. We conducted a prospective multicenter study in France involving 72 patients with membranous nephropathy who were awaiting and then underwent kidney transplantation. In addition, we established a retrospective validation cohort of 65 patients. The primary objective was to evaluate the prognostic significance of pretransplant anti phospholipase A2 receptor 1 (PLA2R1) antibodies on the recurrence of membranous nephropathy. The study also assessed the incidence rate, time to onset, and risk factors for recurrence, as well as allograft outcome. The prospective cohort showed a 26% cumulative incidence of membranous nephropathy recurrence after a median follow-up of 23.5 months. This was confirmed by a 28% cumulative incidence after a median follow-up of 67 months in the retrospective cohort. A strong association was found between the presence of anti-PLA2R1 antibodies prior to transplantation and the risk of disease recurrence (risk ratio\\xa0= 5.9; 95% confidence interval [CI]: 2.3–15.7;  P The presence of anti-PLA2R1 antibodies prior to transplantation was a strong predictor of recurrence of allograft membranous nephropathy. An individualized immunomonitoring and management strategy for kidney transplant candidates with anti-PLA2R1-associated membranous nephropathy should be considered.', metadata={'similarity_score': 0.3707736134529114, 'retrieval_method': 'colbert_vector_similarity'}, id='PMC11652070')"", ""Document(page_content='Glucagon-like peptide-1 (GLP-1) receptor agonists and the dual GLP-1- and glucose-dependent insulinotropic polypeptide receptor co-agonist tirzepatide (referred to here collectively as “GLP-1-based therapy”) are incretin-based therapies being used increasingly in the management of both type 2 diabetes and obesity. They are now recognized to have beneficial effects beyond improved glycemic control and weight loss, including cardiovascular and renal protection. GLP-1-based therapy also slows gastric emptying, which has benefits (lowering postprandial glucose), but also potential risks (eg, hypoglycemia in individuals on insulin or sulphonylurea therapy). Their effects on the gallbladder may also be beneficial, contributing to reducing postprandial triglycerides, but they also potentially increase the risk of biliary disease. In this review, we summarize the effects of GLP-1 and incretin-based therapeutics on gastric, biliary and small intestinal function. An improved understanding of these effects will optimize the use of these drugs.', metadata={'similarity_score': 0.36344456672668457, 'retrieval_method': 'colbert_vector_similarity'}, id='PMC11630531')"", ""Document(page_content='Acute kidney injury (AKI) is a critical morbidity after cytoreduction and hyperthermic intraperitoneal chemotherapy (CRS/HIPEC). This study was conducted to investigate the use of kidney-specific biomarkers to evaluate the diagnostic accuracy of post-HIPEC AKI. Patients who received CRS/HIPEC were prospectively enrolled in this study. We serially sampled urine neutrophil gelatinase-associated lipocalin (NGAL), serum cystatin C (sCyC), and β2 microglobulin (sβ2-MG) on the day before CRS/HIPEC and then 2 h, 1 d, 2 d, 3 d, and 7 d after CRS/HIPEC. The primary outcome was the occurrence of AKI during the first 7 d. The areas under the receiver operating characteristic curve (AUCs) were calculated to evaluate the detection performance. A total of 75 patients were eligible, of whom 5 (6.7%) fulfilled the criteria of AKI during the study period (AKI group) and 70 did not (non-AKI group). No significant differences were observed in these biomarkers between the two groups, except for sβ2-MG on day 3 ( P P P This is the first prospective study to evaluate the value of kidney-specific biomarkers in patients after CRS/HIPEC. We found that AKI cannot be predicted by simply using the absolute measurements of these biomarkers because of the heterogeneous characteristics of the patients.', metadata={'similarity_score': 0.3459194302558899, 'retrieval_method': 'colbert_vector_similarity'}, id='PMC11650413')""]","SGLT2 inhibitors protect kidney function by reducing hyperfiltration, decreasing albuminuria, and providing nephroprotection through mechanisms independent of glycemic control.",0.7849271297454834,10,True,,,,,,,,0.0,301,0
colbert,What is the mechanism of action of GLP-1 receptor agonists?,"GLP-1 receptor agonists work by improving glycemic control, promoting weight loss, and providing cardiovascular and renal protection.","[""Document(page_content='Glucagon-like peptide-1 (GLP-1) receptor agonists and the dual GLP-1- and glucose-dependent insulinotropic polypeptide receptor co-agonist tirzepatide (referred to here collectively as “GLP-1-based therapy”) are incretin-based therapies being used increasingly in the management of both type 2 diabetes and obesity. They are now recognized to have beneficial effects beyond improved glycemic control and weight loss, including cardiovascular and renal protection. GLP-1-based therapy also slows gastric emptying, which has benefits (lowering postprandial glucose), but also potential risks (eg, hypoglycemia in individuals on insulin or sulphonylurea therapy). Their effects on the gallbladder may also be beneficial, contributing to reducing postprandial triglycerides, but they also potentially increase the risk of biliary disease. In this review, we summarize the effects of GLP-1 and incretin-based therapeutics on gastric, biliary and small intestinal function. An improved understanding of these effects will optimize the use of these drugs.', metadata={'similarity_score': 0.5381851196289062, 'retrieval_method': 'colbert_vector_similarity'}, id='PMC11630531')"", ""Document(page_content='The Golgi apparatus serves multiple crucial roles in the cell. These roles include the addition and subsequent modification of glycans, not only to newly-made proteins arriving from the endoplasmic reticulum, but also to precursors during the biosynthesis of glycolipids. New research by Brauer et al, (', metadata={'similarity_score': 0.36178669333457947, 'retrieval_method': 'colbert_vector_similarity'}, id='PMC11649812')"", ""Document(page_content='Glycosylation, which plays an important role in modifying lipids and sorting of proteins, is regulated by asymmetric intra-Golgi distribution and SPPL3-mediated cleavage of Golgi enzymes. We found that cells lacking LYSET/TMEM251, a retention factor for Golgi  N cis', metadata={'similarity_score': 0.32712316513061523, 'retrieval_method': 'colbert_vector_similarity'}, id='PMC11649813')"", ""Document(page_content='Inhibitors of the interaction between Neuropilin-1 (NRP-1) and Vascular Endothelial Growth Factor-A 165 165 2 2 50 50 2 2 50 165 The online version contains supplementary material available at 10.1007/s00726-024-03411-8.', metadata={'similarity_score': 0.3120233118534088, 'retrieval_method': 'colbert_vector_similarity'}, id='PMC11344719')"", ""Document(page_content='NLRP3 is an intracellular sensor molecule that affects neutrophil functionality and infiltration in brain disorders such as experimental autoimmune encephalomyelitis (EAE). However, the detailed molecular mechanisms underlying the role of NLRP3 in these processes remain unknown. We found that NLRP3 is crucial for neutrophil infiltration, whereas dispensable for neutrophil priming. Notably, NLRP3 activation in neutrophils induced blood-brain barrier (BBB) disruption and neutrophil infiltration into the brain via CXCL1/2 secretion and subsequent activation of the CXCL1/2-CXCR2 signaling axis. Moreover, CXCL1 and CXCL2 in the inflamed brain directly reduced Claudin-5 expression, which regulates BBB permeability in brain endothelial cells. Furthermore, neutrophil-specific NLRP3 activation aggravated EAE pathogenesis by promoting CXCR2-mediated infiltration of both neutrophils and CD4 The online version contains supplementary material available at 10.1186/s12974-025-03468-6.', metadata={'similarity_score': 0.2971397936344147, 'retrieval_method': 'colbert_vector_similarity'}, id='PMC1748704639')"", ""Document(page_content='Diabetes mellitus (DM) is a prevalent condition that requires careful management in the perioperative setting to reduce surgical risks and optimize patient outcomes. The preoperative care of diabetic patients is complex because glucose control must be balanced with minimizing hypoglycemic or hyperglycemic events during surgery. A variety of diabetic medications such as insulin, dipeptidyl-peptidase-4 inhibitors, glucagon-like peptide-1 receptor agonists, sodium–glucose cotransporter-2 inhibitors, and biguanides such as metformin present unique challenges and considerations due to their different mechanisms, benefits, and potential adverse effects. In recent years, professional organizations have developed recommendations on the perioperative management of these therapies, although there remain some variations in guidelines related to medication cessation and dosage adjustments. Standardized protocols in preoperative DM care remain a topic of interest to ensure consistent and safe practices across healthcare settings, and further collaborative research efforts could provide clarity and consensus in managing this diverse patient population. The objective of this study was to provide an overview of guidelines and practices to support healthcare professionals in delivering improved preoperative care for diabetic patients. This initiative aims to enhance surgical outcomes and minimize the occurrence of complications. This is a comparative review that provides a systematic comparison of the similarities and differences in the guidelines and recommendations of three professional organizations along with Hamad Medical Corporation. All guidelines were from official websites including Hamad Medical Corporation. Although the reviewed guidelines for the preoperative care of diabetes patients share some similarities, there are also a number of differences due to outdated data and expert opinions, and therefore differ in practices around the world. While the key elements are agreed upon, more research and global collaboration are needed to create consistent guidelines and improve patient outcomes.', metadata={'similarity_score': 0.2890487015247345, 'retrieval_method': 'colbert_vector_similarity'}, id='PMC1748704577')"", ""Document(page_content='Although a role of the thalamus in different arousal and awareness states is well established, there is a surprising lack of knowledge on subregional specificity within this complex, multinucleated structure of the diencephalon. In their recent paper ‘Extrasynaptic GABA-A receptors in central medial thalamus mediate anaesthesia in rats’, Muheyati et al. evaluated whether GABA A A A', metadata={'similarity_score': 0.2882241904735565, 'retrieval_method': 'colbert_vector_similarity'}, id='PMC11650603')"", ""Document(page_content='Common treatments for type 2 diabetes include lifestyle changes such as diet and exercise, oral medications like metformin, and in some cases, insulin therapy. Metformin is often the first-line medication prescribed for type 2 diabetes. It helps lower glucose production in the liver and improves insulin sensitivity.', metadata={'similarity_score': 0.27862343192100525, 'retrieval_method': 'colbert_vector_similarity'}, id='sample')"", ""Document(page_content='The enzyme arginase catalyzes the hydrolysis of  l l l l l Arg1 Arg2 Further basic and translational research is needed to deepen our understanding of the regulation of Arg1 and Arg2 in different cell types in consideration of their localization, species-specificity, and multiple biochemical and physiological roles. This will lead to better pharmacological strategies to target arginase activity in liver, cardiovascular, hematological, immune/infectious diseases, and cancer.', metadata={'similarity_score': 0.27655747532844543, 'retrieval_method': 'colbert_vector_similarity'}, id='PMC1748704617')"", ""Document(page_content='Juvenile hormone (JH) is one of the most essential hormones controlling insect metamorphosis and physiology. While it is well known that JH affects many tissues throughout the insect life cycle, the difference in JH responsiveness and the repertoire of JH-inducible genes among different tissues has not been fully investigated. In this study, we monitored JH responsiveness  in vivo Drosophila melanogaster JH response element-GFP JHRE-GFP germ cell-expressed Lactate dehydrogenase', metadata={'similarity_score': 0.2763129472732544, 'retrieval_method': 'colbert_vector_similarity'}, id='PMC11651902')""]","GLP-1 receptor agonists work by stimulating insulin secretion, suppressing glucagon secretion, slowing gastric emptying, and promoting satiety, ultimately improving glycemic control and often leading to weight loss.",0.5891199111938477,10,True,,,,,,,,0.0,133,0
colbert,What are the cardiovascular benefits of SGLT2 inhibitors?,The cardiovascular benefits of SGLT2 inhibitors include heart failure and chronic kidney disease.,"[""Document(page_content='Indications for sodium-glucose cotransporter-2 (SGLT2) inhibitors have expanded to include heart failure and chronic kidney disease after the year 2020. Whether and how the demographic trends in the prescription of SGLT2 inhibitors have changed after the expansion of indications have not been studied extensively. This study is a descriptive analysis of serial, cross-sectional data on nationwide prescription of SGLT2 inhibitors between April 2016 and March 2023 obtained from NDB Open Data Japan, which contains more than 95% of total health insurance reimbursement claims in the nation. The total number of SGLT2 inhibitor tablets prescribed in outpatient settings with prescriptions papers increased from 577,996,158 tablets in fiscal year (FY) 2020 to 904,598,175 tablets in FY 2022. Patients aged 75 years and older accounted for 20.3% of the total prescriptions in FY 2020, and this proportion increased to 27.8% in FY 2022. Among all SGLT2 inhibitors, the tablet that expanded its indications for patients with heart failure and chronic kidney disease the earliest showed the largest percentage increase in the number of prescribed tablets during this period and the highest share of the elderly population in its recipients in both sexes (men, 35.9%; women, 49.4%) in FY 2022. The number of prescribed SGLT2 inhibitor tablets per population was constantly higher in men than in women between FY 2020 and 2022, which is consistent with the sex difference in the prevalence of these diseases. Prescription of SGLT2 inhibitors to the elderly population is no longer infrequent and accounts for a large portion of the entire prescription of SGLT2 inhibitors in Japan. These findings contribute to updating our perception on the demographics of SGLT2 inhibitor recipients.', metadata={'similarity_score': 0.5698674917221069, 'retrieval_method': 'colbert_vector_similarity'}, id='PMC1748704682')"", ""Document(page_content='The management of acute coronary syndrome (ACS) in older patients remains challenging because standard anticoagulants often fail to yield optimal outcomes. Bivalirudin, a direct inhibitor of thrombin, serves as an alternative to traditional therapies. This drug is particularly effective in enhancing myocardial microcirculation and reducing adverse events after clinical interventions. The present article explores the findings of a recent study that highlighted the clinical benefits of bivalirudin by investigating its effects on myocardial microcirculation and adverse cardiac events after percutaneous coronary intervention in older patients with ACS. Compared with unfractionated heparin, bivalirudin markedly reduced the emergency response time and improved cardiac function indicators. It further mitigated the risks of cardiovascular events and recurrent myocardial infarctions. These findings suggest that bivalirudin can enhance myocardial perfusion and reduce bleeding complications, thus serving as a safe, effective anticoagulation agent for older patients with ACS. Nonetheless, further large-scale, high-quality trials are needed to establish optimal usage guidelines and assess long-term outcomes. Integrating bivalirudin into ACS treatment protocols for older patients may help optimize patient care, balancing efficacy and safety. Continual research and consensus building are necessary for the widespread clinical application of bivalirudin and the improvement of ACS outcomes in older patients.', metadata={'similarity_score': 0.4164641797542572, 'retrieval_method': 'colbert_vector_similarity'}, id='PMC11736530_gen_142')"", ""Document(page_content='Inhibitors of the interaction between Neuropilin-1 (NRP-1) and Vascular Endothelial Growth Factor-A 165 165 2 2 50 50 2 2 50 165 The online version contains supplementary material available at 10.1007/s00726-024-03411-8.', metadata={'similarity_score': 0.41489577293395996, 'retrieval_method': 'colbert_vector_similarity'}, id='PMC11344719')"", ""Document(page_content='Common treatments for type 2 diabetes include lifestyle changes such as diet and exercise, oral medications like metformin, and in some cases, insulin therapy. Metformin is often the first-line medication prescribed for type 2 diabetes. It helps lower glucose production in the liver and improves insulin sensitivity.', metadata={'similarity_score': 0.4129023253917694, 'retrieval_method': 'colbert_vector_similarity'}, id='sample')"", ""Document(page_content='Atherosclerosis (AS) is a chronic inflammatory disease characterized by the gradual accumulation of plaques in arterial walls, with its pathogenesis remaining incompletely understood. Recent studies have highlighted that development of AS is closely associated with the aberrant activation of the NLRP3 inflammasome in the arteries. Inhibition of the NLRP3 inflammasome by natural products and formulae derived from Chinese herbal medicines (CHMs) has been shown to alleviate AS-associated pathologies. However, therapies that effectively and safely target the NLRP3 inflammasome remain limited. This review aims to summarize the key discoveries from recent studies on the effects of these natural products and formulae on the NLRP3 inflammasome in the context of AS treatment. A comprehensive literature search was conducted on databases such as PubMed/MEDLINE up to January 2025, yielding 38 eligible studies. Our analysis indicates that certain therapies can effectively prevent arterial inflammation in animal models by targeting multiple pathways and mechanisms related to the NLRP3 inflammasome. This review summarizes the primary findings of these studies, focusing on the therapeutic effects and underlying mechanisms of action. Based on these insights, we propose future strategies to enhance the efficacy, specificity, and safety of existing natural products and formulae for AS treatment. Additionally, this study offers a perspective for future research that may enhance our understanding of the roles and the mechanisms of CHM-derived phytochemicals and formulae in regulating the NLRP3 inflammasome and treating AS.', metadata={'similarity_score': 0.39650627970695496, 'retrieval_method': 'colbert_vector_similarity'}, id='PMC1748704493')"", ""Document(page_content='Glucagon-like peptide-1 (GLP-1) receptor agonists and the dual GLP-1- and glucose-dependent insulinotropic polypeptide receptor co-agonist tirzepatide (referred to here collectively as “GLP-1-based therapy”) are incretin-based therapies being used increasingly in the management of both type 2 diabetes and obesity. They are now recognized to have beneficial effects beyond improved glycemic control and weight loss, including cardiovascular and renal protection. GLP-1-based therapy also slows gastric emptying, which has benefits (lowering postprandial glucose), but also potential risks (eg, hypoglycemia in individuals on insulin or sulphonylurea therapy). Their effects on the gallbladder may also be beneficial, contributing to reducing postprandial triglycerides, but they also potentially increase the risk of biliary disease. In this review, we summarize the effects of GLP-1 and incretin-based therapeutics on gastric, biliary and small intestinal function. An improved understanding of these effects will optimize the use of these drugs.', metadata={'similarity_score': 0.39217236638069153, 'retrieval_method': 'colbert_vector_similarity'}, id='PMC11630531')"", ""Document(page_content='Diet is a key modifiable risk factor in many chronic diseases, including age-related diseases. The Mediterranean diet (MedDiet) is an extensively studied dietary pattern which has been proposed as a lifestyle intervention to promote healthy aging in the general population, due to its numerous health benefits. Randomized controlled trials (RCTs) have attempted to explore the mechanism(s) by which the MedDiet exerts its beneficial effects on aging. One proposed mechanism is that the MedDiet helps to slow down a process called ‘inflamm-aging’, a type of chronic, low-grade inflammation which contributes to aging. To explore the evidence supporting this hypothesized mechanism, we conducted a scoping review of existing RCTs which used a MedDiet intervention and assessed at least one molecular outcome of potential relevance to inflamm-aging. We identified 14 papers representing 12 unique RCTs. Based on our findings, we present 10 recommendations for the next clinical trial of the MedDiet in inflamm-aging.', metadata={'similarity_score': 0.38000455498695374, 'retrieval_method': 'colbert_vector_similarity'}, id='PMC11649874')"", 'Document(page_content=""Although the novel coronavirus disease 2019 (COVID‐19), caused by the severe acute respiratory syndrome coronavirus 2 (SARS‐CoV‐2), primarily manifests as severe respiratory distress, its impact on the cardiovascular system is also notable. Studies reveal that COVID‐19 patients often suffer from certain vascular diseases, partly attributed to increased proliferation or altered phenotype of vascular smooth muscle cells (VSMCs). Although the association between COVID‐19 and VSMCs is recognized, the precise mechanism underlying SARS‐CoV‐2\'s influence on VSMC phenotype remains largely under‐reviewed. In this context, while there is a consistent body of literature dissecting the effect of COVID‐19 on the cardiovascular system, few reports delve into the potential role of VSMC switching in the pathophysiology associated with COVID‐19 and the molecular mechanisms involved therein. This review dissects and critiques the link between COVID‐19 and VSMCs, with particular attention to pathways involving cholesterol, calcium, and phosphate. These pathways underpin the interaction between the virus and VSMCs. Such interaction promotes VSMC proliferation, and eventually potentiates vascular calcification as well as worsens prognosis in patients with COVID‐19."", metadata={\'similarity_score\': 0.3790280520915985, \'retrieval_method\': \'colbert_vector_similarity\'}, id=\'PMC11649971\')', ""Document(page_content='Although the importance of home blood pressure (BP) management has been widely reported, the achievement rate of home BP targets remains low in Japan. Sacubitril/valsartan is a novel antihypertensive agent with potent antihypertensive effects. Despite its theoretical advantages, the real-world clinical application of sacubitril/valsartan in optimizing home BP management remains underexplored. The aim of this study was to evaluate the effect of switching from azilsartan treatment to sacubitril/valsartan treatment on the achievement of home BP targets and to refine hypertension management strategies in practical clinical settings. A cohort of 55 patients, with a mean morning home systolic BP of 135 mmHg or more was enrolled for an 8-week treatment phase with azilsartan and calcium-channel blockers. Morning BP, pulse rate (PR), estimated glomerular filtration rate, and B-type natriuretic peptide, serum potassium, serum uric acid (UA), and hemoglobin A1c levels were assessed at baseline and then at 8, 24, and 48 weeks after switching from 20 mg azilsartan to 200 mg sacubitril/valsartan. At 48 weeks after switching to sacubitril/valsartan, there was a 60% increase in the rate of attainment of home systolic BP targets. Sacubitril/valsartan significantly reduced the mean systolic BP (from 143.6 ± 7.0 mmHg to 131.4 ± 8.7 mmHg), diastolic BP (from 86.9 ± 12.3 mmHg to 80.2 ± 10.7 mmHg), PR (from 74.8 ± 11.0 bpm to 72.1 ± 10.1 bpm), and serum UA (from 5.9 ± 1.1 mg/dL to 5.5 ± 0.9 mg/dL) within the first 8 weeks (all p < 0.01). These effects were maintained for 48 weeks. The switch from azilsartan to sacubitril/valsartan treatment resulted in a significant improvement in the achievement of home BP targets, which is consistent with our goal of refining hypertension management strategies in practical clinical settings.', metadata={'similarity_score': 0.37268009781837463, 'retrieval_method': 'colbert_vector_similarity'}, id='PMC1748704693')"", ""Document(page_content='Chronic Chagas cardiomyopathy is associated with an unbalanced\\nimmune response and impaired heart function, and available drugs do\\nnot prevent its development. Zileuton (Zi), a 5-lypoxigenase inhibitor,\\naffects inflammatory/pro-resolution mediators. Herein, Zi treatment\\nin the early phase of infection reduced parasitemia associated mainly\\nwith the direct effect of Zi on the parasite, and the enzyme epoxide\\nhydrolase was the potential molecular target behind the trypanocidal\\neffect. In the intermediate acute phase of infection, Zi reduced the\\nnumber of innate and adaptive inflammatory cells, increased the level\\nof SOCS2 expression in the heart associated with lower inflammation,\\nand improved cardiac function. Zi treatment initiated in the chronic\\nstage increased the level of SOCS2 expression in the heart, reduced\\ninflammation, and improved cardiac function. Our data suggest that\\nZi protects against  Trypanosoma cruzi', metadata={'similarity_score': 0.3649723529815674, 'retrieval_method': 'colbert_vector_similarity'}, id='PMC11650774')""]","SGLT2 inhibitors provide cardiovascular benefits by reducing major adverse cardiovascular events and hospitalization for heart failure, effects that appear to be independent of their glucose-lowering action.",0.6581358909606934,10,True,,,,,,,,0.0,97,0
colbert,How do statins prevent cardiovascular disease?,"Statins prevent cardiovascular disease by inhibiting the production of cholesterol in the liver, which helps reduce the buildup of plaque in the arteries, thereby lowering the risk of heart attacks and strokes.","[""Document(page_content='Diet is a key modifiable risk factor in many chronic diseases, including age-related diseases. The Mediterranean diet (MedDiet) is an extensively studied dietary pattern which has been proposed as a lifestyle intervention to promote healthy aging in the general population, due to its numerous health benefits. Randomized controlled trials (RCTs) have attempted to explore the mechanism(s) by which the MedDiet exerts its beneficial effects on aging. One proposed mechanism is that the MedDiet helps to slow down a process called ‘inflamm-aging’, a type of chronic, low-grade inflammation which contributes to aging. To explore the evidence supporting this hypothesized mechanism, we conducted a scoping review of existing RCTs which used a MedDiet intervention and assessed at least one molecular outcome of potential relevance to inflamm-aging. We identified 14 papers representing 12 unique RCTs. Based on our findings, we present 10 recommendations for the next clinical trial of the MedDiet in inflamm-aging.', metadata={'similarity_score': 0.3990134298801422, 'retrieval_method': 'colbert_vector_similarity'}, id='PMC11649874')"", ""Document(page_content='Is the use of supraphysiologic doses of anabolic androgenic steroids (AASs) associated with persistent coronary microvascular dysfunction? In this cross-sectional study including 90 men, the prevalence of impaired myocardial flow reserve was increased among both those with current and former AAS use compared with controls. Among individuals with former AAS use, the accumulated duration of AAS use was independently associated with an increased risk of reduced myocardial flow reserve. The findings of this study suggest that AAS use may be associated with impaired myocardial flow reserve, with possible persistent coronary microvascular dysfunction years after AAS cessation.', metadata={'similarity_score': 0.38858360052108765, 'retrieval_method': 'colbert_vector_similarity'}, id='PMC11650407')"", ""Document(page_content='Systemic lupus erythematosus (SLE) is an autoimmune condition that is characterized by the production of autoantibodies and sustained inflammatory damage. Coronary heart disease (CHD) is a common complication of SLE, significantly increases CHD-related mortality in SLE patients. Despite conventional risk factors, the mechanisms contributing to a higher CHD risk require further investigation, with the immune and inflammatory aspects of SLE playing a significant role. Endothelial cell damage and dysfunction are key factors in the progression of coronary atherosclerosis in SLE patients. This review specifically focuses on endothelial dysfunction and the role of specific microRNAs in the context of SLE and CHD. In addition, we discuss the effects and functions of oxidative stress markers, endothelial progenitor cells, and circulating endothelial cells in individuals with both SLE and CHD. We also explored the typical inflammatory markers associated with SLE and CHD, addressing their clinical significance and limitations.', metadata={'similarity_score': 0.3867160677909851, 'retrieval_method': 'colbert_vector_similarity'}, id='PMC11651451')"", ""Document(page_content='The outcomes related to cardiovascular risk (CVR) in patients with the nonclassical form of congenital adrenal hyperplasia (NCAH) are unknown, especially those related to therapeutic options, including low doses of glucocorticoids or oral contraceptive pills. To analyze CVR by markers of atherosclerosis in females with the nonclassical form according to therapeutic options. A cross-sectional study at a tertiary center. Forty-seven females with NCAH (33.4 ± 10 years) were subdivided into group 1 (G1) (n = 28) treated with dexamethasone (0.14 ± 0.05\\u2005mg/m There were no statistically significant differences in BMI, HOMA-IR, high-density lipoprotein-cholesterol, or triglyceride levels among groups ( P P P P Adult females with NCAH did not show increased CVR using methodologies for detection of precocious atherosclerosis. Although patients receiving dexamethasone therapy had increased IL-6 and IL-8 levels, these data were not associated with radiological markers of atherosclerosis. Our cohort was composed of young adults and should be reevaluated in a long-term follow-up.', metadata={'similarity_score': 0.3862256407737732, 'retrieval_method': 'colbert_vector_similarity'}, id='PMC11651682')"", ""Document(page_content='Inhibitors of the interaction between Neuropilin-1 (NRP-1) and Vascular Endothelial Growth Factor-A 165 165 2 2 50 50 2 2 50 165 The online version contains supplementary material available at 10.1007/s00726-024-03411-8.', metadata={'similarity_score': 0.37462911009788513, 'retrieval_method': 'colbert_vector_similarity'}, id='PMC11344719')"", ""Document(page_content='The management of acute coronary syndrome (ACS) in older patients remains challenging because standard anticoagulants often fail to yield optimal outcomes. Bivalirudin, a direct inhibitor of thrombin, serves as an alternative to traditional therapies. This drug is particularly effective in enhancing myocardial microcirculation and reducing adverse events after clinical interventions. The present article explores the findings of a recent study that highlighted the clinical benefits of bivalirudin by investigating its effects on myocardial microcirculation and adverse cardiac events after percutaneous coronary intervention in older patients with ACS. Compared with unfractionated heparin, bivalirudin markedly reduced the emergency response time and improved cardiac function indicators. It further mitigated the risks of cardiovascular events and recurrent myocardial infarctions. These findings suggest that bivalirudin can enhance myocardial perfusion and reduce bleeding complications, thus serving as a safe, effective anticoagulation agent for older patients with ACS. Nonetheless, further large-scale, high-quality trials are needed to establish optimal usage guidelines and assess long-term outcomes. Integrating bivalirudin into ACS treatment protocols for older patients may help optimize patient care, balancing efficacy and safety. Continual research and consensus building are necessary for the widespread clinical application of bivalirudin and the improvement of ACS outcomes in older patients.', metadata={'similarity_score': 0.36537206172943115, 'retrieval_method': 'colbert_vector_similarity'}, id='PMC11736530_gen_142')"", ""Document(page_content='Atherosclerosis (AS) is a chronic inflammatory disease characterized by the gradual accumulation of plaques in arterial walls, with its pathogenesis remaining incompletely understood. Recent studies have highlighted that development of AS is closely associated with the aberrant activation of the NLRP3 inflammasome in the arteries. Inhibition of the NLRP3 inflammasome by natural products and formulae derived from Chinese herbal medicines (CHMs) has been shown to alleviate AS-associated pathologies. However, therapies that effectively and safely target the NLRP3 inflammasome remain limited. This review aims to summarize the key discoveries from recent studies on the effects of these natural products and formulae on the NLRP3 inflammasome in the context of AS treatment. A comprehensive literature search was conducted on databases such as PubMed/MEDLINE up to January 2025, yielding 38 eligible studies. Our analysis indicates that certain therapies can effectively prevent arterial inflammation in animal models by targeting multiple pathways and mechanisms related to the NLRP3 inflammasome. This review summarizes the primary findings of these studies, focusing on the therapeutic effects and underlying mechanisms of action. Based on these insights, we propose future strategies to enhance the efficacy, specificity, and safety of existing natural products and formulae for AS treatment. Additionally, this study offers a perspective for future research that may enhance our understanding of the roles and the mechanisms of CHM-derived phytochemicals and formulae in regulating the NLRP3 inflammasome and treating AS.', metadata={'similarity_score': 0.3631735146045685, 'retrieval_method': 'colbert_vector_similarity'}, id='PMC1748704493')"", ""Document(page_content='Peripheral artery disease (PAD) and dyslipidemia are both independent predictors of cardiovascular disease, but the association between individual lipid species and subclinical PAD, assessed by ankle-brachial index (ABI), is lacking in large-scale longitudinal studies. We used liquid chromatography-mass spectrometry to repeatedly measure 1,542 lipid species from 1,886 American Indian adults attending 2 clinical examinations (mean ~5 years apart) in the Strong Heart Family Study. We used generalized estimating equation models to identify baseline lipid species associated with change in ABI and the Cox frailty regression to examine whether lipids associated with change in ABI were also associated with incident coronary heart disease (CHD). We also examined the longitudinal association between change in lipid species and change in ABI and the cross-sectional association of individual lipids with ABI. All models were adjusted for age, sex, body mass index, smoking, alcohol use, hypertension, estimated glomerular filtration rate, diabetes, and lipid-lowering medication. Baseline levels of 120 lipid species, including glycerophospholipids, glycerolipids, fatty acids, and sphingomyelins, were associated with change in ABI. Among these, higher baseline levels of 3 known lipids (phosphatidylinositol[16:0/20:4], triacylglycerol[48:2], triacylglycerol[55:1]) were associated with a lower risk of CHD (hazard ratios [95% CIs] ranged from 0.67 [0.46–0.99] to 0.76 [0.58–0.99]), while cholesterol was associated with a higher risk of CHD (hazard ratio [95% CI] = 1.37 [1.00–1.87]). Longitudinal changes in 32 lipids were significantly associated with change in ABI during 5-year follow-up. Plasma levels of glycerophospholipids, triacylglycerols, and glycosylceramides were significantly associated with ABI in the cross-sectional analysis. Altered plasma lipidome is significantly associated with subclinical PAD in American Indians beyond traditional risk factors. If validated, the identified lipid species may serve as novel biomarkers for PAD in this high-risk but understudied population.', metadata={'similarity_score': 0.3622146546840668, 'retrieval_method': 'colbert_vector_similarity'}, id='PMC1748215496')"", ""Document(page_content='Chronic Chagas cardiomyopathy is associated with an unbalanced\\nimmune response and impaired heart function, and available drugs do\\nnot prevent its development. Zileuton (Zi), a 5-lypoxigenase inhibitor,\\naffects inflammatory/pro-resolution mediators. Herein, Zi treatment\\nin the early phase of infection reduced parasitemia associated mainly\\nwith the direct effect of Zi on the parasite, and the enzyme epoxide\\nhydrolase was the potential molecular target behind the trypanocidal\\neffect. In the intermediate acute phase of infection, Zi reduced the\\nnumber of innate and adaptive inflammatory cells, increased the level\\nof SOCS2 expression in the heart associated with lower inflammation,\\nand improved cardiac function. Zi treatment initiated in the chronic\\nstage increased the level of SOCS2 expression in the heart, reduced\\ninflammation, and improved cardiac function. Our data suggest that\\nZi protects against  Trypanosoma cruzi', metadata={'similarity_score': 0.36158761382102966, 'retrieval_method': 'colbert_vector_similarity'}, id='PMC11650774')"", ""Document(page_content='Peripheral Artery Disease (PAD) is a common cardiovascular condition marked by peripheral artery stenosis or occlusion. Despite treatment advancements, patients will still face vascular complications, highlighting the need for innovative therapies. Human proteins play crucial roles in biology and drug research. Mendelian randomization (MR) analysis, a gene-based method, is increasingly used in drug target identification. This study aims to identify PAD-associated plasma proteins through MR analysis for potential therapies. We first used GWAS data and seven pQTL datasets to identify plasma proteins causally linked to PAD through MR analysis. Then, we performed KEGG pathway enrichment analysis, Bayesian colocalization analysis, and MR-BMA analysis were carried out to investigate mechanisms and prioritize these proteins. Finally, we assessed the druggability of the target proteins using the DrugBank database. MR analysis found four plasma proteins causally linked to PAD: MMP3 positively correlated with PAD, while CASS4, ISG15, and MMP1 exhibited negative associations. Bayesian colocalization analysis confirmed these relationships, and the MR-BMA analysis prioritized MMP1 as the main target. KEGG pathway enrichment analysis highlighted lipid metabolism and atherosclerosis pathways as central to these drug targets. The druggability evaluation indicated that drugs targeting these proteins are either in development or already in clinical use. This study integrates genetic and proteomic data to identify therapeutic targets for PAD and evaluate their potential for drug development. The prioritization of MMP1 and ISG15 as key targets shows promise for PAD treatment, but further validation and clinical exploration of these findings are needed. The online version contains supplementary material available at 10.1186/s12959-025-00738-4.', metadata={'similarity_score': 0.3570508360862732, 'retrieval_method': 'colbert_vector_similarity'}, id='PMC1748704713')""]","Statins prevent cardiovascular disease by inhibiting HMG-CoA reductase to lower LDL cholesterol, reducing atherosclerotic plaque formation, and through pleiotropic effects such as anti-inflammatory and plaque-stabilizing properties.",0.8139050006866455,10,True,,,,,,,,0.0,210,0
colbert,What is the role of ACE inhibitors in heart failure?,The role of ACE inhibitors in heart failure is not directly addressed in the provided documents.,"[""Document(page_content='Acute myocardial infarction (AMI) is serious disease with high morbidity and mortality worldwide. CD38 is an important metabolic enzyme and plays an important role in a variety of diseases. Our previous studies demonstrated that CD38 deficiency significantly reduced Ang-II-induced ventricular hypertrophy and cardiac ischemia-reperfusion injury. However, the roles of cardiomyocytic CD38 in acute myocardial infarction (AMI) remain unknown. Here, we reported that cardiomyocyte-specific CD38 deficiency (CD38 The online version contains supplementary material available at 10.1038/s41598-025-02207-4.', metadata={'similarity_score': 0.4452318251132965, 'retrieval_method': 'colbert_vector_similarity'}, id='PMC1748215516')"", ""Document(page_content='Chronic Chagas cardiomyopathy is associated with an unbalanced\\nimmune response and impaired heart function, and available drugs do\\nnot prevent its development. Zileuton (Zi), a 5-lypoxigenase inhibitor,\\naffects inflammatory/pro-resolution mediators. Herein, Zi treatment\\nin the early phase of infection reduced parasitemia associated mainly\\nwith the direct effect of Zi on the parasite, and the enzyme epoxide\\nhydrolase was the potential molecular target behind the trypanocidal\\neffect. In the intermediate acute phase of infection, Zi reduced the\\nnumber of innate and adaptive inflammatory cells, increased the level\\nof SOCS2 expression in the heart associated with lower inflammation,\\nand improved cardiac function. Zi treatment initiated in the chronic\\nstage increased the level of SOCS2 expression in the heart, reduced\\ninflammation, and improved cardiac function. Our data suggest that\\nZi protects against  Trypanosoma cruzi', metadata={'similarity_score': 0.4290677607059479, 'retrieval_method': 'colbert_vector_similarity'}, id='PMC11650774')"", ""Document(page_content='Congenitally corrected transposition of the great arteries (ccTGA) remains a rare congenital disorder with a wide range of manifestations. The management of heart failure (HF) of the systemic right ventricle (RV), arrhythmias, heart block, and acquired cardiac conditions require a complex and multi-faceted approach. The objective of this manuscript is to present the current evidence regarding diagnostic, treatment, and management strategies for HF in ccTGA, including ventricular assist device (VAD) therapy and heart transplantation. A systematic review of the literature was conducted using PubMed, covering the period between 2010 and 2024. The search terms included “heart failure”, “ccTGA”, “VAD”, “heart transplantation”, and “systemic RV failure”. Two clinical cases were included for illustrative purposes. HF is a common occurrence in the context of ccTGA, primarily driven by progressive pressure and volume overload of the systemic RV, regurgitation of the systemic atrio-ventricular (AV) valve, and the development of arrhythmias, including complete heart block and (supra-)ventricular tachycardia. The use of HF medication is indicated for symptomatic patients, however, data on the efficacy of standardized HF medication remains limited. Timing of AV-valve replacement is essential to prevent further progression of HF. In ccTGA, the timing of surgery and interventional treatment approaches, the effect of pharmacological treatment in the context of HF, as well as the timing of initiation of a mechanical circulatory support, VAD and heart transplantation, are based on individualised consensus-level decisions. Optimal management remains a topic of debate due to the scarcity of outcome data. Future investigations should focus on identifying surrogate parameters for guiding treatment.', metadata={'similarity_score': 0.42047226428985596, 'retrieval_method': 'colbert_vector_similarity'}, id='PMC1748704794')"", ""Document(page_content='Indications for sodium-glucose cotransporter-2 (SGLT2) inhibitors have expanded to include heart failure and chronic kidney disease after the year 2020. Whether and how the demographic trends in the prescription of SGLT2 inhibitors have changed after the expansion of indications have not been studied extensively. This study is a descriptive analysis of serial, cross-sectional data on nationwide prescription of SGLT2 inhibitors between April 2016 and March 2023 obtained from NDB Open Data Japan, which contains more than 95% of total health insurance reimbursement claims in the nation. The total number of SGLT2 inhibitor tablets prescribed in outpatient settings with prescriptions papers increased from 577,996,158 tablets in fiscal year (FY) 2020 to 904,598,175 tablets in FY 2022. Patients aged 75 years and older accounted for 20.3% of the total prescriptions in FY 2020, and this proportion increased to 27.8% in FY 2022. Among all SGLT2 inhibitors, the tablet that expanded its indications for patients with heart failure and chronic kidney disease the earliest showed the largest percentage increase in the number of prescribed tablets during this period and the highest share of the elderly population in its recipients in both sexes (men, 35.9%; women, 49.4%) in FY 2022. The number of prescribed SGLT2 inhibitor tablets per population was constantly higher in men than in women between FY 2020 and 2022, which is consistent with the sex difference in the prevalence of these diseases. Prescription of SGLT2 inhibitors to the elderly population is no longer infrequent and accounts for a large portion of the entire prescription of SGLT2 inhibitors in Japan. These findings contribute to updating our perception on the demographics of SGLT2 inhibitor recipients.', metadata={'similarity_score': 0.4158058762550354, 'retrieval_method': 'colbert_vector_similarity'}, id='PMC1748704682')"", ""Document(page_content='Cardiac fibrosis occurs in a wide range of cardiac diseases and is characterised by the transdifferentiation of cardiac fibroblasts into myofibroblasts these cells produce large quantities of extracellular matrix, resulting in myocardial scar. The profibrotic process is multi-factorial, meaning identification of effective treatments has been limited. The antifibrotic effect of the bile acid ursodeoxycholic acid (UDCA) is established in cases of liver fibrosis however its mechanism and role in cardiac fibrosis is less well understood. In this study, we used cellular models of cardiac fibrosis and living myocardial slices to characterise the macroscopic and cellular responses of the myocardium to UDCA treatment. We complemented this approach by conducting RNA-seq on cardiac fibroblasts isolated from dilated cardiomyopathy patients. This allowed us to gain insights into the mechanism of action and explore whether the IL-11 and TGFβ/WWP2 profibrotic networks are influenced by UDCA. Finally, we used fibroblasts from a TGR5 KO mouse to confirm the mechanism of action. We found that UDCA reduced myofibroblast markers in rat and human fibroblasts and in living myocardial slices, indicating its antifibrotic action. Furthermore, we demonstrated that the treatment of UDCA successfully reversed the profibrotic IL-11 and TGFβ/WWP2 gene networks. We also show that TGR5 is the most highly expressed UDCA receptor in cardiac fibroblasts. Utilising cells isolated from a TGR5 knock-out mouse, we identified that the antifibrotic effect of UDCA is attenuated in the KO fibroblasts. This study combines cellular studies with RNA-seq and state-of-the-art living myocardial slices to offer new perspectives on cardiac fibrosis. Our data confirm that TGR5 agonists, such as UDCA, offer a unique pathway of action for the treatment of cardiac fibrosis. Medicines for cardiac fibrosis have been slow to clinic and have the potential to be used in the treatment of multiple cardiac diseases. UDCA is well tolerated in the treatment of other diseases, indicating it is an excellent candidate for further in-human trials.', metadata={'similarity_score': 0.399313747882843, 'retrieval_method': 'colbert_vector_similarity'}, id='PMC11650366')"", ""Document(page_content='Inhibitors of the interaction between Neuropilin-1 (NRP-1) and Vascular Endothelial Growth Factor-A 165 165 2 2 50 50 2 2 50 165 The online version contains supplementary material available at 10.1007/s00726-024-03411-8.', metadata={'similarity_score': 0.3791380226612091, 'retrieval_method': 'colbert_vector_similarity'}, id='PMC11344719')"", ""Document(page_content='Congenital heart defects occur in approximately 1% of newborns in the US annually. Currently, less than a third of congenital heart defects can be traced to a known genetic or environmental cause, suggesting that a large proportion of disease-causing mechanisms have yet to be fully characterized. Hemodynamic forces such as wall shear stress are critical for heart development and are known to induce changes in embryonic cardiac patterning leading to malformations. However, measuring these hemodynamic factors  in vivo in silico', metadata={'similarity_score': 0.37410375475883484, 'retrieval_method': 'colbert_vector_similarity'}, id='PMC1748215490')"", ""Document(page_content='Cardiometabolic syndromes including diabetes and obesity are associated with occurrence of heart failure with diastolic dysfunction. There are no specific treatments for diastolic dysfunction, and therapies to manage symptoms have limited efficacy. Understanding of the cardiomyocyte origins of diastolic dysfunction is an important priority to identify new therapeutics. The investigative goal was to experimentally define  in vitro in vivo vs E e E e in vitro in vivo vs \\n Understanding cardiomyocyte stiffness components is an important priority for identifying new therapeutics for diastolic dysfunction, a key feature of cardiometabolic disease. In this study cardiac function was measured  in vivo in vitro Calibrated cardiomyocyte stretches demonstrated that stiffness (stress/strain) was elevated in HFSD cardiomyocytes  in vitro E e in vivo Data show unequivocally that cardiomyocyte mechanical dysfunction cannot be detected by analysis of non‐loaded shortening. These findings suggest that stretch‐dependent augmentation of the myofilament–Ca Understanding cardiomyocyte stiffness components is an important priority for identifying new therapeutics for diastolic dysfunction, a key feature of cardiometabolic disease. In this study cardiac function was measured  in vivo in vitro Calibrated cardiomyocyte stretches demonstrated that stiffness (stress/strain) was elevated in HFSD cardiomyocytes  in vitro E e in vivo Data show unequivocally that cardiomyocyte mechanical dysfunction cannot be detected by analysis of non‐loaded shortening. These findings suggest that stretch‐dependent augmentation of the myofilament–Ca', metadata={'similarity_score': 0.36695200204849243, 'retrieval_method': 'colbert_vector_similarity'}, id='PMC11649524')"", ""Document(page_content='Atherosclerosis (AS) is a chronic inflammatory disease characterized by the gradual accumulation of plaques in arterial walls, with its pathogenesis remaining incompletely understood. Recent studies have highlighted that development of AS is closely associated with the aberrant activation of the NLRP3 inflammasome in the arteries. Inhibition of the NLRP3 inflammasome by natural products and formulae derived from Chinese herbal medicines (CHMs) has been shown to alleviate AS-associated pathologies. However, therapies that effectively and safely target the NLRP3 inflammasome remain limited. This review aims to summarize the key discoveries from recent studies on the effects of these natural products and formulae on the NLRP3 inflammasome in the context of AS treatment. A comprehensive literature search was conducted on databases such as PubMed/MEDLINE up to January 2025, yielding 38 eligible studies. Our analysis indicates that certain therapies can effectively prevent arterial inflammation in animal models by targeting multiple pathways and mechanisms related to the NLRP3 inflammasome. This review summarizes the primary findings of these studies, focusing on the therapeutic effects and underlying mechanisms of action. Based on these insights, we propose future strategies to enhance the efficacy, specificity, and safety of existing natural products and formulae for AS treatment. Additionally, this study offers a perspective for future research that may enhance our understanding of the roles and the mechanisms of CHM-derived phytochemicals and formulae in regulating the NLRP3 inflammasome and treating AS.', metadata={'similarity_score': 0.3621019423007965, 'retrieval_method': 'colbert_vector_similarity'}, id='PMC1748704493')"", ""Document(page_content='The enzyme arginase catalyzes the hydrolysis of  l l l l l Arg1 Arg2 Further basic and translational research is needed to deepen our understanding of the regulation of Arg1 and Arg2 in different cell types in consideration of their localization, species-specificity, and multiple biochemical and physiological roles. This will lead to better pharmacological strategies to target arginase activity in liver, cardiovascular, hematological, immune/infectious diseases, and cancer.', metadata={'similarity_score': 0.3599577844142914, 'retrieval_method': 'colbert_vector_similarity'}, id='PMC1748704617')""]","ACE inhibitors treat heart failure by blocking the conversion of angiotensin I to angiotensin II, which reduces vasoconstriction and aldosterone production, decreases afterload and preload, improves cardiac output, and ultimately reduces mortality and hospitalizations in patients with heart failure with reduced ejection fraction.",0.6081752777099609,10,True,,,,,,,,0.0,96,0
